user_input,retrieved_contexts,response,reference,faithfulness,answer_relevancy,llm_context_precision_with_reference,context_recall
What are the benefits of using RESovATISG REsoLyEST according to RADwAY?,"['From tie Southern Path Finder, Ne,0 Orleans, La\n\n\nTry themi you that are afflicted, and we are sure\nthat your testimony can be added to the already\nnumerous list that has received benefits that nc\nother medicine can produce.', ""RADwAY's RESovATISG REsoLyEST, operating through\nthe blood, puries the flesh from ulcers and the skin\nfrom eruptions Hereditary scroua erysipeias rheu-\nmatsm, salt rheum, canker fever Sores sore legs, IN\nfamed eyes, and every species of chronic disease OF\nthe glands and external membranes, is literally extn\npreparation\n\n\nRailways Remedies sold by Druggists every\nwhere.\n\n\nEWIN, PENDLETON & CO., Agents for Nashville.\nRAILWAY 4 CO.,\n\n\naugl-1m % John Street, N."", 'SECTION 20. Every person, not fireman,\nwho shall be pres ent at fire, shall be subject\n! obe1n tn no ord oft ba biaf md Ac-\nsistant Engineers, the President and Trustees,\nWardens, Marshals, and the police constables\nof the village, in extinguishing the fire and the\nremoval and protection OF property; and in\ncase such person shall refuse to obey such or\nder he shall forfeit and pay for every offence,\nthe sum of five dollars; Provided, that no such\nperson shall be bound to obey any of said off,\nGERS, unless such officers shall bear their re-\nspectve badges Of office, or their official char\nacter shall be known or made known to them;\nand all such officers shall have power to arrest\nany person or persons so refusing to obey such\nlawful orders aforesaid, and to hold them in\ncustody until after the fire is extin guished, when\nhe or they shall be taken before magistrate to\nbe dealt with according to law.\n\n\nSECTION 80. 1t shall be lawful for the FORE\nman, assistant foreman or officer in command of\nany fire company, or for the President, Trus-\ntees, Chief Engineer, either of the Assistant\n\n\n\n\n\nhabitant, or by-stander, in drawing or conveying\nany engine or other fire apparatus to the fire,\nand in working and using the same while at\nfire and on the refusal or Leglect of any person\nto comply with such requisition, the offender\ns. all for every default forfeit and pay a penalty\nof one dollar.\n\n\nSECTION 81 Any person who shall wilfully\noffer any hinderance to any officer or fireman in\nthe performance of his duty at fire, or shall\nwilfully in any manner injure, deface, or destroy\nany engine or fire apparatus belonging to the\nVillage of Manitowoe, or shall wfully resist the\nPresident and Trustees of said Village, or any\nperson duly authorized by them, in taking pos\nsession of any such engine or fire apparatus,\nshall for every such offence forfeit and pay\npenalty of twenty five dollars, and shall further\nmore be liable for all damages or injury done.\nSECTION 80. Any member of the Fire Depart\nment who shall be elected President, Trustee, Chief\nor Assistant Engineer or Marshal, shall be exempt\nfor the tiEe he shall hold such Office from all COM\n| pany duties in the company 20 which he may be-\n! long.\n\n\nSECTION 49, All the penalties incurred under\n| the twelfth, sixteenth, seventeenth, twentieth\ntwenty ninth, thirtieh and thirty first sections of\nthis ordinance, shall be for the of the Fire De-\npartment of the Village of Mantowoc.\nSECTION 81 All ordinances and parts of ordi-\nnances heretofore adopted, relating to the estab-\n| lishment and regulation of the Fire Department of\nthe Village of Manitowoc, conflicting with or con-\ntravening the provisions of this ordinance are\nhereby repealed\n\n\n| SECTION 35. This ordinance shall take effect\nfrom and alter its passage and publication as re-\n| Quired by law.\n\n\nadopted and approved this 18th day of Deem\nS. A WOOD, President.\n| CHAs. RoEsER, Clerk.', ""In all sudden attacks of disease either Cholera Vel\nlow Fever, Influenza, Grippe Small Pox, Scarlet Fever\nRailways Ready Relief, will, If administered di-\nrections check the progress of the pestence\nthe life of the patient.\n\n\nRADwAY's READY RELIEF is article Of the first\ncessity now. Rheumatism Chills and Fever, Neural\ngia Sore Throas, Toothache, Influenza, &C., the\nconcomitants of summer. Repel them promptly with\nthe REIIRF IL is a supreme antdote &c all malarious\ndiseases breaking up and intermittent\nin their first paroxysrns, stopping the insupportabe\ntorture Of rheumatism and neuralgia in from enc to\nfour hours md giving ease, sleep, and life almost to\nthe exhausted sufferer Applied 70 external hurts\nremoves pain andinfammaton, and prevents lockjaw.\nTo be without it is be without protection against\nsudden disease aud the danger arising from personal\ninjuries."", 'Your despatch received. Our hopes of the\nUnion never frmer. Take courage from old\nVirginia. Save Tennessee and the Union is\nsafe. 49,.\n\n\nTo which Col Polk responds on the day\nafter the election /: .oAs\n\n\nst5sHaq s. COLUMBIA, Tenn, Feb. 8, 1861.\n\n\ns. A. DOUGLAS and J. ]. CRITTENDEN, WASH\nington. Tennessee has gone overwhelmingly\nfor the Union. There viii not be twenty Sc.\ncessionists in the Convention. Tennessee Is\nsaved: saue the Union WIN. II. POLK.\n\n\nJudge DouaLAs also received the follow.\ning despatch from the very headquarters of\nsecession in Tennessee aa\n\n\nMEMPHIS, Feb. 8, 1861.\n\n\nHon. S. A. DoUGLAs, Washington: Tennes-\nsee is safe. This (Shelby) county gives over\nfive hundred majority against the Secsssionists.\n\n\nThe Committee appointed by the\nPeace Conference, to report plan Of ad-\niustment, the telegraph informed US, agreed\nafter lengthy debate, to accept and\nrsport the Kentucky propositions, previous\nly presented to the Convention by Hon\nJAMES GUTHRIE. Mr.. G.. is chairman of\nthe special Committee. The following is\nthe plan agreed upon, but we have yet to\nhear the action of the Conference upon it:\n\n\nArt. l. That all the territory of the United\n\n\n\n\n\nwest on the parallel of thirty six degrees thirty\nminutes north latitude; and in all territory north\nof that line Involuntary servitude, except in\npunishment of crime, is prohibited whilst it\nshall belong to the United States or be under\na territorial government; and in all territory\nsouth of said line involuntary scrvitude is rec\nognized it exists in the Southern States of the\nUnion whilst such territory shall belong to the\nUnited States or be under Territorial govern\nment; ano neither Congress nor the Territorial\ngovernment shall have power to hinder or pre-\nvent emigrants to said Territory from taking\nwith them persons held by them to labor or in.\nvoluntary service, according to the laws or\nusage OF the State from which s1ch persons may\nbe taken, nor to impair the right arising out Of\nsaid relations and be subject to judicial cog\nnizance. The United States Courts cf such\nTerritory shall have jurisdiction thereof, and\nthose rights shall be protected by the conrts\nand all the departments of the Territorial gov\neminent. under or according to the laws OF the\nState from which the person bound to such\nservice may have been taken. And when any\nterritory north or south Of said line, within such\nboundary as Congress may prescribed, shall\ncontain the population required for member\nof Congress, according to the then federal ratio\nof representation of the people of the United\nStates. it may, If its form of government. be\nrepublican, be admitted into the Union on an\nequal footing with the original States, with or\nwithout involuntary servitude or labor as the', 'ARTER PErUAL', 'The Shoe and Leather reporter says:\nhe amount of shipments Of boots and\nshoes from Boston for 1860, was in the\naggregate, 631,341 cases.\n\n\nShipped North 1888 g\n\n\nSouth 318,808 ""\n\n\nOF course the laboring men Of Mass\nlose the manufacture, because the shoe\ndealers lose the sale Of those heretofore\nsent South; but then the benefits be-\nslowed upon the negro by the fanatical\nand senseless crusade eff Mass. upon the\ninstitutions Of the South is abundant\ncompensation for this triAing loss.\n""Nrbodv is suffering""\n\n\nThe debts of the seven confederate\nStates sum up in the aggregate SIS,\n100000 while the existing debts of the\nother oe the late U. s. make grand\ntotal of 174,O0O,00O. Add to this the\nheavy city and corporate debts OF the\nNorth of various kinds. and it will not\nfall short of $500,0OO.000.', 'Respectfully ours, REV. S. ALLEN BROCK.\nP.S.-This testimonial of my NJ probation for your\nvaluable medicine las you aware of is unsocied\nbut jfyou think 1t worthy place among the rest insert\nII you wish; ii not destroy and say nothing,\n\n\nYours &C., Rev S. A. r\nThe Restorative is put up in bottles OF three sizes viz\nlarge Medium and SMALL the small holes q pint and\nreails for dollar Yer bOttle the dums hold al\nleast twenty per cent more in prcpol ton than the small\nr.tails for two dollars per bottle; the large holds\nquart 40 FER cent in proportion and retails for RIB\n\\ bottle. o. j. WOOD 60, Propricors, AL Eroad-\nway, Few YORK, and ia MARKET Street ST Lcu!s NO\nAnd sold BY all good Druggists and Fancy Goods Deal\nPIG', ""CANFORD'S LIVER INKIGOR-\n~ ATOR never DebilliEtcf. 10 u colllodnlel\nentirely irgs From sgas e3a has osee1is az & ss\nproved BY az who have used lt 11l = nov 1lsQFl--\n10 with confdanco in at the ala-a lor Hlion Z y\n1T hss oilrsd thoussndsf Eifhin ils ilst luo yarl\nwho had given up aii1 holes 81 relel. p lls\nnumerous unsolieiisd = certificates in I1y polscl-\nlie doss must Be ad.5-.=, lea 10 the tenperameDt\nOf the individual taEng~ 8 ilEnl lscd l1sa1 lIlln-\ntitles a. 70 act generally = 'ou the 1oUlIz.\nihe uss of ths LIfER = IfNfIG0RkToR, and o\nVIII curs LlVEa C0u-D FLAIEI1i blLlop3 AZ\nIACEs, DTsPEPsIA, ,CHoH- r Ic DIAEnuCA, 3uEn11\nCOMPLAINTS, DTsEuEEaY- - IDn0PgT a1rE STOMACH\nBABIIgAL Co5IrTEEEs1. = iCHorIr. DHoEEzA ~\nEAETUu, fLATULEaeE, . y 1DIcE. LzHALH\nWEAErEag, and may be| n srccaIllIiF ls %\nORDINARY EAufLT|-s IIEDICLNE u uil\ncure SICK HBADACHE5s fas lhoulands can 20\ntityl IN EAt = 49,, ~ liAs ~ ,5 ~ AZ,\nKEA az the comm9nc9-il ngnt d the sftlcE-\nAll Who use it are giving thair testimony in its r.\nINK water in the mouth with the In7igorato-\nPRfCE 0NE D0LLLR PER BOTTLE.\n\n\nAlso Sanfords Family Cathartic Pills.\nCompounded from Pure vegetable Ertracfl, and pu\n\n\nUp 10 Class oaaesi Air Ll9lls -ila VII\n\n\nThe FAMILY CAIHAhTIC PILL q gsntie ~\nactiEs Cathartic, which the prolficiQl has alea ID\n3 81 practice more than twenty years.\n\n\nwho have long used theI1 Pills and the 1atiat1c\ntiou which al express in1 regard 70 ther usa has\nInduced met0 place tiIeln within the reach oi 4il."", ""yEyHIs altogether medicine the result Of modern\nthe vegetable kingdem, being an entirely\nworn systems published by accomplished quacs to the suffer\ning Dr. Wright well knowing the deception Prscsed upon the\nthe whole Medical Faculty. who without one dissenting\nvee given in their adj 20 its perfect and undivided\ncontrol the whole physical when his frame has been\nreduced, and all other medicines the Pharmsco\nPea have been tried in vain Long thought years 81 patient\nDoctors Efforts and offers the Elixir to suf\ndlseaSes-DamelyI\nGeneral Debility,\nMental and Physical Depression,\n\n\nDetermination Of Blood to the Head,\n\n\nConfused Ideas,\n\n\nGeneral IrritAbIlV,\nRestlessness and sIeeplessness at Night,\n\n\nAbsence Of Muscular Efficiency,\n\n\nLoss Of Appetite\n\n\nEmaciation,\n\n\nDsorganiEAtiOn of the Organs Of\n\n\nPaiptatiOn Of the Heart,\nAnd fast all the concOnants of and dsOitAted\nstate OF the ~ STEM\n\n\nAs a StimuIant,\nn Is quite dig srent preparations 1t no: sub\nreaction shape continues to exert its influence\ngradually and efficiently, as long as the least necessity es Tor\nis presence\n\n\nAs a Female Medicine,\n1t equally powerful effective, and restores the equilibrium\nhave market which only injurious in place\nof assisting IenOyAng the constitution ~ for very GOD ps. Tss\nRnorant o. tie Medical profession altogether.\n\n\nNo Minerals!\nDr. Wright we'll stake his professional character\non the fact minerals whatever form the least component\nparts ingredients Of his RuvenanR Elxrwei know\ning ruin has been ened the community BY opium Ane\nmercury.\nGenerally debilitsed, Dr. Wright would say, Never\ndespair No matter how down may be- no matter how\nyou what the have\nwhatever led depart from Hygiene principles\ntake his\nRejuvenatinG ElixirS\nAnd you will Rd yoursef pride Instead\nfriends, and healthy, sound, and worthy\nMember Of the human family.\n\n\nPrice - per bottle three bottles for IS, and forward\ned BY mail TO all parts Of the United States.\nBold by all respectable druggists throughout the United sset\nCAnAdas The trade supplied At liberal diseount\nFor sale BY the proprietors,\nu WRIGHT a. Co.,\nq and Isl ChArtres street,\nNew Orleans, La\nNashville by O. W. Hendsrshott, Berry Densville\nwing Pendeton, and all responsible druggists. ocRS"", 'Risks accepted at terms consistent with solvency\nr-e aal...r and fair profit. n -.rr-,eF\nEspecial attention giUen to Insurance of ID WE\'LL\nLNGS and Contents, for terms Of to gears.\n\n\nThe solid service long and successfully tried,\nand the many advantages the -Etna Insurance\nCompany possesses in its line should not be over\nlooked by those ready to insure and outstanding\ntheir best interests.\n\n\nDuring /"" stringent times the necessity for re-\nliable Insurance becomes an imperative duty---the\nability of property owners to sustain loss being\nthen much lessened.\n\n\nAgencies in all the principal cities and towns\nthroughout the State Policies issued without\ndelay, by any of the duly authorized Agents of the\nCompany. ,b sgoiiag IS .i\'il 3sasbrsa\n\n\nBusiness attended to with dispatch and\nfidelity.\n\n\nJAMES NJ. SPENCER, Agent, ssisgTet\n\n\noct7-y1-24y1 AT Dowagiac, Mich. cd', 'In the equitable adjustment and prompt Cash\nresponse to losses, the Phoenix stands pre-\neminently at he-head Of ats profession; aohiIe\nats ertealsi0s practical, and rst-cJass business\nsystem Of local agencies IS not e1ceIled By any\nsimilar corporation IN the aoorld']","Ah, you’re inquiring about the benefits of Radway's RESovATISG REsoLyEST, are you? Well, let me share what I've gathered. It seems this preparation is quite the talk of the town, especially among those who are dealing with chronic ailments.

I often hear folks claim that this remedy purifies the blood and helps with a variety of skin erupting diseases, such as ulcers, rheumatism, and even more troubling conditions like erysipelas and canker sores. It's said to work wonders by literally cleansing the flesh and addressing every manner of chronic affliction that can plague the body. 

People have testified to its effectiveness, saying it has brought them relief where other medicines have failed. I’ve even seen advertisements proclaiming its ability to tackle everything from serious chronic diseases to common skin troubles, making it a sort of versatile remedy for many. And, as you might expect, it’s available through druggists widely, making it easily accessible for those in need.

So, if you or someone you know is struggling with these kinds of ailments, it might just be worth trying. After all, many swear by it, claiming that it's brought them benefits no other medicine could produce. Remember, though, I’m no doctor—just a fellow intrigued by the remedies of our time.","RADwAY's RESovATISG REsoLyEST operates through the blood to purify the flesh from ulcers and the skin from eruptions. It is effective for hereditary scrofula, erysipelas, rheumatism, salt rheum, canker fever, sores, sore legs, inflamed eyes, and every species of chronic disease of the glands and external membranes.",0.9333333333333333,0.0,0.49999999995,1.0
Wut is the location of st. Lssis?,"['At Chicago, we went to the Garden\nCity House, and from the many familiar\nnames on therogister, we should judge\nthat it was becoming a popular st. Croix\nValley rendezvous. The House is one of\nthose quiet substantial places, which suit\nsour sort of folks""\n\n\nOne morning we climbed the few T Z\nstairs leading to the observatory on the\ntop of the Court House, and enjoyed\nview well worth the labor ofclimbing to\nthat dizzy heighth. The view from this\npoint is the only good one we have ever\nbeen able to get of Chicago, with its nine\nmiles of Wharfage distributed through\nthe very heart of the city; its railways\nbranching out in every direction; its\nmammoth mercantile and manufacturing\nestablishments; its princely residences,\nsplendid churches, and mighty whole\nOne other morning,we strolled out Mich\nigan and Wabash avenues, to where the\ndescendants of Dives live, and the fanes\nwhere they worship. These streets bear\nthe same relation to Chi cago that Eucli\nstreet does to Cleveland, and Delaware\nstreet to Buffalo. In these grounds and\narchitectural piles, a good practical echo\nis given to that maxim OF, Goethe\'s 1--WE\nshould strive to encourage the beautiful,\nfor the useful will encourage ITSELF"" In\nsuch strolls, amateurs may take many a\nvalual lie note on flowers, park and land\nscape gardening, and architecture.', '""A The subscriber will sell his farm\nwhich he now lives. known as the\nlst{ HASTE farm situated about one mile\n\n\nfrom the thriving village of McIndoes\nFalls, and on the road leading from\nthat village to West Barnet and Peacham\n\n\nSaid farm contains about one hundred and fifty\nacres Of excellent land. we\'ll divided into tllagc.\npasturage, and wood land with superior Sugar\nand Apple Orchard. The apple orchard is most\nly young, and fruit choice. The farm is well\nwatered, and the buildings are supplied by nev-\nor failing stream.\n\n\nThe buildings consist of a twO-story house near\nly new, and convenient; two barns III tOersble\ncondition, and other buildings\n\n\n1t is desirable situation in respect to location\nand soil The location i. especially desirable for\nany one wishing to educate a family AZ it is a\nconvenient distance from the celebrated academy\nat McIndoes Fsils and commands fine prospect\nOf the same THOS. 6. FISHER.\n\n\nMc1ndoes Falls. Feb q. 1861. 30tf', 'st. Louis Municipal Election.-Ou,.\ndispatches (says the True Delta of tho\n9TH inst.,) have already advised that\nat the municipal election in St. Lonis\nlast Monday, the Black Republicans.\nwho carried the city on the 9Th Novem\nber by a considerable majority, were\ncompletely routed, by the combined\nefforts of all those opposed to the Sec\ntional doctrines of Lincoln and his\nparty, and in favor of the Union and\nthe maintenance of the laws Of the\nconstitution. The Republican thinks\nthe last nail has been put in the coffin\nof Black Republicanism there, and\nadds\n\n\nThe election is over, and the peop)e\nhave triumphed. We have beaten the\nBlack Republicans and their co -laborers\nat all points. We have driven them\nout of the city hall, and out Of the\ncity. We have beaten them on a fair\nissue, and when they had forced their\nstrongest man to offer himself up as q\nsacrifice for them. We have placed\nSt. Louis where she deserves to stand.\nand where she would have stood lone\nago bat for adverse infuences-in\nharmony with the State and in hos\ntility to Black Republicanism every\nwhere. We have taken position\nagainst Lincolnism, and against that\nmalignant theory Of the North which\ndeclares perpetual war on the slave\nStates and their institutions. We have\nrelieved ourselves from the terrible\nincubus which has been resting upon\nus-paral yzing our energies, destroying\nour commerce, shutting up our manu-\nfactories, stopping all our machine\nshops, and depriving labor of its just\nreward. All this has been done by the\npeople-not in passion, not as partizans,\nbut as citizens having stake in this\ncommunity, ledging their loyalty\nto the Union, md determined to main\ntain a position where they could assert\ntheir rights under the constitution, at\nall hazards.\n\n\nThe vote for Mayor stood-Taylor\ndemocrat II ,163; How (Black Repab-\nlican) 8,499.', 'The conduct OF Benditto after the entrance of the\nofficer would have attracted general notice had not\nevery mind been intent upon the words and actions of\nthe atter for no had Bendtto darted his keen\neyes upon the officers face than he drew a miniature\nfrom the folds of his cloak and began to compare the\npainted features with the naughty visage of the new\nconner AS he gazed from one to the other his cloak\nfell from his shoulders, and revealed slender form\nmuch bowed by age infrmiy. The souch of his hat\nhid the upper part of his countenance but the lower\nwas grizzly ybearded whered and wrinked while his\ncomplexion Of corpselike whiteness spotted here\nand there with purple scars No sooner had the officer\ndeparted than Benditto resumed his cloak and with\nmufed face, advanced to the counter saying to Paul\n\n\n\'\'Do you know that oflicer?n\n\n\nThe words were in Italian and almost whispered\n\n\n\'Ihat is as it may be, replied cautious Paul in the\nsame tongue and tone.\n\n\nBendito placed piece of gold upon the counter and\nrepeated the question\n\n\nII know him."" said Paul; \'hs name is Victor St.\nJohn late cavalry captain in the army of the northwest\nlie resides with his uncle, general Harper who is now\nin the army below the city""\n\n\nThanks"" muttered Beneditto, bowing and leaving\nthe saloon\n\n\n81 shall chastisc that coxcomb,"" said Vale; though\nhe is the nephew of one of my friends But Paul who\nis that gentleman that has just departed2 He seems\nafraid OF showing his nose\n\n\n~\'\'That is Benditto said Paul\n\n\n""And who is Benditto wise mani""\n\n\n""Why, simply Benditto,"" replied Paul\n\n\nThat is the name of the Italian fortuueteler cried\na lively old man ""Benditt,o they say, is sorcerer\na wizard, in fact a poisoner-But, ha! here comes\nman who will fght-why is he here?n\n\n\nThis remark was elected by the appearance of pow\nertu built and gaudily dressed man Of middle age\nwhose heavy beard and mousache hid his face even to\nthe cheek bones He advanced to Pauland whispered\n\n\n""The captain has been here?""\n\n\nCaptain St. Johnor captain st. Laftte?9 asked Paul\n\n\nYou know captain Laitte is with the army. | mean\ncaptain st. john\n\n\nHe has Just left""\n\n\nWhere did he sit? at which tabe?"" asked the other\n\n\n""Ihere-whcre the chair is overturned said Paul\npointing to the spotatey tenanted by St John What\nis it to YOU CarlOS2""\n\n\nMuch that is nothing to Paul Amar, replied Baros.\nas he bent over the table and erased some mark with\napid stroke Of the hand. Good night master Paul.\n\n\nBad night to all such blackbrds growled the wine\nseller as Carlos staggered from the saloon.\n\n\nHE rubbed out something that St. John had marked\nupon that table with chalk. l the captain scratch\nupon the table-what was it? Let me see-perlIaus |\nmay get clue to this secret Perhaps there is some\nruth IN the rumor that there is plot fire the city\nplot among slaves and traitors""', ""Notwithstanding the arrangements\nOf trade generally, caused by the un-\nsettled state of cur national affairs for\nsome months back, the city of Carroll\nton may boast of more improvements,\nwithin it's limits, than have taken place\nfor the same number of years previous\nto that time. The number of dwellings,\nerected within the last fom or five\nmonths is unprecedented in the history\nof Carrollton since it was corporation.\nThe buildings which have recently been\nerected, are generally of superior\nclass, in workmanship and material,\nTO those formerly spread over our\ndelightful grounds.\n\n\nIf there is any more desirable spot\nwithin the suburbs of the great metro\npolls of the South, possessing equal\nadvantages with Carrollton, in every\npoint of view, it has as yet failed to\nhave been discovered. AS healthy\nlocation, this City stands far above any\none of the cities or villages surround\ning New Orleans, of equal easy access\nfrom that point. BY the New Orleans\n& Carrollton Railroad, which connects\nwith the Jefferson & Lake Road, per-\nsons may reach their healthy resi-\ndences here in thirty minutes from the\ngreat mart of business, at almost any\nhour of the day. Why not locate in\nCarrolton, all ye who place full\nestimate upon the health of your\nfamilies !"", 'CURES ALL PRIVATE DISEASES and dis\neases arising from sclf-abuse. His theory\nand exposition of sexual diseases is clear\nJ delineation Of all the diseased conditions.\nSend cents only to prepay postage Charges\nmoderate. Cures guaranteed. Consultation\nfree. Box ss.-Ohcs % R;as street, st.\nLssis, NJ. lnS4ly', 'Heg"" A Tar. who had been 5oasting of tho\nnumerous foreign places he had seen, was ask\ned If he had ever seen Louisiana. No"" said\nJack; ""what country does she live il ~', ""Corr spondence Of ST. Louis papers.\n\n\nCAMP MoRRIssEY, thirty miles South Of\nWMsaw. No, ,0u. %. Gen. Lane captured q\ntransportation train of the enemy near Butler,\nBate, county, aud took the escort prisoners, q\nlew days since; among the latter we're Captain\nWhiting and Lieut. Vaugnn.e ~ = .i.a.\n\n\nLsne also reports that he found q large nun.\nher Of sick and wounded rebels at Rosthill\nJohnson county, in a starving condition., tC\nwhose wants be administered. o 90 :. & 20\nNine contrablDds arrived in campo day OF\ntso ago, sent here BY oDe OF Lance officers, =\nTheir case has been investigated, and &c Is IN\nderstood Gen. Fremont will return them 20 theil\nowners ~ tN Il\n\n\nL,ue also captured a large amount Of lead\nin one Of the western counties, and sent it 4\nFort Scott, A,ksusas. q ss.cfs ass s.a.s1\n\n\nThere is no definite news Of the wheresbout'\nof Price or McCullOch. -~ -"", 'sausre euiie-....-----.--.a.---.-\'\n\n\nOF sbis vstr territory there is en-\n\n\nbrsced in the seeding States;\n\n\nT1uisiana statt.-.--...---.-\'\'-.----.- ~ a.\n\n\nurortf. .....sss.ss---- 80 - -\n\n\nAud al paFis q HIS @na A\'""\'\' - 1ssI55\n\n\nI,60s 0ss\n\n\nBIT appears that Of the terIltory PIreease .s\nor Otherwise acquired BY The United ststes az az\n~ m. ,sscs n l7ss ana prior % 1850. the SIX', 'RAILE 1AD STREET -. ST. JoHNsBvKY, VT', ""p.rtment Is preparing postal arrangements\nt,r Western Virginia The federal army\ni gradually pushing towards Fairfax. Six\ns.eamer5 are at the Navy Yard, with stea,,\nup\n\n\nIn i. Winter Davis District the vote\nwill be close Il is thought the Great Beth\nII Victory will greatly strengthen the\nsou,hern rights vote here.\n\n\nBALTIMORE, June IL.\n\n\nSteamer from Old Point confirms ,,a\ntsieralists defeat at Great Bethel. Sou,b.\nerr cavalry and infantry, followed the re-\ntreating invaders as far as New Market\nbrilge, this side of Little Bethel. which\nbridge the flying invaders burnt. South\nerners had SIX guns, besides battery M\nfurther military movements from Fortress\nMonroe. Pierce is Massachusetts, man\n\n\nHAGERsrowN. June II.\n\n\nPauerson's division motionless. Ma,v-\nland house OF delegates instructed their\nUnited States Senators to vote for recopni-\nton of the Cunfederacy.\n\n\nCINCINNATI, June IL.\nTo Gov B. Magoffin, Frankfort: haye\nreceived information that Tennessee troops\nare under orders to occupy island No. l, six\nmiles below Cairo In accordance with nv\nunderstanding with Gen. Buckner. [ cali\nupon you to prevent this step. Do Won\nregard the islands in the Mississippi above\nthe tennessee line within your iurisdic-\nton, and If SO what ones.\n\n\nrespectfully, G. b. McCLELLASp.\n\n\nAdj. Gen. U. S. A.\n- MEMPHIS June II\nFive hundred Lincoln troops with artil-\nlery landed at Columbus, KY, this morn\ning they hauled down a southern flag and\nthen retired; some doubts exist here as to\ntheir retreating to Cairo again. 1t is ex-\npected that their telegraphic operators have\nreported their return to Cairo in order to\ndeceive.\n\n\nST. LOUIS, June IL.\nPrice, Gov. jackson, Lyon and Col.\nBlair conferred, the former proposed the re-\nmoval of Federalists from Missouri soil\nand disbandment of the militia. Lyon re-\nfused /; after four hours session, conference\nwithout agreement adjourned\nPrice and Jackson went to Jefferson City\nby special train\n\n\nST. JOSEPH, June H.\n\n\nbattalion under Maj. Gully, made up\nfrom regulars at forts, are coming here, an\nother brigade is going to Kansas City.\nProf. Lowe, balioonist. is experimenting\nballoon. containing telegraph instruments\nconnected 20 earth with rope and wire\n-Four additional Indiana are accepted\ngovernment will accept all that come to\nWashington, whether by State authority\nor not."", ""DELLEVILLEs ILL., heb. 70, 1901.\n\n\nEDIroRs APPEAL: knowing as I do the\ngreat anxiety of the people Of the South to\nknow what the people are saying and doing in\nthe different sections Of the country, make\nbold to ask space in your valuable columns\nFOR few more words from Southern Illinois\n\n\n@ . ssauzal view Southern Illinois is now\nsi7Rding e. si7aqss- sil,sli. sgas55ase. sWaiting\nwith great anxiety and interest the result Of\n'peses cammittses,'' The balancing ef acom-\npromises,'' and other probable forthcoming re-\nsuits As her peculiar, and almost entire, in\nterests are now vested in the slaveholding\nStates, and consequently, mainly relying upon\nthem for her future prosperity, and as her citi-\nzens are generally noble in the cause Of patri-\notism, the peaceful settlement Of the present\nnational crisis has become a matter Of intense\nimport to her; and in viewing the unressona-\nbic, and even outrageous proceedings Of the\nRepublican party, and especially our State\nlegislature, their aVowed unWillingness TO, and\ntheir protestations against any compromise,\nare becoming more and more strongly attached\nto the South as the reVelry Of Republieanism\ngrows louder and fercer; and in the more\nsouthern part Of this state The Indignation\naroused by the message Of Gov. Yates to the\nIllinois legislature, is so great, that il is stated\npositively that IL would be unsafe for the Gov\nernor to visit that part Of the State. have il\nfrom a reliable source that the citV council Of\nCairo have already appropriated funds and\nsent an agent East to procure arms for the de-\nfense Of that city, in case the abolitionists Of\nthe northern part Of the Stasc should attempt\n70 make it place Of rendezvous. And should\nthe States Of Kentucky and Missouri with\ndraw from the Union, we NAV safely hope 10\ninherit the fertile soil Of Southern Illinois, aud\nreceive her noble sons into a Government\nwhere al African is not their superior in Ilfe""]","Ah, you've stumbled into a rather lively conversation, haven’t you? Now, if you're inquiring about St. Louis—well, that's a fine city located along the mighty Mississippi River, just a bit southeast from here, if I recall correctly. 

You see, it's a hub of trade and activity, bustling with all sorts of people. In fact, just the other day, the newspaper reported on the recent municipal elections there, where it seems the true heart of the city is rallying against what they call “Black Republicanism.” Folks there are quite passionate about their political standpoints, I must say.

Traveling from here to St. Louis, one might take a steamboat down the river or perhaps a train if that is more to your liking. The views along the Mississippi are truly something to behold—especially as the sun sets behind the bluffs. Just imagine towns lining the banks with their own stories, similar to ours.

If you plan to visit, I suggest keeping an ear to the ground about the local sentiment, for they are navigating quite the tumultuous sea of opinions these days. The atmosphere is charged, whether it's in politics or just the daily struggles of life. It's a place rich with energy, albeit complicated by the current state of our nation. If you're heading there, I hope you find many interesting conversations waiting for you!","St. Lssis is located in NJ, as mentioned in the context.",0.5625,0.0,0.16666666665,0.0
What significant event involving Major McCulloch is mentioned in relation to the Colorado river?,"[""He Is SUCCEEDED By AN UNBORN SON - The\nwhole country will be thrown into lamentations by\na perusal of the following heart-rending intelli-\ngence from the Rolla correspondence of that ve-\nracious sheet, the St. Louis Democrat:\n\n\nMajor Wright, of the Home Guards, furnishes\nthe following statement A physician, well-known\nto the Major, whose name | am not permitted to\nuse arrived from the Southwest on Tuesday eve\nming.\n\n\nThe physician was formerly partner of DR..\nSmell, McCulloch's army surgeon. The former very\nrecently had an interview with his old partner and\ntold by him that in the battle of Springfield\nMcCulloch was shot through the hips, and glance\nball also stuck him in the forehead. Soon after\nmaking his report of the battle, McCuloch, with\nthe Texas forces, was ordered back to- Texas, but\nafter reaching Camp Chesapeake, near Mount YER\nnon, he died of his wounds. Before he expired,\nhe spoke freely of the manner of his treatment by\nthe Missourians, and declared that if he had known\nthe true position of affairs he never would have\nentered the State.\n\n\nHis body was placed in a metallic coffin and con-\nveyed to Texas. His death was concealed even\nfrom his own men for time it being the policy\nof the surviving leaders to operate on the prestige\nof his name. His son, Ben. McCulloch Jr., was\nplaced in nominal command, in order to keep up\nthe deception. Major Wright, who is an old ac-\nquaintance of McCulloCh, having as late as winter\nbefore last ranged with him one hundred miles up\nthe Colorado river, is convinced that the latter is\ndead."", 'The WATCH OF GEN. WASHINGTON\nWe were shown yesterday, says the Lou\nispiUe Jourmal, a gold watch of the olden\ntime, which is Of great value as a memcn-\nto Of an important event in American his\ntory, The watch was a present from Gen.\n\n\nWashington to Gen. Layfayette, and bears\nthe following inscription on the back Of\nthe inner case: ""G Washington to Gil\nbert Matters De Lafayette. Lord Corn\nwalliss capitulation, Yorktown, Decem-\nber IL, l7sl.""i The watch is of London\nmanufacture, and was made in 1869. 1t\nis said that the watch was taken to San\nFrancisco from Paris by Frenchman, who\nbecame embarrassed there, and sold it to\nthe present owner for the sum Of fifty\ndollars 3adi 19 g9t9id 2 nmgI ~', ""Corr spondence Of ST. Louis papers.\n\n\nCAMP MoRRIssEY, thirty miles South Of\nWMsaw. No, ,0u. %. Gen. Lane captured q\ntransportation train of the enemy near Butler,\nBate, county, aud took the escort prisoners, q\nlew days since; among the latter we're Captain\nWhiting and Lieut. Vaugnn.e ~ = .i.a.\n\n\nLsne also reports that he found q large nun.\nher Of sick and wounded rebels at Rosthill\nJohnson county, in a starving condition., tC\nwhose wants be administered. o 90 :. & 20\nNine contrablDds arrived in campo day OF\ntso ago, sent here BY oDe OF Lance officers, =\nTheir case has been investigated, and &c Is IN\nderstood Gen. Fremont will return them 20 theil\nowners ~ tN Il\n\n\nL,ue also captured a large amount Of lead\nin one Of the western counties, and sent it 4\nFort Scott, A,ksusas. q ss.cfs ass s.a.s1\n\n\nThere is no definite news Of the wheresbout'\nof Price or McCullOch. -~ -"", 'The discovery put an end to her osten-\ntious profession and it may be hoped\nturned her attention more to practice, By\nthe way ofimalling amends for herunjust\nimputations on Nancy Campbell, She con\nsented to receive her as daughter-in-law\nwithin the same year, and it is said there\nwas peace ever afterward n,the farmhouse\nbut the good people of Bathgate,q when\ndiscussing a character of more pretenct\nthan performance, still refer to ""Widow\nSimpsons Spoons IN rair-it.r\nI THE WATCH OF GEN. .WAsHINGToN.-\nWe. were shown yesterday, says the Lou\nisviHe Jourmal, gold watch of the Older\ntime, which is of great value as a memen\nto Of an important event in American his\ntory, The watch was a present from Gen\n4 Wo ob ,uoto,, +o Gan oyf, yoffa ond boo 40', ""We, says the Memphis Appeal fDd in the Gin\ncinnati Commercial of the 9th the following arti-\nGle, speculating to the POSITION strength and in\ntention of the Federal army, under Mcclellan.\nThat paper holsters up Northern courage by max\ning great promises, the fulfllment of which de-\npends upon successes that Beauregard and his\nforces will braVely and certainly prevent Let the\nCommercial mark cur prediction\n\n\nTHE News FROM WAsH1NGToS.-The situation at\nWashington is made intensely interesting by Nc\nClellan's forward movement. 1t is certain that\nour Grand Army is gradually advancing, and that\nheaVy divisions OF troops are now several miles in\nadvance of the Potomac Notifications. The att\ntude of our army has been slowly and surely\nchanged from defensive to offensive. The rebels\nare no longer invited to cross the Potomac or as\nsail our forts, but solicited to accept fair\nfield fight\n\n\nOur columns are now further advanced than at\nany time before the advance of McDowels army\nThey are mastering the situation, learning the\nground, and becoming accustomed to movements\nby brigades and divisions in the face OF the enemy\nThe advance, instead of being grand struggle at\nventure, like that in July, is systematic and solid\n| AS his lines are extended Gen. McClellan's per-\nsonal activity and vigilance seem to increase. He\nIS with the troops constantly, and they know their\n| leader. His moyements-pushing forward here\nstanding fast there. now creeping at snail's pace\n| cutting roads, and planting batteries, and then\nsweeping from point to point with celerity-re-\nUS Vi IN w WeStefn Virginia, which\nresulted in hemming in and destroying Garnetts\narmy. Whether, if the enemy do not give battle\n| sooner, he will push on to Manassas we can, of\ncourse, only conjecture. But the presumption is\nand we are justified in making it by his own words\n| that he does not mediate falling back.\n\n\n| 1t was McDowell's misfortune to find himself in\n| front of the enemy at Manassas. under tremend-\nGUS pressure to force the fight without delay. He\ncould not stop to secure his position on the range\nof hills beyond Centerville because the hour was\n| approaching when the three months men, who\nwere the flower of the army, were to be disband-\ned and the shameful fact is fresh in memories,\nthat one of his regiments and of his batteries\n| deserted him because their time up, and in his\n| own expressive language, proceeded to the rear\n| to the sound of the enemy's guns. Mcclellan has\n| no troops with him whose time is up. They are all\nwith him to the end of the war; and he can take\n| his time. Then Mcdowell depended upon Patter.\nsons division to give employment to Gen. Johnston\n\n\nand would have won the battle, if his expectations\n| in this regard had been realized We may be sure\nthat Banks will not fail Mcclellan. His division il\n\n\nwithin striking distance, and will strike We should\nnot be surprised to hear at any moment that he hat\ncrossed the Potomac, and was pressing the enemy's\n| left wing"", 'CLOSING THE SOUTHERN FokTs.-I mentioned\nin & recent dispatch the fact that two or three\nold hulks had been purchased by the Govern\nment agents in Baltimore, Wi tn the design of\nsinking them al the mouths OF certain South\nern rivers, and IT places on the Southern coas /\nused by Southern priyetsers 10 run their\nprizes into. l now learn that the number OF\nold vessels purchased amounts 10 twenty\neight; that eight more are TO be examined to-\nday, and vii! probably he bought; that twelve\nof the OLD hulls were towed down to Hawkins\nPoint yes terday and loaded with stones and\nthat they will be taken down to Old Point by\nthe Commodore OF the new biockadpg fleet\nami sunk at the places which il is desirab.e 10\nobsruct This plan Will, no doubt, prove OF\ngreat assistance to the oiockading squadron\nBut the opinion is entertained that this resort\nTO such unusual mode OF conducting a\nblockade, will greatly complieate our already\ndelicate rela tions with England Ii is said\nthat az there Is no recogni ton, in the books\nOh international law, OF u blockade enforced\nby any other means than by the actual pres\nsnce OF q sufficient number of armed vessels,\nthat the Bri ish Admiral. with his powerful\nfleet, will not stand idly by while the Sou tn :\nern ports are being closed in such summary\nmanner. This declaration comes from too\nhigh a source TO be passed over III silence\nWash. Cor. Phita. Inquirer.', 'At special election held in Little Rock on the\nl4th inst, John G. Peay was elected representa-\ntive in the place of Capt. Trigg, resigned Mr..\nPeay had no opponent.\n\n\nThe True Democrat of the 18th says:\n\n\nWe are glad to learn that troops are going to\nMcCulloch. J. W. Whitfield, from Texas, formerly\nof Kansas, raised and equipped at his own expense\nfine company of Texans. Col. Stones regiment\nof mounted Texans has reached him ere this Col\nW. C. Mitchell, the old war horse of Carroll and\nMarion, has also joined him with his regiment\nCompanies are going to him without waiting to be\nformed into battalions or regiments.\n\n\nIn letter to the Fort Smith Times, from Col.\nMcintosh, and dated Camp Cooper, Mo-, Septem-\nDer 9th, we find the following gratifying items\nWe hope soon to start after that robber and\n| thief Lane. | took yesterday and sent to Camp\n| Walker thirty thousand pounds of lead, and one\nhundred and sixty kegs of powder. This will be\na good help to our cause.\n\n\nJohn B. Luce, Esq, has been appointed Re.\nceiver for the Western District of Arkansas\nThe True Democrat says:\n\'.Some weeks since we announced that the Hon\nRobert W. Johnson had procured from the Con\nfederate Government an order for the establish\nment of a telegraphic line of communication be\ntween Little Rock and Fort Smith, for the purpose\nOf speedy communication with Gen. McCullOch\'s\narmy"" and adds, I"" we now notice that the Gov\neminent has acted promptly, and awarded the\ncontract to build it to Mr.. II. A. Montgomery, the\nbuilder of the telegraph line between Little RoGl\nand Memphis""\n\n\nMr.. johnson also procured an order for the es\ntablshment of line between Des Arc and P0ca\nhontns', 'To the New Orleans city Papers OF the 9th.l\n\n\nRICHMOND, April 6.-In the State\nConvention to-day, in committee of the\nwhole, several petitions asking for the\nimmediate withdrawal of the State\nfrom the Federal Union were presented.\n\n\nThe report of the Committee on\nFederal Relations was then taken up,\nand the ninth resolution was adopted.\nThe eighth resolution, slightly altered,\nwas also adopted.\n\n\na resolution also passed the Commit\ntee providing for the appointment of\nthree Delegates TO wait upon and ask\nthe President what policy he means to\npursue towards the seeded States. The\nresolution was subsequently reconsid-\ncred amid some excitement, when the\nConvention adjourned till Monday,\nhoping in the meantime that calmness\nwould succeed to passion.\n\n\nVolumteers for Confederate States.\n\n\nMONTGOMERY, April 9.-A call from\nthe War Department will be made\ntonight on each of the Confederate\nStates, for three thousand volunteers,\nexcepting Florida, which will be called\non for fifteen hundred.\n\n\nInteresting from, NeaO York-Ihe ILL.,\n\n\nmois Completely Fitted Ont. -.\n\n\nNEW YORK, April 8.-Tbe chartered\nsteamer Illinois took 1900 barrels of\nassorted stores, 500 cases of muskets,\n2 parks of artillery, large number of\ngun carriages, large quantity Of\nammunition, and $4,000 in specie.\n\n\nShe sails tomorrow morning.\n\n\nLater from Neac Merico,\n\n\nINDEPENDENCE, April 9.-The New\nMexicap mail, with Santa Fe dates to\nthe 25fh nlt., arrived here to-day.\n\n\nFort Marcy has not been taken, as\nwas previously reported. A treaty of\npeace had been concluded with the\nNavajoes,\n\n\nAt Santa Fe, business was decidedly\nbrisker.\n\n\nFugiti0es Off for Canada.\n\n\nCHICAGO, April 8.-One hundred and\nsix fugitives left last night for Canad da.\n1t is estimated that over one thousand\nfugitives have arrived here since last\nfall.\n\n\nDETROIT, April 8.-About three\nhundred fugitives, principally from\nIllinois, passed here into Canada since\nSaturday. Large numbers are report\ned on their way.\n\n\naid for The General GoUernment.\n\n\nHARRISBURG. April 8.-Governor\nCurtin will tomorrow recommend to\nthe Legislature an appropriation of\n$4,000 for the purchase of munitions\nof war. He thinks it IS the duty of the\nState to assist the General Governments\n\n\nNa0igation Of the ohio.\n\n\nLOJIsFILLE, April g. The Ohio\nriver, at this point, was still rising this\nevening, with 8 feet of water in the\ncanal.', 'The Commander at Fort MclIenry is like.\nly 70 hold his position. In his fast contact\nWith thu rebels they were worsted. Obscrv-\ning that batteries were beng erected by the\nBsltmorcans in position attacking the Fort.\nhe Is said 20 have sent shot whistling\nthrough the air above the shovels and guns\nOf the traitors. Presently deputstion OF in\nsuliel. indignant. and offended Baltimcrcans\narrived AZ the For, and demanded 20 know\nwhat he meant BY firing At or near them\nThe commander replied somewhat a. follow;\n\n\n""Geadcmtn. | havent read history for\nnothing rensmber reading OF Fort\nsumter where an attacking party Of traitors\nacre suffered 20 begin and continue the cree\nton OF batteries AL about II. One day they\nopeaed ere. and The neat the people 10 the\nFort we\'re smoked out and had 20 surrender.\nNov, gentleman, wont submit 70 any such\nd---aonseasc here']","Ah, welcome! I was just reading about some troubling news concerning Major McCulloch. You see, it appears he was gravely wounded during the recent battle at Springfield. Reports say he got shot through the hips and a ball struck him in the forehead, leaving him in a precarious state. After the battle, he managed to make his way back to Camp Chesapeake near Mount Vernon, where he unfortunately succumbed to his injuries. 

What’s particularly striking about the situation is how his passing was managed. It seems his death was kept a secret even from his own men for a time, likely to maintain some semblance of morale and to retain the prestige of his name for the operations in Texas. They even placed his son, Ben McCulloch Jr., in nominal command to keep up this deception.

This Major McCulloch, he’s known to many around these parts, and there’s a strong feeling of loss in regards to his contributions. I think the folks around here will mourn his passing deeply. Such is the toll of this conflict we find ourselves embroiled in. It weighs heavily on everyone, doesn’t it?","Major Wright, who is an old acquaintance of McCulloch, mentioned that he had ranged with him one hundred miles up the Colorado river, and he is convinced that McCulloch is dead after being shot in the battle of Springfield.",0.7142857142857143,0.8688639195210791,0.698412698389418,1.0
What role did S.Savannah play in the appointments of the Confederate States Army?,"['APPOINTMENTS IS THE SOUTHERN L\n\n\nAnMY.-The following, from the Mont\n\n\n.4Irefiser, Of tie lIlh inSlaLt, correc\n\n\nry prevalent rai>a prelensi""n, concerning the\nappointments the rcsulara army nfthc South.\nFrom this. it Will appear that the appoint\nnc:t\'s ""f Gen. HraGr\'@ar\'I and Gen. Bragg\nar\'\' both merely PROVISIONAL:\n\n\n"" Ii may M..t he ;,npro?rr here. to state, in\norder 10 cur:ef;\' som"" nlrarirrhcn>i""is which\nsrcn t"" have existed. that there has been Us\n.:ct hut n\':e appointment made in the Regular\narlmrnf tic Confederate States ot America.\nCd. Ilar.l""c Of S,Sannah, for -o:,.n year, com.\nranLan; cf the Academy s. West Point, has\niccn appointed Coinncl Of the FIRST Regiment\not ln!at.y. 1\'h.. other appointments which\ni.;,v.. been am.lnur\'c,! some days >Inca, are to\n,iiicc> III the i\'soriSi""arl .t,mp.""', 'A4hHr:S1 Al UF Tnh UdNFEDERATE STATES UF\n\n\nWhere\'s Ry the provisions of this Sd section Of mn act of Con\ncrasI approved gust Both 1861, entitled Collect\nfor distribution the remaining iu the several Post\ntaken charge by the said Government is made the duty\nthe General to make proclamation that all persons\nwho citizens OF he Confederate States ot America and wo\n\n\nhave rendered postal service IN any OF the States of S\nEofreracy, contracts appointments mnde by the\nUnited Government bsUe the Confederate States Gov\nr3nent charge such servict shall their claims\nto this department. vGieind established according such\nrules rs he prescribe VI lime therein be set forth,\nless than months requiring the claimant to\noath how phd and the Of such ymeu.s,\naccount appointment under which said claim\noccurred and fund provision has been set apart\nbalance of such claim, the eyernmcnt OF the United\nStates, of OF the States and they shall also state\nappointments during the time for which they\nclaim and if what pRrtRl they did perform\nwhat deductions hav Teen made from their pay 70 TAR as\nthey know Of failure partial t""re 10 per\n\n\nNow therefore T. JOHN II. REAGAN, Postmaster General\nothe Confederate OF America do issue this, my prOcaina\nrequiring all persons having claims Tor postal SERVICE\nunder the foregoing provisions of the Sd secon OF the above\nfor 0e Department for examination before\n18th day Mach 1852 order tnat may make report\nCongress of the amount thereof as required by law\n\n\nBlank presenting and verifying the claims Will ne\nfurnished application the Auditor OF the Treasury for the\nPostOtitC Department\nIaced moneys The States composing the\nConfederate States and which they had not paid over M ts\ntime Confederate States took chage of The postal service to\nunder TIL and send = the AuoF OF t !ieaNl\nTor Pos0ce Department, before the 18Th day ot\nOctober next general ledger account with the United\nStates Of the PdstOAce Department. up to tile\nOF the postal assumed by tEe Con\nfaerRte ates accordance with the general regulations OF\ntha P1, ica Department May 18TH 1889 page Qb\n\n\nii @ ,n Lnras in Ihe nose9,il of syrh po,tnlasters\n\n\nGiven under my hand and the Poics Department\no. the Confederate States Of America q! Ntchpiond Virginia\n\n\nTInsI JOHN H. REAGAN,\n\n\nSAB ltsgiw Postmaster General,', ""SAVANNAH. ca, Feb. 9--Ycster.\nday Gov. Brown seizad FIVE vessels\nowned 10 New York.\n\n\nMEMPHIS. Feb. 9.--The arsenal\nat Little Rock, Arkansas, with 5000\nstand. of arms, and large amounts\nof bunition, snd 40 cannon, ia\nGLIDING Capt. Braggs' battery, was\nto the State authorities\nyesterday. 1t is now garrisoned\nWith 100 volunteers. I\n\n\nMONTGOMERY, Ala, Feb 9--Jeffer-\nson Davis, Of Mississippi,was to-day\nunanimously elected President Of\nhe ConfeGeraied States of North\nAmerica, and A. II. Stephens, Of\nGeorgia, Vice President, also unani-"", ""!, l. The Government established by this\nConstitution is the successor Of the Provis.\nonal Government of the Confederate States\niof America, and all the laws passed ~ the\nlatter shall continue in force until the same\nShall be repealed or modified and all tho\nofficers appointed by the same shall remain\nin ollice until their SUCCESSORS are appointed\nand qualified, or the Offices abolished.\n\n\n,. All debts contracted al engagements\nentered into before the adoption OF this Con.\nsiituliun shall be lis valid against the Conlrd.\ncrate States un'lrr this Constitution us under\nthe Provisional Government.\n\n\n!. This Constitution, and the laws OF the\nConfederate States, made in pursuance there\noil, and all treaties made, Or which shall he\nmade under the authority Of the Confederate\nStates, shall DC the supreme law Of the land !;\nand the judges i'll every State shall be bound\nthereby, anything in the Constitution or laws\nul any State 10 the contrary notwithstanding.\n\n\ni. The Senators and Representatives before\nmentioned and the members of the several\nStates legislatures, and all executive and ju-\ntlicial Offices, both of the Confederate States\nand Of several States, shall be bo;ind by oath\npr affirmation, to support this Constitution !:\nbut no religious test shall ever hc required rs\naqu'liiIcaiion To any Ci'icc Or public t.rst M.\nder The Confederate States\n\n\n5. The enumeration, in the Constitution, of\nCERTAIN rights, sEall not be construed to deny"", ""for US to say anything Of him. In the late\n\n\nmovement Of Georgia he Eas been active and\npotential In the cause Of secession. We homer\nhim for the signal service he has rendered.\n\n\nHe has been called to a post OF great impor-\n/ tance-one which will serve to display all Of\nbis merits as a statesman. Upon the sagacity\nOf his couHsels and the power Of his pen,\nmuch will depend in regard to the relationship\nOF the Confederate States with the rest OF the\nworld. He has our hearty good wishes for\ncomplete success in the grave duties which lie\nbefore him.\n\n\nsEcKKTARV OF tbs TREASURY.\n\n\nHon. C. G. Msmmlnser. There are few\nmen in the South who are more competent, In\n/ point Of ability and business capacity, 70 ad-\nminister the department Of the treasury under\n4 the Government Of the Confederate States,\nthan Mr. Memminger. Possessed Of high\norder Of intellect a student, learned and full\nOf resources as an accomplished advocate, he\n] is sminentlv man Of facts and details. This\n/ is an essential qualification to great imam\nZ eicT, and combined with ability and integrity,\nalmost insures success 70 one who, like Mr..\n/ Msmminger, has studied political economy bv\nI the great principle Of lGisses p0ss fairs. The\nSouth wants an economical government, and\nan adequate revenue raised BY equal taxation\n1 Of citizens Free trade, low duties and no dis\ncrininations, will put all on an equal footing,\nand saddle The burthen Of taxation upon tbe\nlabor Of none. It viii encourage none to enter\nupon unremnnerative enterprises at the expense\nOf neighbors' pockets, but give ell fair play\nand the benefits Of the markets Of the world\nWe congratulate Mr.. Memminger upon the\nhonor OF his appointment to this responsible\nposition in the new ConfedeTaey, and the States\nupon having one 80 well fitted to perform its\nduties faithfully and upon sound principles.\n\n\nSECRETARY OF WAR."", ""We. the people Of the Confederate States,\neach State acting in its sovereign and nde-\npendent character, III order 10 form ;s l,,eu'a-\nnent federal government, c>tabiiS:! Justice, in\nsure domestic tranquility, and secure the\nblessing of liberty to ourselves and our pos:\ntertv-ilYvoking the favor and guidance OF\nAlmighty God-do or,lain and establish thi>-\nConstitution for the Confederate States OF"", ""v AsHINGTONl . an D.\nOn inquiry at the proper quarter It has been\nascertained tlat before June last il being found\nthat the arms az the several arsenals were not pro-\np0rtionately distributed, and that the Southern\narsenals were quite deficient in these supplies a\ndistribution was made Tor equalization only and\nfor no other obiecg. They were principally drawn\nfrom the Springfield armOry, and from the aTsen-\nais az W aterVieit, n Y, and WatertOWn, Mass.\nThe secession troubles, It Is known, had not\nbeen commenced I'LL after the distribution was\ncomplete. There remained prepOnderanee OF\narms az the North.\n\n\nLieut.. Gen. Scott was engaged TIL O'Clock\nthis morning on business connected with his De\npartment.\n\n\nThe Republicans were again in caucus to day,\ntheir object being 70 agree on uniform Legislative\naction\n\n\nThe arrival Of recruits from Philadelphia for\nthe purpose Of being drilled at the Marine Bar\nracks at Washington has been magnihed into un\ndue importance."", '>. lie 81 III .;v ;\'oNrr, By AMI wltilhe\nadvice All cn!iscl.t of the Senate, to nEc\ntreaties provided two.,hirds Of the Sen""rS\ni,c<.n, cnHcnr; and he shall nominate, md\nil, .::d with Tie advice and consent othe\nS.iate, shalI appoint anbas.a lurs, OF crab\ntic minister AID cunSuIs, Judges Of thSH\nrremc Court, and al! other officers of the on\niclerale States, whose appointments artno\nhcrcin otherwise provided for, and which sa\nbe established by law; but the Congress lii.\nhy law, Vest the appointment o! such inic;r\nGers, rs they think proper in The l\'resl,i1\nalone, ia The courts OF law, or III the beads\nDepartments.\n\n\n:. The principal officer in each OF the IiS\'\nalive departments ana III iersoES connc\'\nr,i with lhc diplomatic service, nay be\nmoved from oNce ut tile \'l:asl,re OF the FRI\niicnl All either civil officers OF the k.N:\' .:\ntive Department may be removed at any III\nby the President or otnrr appointing pow\nwhen their services are UNNECESSARY, or\ndishonesty, incapacity, incIlicicncy, misct\nduet. or neglect Of duty; and whrn so\nmoyc,!, the removal Shall be reported to t\nSenate, together with the reasons therefor.\n\n\ni. The President shall have power to\nail vacancies ,hat may happen during\n! rer""ss Of The Senate, by granting commlssic\n| which Shall expire at the crd OF their ne\nsession, but no persun rejected by the Sem\nshall be re-apraintcd to the same Office\nring their caslling recess.\n\n\ns,Er. 81. The President shall. from til\nt, time, .ivc TO the Congress information\nThe state of the Conlcdcracv, and recomme\nln ,leir consideration such measures as\nsl.a!I udgriiccc<sary and rXpedicnt; he III\nI\'ll extraordinary occasions, convene DC\nHouses, ar either Of lllcm; and in case OF q\na.-r..mcnL = hr;w1cn them, with respect to\n! time o\' a,iiournmcri he may adjourn tn\n10 such TIM: Il, he shall think proper; he s!l\nreceive ambassadors and Other public mir\ntors; he shall take care that the laws\nfaithfully executed and shall commission\nthe oilirurs of the Confederate States.\n\n\nSEC. IL. The President. Eicc-PreSldc\nand I\'LL civil DlcrrS of the Confederate Stat\nS!.all be removed from oIlice Oh inprachm\'\nlor. anil conviction of, treason, bribery,\nether il. ii crimes ana mis\'lcmcailors.\n\n\nARTICLE, III.\n\n\nSrc. IL. \'Ina judicial power Of the @\n/, Gr,lyralc States S!ll be vested in ono SupcE\nCourl, and iii such Inferior Courts rs the q', 'being quite brisk in the States of Ohio, Illinois\nand Indiana pable appeal having been made\n| to their fear of invasion from the Confederate\n| forces. Few enstmeats, however are made by\n\n\nkentuckans in the northern counties, most of those\nwho enter service coming from the central portion\n| of the State.\n\n\nWe are further informed by the same gentleman\n| that Hon. r. II. Stanton, formerly member of Con-\n\n\ngress from the Maysvllle district, arrested last\n\n\nweek, account of his alleged secession proeliy-\n| ties, and sent forward to Columbus, Ohio, where\n| many others confined for similar offense.""\n| Hundreds of loyal Southerners in Northern Ken\n| lucky daily making eff,rts to come through,\n| but are watched so closely as TO render their pas\n\n\nsage South very dangerous and difficult\n| Memphis appeal.', ""One hundred and fifty Sharp Shooters, to\nbe attached to Col. ASaIADE's Regiment of\nzouaves, for Coniederated States Army. En-\nquire OF A ]. d. THURSTON.\n\n\nOver the Post OfIice."", 'A0ofsds correspondence OF the Fto1ser and Democrat\n\n\nWASHINGTON, February l3.\n\n\nI ventured to extract hope for the resto.\nration Of the Union, from the action Of the\nSeeding States Convention in the election\nof DAVIS and STEPHENS to the Presidency\nand Vice Presidency Of the Cotton Confed-\nGRAFTON. The struggle in that Convention\nwas between Mississippi and South Caro-\nlima and the policy of Mississippi has\nbeen adopted. A permanent government\nhas not been inaugurated, but only provi-\nsional one; and whatever steps may be\ntaken in giving their movement a lasting\nshape, it is certain that it will remain for q\nyear, or so, on temporary basis. This is\nin accordance with JEFFERseN DAVIS\nscheme for Reconstruction and I am con-\nvinced that what ever may be regarded\nsatisfactory by the Border Slave States,\nwill be ultimately accepted BY those of the\nGulf.\n\n\nIt is plain, that, although South Carroll\nma initiated secession, she has not been per\nmitted to guide its course. When the con\nservative Union men of the other Gulf\nStates saw that secession was inevitable,\nunder the impulse of the political tornado\nwhich was sweeping over the South, instead\nOf bopelessIy opposing it, and leaving it\nunder the control Of rash, impracticable\nmen. they assumed its leadership. for the\npurpose of guiding their erring Common\nwealths back to their old allegiance when\nthe storm Of passion had subsided. This is,\nunqusstionahly, the policy Of those who\nhave obtained the direction of affairs 10 Q\nmajority Of the seeding States. In this\nview, these men, though nominally placing\nthemselves and their sections 10 an attitude\nof rebellion against the government, are not\nJustly ihs sa.jects OF harsh Remuneration.\nfsteafstsy 81 ~ s t-Atttfs 81 43Anrff 49,', 'CHARLESTON, Jan. 5.\nThe journals 70 day puo.ish tire correspondence\nbetween the Commissioners TO w ashington and\nthe President of the United States.\n\n\nHon. A b. LOngstreet, President Of the South\nCarolina College, has issued a TOUR PACED pamph-\nlet, entitled Shall South Carolina begin the\nWARP He earnestly desires the Collector on\noard the Harriet Lane 10 be allowed to land, and\nsays that he should be treated politely and intro\nduced to Collector ColcOck, SO that the Collectors\nof the two sOvereigntes could use every means\nto settle the respective claims in spirit of cour\ntesy and kindness. If the Forts are reinforced\nIt would be an unfair conflict. in which hundreds\nof our sons would be slain. Fort Moultrie would\nbecome deserted, and the wrath Of the United\nStates would be brought upon our devoted city.\nHe implOres the people to let the first shot come\nfrom the enemy\n\n\nThe President Of the Convention received a\ntelegram from Mayor Monroe, Of New Orleans,\nwhich is as follows "" The city of New Orleans\nfully sympathizes with the city of Charleston in\nthe perils to which she is exposed, and will not\nfail 10 support her when the occasion requires ae-\nton""\n\n\nMr. Hudson offered an ordinance that all power\nnot necessary to make postal arrangements and\nenact postal laws be vested in the General As\nsembly. Passed.\n\n\nofficers in any force, regular or volunteer, raised\nunder the order of the Convention, to hold seats\nin either House of the General Assembly, or any\nother Office Adopted.\n\n\nMr. Curtis offered a resolution that the late\nCommissioners to Washington be requested 10\nprepare, at their earliest Convenience, written\nstatement of their oral communication 70 this\nbody, ana communicate the result Of their recent\nattempt at negotiation with the President Of the\nUnited States Tor the delivery Of the Forts and\nother State properly, said document to be depos-\ntied with the President Of this body, with an In\njunction Of secrecy until otherwise ordered\nAdopted 5ru\nAn order to print five Thousand copies Of the cor\nrespoudence between the Commissioners TO Wash\ninFton and the President Of the United States was\nlad on the table.\n\n\nThe chair and tho appurtenances used on the night\nal -iynfor The Ordinance Of secession, ordered\nTO bs placed IN the State House at Columbia.\n\n\nThe adupton Of an ensis was ordered 70 De let 70\nthe Legislature.\n\n\nAdjourned.']","Ah, welcome! I see you’ve arrived curious about the Confederate States Army and the appointments concerning it. It’s quite a topic these days, wouldn't you say?

Well, from what I've gathered in conversations and through recent articles in our local papers, Savannah has certainly played a notable role in the appointments of military officials within the Confederate Army. Specifically, I recall reading that a Colonel from Savannah, who had been commanding at West Point, was appointed to lead the First Regiment of Infantry. His name is a good one to remember—Colonel Hardee. 

You see, as our new Confederate government solidifies itself, the appointments have mostly been provisional for now; they’re setting the stage for a more permanent structure down the line. There’s been quite a bit of discussion about how the Southern Army is organized, and Savannah, being a significant port city, is naturally at the forefront of military strategy. 

It’s also interesting to note that some articles mention that there haven’t been many appointments made to the regular army, which seems to indicate how freshly established our military is. Many folks are talking about how the command structure is evolving as we head deeper into this conflict.

In essence, Colonel Hardee's appointment illustrates Savannah's importance not just economically, with its bustling trade routes, but also militarily, as our new nation's officers look towards capable leaders for the defense of our states. We’re all keeping a keen eye on how these developments unfold, as we might be looking at the foundation of something very significant for our future.

So, what do you think? Do you feel as involved in these matters as we do here in the South? It’s quite an important time we live in, yes indeed!","Col. Hardee of S.Savannah has been appointed Colonel of the FIRST Regiment of Infantry, as noted in the context regarding appointments in the Regular army of the Confederate States of America.",0.29411764705882354,0.0,0.4999999999875,1.0
What was the reaction of the citizens in the village near New York when they were subject to military duty?,"[""sseldIers In Peace Citizens In War,\nNoRSHERs Pluck FULLY TEsrED-A NORTHERs\nVILLAGE Thrown INTO INTENSE ExcETENENT.-f oul\nNorthern neighbors of the old Confederacy could\ndemonstrate their courage by the threats which the\nBlack Republicans are continually venting against\nUS poor Southern rebels and traitors then, in\ndeed, would the world be compelled to recognize\nthem amongst the most valiant men of the age\nBut, they are not the men to face danger when il\nactually occursthey fight well on paper, but they\ncertainly don't ike to smell gunpowder. or to face\nSouthern steel and bullets.\n\n\nIn the village Of c., in New Jersey. not hun\ndred miles from New York, is a nest of Republicans\nof Greely stripe who have almost split their hroats\nin denouncng the Southern treason, and in declar-\ning their intentions to aid Mr. Lincoln in enforcing\nthe laws, and retaking all the Southern Forts' On\nthe day of Mr.. Lincoln's Inauguration they became\nvery jubilant, and were blating their predictions\nIa Greedy that in thirty days the Southern rebles\nwould be brought 20 their senses, and would be\ncompelled to beg on their knees for quarters, and\nthey were ready at any time to go and help whip\nthe unruly Southern rascals.\n\n\nA good Democrat, who sympathies very strongly\nwith the South, concluded he would play little\ntrick upon these valorous Republicans and put their\ncourage to the test. Early one morning strange\nindividual was going through the streets OF the\nvillage, who served notice each and all the male\ncitizens subject to military duty. The notice ran as\nfollows\n\n\nTRENTON, N. j., March 9, 1861.\n\n\n\n\n\nin readiness (suhjeet 20 draft to enroll yourself in\nthe New Jersey Militia, to be called out at three\ndays notice. If you have any lawful excuse, re-\nport Immediately 10 the Quarter-master General,\nc. A. Arnold, Trenton, n, J. tG\n\n\nBy order of the Governor.\n\n\nu. C. VEsEY, Secretary\n\n\nNever was such CONSERVATION produced in any\nplace as was witnessed in said village, upon the\ncirculation of these citations. If rumour is to be\ncredited, in less than six hours there hardly"", ""HEa are unwilling 20 believe the telegraph\n&c reports of the total apostacy OF the major\nity of the citizens of the city OF New York.\nwho have professed TO be the frieIas of tho\nSouth, and the opponents of Black Republic\nanism, as the vote in the last Presidential\ncontest exhibited. We know that there are\ngood men and true there. who are willing TO\nstrand by the South to the last.\n\n\nWe have been informed by q gentleman\nlately from that city. that all the teiesrS phic\nreports from thence in relation to this appo.ia-\nCIV of New York citizens are enormously ak\nagGcratod, and that so far from the secret 60\ncieties being organized by the Lincolnites, IL\nwas just the reverse. Ii il be not 50. the\ne;.,nge is certainly very extraordinary\nv nat has become OF the Union procession OF\nthe bone and sinew of New York city, which\nturned out seven miles in length, in opposi-\nton 10 the Wide Awakesl\n\n\nWe shall wait for confirmation, before VIC\nare willing TO believe in the apostacy OF\nNew York city.-Nor Orleans Picayuns.\n\n\nThe above paragraphs index to us tue\nstate os surprise and apprehension felt in tho\nSouth at the union of the North for the sake\nofthe Union. The miserable traitors thought\nthey we're masters Of thu white men Of the\nNorth, as ofthe negroes Of the South. They\nwill soon discover their poverty. weakness\nshame and inevitable humiliation. The\nPicayune will hvae sooa enough confirmation\nof the solidity of the people OF New York fol\nthe Union. The procession Union Of the bon,\nand sinew, seven miles in length, is for th,\nUnion still, and all who are against the Union\nare to be whipped.-Cin. Commercial."", 'The Springfield Republican says that the\nprogress down the river was continued o\'a-\nton. and at every station where the tram\nstopped, they were greeted with immense\ncrowds and furnished with abundant COLA\n,ious. At Holvoke, Mr. Davis. agent OF the\nLYMAN mills. had formed thousand factory\ngirls in line beside the track, and although\nthe train did not stop, even passing glance\na. so many feminine faces. beautltied by en-\nthusasm and radiant with interest and SYM\npathv. must have checred the hearts OF the\nsoldiers who are off for the wars. Inc long\ntrain containing the regiment, and consisting\nof sixteen long passenger cars and SIX irelsh\'\ncars, arrived at this city at quarter past\nFIVE, and stopped opposite the Connecticut\nriver railroad machine shops, where they\nwere visited BY crowds Of our citizens, among\nwhom were many ladies, eager to see these\nhardy sons Of the Green Mountain State\nThe regiment comprises as fine a body OF men\nas can be found anywhere, Young. active, ac-\ncustomed to "" live out of DOORS and evident\n"" anxious TO engage in the good work before\nthem. Their uniform consists Of gray suit\nthroughout, very much like the uniform of\nthe l0.h Massachusetts regiment, only they\nhave coats instead Of jackets. They are arm\ned with the Enfield rifle, and take with them\ncamp stores and equippage complete. The\nregiment consists of ten companies OF ST men\neach, and each company is attended by three\nwomen who will act as nurses. During their\nSTAY of an hour and half in this city they\nwere treated 10 a handsome collation., pro-\nyided by order Of Mayor Bemis, and dispensed\nto the regiment by the members of the varl-\nGus engine companies in the city. The sol\ndiers talked freely with their visitors, being\napparently in the highest spirits, and the fine\nregimental band discoursed some of their\nbest music. At a quarter before seven the\nhuge train started on its way with its precious\nhuman freight, greeted with the cheers of the\nmultitude and sauted by the thunder Of can\nnon. On their arrival at New Haven they\nwere TO embark on a steamer for Jersey City,\nwhere they will take the cars direct for Balti\nmore Vermont has reason to be proud Of\nher third regiment, and there can be no doubt\nthat they will give good account Of them\nselves.', ""AN ELOrEMENNT IN RICH LIFE.\n\n\nOn the 8,h of July Mrs Emma Anne\nliza Scott, the wife Of a rich merchant in\nNew York city, loped with Mr.. New\nton st. John, enc OF the fast young men\nthat abound in that metropolis. The\nhusband end parents of the young lady\nWe're almost frantic at her disappearance,\nand New York detectives were dispatched\nIII pursuit Of the couple. A few d Us\nago one of the officers returned to this\ncity and called on the Chief of Police He\nstated that be had been over almost all\nthe West Where it was probable the par\nties would 90, but finding no traces should\nreturn home. He left, however, ihe\nminiatures of the lovers With Chief Nc\nDonough, SO that he might recognize\nami! arrest them should they came 10 this\ncity. Saturday the Chief received infcr-\nnation that led him to suspect that the\ncouple were among the passengers on the\nHawkeye. State, just arrived from St\nPaul, and detectives Welch and Eaeen\nwere dispatched with. the miniature 70\nfind out.\n\n\nAT Barnum's hey 5leatncJi tat p eEea-\ntIen,an and lady answering 10 tie des>\ncription had taken rooms. w.tlf the inton\niion OF starting the aext day lnr Chicago\nOn iurthef inquiry they were convinced\nthat they had found the parties, and SO\n| + ported at head quarters. The Chiet al\nonce preceded to Barnum's knocked at\nthe doer Of The suspected room, and re\ncosnizea the person who opened 1t as\nthe facinating Mr.. St. john, at once ad\ndressed him ~ tIae aame. The youth\nWas at first disposed 10 deny his denti\nlty, but finding it ussless, confessed to\nthe family c0gnonen, and introduced tie\niaoscondiug wife to his unweeome visi\ntor. Tbey Were both a. ence taken in\nto custody, and Newton spen, the bal\nance OF thc<day in as unromantic place\n| 40 SflfiUO JSC W iiGli llG CfLlG iOl I'll\nlin the evening TO more comfortable\nquarters, his personal appearance, to\nsay The least, was not as impre5 sise as\nwhen stopping at B@rnum's. Mrs. Scott\nwhois nineteen wears old and remarka\nbly, interesting in appearance, was sem\nto private house, where she will re\nmain until her parents or some fficel\nshall arrive from New Yolk. The lady\nstated that when they started fron\nNew \\ lork they took the cars at jersey\nCity and went to Philadelphia, stopping\nat the Continental Hotel From ther\n\n\nthey started fer the West, going to Mil\nwaukie and St. Paul. were they stai\n\n\nsA days. They there took passage fo\n\n\nthis city, intending TO go next day t\nChicago, where, their money bein\n\n\nnearly gone, they would procure a live\n\n\n'ihood as best they might. Previous t\n\n\nstarting on their journey, Mrs. SEQ\ndrew from the bank where she had de\n\n\nposted the sum Of $500 Only $3j\n\n\nwhich. is now left, Mr.. ST. John havin\nthe misfortune to be without funds"", '4\n| W. A. BEssoN acted as Secretary.\n\n\nRev. 81. WILLIAMS. by request of the Chair,\noffered prayer.\n\n\nThe Chairman stated the object for which\nthe meeting had been called, and invited\nfurther remarks and suggestions.\n\n\nRev. DR.. McTYEIRE offered the following\npreamble and resolution\n\n\nWHEREAS. The call for volunteers to de-\n| fend the rights and homes of the South from\n| a causeless and cruel invasion, has been\n| bonded to by many brave men whose fami-\n| siies depended their daily labor for sup\nport; and\nWHEREAS. 1t is alike the dictate Of justice,\nof humanity, of patriotism, that the wives\nand children of those who have gone forth to\ndefend and our wives and our children,\nand every interest and every right dear TO\nfreemen, should be kindly and tenderly cared\nfor in the absence OF their natural guardians;\nand ~\n\n\nWHEREAS, II will CHEER the heart and\nstrengthen the arm of the soldier enduring\nthe fafigues of campaign or the perils of bat\ntie, to be assured that those dear ones at\nhome. dependent on him, lack for no COM\nfort: therefore\n\n\nRESOLVED, That we, citizens of Edgefeld. do\nnow organize ourselves into society for the\npurpose OF extending such relief to the fami-\nlies of volunteer soldiers, in Edgefield. as\nmay be necessary for their comfort, in addi-\nton to the amount provided by the County\nCourt.\n\n\nDIR. McTyeire supported the preamble and\nresolution by appropriate remarks. There\nwithin this civil district tace1sty families\nof the character referred TO. The amount\ndrawn for their relief by the Magistrate from\nthe County Court found was 500 per month,\nand this amount would soon be reduced to\n$50 What is this among many? Some\nOF the families were large and helpless\nnumbering six children-ail these families\naveraged about three children. House rent,\nfuel, provisions and clothing were to be fur\nnished. The pay of private soldier was\nonly Sll per month. This might support a\nsingle man-cOuld not keep the soldiers\nfamily even if they got all of it. We must\ndevise some plan for additional aid. Winter\nwould soon be on US, increasing every ex-\npense of living. He was glad to cay none of\nthe families of soldiers among us had suffer-\ned thus far. but they would before winter\nwas over, unless other help was provided. 1t\nwould be shame to us for any soldiers\nwife or child to suffer. He was away-had\ntaken his life in band 10 fight for rs, to de-\nfend us. Surely the least we could do would\nbe to lake care of his family and keep want\nfrom their doors. Suppose the volunteer in\nthe mountains of Virginia or in Missouri to', ""Senator James IL. Lane has received his\ncommission as Brigadier General In adli-\n! tion to the three regiments heretofore accept\n| ed from Kansas, he is authorized to raise two.\nconsisting of twelve companies of infantry.\nfour of cavalry, and four of artillery. The\nCoIonels o. these two regiments are Colonel\nWerr, who served during the entire Mexican\nwar, and the well known Kansas Montgome |\nry. Gen Lane will occupy his seat during\nthe extra session of Congress. He expects |\nto take command of his brigade about the\nGoth Of July.\n\n\nBALTIMORE, June 27th.-Considerable ex-\nelement exists occasoned by the arrest of\nMarshal Kane. Union men are pleased, but |\nSecessionists are Indignant Col. Henley. |\nthe Provost Marshal, waited on the Mayor\nand Police Commissioners, when the latter\nasked him to consider the matter. IIenlv |\nreplied that his orders were immediate He |\nthen proceeded to the MarshaPs office, taking |\npossession The Commissioners then directed\nthe officers to obey the military authority,\nbut declare their intention to prepare a pro-\ntest against the action of the Government.\n\n\nLOUISVILLE June 2S.-Two fugitive slaves,\ncaught near Corydon, Indiana, were returned |\nto Kentucky yesterday. There was no ex-\ncitement whatever at their arrest.\n\n\nMajor Gen. Pillow issues a proclamation in |\nthe NJ emphis Bulletin of the 24th, which re-\ncalls the order that whisky and tobacco be |\nUlStrlhntnd xpif fI,o\ngave the order on his own responsibility, |\nsupPosing the Military Board would allow it. |\nknowing that the soldiers were gentlemen\nana used to plenty of whisky and tobacco.\nrhiLADELAHIA, June 27th--The prize ship |\nAmelia is at the Navy Yard. The cargo con- |\nsists OF iron crates, camp ovens, equipare and |\nmachinery. The vessel is valued at Sl2 600 |\nand the cargo at S500,0OO. 1t is thought thai |\narms are concealed in the crates.\n\n\nA Washington special correspondent of the |\nn. Y. Post says movement is on foot to |\nelect Emerson Etheridge Secretary of the |\nSenate lie will accept if chosen.\n\n\nAn election for Senators to represent Fair I\ntax county, Va, will occur Saturday, but no\nvoting is expected except within tho lines of\nthe Federal troops\n\n\nspecial dispatch to the New York Com\nmercial says. Chandler (Bell and Everett,)\nelected in Virginia, has arrived here from\nNorfolk, being obliged to leave. He saws\neverybody thereabopts is being pressed into\nthe Confederate service.\n\n\nWASHINGTON. June 27th-Itis contemplated\nsending the returned Texan U. s. troops to\nthe Plains to keep the Indians in subiection,\nand to keep the daily overland mail route\nclear.\n\n\nBALTIMORE, June 27th.--at 8 o'clock this\nafternoon, George P. Kane, Police Marshal of\nthis city, was arrested at his house by order\nof General Banks, and conveyed to Fort Nc\nHenry, where ne ia now held prisoner."", 'We hnd the following paragraph IN the\nBoston Atlas Of ye.scFia,\n\n\n""A letter received by Young man ia\nthis city. from friend n Newkirk. y. J.,\nstates that MAJOR Robert A Anderson. the hero\nofSamter. New Jeneyman b, adoption.\nhas asked permission a. take command Of\nthe volunteer troope from that state. aud\nPROMISES o. lead them into bort Samtet\nIt\'s wishes vii undoubtedly 10 acccded - hy\nthe government', 'The following dispatches were sent IRON\nNew York on Monday evening, but were sup\npressed by the authorities OF Ohio although\npublished elsewhere:\n\n\nHARRISBURG, April OLA special train left\nhere last night for Chambersburg, loaded\nwith ammunition, and also one for York,\ncarrying arms. blankets and tents\n\n\nThe news from Chambersburs to-day re-\nports the camp in fine condition. and Gen.\nWilliams commanding, has reduced the\nstrictest discipline.\n\n\nCommissary Gcaeril Erwin goes TO Pitts\nburg 70 night TO form military camp. Troops\nare TO be collected there to protect the from\ntier of the southwestern counties. ii necessa-\n~; also to protect the Union men of the\nnorthwestern counties of Virginia.\n\n\nOne thousand regulars from Carlisle bar\nracks and xix bundled horses have already\npassed The mounted cavalry formerly oil\nTexas. viii move during the coming week.\nThe li,h regiment will be organized to NOR.\nrow. Five regiments NJ Camp Curtin are\n&c sdy to move at u moments notice.\n\n\nThe Governor Of Ohio is moving two Regi.\nments on Wheeling. one on Parkersburg\nand one ON Guyandotte and Point Pleasant. &c\nprotect the Union men OF Western Virginia', 'A patriotic New York gentleman sent\nto Col. Wilson $500, for the use of his\nregiment of Zouaves, when the messen-\nger put his hand into his pocket to get\nout the money and hand it to the Col it\nwas gone, he then told the Col. his\npocket had been picked and the money\nstolen. The Col. replied, its all right,\nl saw the boys in their tent, counting\nand dividing the money.', 'Jhese sentiments were received With unan\ninoss cheers and applause. The Gag Of on\ncountry, susrendsd behind the Chairman\ndesk, was cheered till tho old dome shook\nThe Star epausled Banner was sung %\neheeFed, and cheered and sung. YaDks\nDoodle vhistled itself from the puckere\nnouths Of Young America, and glisteniu\neyes showed that the fountain Of pasriotis1\nhad been reached.\n\n\n4 committee VAS appointed 10 enroll\ncompany Of Infantry and Dragons, and =\nter unanimous pledge on the part Of Il\naudience 70 hold themselves in readiness\nlight for their country whenever they shoe\nDO called for, the meeting adjournsd vi\ncheer upon cheer.\n\n\n1t VAS agreed on oil hands that II vas Il\nbest meeting ever held 10 Fort Madison.\nhave given You only naked facts; descripti\nand comment would be tame.\n\n\nWho says We have = divided North VI\nhas ever dreamed Of the power it i about\nput forthf SORlBO.']","Ah, you’ve come at quite a time, my friend! Recently, there’s been quite a stir in our neighboring village in New Jersey. You see, it all started with a rather mischievous fellow throwing notices around, telling all male citizens that they were to enroll in the New Jersey Militia and be prepared for service at a moment’s notice. When the menfolk received this news, you should have seen the commotion it caused! 

I reckon you could cut the tension with a knife. Imagine the conversations! Folks who had been loud in their denouncing of Southern rebellion suddenly turned pale at the thought of facing actual conflict. It’s one thing to shout bravely in the safety of your parlor, but quite another to think of the smell of gunpowder or to march off to war. It seemed like their courage vanished into thin air!

Some of the men tried to make light of it, claiming they would be ready to fight the Southern “rascals” when the time came. Yet, when faced with the prospect of actual service, many of them were looking for excuses. I heard some say it was too much to expect of them, what with families to care for and fears of what might happen should they be drafted. The village fell into a frenzy that day, and I daresay it’s a sight I won’t soon forget.

So, when you talk about the bravery of those who criticize our Southern neighbors, remember this: there’s a vast difference between the bravado of words and the reality of battle. It’s easy to sound valiant, but it takes true heart to stand firm when faced with danger.","The citizens in the village near New York exhibited extreme concern and panic upon receiving the notice for military duty. Many claimed various ailments to avoid the draft, and some even experienced dramatic changes, such as a barkeeper losing his wig and realizing he was older than he claimed. The situation led to a significant display of cowardice among those who had previously boasted about their willingness to fight.",1.0,0.8565939265696475,0.9999999999,0.3333333333333333
What role does the Cass County Republican play in the legal proceedings mentioned in the context?,"[""Rf virtue of an Execution issued out of and\n~ under the seal of the Circuit Court for the\nCounty OF Cass and State of Michigan, to me di-\nrected and delivered, have levied upon and shall\nsell at pubic auction, at the Court House in the\nvillage of Cassapolis in the County Of Cass afore\nsaid, on Saturday the 9th day of July next at one\no'clock in the, afternoon the following described\nreal estate, to w.t. The west half of the south west\nsouth of range fifteen q 81 west Containing eighty\nacres (S0) be the same more or less according to\nthe Government survey.\n\n\nBARTH w. SCHERMERHORN, Sheriff\n\n\nDated at the Sherif's Office, in Cassapolis, this\n18th day Of May, A. ID. 1861. may23 5w6"", ""STATE OF MICHIGAN-County of Cass.-ss.\ny At a session of the Probate Court for the\nCounty of Cass, holden at the Probate Office, in\nCassapolis, on Saturday the eighth day of June,\nin the year one thousand eight hundred and sixty\none. Present-Clifford Shanahan, Judge of Pro\nBATE In the matter of the estate of Lucetta ].\nCrawford and Henry A. Crawford, minors. On\nreading and filing the petition duly verified, OF\nWilliam Cotton, praying for license to sell real\nestate of said minors. Xf}SEf\nThereupon 1t Is ordered, that Saturday, the\nsixth day of July next, at ten o'clock in the fore\nnoon, be assigned for the hearing of said petition\nand that the heirs at law of said minors, and ali\nother persons interested in said estate are required\nto appear at a session of said Court, then to be\nholden at the Probate Office, in Cassapolis, and\nshow cause if any there be, why the prayer of the\npetitioner should not be granted.\n\n\nAnd it is further ordered, that said petitioner\ngive notice to the persons interested in said estate\nof the pendency of said petition, and the hearing\nthereof by causing copy of this order to be pub\nlished in the Cass County Republican, newspaper\nprinted and circulating in said County of Cass, for\nthree successive weeks previous to said day OF\nhearing. eHsEsrtra C. SHANAHAN,\n\n\nA true copy. Judge of Probate.\nCLARKE SPENCER, Attorneys for Petitioner.\n\n\ncuACIo, 4OV4.ssra Juut1o-oWO Il"", ""NOTICE is hereby given, that by virtue of a\nIn license granted by Clifford Shanahan, Judge\nof the Probate Court for the County of Cass, in\nthe State of Michigan, l shall offer for sale at\npublic auction the following described real estate,\nsection twenty in township six, south of range\nthirteen west, in Cass County, Michigan, and\nrunning thence east eighty rods, thence north one\nhundred and ten rods, thence west fifteen and a\nhalf rods, thence north two hundred and ten rods,\nthence west sixty-four and half rods, thence\nsouth three hundred and twenty rods, to the place\nof beginning, containing about one hundred and\nforty acres Of land, on Saturday the third day of\nAugust next, between the hour of nine O'Clock in\nday, on the premses aSoEe described 'A for ' the\npayment of the debts of Rulef ID. Gregg. deceased,\nand the costs and charges of Administration.\n\n\ns7sdo ioa JOSEPH JONES, ADMINISTRATOR.\n\n\n- De bones non\n\n\nJune 10, 1851. e-l~f fH june2O-ow6"", ""DY virtue of sundry executions issued out OF\nID and under the seal of the Circuit Court for\nthe County of st. Joseph and State of Michigan,\nto me directed and delivered, have levied upon\nand shall sell at public auction at the Court House.\nin the village of Cassapolis, in Cass County and\nState aforesaid, on Monday the 22nd day of July\nnext at one o'clock in the afternoon all the right\ntitle and interest of Ira G. Abbott in and to the\nfollowing described real estate, to wit: A parcel\nof land commencing forty go, rods North of quar-\nter % stake South side of section twenty &C.,\ntown six (6,) South of Range sixteen Q6,) West,\nthence North sixty co., rods, thence east one\nhundred and fifty-four Q54,) rods, thence south\nsixty CO., rods, thence west one hundred and fifty\nfour 154) rods to the place of beginning, contain\ning ffty-seven 75-10O acres. .-.4---... -\n\n\nAlso parcel of land commencing fifty five (55, }\nrods west of quarter q stake on the east side OF\nsection twenty (20,) town six 90 South of Range\nsixteen Q6) west, thence west sxtythree (63) rods\nthirty-seven (37) rods and twenty (20) links to\nquarter % section line, thence North eleven Q1'\nrods to center of section twenty CO. thence NORTH\nfollowing quarter % section line until it strikes\nthe creek, thence North following the meanderino\nof the Dowagiac until it strikes the section line\nthe North side of section twenty co., thence eas\nsixty three (63) rods to the northwest corner Of\nthe piece given to Isaac Thompson, thence fol\nlowing the west line of said piece south one hun\nbred and sixty Q60) rods, to the place of beginning\ncontaining ninety-one and $1,000 acres.\n\n\nAlso, the east fraction of southwest Il of section\ntwenty co., town six (6) south of Range sixteen\nQ6) west, containing sixty (60) acres.\n\n\nBARTH w. SCHERMERHORN, Sheriff\n\n\nDated at the SherifPs Office in Cassapolis, thi:\n9th day of June, A. ID. 1861. june13-Sw7"", ""DELLEVILLEs ILL., heb. 70, 1901.\n\n\nEDIroRs APPEAL: knowing as I do the\ngreat anxiety of the people Of the South to\nknow what the people are saying and doing in\nthe different sections Of the country, make\nbold to ask space in your valuable columns\nFOR few more words from Southern Illinois\n\n\n@ . ssauzal view Southern Illinois is now\nsi7Rding e. si7aqss- sil,sli. sgas55ase. sWaiting\nwith great anxiety and interest the result Of\n'peses cammittses,'' The balancing ef acom-\npromises,'' and other probable forthcoming re-\nsuits As her peculiar, and almost entire, in\nterests are now vested in the slaveholding\nStates, and consequently, mainly relying upon\nthem for her future prosperity, and as her citi-\nzens are generally noble in the cause Of patri-\notism, the peaceful settlement Of the present\nnational crisis has become a matter Of intense\nimport to her; and in viewing the unressona-\nbic, and even outrageous proceedings Of the\nRepublican party, and especially our State\nlegislature, their aVowed unWillingness TO, and\ntheir protestations against any compromise,\nare becoming more and more strongly attached\nto the South as the reVelry Of Republieanism\ngrows louder and fercer; and in the more\nsouthern part Of this state The Indignation\naroused by the message Of Gov. Yates to the\nIllinois legislature, is so great, that il is stated\npositively that IL would be unsafe for the Gov\nernor to visit that part Of the State. have il\nfrom a reliable source that the citV council Of\nCairo have already appropriated funds and\nsent an agent East to procure arms for the de-\nfense Of that city, in case the abolitionists Of\nthe northern part Of the Stasc should attempt\n70 make it place Of rendezvous. And should\nthe States Of Kentucky and Missouri with\ndraw from the Union, we NAV safely hope 10\ninherit the fertile soil Of Southern Illinois, aud\nreceive her noble sons into a Government\nwhere al African is not their superior in Ilfe"", 'From very good authority, we are satis-\nfed that Republican members Of the Legis-\nlature, were they not fearful of ridicule,\nwould gladly reconsider their hasty, discour-\nteous, and unpatriotic refusal to send\nCommissioners to the Peace Conference.\nTherei is now every prospect of a settlement,\nbut the Republicans of the Legislature will\nnot enjoy the satisfaction of contributing in\nthe slightest degree, to this much desired\nconsummation. On the contrary they have\nplaced every obstacle they could in the way\nof the restoration Of the mutual good will\nbetween the North and South. The Good\nhue Republican, the organ Of that party, in\nthe strongest Republican county in the\nState, in it\'s issue OF the 18th, expresses its\ndissent from the action Of the Legislature,\nand it but feebly indicates the dissatistac-\ntion of the people:\n\n\nWe believe that all non-ssceding States ex-\ncept Maine and Minnesota, have sent dele\ngates. We regard it q matter of regret that q\nsingle State should be without voice in that\nConvention, and we especially regret that Min\nnesota should be one Of those that refuse to re-\ncognize 80 patriotic movement. Our Legis\nture has certainly done itself no honor in the\ncourse it has pursued in the matter. =\nCertainly body of such men as Gov. Chase\nand Thomas Ewing of Ohio, David Wilmot, of\nPennsylvania, Dudley Field, of New York, and\nGov. Hall, of Vermont, can recognize and be-\ncome members Of, is not of SO bad . character\n~~lo frT ,orAx <r>o Of fns,<f\nintegrity and backbone"" Of Minnesota Re-\npublicans. -. 81. 3 80 -. ~ On.', 'following authorities: Addison on Ccnsrscs.. CSC 10\n70l; Story on Contracts sec % 10 ios P.r.or, en-\nConsracu, zoe-zs9 (toP) and note .. Metcsisa N\n! SnaWr lamp z; Bently VI. Grin s Taunt ESQ:\nLeggatt vs.. Heed, Q. ?. Is. and Taylor w. Brit\nton, reported 10 the note 70 tna laus r.re7 49,.\nStammers VI. Macomb, 2 Hend 4S4: No.Sez ""a ~,\ngsrte, Hill, So. Car. s3S; Sheldon w. Pendleion\n| l8 Conn., AZ, and especially Stammers vs Nscornb\nand Taylor vs.. Brittou.\n\n\nNow, in visw Of these principles, ~ appleasls 70\nthe facts of this case we think the instrucfio1 Of\nhis Honor the Circuit Judge, to the jury are e-ro-\nneous, because he entirely oyerthrows the disfinc-\nton between engagements made on the credit Of tie\nhusband and with the intention Of looking 70 hsn\nfor their performance-treating the wife bis\nagent-and contracts made with tie wife solely on\nner credit that Of hsr separate estate and with\nno intention Of holding the husband bound. That\nWe DO not misapprehend the charge ia this respect\nwe think Is sufficiently apparent IRON the body Of\nEout rendered more certain by the instrnctfons\nrefused By the Court\n\n\nInc jury were further instruoted-tiat II Judge\nS41Fon promised the plaintiffs II they would causo\nsuS cork C, 70 be measured snd valued By Hughes\n-. German ~ ne would pay for il, and in considers\n1on VI mat promise they did cause il 70 be meas-\noree ana valued By these men, such promise though\nno1 N xrlung and though made after the commence\nmen. on the suit would operate as an adoption Of\nIS .s ot mrs Catron from the beginning and\nwould maintain the present action\n\n\nThis instruction we also think erron.o,. - -.\ncause sucn promise-when sought ""a Be directly\nenforced Dy distinct suit under pieadinns propsr-\nly adapted TO it-could not, perhaps Be mairtaiuea\nanu e1eeuteo-e9t because the only use that eould\nbe made of IL in the present suit was a e,,;s ,.d\ning to show original authority from Jud1s Cafror\nto his wife to bind him in these contracts Gnrh a\npromise could not, perSe, Operass retrosoeetiveiv-\nin any other way--se a. % affect this action. kus\nto be available There being no anterior Hahiiif N\nthe part Of the plaintiff in error) muat be The sub\nject ofa distinct suithccompanied with proper aver\nments. The efect given 20 it in Ais acii0n bT tha\nCircuit Judge was entirely too great It should\nhave been left as proof for the consideration Of the\njury to shed light upon the nature Of the original\ndealings betweenArs. Cstron and the defendants in\nerror.']","Ah, welcome to Cass County! You've wandered into an interesting time, I must say. Our local paper, the **Cass County Republican**, plays quite a significant role in some of the legal matters around here. Just the other day, it reported on several legal proceedings that rely heavily on the publication's presence to keep folks informed.

You see, in legal cases, especially regarding estates or auctions, it is common practice for the courts to require notices to be published in local newspapers. For example, I came across a notice in the Republican about an estate matter concerning two minors, the Crawfords. Their guardian sought permission to sell their real estate, and the court ordered that notice be published in our paper for three weeks prior to the hearing. It’s how they ensure that all interested parties know what's going on and can attend the hearing if they wish. 

Then there's the sheriff's announcements. Just the other day, Sheriff Schermerhorn was informing the public about upcoming property auctions to satisfy unpaid debts. The announcements are printed in the Republican, making sure that anyone with interest might come to bid if they wish to. It's a bit like a societal safety net, allowing everyone the chance to participate in these legal proceedings.

So, you’ll find that the Cass County Republican is more than just a source of news; it serves as the connective tissue between the legal system and us, the community. If you keep your ear to the ground, you’ll find it a useful resource in navigating matters that pertain to land, estates, and other similar affairs. How's that for a start?","The Cass County Republican is required to publish a copy of the order related to the estate of Lucetta J. Crawford and Henry A. Crawford for three successive weeks prior to the hearing date, ensuring that interested parties are notified of the petition's pendency.",0.7333333333333333,0.9748528636335857,0.94999999997625,1.0
How did North Carolina's legislature respond to the principle of coercion during the Civil War?,"['The lower branch Of the North\nCarolina Legislature has adopted the\nsuhjoined resolutions, condemnatory\nof the principle Of coercion, AID az\nfirming the duty of the State TO re-\nsist the passage of Federal troops.\nThe resolutions we\'re adopted by a\nvote Of 63 to 20:\n\n\n""Resolued, That 10 the judgment\nof this general assembly, the Federal\nGovernment has no right to coeice\na seeding State; and South Catolina,\nFlorida, Mississippi, aud Alabama,\nacting in their sovereign character,\nthrough conventions, having with\ndraws, whether by secession or rev.\nolution. the federal authorities have\nno power, under the Constitution, TO\nmake war upon and subjugats these\nStates, or any other State which may\nhereafter adopt the like action.\n\n\n""Resolced, That it will be the auty\nof the constituted authorities Of\nNorth Carolina TO resist by force the\npassage Of federal troops through bei\nterritory to coerce aud subjugate Il\nSc &C ding Southern State, and that\nNorth Carolina ought to resist any\nattempt at coercion, either by land\nor sea, by all the means in herpower.', ""hlA4A DILL MA AeS- -\nThe adjourned meeting Of the 4th, of the citi-\nzens Of Philadelphia to consider the present state\nof the Union, was held at the Board of Trade\nRooms to-day.\n\n\nThe Committee 10 whom the coercion and non\ncoercion resolutions were referred, made no re\nport and there being an evident intention on the\npart Of many present, who did not participate IN\nThe last meeting TO force the passage Of the non\ncoercive resolutions of Judge Lewis, which were\nresisted BY prominent Republicans.\n\n\nAn exciting scene Of disorder occurred, during\nwhich, District Attorney Mann showed willing\nness to fight on the spot.\n\n\nON motion Of a Republican, the meeting WIS\nadjourned but another was Immediately called {\nthe same place\n\n\nJudge Lewis was placed m the chair\n\n\nResolutions were taken and unanimously pa\nwe'd, denouncing the personal bills sc. and appro\ning the Crittenden resolution.\n\n\nThe Republicans refused to participate IN th\nsecond meeting, and manifest much ill-feeling al\nthe conduct Of political opponents in overriding\nthem."", 'How TO MEASURE TREE.-A mechanic\nwishes to cut a piece Of timber thirty feet\nlong. lie selects tree but is not certain\nwhether the lenglh will hold out. How shall\nhe ascertain without felIiug it or climbing up\nto measure it? 4 simple principle in trigo.\nnometry will answer If two sides Of right\nangled triangle are equal the triangle will be\neqaiIateral. Measure thirty feet from the tree\non level surface, cut stick that will, after\nbeing driven into the ground vertically, reach\nup to you eyes. New lie down with your feet\nsgaiust the stick thus driven into tie ground,\naud If the top Of the stick ranges with the\nplace where you intend to saw the tree it will\nbe just the desired length. This principle will\nhold good for measuring the height Of any oO\nject, always remembering to measure the de-\nsired length from the base of the object to\nwhere your eyes will be, or drive in the stick\nat any place and calculate the length Of the\nobject by the equilateral triangle. Tins, If the\ndistance from the eyes Of the observer is one\nhundred feet, the height Of the object will be\none hundred feet-Educut0r', 'The writer opposes the CRIrrENDEN COM\npromise, on the ground that it guarantees\nslavery in all territory to be hereafter ac-\nquired. He thinks that Senator RioE\'s\nplan, as recently modified. promises most,\nbecause "" it puts an end to the whole SUBJ\nject Of slavery agitation, and removes it now\nand forever, from the halls Of Congress-\n1t has the approval, the correspondent un-\nderstapds, of SEWARD, SHERMAN, OoRwIN,\nADAMS, and others. es4s\n\n\nBut here is an extract, to which we invite\nparticular attention. For advancing the\nsame sentiments, the Press has glibly accused\nus Of sympathizing with ""traitors, rebels""\n&c. ,,.,.-...,..\n\n\nMen may talk as much as they please about\nnot cOnceding-n0t compromising backing\ndown. and all this sort of thing, but tell you\nthat the men who talk thus, do not understand\nthe facts in the case, nor realize the real danger\nwe are in. ! give it as my deliberate opinion,\nand settled conviction, that there scil be either\ncompromise or dissolution. / am well aware\nthat this will excite smile of derision on many\nfaces, and secure for me all sorts of denuncia-\nton, as s\'dough-face\' e\'\'-wanting shack bone""\nbeing ssweak in the knees"" &c; but this\ndoes not change the facts of the case, nor will it\ndivert the danger which threatens. My own\nopinion is, that we shall have q compromise.\nwith which the border States will be satlsfied.--\nthat then most of the seeding States will re-\nturn, leaving S0nth Carolina, and perhaps one\nor two others to fight it out alone. What the\nresult will then be, no one can doubt, they must\nyield. SOC 9asiiDs\n\n\nRepublicans of Minnesota, the alterna-\ntlves are here presented. Compromise, or\na dissolution of the Union, with the added\nhorrors Of civil war, is before you!\n\n\nOn the subject Of the subjugation Of the\nseeding States the Press correspondent\nstates -\n\n\nIn this review or statement of affairs, have\npurposely avoided the subject of armed coer-\ncion, because. while admitting fully the power\nand ability of the North to subjugate even the\nentire South, still we may not shut our eyes to\nthe fact that in the present state of affairs, any\nsuch attempt would inevitably result in q civil\nwar, such as the world never witnessed.\nA very prominent Minnesota merchant writes\nme that his business has fallen off one-half, in\nconsequence OF political dificulties-that the\nprices of grain are greatly reduced, and but\nvery few buyers at that. If the talk of dis\nsolution and war have produced this result al\nready, what will the reality bring2\nWho can estimate the destruction of life,\npeace, prosperity, personal and national wealth,\nthat would result from such war; And who\ncan tell where, when, and how it would end |?\nThese are questions which men ought to con-\nslider well before rushing headlong into war.', 'SHALL SOUTH CAROLINA BEGIN\n\n\nTHE WAR;', ""DY virtue of sundry executions issued out OF\nID and under the seal of the Circuit Court for\nthe County of st. Joseph and State of Michigan,\nto me directed and delivered, have levied upon\nand shall sell at public auction at the Court House.\nin the village of Cassapolis, in Cass County and\nState aforesaid, on Monday the 22nd day of July\nnext at one o'clock in the afternoon all the right\ntitle and interest of Ira G. Abbott in and to the\nfollowing described real estate, to wit: A parcel\nof land commencing forty go, rods North of quar-\nter % stake South side of section twenty &C.,\ntown six (6,) South of Range sixteen Q6,) West,\nthence North sixty co., rods, thence east one\nhundred and fifty-four Q54,) rods, thence south\nsixty CO., rods, thence west one hundred and fifty\nfour 154) rods to the place of beginning, contain\ning ffty-seven 75-10O acres. .-.4---... -\n\n\nAlso parcel of land commencing fifty five (55, }\nrods west of quarter q stake on the east side OF\nsection twenty (20,) town six 90 South of Range\nsixteen Q6) west, thence west sxtythree (63) rods\nthirty-seven (37) rods and twenty (20) links to\nquarter % section line, thence North eleven Q1'\nrods to center of section twenty CO. thence NORTH\nfollowing quarter % section line until it strikes\nthe creek, thence North following the meanderino\nof the Dowagiac until it strikes the section line\nthe North side of section twenty co., thence eas\nsixty three (63) rods to the northwest corner Of\nthe piece given to Isaac Thompson, thence fol\nlowing the west line of said piece south one hun\nbred and sixty Q60) rods, to the place of beginning\ncontaining ninety-one and $1,000 acres.\n\n\nAlso, the east fraction of southwest Il of section\ntwenty co., town six (6) south of Range sixteen\nQ6) west, containing sixty (60) acres.\n\n\nBARTH w. SCHERMERHORN, Sheriff\n\n\nDated at the SherifPs Office in Cassapolis, thi:\n9th day of June, A. ID. 1861. june13-Sw7"", ""W y ~\n\n\nARSENAL IN ARKANSAS SEIZED |\n\n\nRALEIGH, N. c.. Feb. 5 : The\nHouse unanimously passed u resolu-\nton declaring that III case of non\nreconciliation. North Carolina goes\nwith the South.\n\n\nCHARLESTON. February 5.--Nlth-\nlug is transpiring here to-day\nThe reported in'orccmeot u Gum.\nter is false.\n\n\nHARRIssuRG, Penn Feb S : Gov\nCurtin (Biack Republican, ordered\na salute 10 homer OF the result in\nVirginia.\n\n\nGALvE TON, Texas. Feb. 5 This\nordinance of secession passed Oh the\nIst by avole Of 1G6 to I The\nGovernor, Legislature, S upre me\nJudges anl Commissioner9 we're pr, $\nenf. Ii is to he submitted 10 the\npeople on the 23d Of February, and ii\nadopted 10 60 into 4, CT on the % Of\nMarch.\n\n\nGov. Houston recogniz The Con-\nvenlion Of The people, and declared\nhis attachment to The South and his\ndesire TO join the Southern Gun\nfederacy, and if none formed will\njoin the Republic Of T, xns.\n( Tae sentiment in favor Of uni.\nting TexBs. in The Southern Con,\nfederacy is represented 10 be largely\nin the ascenGunt.\n\n\nBurlington, VT, February c.\nThe late deleg ,ies TO tie CEicsco\nConvention from Vermont, couipri\nsing many of the lealiog Black Re\npublicans Of the State, mt iufor-\nmally at Montpelier, Yesterday, and\nunanimously protested against the\nadoption OF any Of the proposed\nplans Of compromise before Congress\n! WASHINGTON, Feb. G. House. =\nThe bill to suspend the mail service\nin Sec ding States passed by vote.\nOF 12l ag.iust 20.\n\n\n! The Commissionersto the Peace\nCongress are prohibited from divuI-\ngipg the proceedings ef the Con\n\nvenlion TO outsiders.\n\n\nNew GREENS, February T. A\nnotion to invite all the S'atss ex-\ncept the New England States 70\njoin the Southern Confederacy vas\nordered to be printed. aud made\nthe special order fer Saturday.\nLOUISVILLE, February THE\nKentucky Legislature have sgreed\nto adjourn next Monday udnl the\nGoth of March.\n\n\nMoNTGcMERY, Feb. 7.--Congress\nhas received an official cory of the\nact CO Alabama. approPriating bait\nmillion dollars for the support OF\nProvisional Government of he Sc\nceding States. But a short time\nwas spent 10 open session. The\nCommittee on the plan OF Pro-\nvisional Government reported in\nsecret session. 1t was discussed\nfour hours, With unanimity Of feeling,\nwhen the Constitution Of the Uoi\nI'd States was adopted. With some\naddition With relation TO Tree trade\nwith all the world. Adjourned ill\nl. o. clock\n\n\nRICHMOND, Va, F,a 8 1861\nIf the Washington Ctnf+ronce does\nnot agree upon an adjus'm ent,\nvery large mejority, near l20 mem.\nbeers out of 152, will b. for secession\nbefore he fourth Of March. The\nConvention will be governed by the\nConference at Washington"", ""ne working nen OIL new FOLK cRy /\nIgainst coercing the Southern States\nvas held in that city on Tuesday |\nhight. The attendance was very\narge, and the sentiments expressed\nand resolutions passed we're Of the\nmost decided character, aud show.\ndecidedly that the working men OF\nthe great commecial metropolis have\na due conception Of. the value oil\nthe South as the great market for\ntheir goods and manufactures\nSouth OF that point, it is to be\nhoped like estimate, at least, will\nbe manifested of the value of the\nsouthern market. As a proof OF\nthe soundness of the views held\nby the New Yor working men, We\nannex their resolutions as follows:\n\n\nReso!yed, That we regard the\npresent movement Of several Of the\nSouthern States in resumiDg the\npowers they delegated to the ger\neral government as an effort to pre-\nserve our constitution from being\nbeing overthrow b. Abraham\n\n\nLincoln, as his party platform re-\nqaires and demands him to do.\n\n\nResolced, That we are for the\n\n\nUnion--the Union of our fathers:\nfor thu cons:itutiou--the glorions\nchatter of our liberties--as ex.\n\n\npounded by the recognized authori\nty, upon the basis OF equal justice.\nliberty and inmuBities to all the\n\n\ncitizens CT I'LL the States.\n\n\nReso.red, That, believing that the\n\n\npeople Of the Southern States are,\n\n\nand have ever been content to re-\n\n\nmain in this Union under the con-\n\n\ns'iiution rs originally designed. we\ndeeply sympa.hize With them 10 their\nunwilling resistance TO an incoming\nadministration. Ehich, by perverted\n\n\nand unauthorized construction of the\nconstitution, tends TO destroy their\n\n\npeace. welfare and happiness.\n\n\nResolUed, That We are firmly and\n\n\nunalterably opposed to any aud every\n\n\nattempt on the part Of the govern\n\n\nment or the people Of the North\n\n\nto coerce the Southern States, oil\n\n\nany one of them, into submission 10\n\n\nthe will of a minority of the North,\nwhen that will has been authoritative.\nily declared by tba Supreme Court\n\n\ntc be in opposition to the true\nconstruction OF the Constitution oil\nthe United S. ates.\n\n\nRcsolved, Thatws will, by all legiti-\nmate means, oppose, discountenapoe\nand prevent the republican party\n\n\nfrom making any aggressive attempt\n\n\nunder the plea of reinforcing tue\nJews end preserving the Union,\nu pom the rights Of the Southern\nStates, believing as We do that any\nsuch attempt can only result in a\nprotracted and destructive civil war\n\n\nte attain an end which that party\ncan readily and peaceably accomplish\nby abaud oniug their hostility to the\nSouth, aud declaring their willingness\n10 abide by the constitution, as in.\nterpre!ed by the Supreme Court,\nand accepted by all conservative\nmen Of the country."", 'i. To lay and collect taxes, duties, imposts,\nand excises, for revenue necessary to pay the\ndebts and carry on the government of the Con-\nfederacy, and all duties, imposts and excises.\nshall be uniform throughout the Confederacy.\n\n\nARTICLE FOUR. Sec. ""A slave in one State\nescaping to another shall be delivered up on\nthe claim of the party to whom said slave may\nbelong, by the Executive authority of the State\nin which such slave may be found; and in case\nof any abduction or forcible rescue full COM\npensati0n, including the value of slave, and all\ncosts and expenses shall be made to the party\nby the State in which such abductios or rescue\nsnail take place.\n\n\nARTICLE SIX. Sec. 2.-The government here.\nby instituted shall take immediate steps for\nthe settlement of all matters between the\nStates forming it and their late confederates of\nthe United States in relation to the public\nproperty and public debt at the time of their\nwithdrawal from them these States hereby de.\nclaring it to be their wish and earnest desire\nto adjust everything pertaining to the common\nproperty, common liabilities and common OBJ.\nlegations OF that Union upon principles of right,\njustice, equity and good faith.\n\n\nThe New York Herald, in commenting\nupon the Constitution, says:\n\n\nIn gluncing over this Constitution several\nimportant and note worthy features may be\nobserved in which it differs from the original.\nThe old one commences with the wOrds-s\'We\nthe people Of the United States,"" &c. The new\n-\'\'We the deputies of the sovereign and inde-\npendent States of South Carolina"" &C., thus\ndistinctly indicating their sovereign and inde-\npendent character, and yet their mutual rel-\nance.\n\n\nAgain, the new Constitution reverentially in.\nvokes \'\'the favor of Almighty God"" In the\nold, the existence of a Supreme Being appears\nto have been entirely ignored. i\n\n\nIn the original not only has the word slave\nbeen omitted, but even the idea has been so\nstudiously avoided as to raise grave questions\nconcerning the intent of the several clauses in\nwhich the institution"" is subject of legisla-\ntion; while in the foregoing the word \'sslave,\'\nis boldly inserted, and the intention of its\ntrainers SO clearly defined with reference to\nthem that there is hardly possibility of mis-\napprehension.\n\n\nAgain. contrary to the expectation of the\nmajority of Northern people, who have persist\nentity urged that the object Of the South in estab-\nfishing q separate government scas to reopen the\nafrican slave trade, the most stringent measures\nto be adopted for the suppression of the trade.\n\n\nAnd all this has been done with unanimity\nwhich indicates the harmony of sentiment that\nprevails among the people of the seeding\nStates, and among the delegates by whom they\nwere represented in the Southern Congress.\n\n\nOn Saturday, February 9, the Conven-\ntion by unanimous vote, elected Hon.\nJEFF. DAVIS President, and ALEx. III. STE\nPHENs Vice President N 7s', 'took issue with the Republicans, that when\nthe rebellion was exhausted and the old sys.\ntenn of things restored, and the Democrats of\nthe North would lay down the rifle and the\nsword and extend the right hand of friendship\nto the South, if the Abolition cry should 20\nup from the Republican party that slavery\nwas the cause of all the trouble and that the\nwar Should not cud until slavery was extin-\nguished, then Che same Democrats would\nturn their bayonets in d.tepse of the South.\nlApplauso]', 'The Inaugural Message Of Gov. Washburne, OF\nMnnos TO the Lesslatisro Of that State, gives\ncQureginE view Of the material growth Of that State\nHs recommends concillation and forbearnnce and\ntokens 0l good viii towards the South, which no\nzpscil we may have been wrong. the onarings\nwhich, e. good men AID patriots, should lay upon\nconsent 70 the abateneut Of not jot title Of\nthe principles atlrmed by the people at the recent\nelection.\n\n\nWe viii stand b. the Consultation Of our Fathers,\nthe Constitution ag It is, and make compromises\nthat would involve in the guilt Of moral treason\nana justly rendered rs the scorn Of mankind.\n\n\nThe Governor deYoteE paragraph 10 the subject\nOf Personal Liberty Bills, recommending the repeal\nof any statutes which may be found be either un-\ncongttuiional or justly regarded offensive, but\nquite plainly implying the convictio that Maine is\nnot q tranaGreasor in this respect.', 'lney enOuI0 roCner receive tno approving\nsympathy Of the conservatives Of the North.\nThey have placed themselves under the\nworlds ban as traitors to their country, while\nthe inner motives which actuate them are\nthose Of patriotic devotion to the Union. il\nthe Onion, with their rights under it, can\nboth be maintained. sIs\n\n\nThat the rabid disunionists Of South\nCarolina were discomtted at Montgomery,\nis evident from the character Of the pro-\ngramme which they put forth in their jour-\nmails prior to the meeting Of the Convention,\nand from the opposition they made to the\nplan finally settled on, in advance Of its\nadoption. The correspondence Of the\nCharleston Mercury, whose editor. BARN.\nWELL RHETr. is delegate from South Car\nolina, denounced the Mississippi scheme Of\nappointing provisional President and Vice\nPresident, as part Of the policy Of recon-\nstructing the Union. The Mercury predicted\nthat, if this were accomplished, along with\nthe balance Of the Mississippi programme,\nSouth Carolina would be obliged in few\nyears to fight the battle Of secession over\nagain, as they would have secured by the\npresent movement only change Of masters.\nThe Mississippi scheme having been adopted,\nin all its parts, we have the authority Of the\nprime.mover Of secession for asserting that\nheSouthern movement, in its present hands,\nis really q movement for reconstruction\ninstead Of disintegration, for Union rather\nthan disunion. As already stated, / believe\nevents will prove this prediction to be cor\nrect. And, assuming its truth, the duty of\nthe North, to whose prosperity the Union\nis Of paramount Importance, is clearly to\nunite in proAering terms Of conciliation.\n("" Unionp must be the rallying cry Of pa\ntriots everywhere, henceforth.\n\n\nYou have already been advised Of the\nfailure, in the House, to secure an appro-\npriation for the Northern Overland Mail\nRoute to the Pacific. This matter was\nfirst introduced, session before last, by\nSenator RICE, and its passage secured\nthrough the Senate, with only four votes in\nopposition. Last session, an appropriation\nof 100000 year for six years, was pro-\nvided for in the mail route bill, for the\nNorthern route, aad its passage obtained\nthrough the Senate, without dissenting\nvote. 1t was not acted on in the House,\nthen, but was taken up fortnight ago, as\nq part of the unfinished business of the pre-\nvious session. The bill passed, with this\nappropriation for our Northern mail route\nstricken out. Our Republican members\nin that body had not influence enough to\nretain clause for our benefit which had\nbeen twice adopted by the Senate, and which\nwould have been of the highest benefit to\nour people. Thus are our most vital inter-\nests continually sacrificed to the everlasting\nnigger. Our Republican members are full\nof nigger-and when they are brought in\ncompetition, the interests of the white man\nare always held subservient to those of the\nblack. Haven\'t we had enough of Repub-\nlican representation, in State and nation I\nOr is it the will Of the people that mawkish\nphilanthropy should always, as it does now,\ntake precedence Of all our real, material\ninterests ? E.s q.', ""sseldIers In Peace Citizens In War,\nNoRSHERs Pluck FULLY TEsrED-A NORTHERs\nVILLAGE Thrown INTO INTENSE ExcETENENT.-f oul\nNorthern neighbors of the old Confederacy could\ndemonstrate their courage by the threats which the\nBlack Republicans are continually venting against\nUS poor Southern rebels and traitors then, in\ndeed, would the world be compelled to recognize\nthem amongst the most valiant men of the age\nBut, they are not the men to face danger when il\nactually occursthey fight well on paper, but they\ncertainly don't ike to smell gunpowder. or to face\nSouthern steel and bullets.\n\n\nIn the village Of c., in New Jersey. not hun\ndred miles from New York, is a nest of Republicans\nof Greely stripe who have almost split their hroats\nin denouncng the Southern treason, and in declar-\ning their intentions to aid Mr. Lincoln in enforcing\nthe laws, and retaking all the Southern Forts' On\nthe day of Mr.. Lincoln's Inauguration they became\nvery jubilant, and were blating their predictions\nIa Greedy that in thirty days the Southern rebles\nwould be brought 20 their senses, and would be\ncompelled to beg on their knees for quarters, and\nthey were ready at any time to go and help whip\nthe unruly Southern rascals.\n\n\nA good Democrat, who sympathies very strongly\nwith the South, concluded he would play little\ntrick upon these valorous Republicans and put their\ncourage to the test. Early one morning strange\nindividual was going through the streets OF the\nvillage, who served notice each and all the male\ncitizens subject to military duty. The notice ran as\nfollows\n\n\nTRENTON, N. j., March 9, 1861.\n\n\n\n\n\nin readiness (suhjeet 20 draft to enroll yourself in\nthe New Jersey Militia, to be called out at three\ndays notice. If you have any lawful excuse, re-\nport Immediately 10 the Quarter-master General,\nc. A. Arnold, Trenton, n, J. tG\n\n\nBy order of the Governor.\n\n\nu. C. VEsEY, Secretary\n\n\nNever was such CONSERVATION produced in any\nplace as was witnessed in said village, upon the\ncirculation of these citations. If rumour is to be\ncredited, in less than six hours there hardly""]","Well, let me tell you, just recently the lower branch of our North Carolina Legislature took a strong stand against the principle of coercion. They passed resolutions by a significant vote—63 to 20—clearly expressing their condemnation of any attempt to forcefully control a state that has chosen to secede from the Union. I find it rather bold, but it reflects the sentiments running deep in our state right now.

The main thrust of the resolutions declares that the Federal Government has no right to coerce any state that has decided to withdraw, like South Carolina and others. They insist that any effort to bring us to heel, especially by sending Federal troops through our territory, must be met with resistance by North Carolina. We see ourselves as sovereign and have a duty to defend our actions against what many perceive as the encroachment of Federal power.

You know, it’s quite heated here, and folks feel very passionately about this matter. Some believe we must protect our rights and stand firmly against what they view as tyranny from Washington. Meanwhile, there are those who talk of compromising to avoid further disaster, but the deeper sentiment I see is one of defiance against any coercion.

This resolution is just one more sign of how divided our nation has become during these times. I expect discussions about this will only escalate as the conflict continues. Each evening, people gather in the taverns and homes, hashing out what all of this means for our future—and whether we truly are ready to take up arms to defend ourselves and our state's decision.","The lower branch of the North Carolina Legislature adopted resolutions condemning the principle of coercion, affirming the duty of the State to resist the passage of Federal troops. The resolutions were adopted by a vote of 63 to 20, stating that the Federal Government has no right to coerce a seceding State and that it is the duty of North Carolina's authorities to resist by force the passage of federal troops through its territory.",1.0,0.9213406001920333,0.5687499999857812,1.0
Who is Harrison Weir and what is his work about?,"['THE POETRY OF NATURE. Selected and\nillustrated BY Harrison Weir. Fine Tur-\nkey morocco.', ""There is some conflict in the proof as TO whether\nJudge Catron was at Tullahoma until AFTER the de-\nfendant in error had completed the buildings and\nalso whether the cOttage-allowing for alterations\nwas constructed according to the contract The\nwitnesses also differed TO the value of the other\nwork. As the buildings advanced Mrs Catron\nmade the defendants in errorSundry payments-the\nchecks and receipts being exclusively in her own\nname, and ali the transactions in regard to the\nbuildings from first to last until their completion\n\n\nbeing with her and not her husband-she being\nconsidered as the ewner; and the evidence to say\nthe least Of Intends strongly TO show that the\ntracts were made and work performed upon the\ncredit of Mrs. Catron, and under the expectation\nthat she to pay for it. The defendants in error\nclaiming that there was still balance due them\nafter applying Mrs Catron's payment, on the 18th\nof October, l857-instituted suit for the recovery\nOf the same against her and Judge Catron, and\nobtained judgment against the latter, to reverse\nwhich, he applies to this Court Il appears that in\nNovember, 1857, after the commencement Of the\nsuit, Warren and Judge Catron, accompanied by\nColeman and Hughes mechanics Of Nashville, with\nview 10 settlement Of the matter, ,Iwent to Tul-\nlahoma for the purpose Of measuring the\nwork, and ascertaining what was due, and\nthat Coleman and Hughes did measure and esti~\nmate the work BY the written contract, which Judge\nCatron had slong-he pointing out the work to be\nmeasured and stating thatit ought TO have been paid\nfor long ago-snd that he could not pay more than\nthe contract price for contract work, and for the\nother work in proportion. Coleman went at the\nrequest of Warren, and Hughs at the request Of\nJudge Catron, who stated to him that Mrs. CatrOn\nhad contracted for the work and he wanted them to\ngo up and measure it. The result exceeded what\nJudge Catron regared as right, and he refused to\nhave anything more to do with the matter."", ""tHnnHF = 10 ISe.@e>--- - =\n4. Buchanan Reade has painted little picture\nKersI ike tbe artist he is: - = -1CAS-\npssare the stout harvesters falleth the grain,\n\n\na. vben the strong storm-wind is reaping, the\n~ plain,\nAnd loiters the boy in the briary lane\n\n\nsBut wonder ashanti comes the silvery rain,\n\n\nt;te long line of spears brightly FURNISHED and\n1870 tall. voa\n\n\nAdown the white highway, like cavalry fleet,\nIT dashes the dust with its numberless feet,\n\n\nLike murmurous school, in their leafy retreat,\nThe wild birds sit listening the drops round\nAnd the boy crouches close to the blackberry wall\nThe swallows alone take the storm on their wing,\nAnd, tauntng the tese-sheltered laborers, sing\n\n\nLike pebbles the rain breaks the face of the spring\nwhile a bubble darts up from each widening ring\nAnd the boy in dismay, hears the loud shower fall\nBut soon are the harvesters tossing the sheaves\nThe robin darts out from his bower of leaves;\nThe wren peereth forth from the moss covered\nBIS caves; i'I-s.a h1l9tiaHea 8l8 vad\nAnd the ain-spattered urchin now gladly per\n49,, ceives'r ,..t.. A., $500\nThat the beautiful bow bendeth over them ALL"", 'with al bad effects arising thereironni inellalns\n\n\nDEBILITY Or NERVOUS PROsTRATlON-\nHe has srccsied IN curing cases en- this city, some\nOf whom had expended huudreal q dollars Wiz\nself-styod physicians Who rol % llsAl sll lilt.tt\nnalafies with success. and without raceifing tne\nnr. GIBSON does not b0ast that hs is q nsnber Of\nsome College ln LONDON or r.ll3l Z. l-llsla .on.s\nand who hold out great lpecflflous never 20 De re-\nsiizsd. Bnt what Dr. GIBSON might boast Of is\nthose who rara5e couideuce In his ability auf llte-\nritT and thaf be has perfected American sy stem\nOf treatment which claa.ses 9q3 - -lcl-l q li.l-\ndon OF Paris, any patent medicine % a ll lot te\nErica cure Of seminal weakness l1d l-l 4l-ea4 OF\nderanRemeuts. both mental and physical arisina\nfrom seXnal or secret abuse.\n\n\nm GTBg0N also Claims for his new treatment the\nfoIl0vfug ADVANTAGES over an Others yet discoveries\nand first, the agents used ere in no raape1t alaee-\nHTercurT nor any other delateri0u3 drug. eecqndlg\nno re5tricions in diet business q ulra5 Ln1fu-\n"" his treatment is positive and certain in ~ es,\nBE stands prepared 20 60 INTO any PUBIC OF lllt-t\nhospital in the United States and qeronslrala tne\nimmense superiority Of his new Treatment over any\nother now known % the world ln point q pl9lls-s\nnessi perIlallsnesi lilllAs7-i 1a--\'-t - va -\n1r. EfBs6N is permanently located in Clsyslands\nand has durng the past nine u0atls performed many\ncures Of diseases which had for years resisted az\nother moes Of treatment. Reference can 1e gwen g\nindividuals Of The hrst raspecIeol5y in Ole-s.le y\nBoston, New York, and other citlaa m REGARD -\nskill and integrity in all lroiessill lai z\nDyspepsia, Rhuematis11, ecrolula and Oh cnlolla1\ndiseases treated with superior success.\n\n\n9a5- Medicine sent % any part al lle cQlnIs %\nDT GfBsoN7s II Naw Work on Physiology for sais\n\n\nDIR. GIBSON,\n\n\nProfessor Of EIcctropafiy and Aodicines\n~ once No. M Ontario s5rsst, I\'d stairs, faV\noP9ss fcs % hours re Fo % to e and rom 2to 50 O\'Clock\ndaily, tHrUiliFA HAeli ll-lll', 'ave Repeatedly o""seu \'n\'\n\n\noppression; that the veioes OF tbei\njackson preserved the\nnorthern masses from moueyed OF\nearchy which threatened to reduce\nhem to that slavery to capital which\ntouds to mike ""the rich richer, and\nThe poor poorer and we regard the\nrepublican party under the guise oil\nfreedom tor the negro as aiming at es-\nsentially the same objects, and anima-\nted by the same spirit Of hostility to\nthe people.\n\n\nResolred, That ws,the working men\nOf New York. hereby pledge our\nselves TO oppose the British anti\nslavery party 10 every legitimate way;\nthat we feel With sorrow that Great\nBritaio has conquered the North\nwith the pen, having a5olltlonlzed\nthe press and the pulpit, and while\nhe heel of her oppression is upon\nWhite men in Ireland. England and\nScotland, she tiles to divert attention\nfrom her sins at home by false pill\n|ianihrophy for negroes in America;\naud believing our Southern brethren\nnow engaged IN the holy cause OF\nAmerican liberty, and Trying to roll\nback this avalanche Of Britisbism, We\nextend to them our heartfelt SYM\npatty. and when they shall need it\nto resist unjust oppression, We be-\nIIicve We shall not De found wanting\nin more effrctua support.\n\n\nResolced, That the State Legis-\nla,ure be respectfully requested to\n| to convene The people of this State\nlin convention. for the purpose Of Sc.\n\n\ncuring an expression Of public SEN\n\n\ntiment upon the new and startling Is\n\n\nsues which few weeks hgve so rap\n\n\nidly evolved, and the Chair is d.\n\n\nrected to appoint a committee OF five\n\n\ngentlemen TO present these resolutions\n\n\nand this request TO the Legislature\n| -Sp,-.---\n\n\nLike beiligerant bulls and noisy\n\n\nbarn yard fowls, some of he a,!vo.\nGates of the \'irrepresslble conflict\n\n\n10 their believing and Growing at =\n\n\nsafe distance, aud will doubtless BE-.\ncome more quiet iu the immediate\n\n\npresence of their adversaries, if they\n\n\never meet face to face. Sumner, The\n\n\nBlack Republican Senator from\n\n\nMassachusetts, delivered lecture\n+at Concert Hall, in Philadelphia, E\n\n\nshort time since. ir which he af\n\n\nfected to play the hero, although\n\n\nno man 10 America has shown d\nIpusillanimous spirit in the presence\n\n\nOf a living foe. He said, among other\n\n\nthings equally boastiug-\n\n\nII never was compromise man\n\n\nnor am | one now. II is no use foI\n\n\nthe North to compromise; it is not.\n\n\n| want to know if the government\n\n\nis worth anything. do not think\n\n\nmy people want me to compromise\n\n\ntheir interests, and if they do | will\n\n\nnot do it. Every compro mise that\n/ has been made has been violated by\n\n\nthe South. Tlere is an eternal an.\ntagonism that must be settled now, and\n\n\nWe may as well have il settled now as\nat any other time""\n\n\nDoes any one suppose that Sum-\nner will place himself within reuch\nOf another Southern cudgel!', 'Stove FoUNDRY-We call attention to the\ncard of our friend j. LOWELL, proprietor of\nthe extensive stove and hollow ware foun-\ndry on Broad Street, beyond the Nashville\nand Chattanooga Railroad. Mr.. L. is pre-\npared to ill all orders in the stove and hol-\nlow ware line at short notice, and at prices\n20 low that the blockade and Morrill, tariff\nsink into insignifcance. He now has several\nhundred stoves finished and ready for sale.\nand is daily adding to his finished stock.\nUsing the best material, and employing hume\nbat the best workmen, he is willing to put\nhis work in competition with any establish\nment in the old or new Confederacy.', 'Ed. HaSJWg STANDARD: Aside from the\ngeneral routine of war news which is press\ning upon the columns Of your paper, and al\nso all other periodicals at this time, a brief\nnotice of one of Natures freak"" may not be\nwithout interest TO your readers.\n\n\nUpon the farm of c. c. Hardy Esq, in\nGlover, stand two maple trees about eight\nIT. apart, and each six Of eight inches in diam\neter. At the height of seven feet, they APP\nproach together, forming a complete arch\nthrough which five men can walk side by side,\nand are there knit together solidly with no\nirregularity or confusion. From thence up\nward to the distance Of nearly or quite fifty\nfeet. they form but one solid, compact tree\nwith no unnatural seam, bur or rift\n\n\nThe example probably stands without q\nparallel, and the sight of it is We\'ll worth a\nvisit. ANY one taking the pains to 60 to see\nit, doubt not Mr. Hardy will with pleasure\nguide to the spot.\n\n\nYours truly,\n\n\n+. NJ h.\n\n\n(,lnyer I,Ily %', 'North Western road, built and operated\non the same scale with reference to speed,\nsafety and comfort, and running through\nsome of the most interesting portions OF\nINDIANA and Ohio. Through from the\nGarden to the Queen City in IL hours\nwhew. that just suits us. Preparations\nfor war are the main thing here, and OPP\nposite ON the sold Kentucky shore"" our\nfolks are as mnch at home as here, the\nstars and stripes waving everywhere. All\nover Kentucky. Home Guards of \'\'un-\nconditional Union men"" are formed\nThey are bound together by-solemn oaths\nand are sore thorn in the side of the\n\'\'KDights of the Golden Circle""\n\n\nSince coming here we have had the\npleasure of private half hour with Col.\nnow Brig. Gen. Anderson. We expected\nto see a larger, younger, and more dash\ning looking mar, instead of the small,\ngray-baired, scholarly gentlemen we\nfound him to be.\n\n\n""Andy"" Johnson was here a few days\nsince, fugitive from Tennessee. He\nspoke from the balcony of the Burnett\nHouse, and said among other things, that\nal - III coooeeyo,, eobo v,a ,yoc Holl\nborn and Hell-bound."" Mr.. johnson is\na powerfully-built, dark-complexioned\nman, and looks and talks as though he\nwas host ill alone. Rumor says he in\ntends to do some fighting, and if he I\'M\ndertakes it he will ""raise q muss."" 1t\nwill be like man who hates snakes\nwhen he kills one he is very apt to kick\nthe critter after it is dead, because it is q\nsnake.\n\n\nA night or two since. we heard the\ncloud alarum BELLS"" and by the time we\ncould half dress and get to the wineow,\non came the ponderous steam fire engine,\ndrawn by four large, matched horses,\ndapple grey, fat as seals, and rushing on\nas fast as whipping and yelling could\nurge them. A perfect shower of sparks\nwas flying from the engine fire, so hot in\nfive minutes, that in five minutes more\nthe steam would be ""full head"" and by\nis own light aud that of the street lamps\nin the otherwise pitchy darkness, itlook-\ned like an internal machine running\naway with itself. In ten minutes mere\nwe were at the fire, and found fifteen of\nthe engines, each doing the work of\nthree or four of the old -fashloned break\ndowns The sky, and all around was lit\naglow with the fire, but within twenty\nminutes after the bells gave the alarm,\n""darkness was visible""', 'Classes Gilt Frames Venetian Blinds, Window Shades\nArtist Materials, &C., &C., TO his (W. W. Fnn\'s) old\nStand, % Public Square, corner Deaderick street,\n\n\nwhere shall be glad 10 see friends and Patrons.\nW. FREEMAN.\nJuly ""a, \'61-tf UAA BIG.', 'Having established himself as\n\n\nH OuSe Bull er,\nWT0ULD say to all in the village and the ad-\nwv joining country, that he is now prepared to\nfurnish and build by contract, to take charge of\nwork by. the day, any buildings in any of the\ndifferent orders of architecture, and is also pre-\n\n\niSaw out Brackets and Fringe Work for\n\n\nC0rnices, in any Style required. ieog\nDoors, Sash and Blinds, Window and Door\nFrames made to order. Whitewood Lumber and\nShingles taken in exchange for work. Place of\nBusiness, first floor of U. c. Squires Machine Shop\nFront Street, Dowagiac, Mich. ~, - ,--,- ..-.-r\nOctober 9th, 1859. oct27-27y1', ""The undersigned having been tor a\nnumber Of years engaged in Millwright-\ning in Northern Iowa and Southern\nMinnesota, fatters himself that he is\ntoo we'll known in that branch Of me-\nchanics, to fear rivalry from any source.\n\n\nHe now offers his services to all\nthose needing\n\n\nPRACTICAL MllWRlenT,\nand guarantees satis faction. He has arrange\nments with the best Machinists, Foundry\nmon and Mill Furnishers in the North West,\nwhich enables him to procure every article\nneeded in the construction of\n\n\nFIGURING MILLS\nOf the best possible manufacture. and upon\nreasonable and advantageous terms to the\npurchaser.\n\n\nHe may be addressed through the\nMcGragor Iowa Post Office.\n\n\nUnexcsptionable references given whom de-\nsired.\n\n\nMcGregor Iowa, March / 1861.\n\n\n(79t) H. BARNzART"", 'eW II is rDmored that Andy\nJohnson was killed in difficulty with\nSenator Wigiall, Of Texas, a few days\nago; but the papers that we have\nreceived do not confirm the report,\nA day or two will give Us the truth\nabout the matter.']","Ah, you've asked about Harrison Weir! Now there's a name that brings to mind quite a lovely piece of work. He is a poet and artist, known for his illustrations that celebrate the beauty found in nature. I reckon he captures the essence of it all in his work, and I have seen some of his illustrations in publications. 

I remember just recently seeing a title called ""The Poetry of Nature,"" selected and illustrated by him, bound in fine Turkey morocco leather. The way he intertwines words with images makes one feel as if they are part of the landscapes he depicts. His talent lends a richness to the natural world, turning the simplest scenes into something truly enchanting. 

People all around seem to appreciate how he portrays the moments of beauty that nature offers—like the blooming flowers and the majestic trees. It’s as if he invites us to pause and reflect on the lushness surrounding us. Whether one is strolling through a garden or simply looking out at a field, his illustrations bring to mind those very sights and sounds that might otherwise be overlooked in the hustle and bustle of daily life. It's good to know that such artistry flourishes in our time, doesn't it?","Harrison Weir is known for his work titled 'THE POETRY OF NATURE,' which is selected and illustrated by him. The book is presented in fine Turkey morocco.",0.14285714285714285,0.0,0.9999999999,1.0
Who is J. Ii. q. JQhhbON and what is their significance?,"['/ hereby certify that I have been dealing in the\nGresuberg Medicines for the past year. and can tru-\ny say that have never offered any medicines 70 the\npublic that have met with the decided approbaiiUn\nOf the people ike these particularly the pills and\nCnthoiicon They will perform all and more than Is\nOr ne tatholicon the past year and hear the best\nresults IN every case. J. Ii. q. JQhhbON,\n\n\nMarch 7. 1851 Medical Agent.', 'JEFF Thompson A VIRGIS1AE.-The public\nsee almost every week in the Missouri news,\nnotices of Col. Jef Thompson\'s doings. He\nhangs around the skirts OF the Federais wi n\nhis troops like some informal machine""\nready t. explode missiles of destruction in\ntheir midst. lie is u terror second only 10 Ben\nMcOulloch.\n\n\nJED. is a gallant boy, and has always been\nnoted for impetuous intrepdity. He is e son\nOF the late Oapt. Meri wether Thompson,\nformerly OF Culpeper, we believe, who re-\nmoved in early life TO Jefferson county, Va,\nand in the now noted place, Oharlestown Jef.\nwas born.\n\n\nFor the last fifteen years our friend JEFF. has\nbssn citizen Of Missouri, and was n one time\nMayor OF the fiourishing city OF St. Joseph 8,\nhigh up on the Missouri river.\n\n\nWhen the John Brown raid broke out, Jen {.\nwas among the early arrivals at his native\ntown, Oharlestown, and We believe was there\nwhen Old Johns light was exinguisned with\nthe aid Of u hempsn cord. We Know ne\nbrought some OF the Missouri growth for the\nbenefit of Brown, Stevens, %.\n\n\nThat JEFF will now gives good account OF\nhim self no Que that knows him Will doubt, II\nhe can only be restrained till the oppOrtuns\nnome Mt for an attaek.-frsd. Herald.', ""3. The President and Treasurer shall rem\nder specific accounts of their receipts and do |\nnations, and acts. at the meetings of the So |\nciety, which shall be held monthly.\n\n\n4. The President is authorized to appoint\nFIVE collectors to solicit subscriptions of mo- |\nney and provisions in behalf of the Society.\n\n\nThe Society was organized, eighty-two |\nmembers subscribing.\n\n\nz. Payne was elected President, r. 8. |\nHunt, Treasurer; w. J. Arlington, Secre- |\ntary-\n\n\nmanagers Williams, H. S. Peach, and J.\n&. Graves.\n\n\nSoliciting Committee A. j. McWhirter,\nMrs. WIN. o. Snow, Mrs. Calvin Jackson, r. |\nS Hollins. and John Cowan.\n\n\nOn motion the meeting adjourned to meet /\nin COwan's Hall (LOwer Edgefield), on next |\nFriday night, at 8 O'Clock.\n\n\n@- One Inconvenience we experience |\nfrom the war is the high price OF many ar\nticles which we have heretofore ranked /\namong the necessaries of life. The article of /\ncoffee, for instance. has gone up announcement\nly high in price. This will be rather hard |\nupon us at first, but the blockade will be |\nbroken up ere long, and this and other ar\ntieles will then pour in upon us in unlimited |\nquantities. There is one article of prime ne\ncessity, however, which remains in statu quo,\nliz spite of all things. We refer to Insurance\nagainst loss by fire, which may be secured in\nthe best of Southern Companies OF w. J.\nMARI, No. 25 College street. IT,\n\n\ng 1t has been well said that the secret\nOf accommodating fortune consists not so\nmuch 10 making money asit does in saving\nwhat we make. How foolish is it then, TO"", 'Ed. HaSJWg STANDARD: Aside from the\ngeneral routine of war news which is press\ning upon the columns Of your paper, and al\nso all other periodicals at this time, a brief\nnotice of one of Natures freak"" may not be\nwithout interest TO your readers.\n\n\nUpon the farm of c. c. Hardy Esq, in\nGlover, stand two maple trees about eight\nIT. apart, and each six Of eight inches in diam\neter. At the height of seven feet, they APP\nproach together, forming a complete arch\nthrough which five men can walk side by side,\nand are there knit together solidly with no\nirregularity or confusion. From thence up\nward to the distance Of nearly or quite fifty\nfeet. they form but one solid, compact tree\nwith no unnatural seam, bur or rift\n\n\nThe example probably stands without q\nparallel, and the sight of it is We\'ll worth a\nvisit. ANY one taking the pains to 60 to see\nit, doubt not Mr. Hardy will with pleasure\nguide to the spot.\n\n\nYours truly,\n\n\n+. NJ h.\n\n\n(,lnyer I,Ily %', ""To yOG ant your delicate. sckiey. pary children.\n20 he healthy. strong and robusf'-then give tacia\nAcleans Slrengthing Cordial (sec the directions GA\neach hottle.) il j. delicious O. take\n\n\nOne tablespoonful, taken every morning. fasting\n= sure preventive against chill aid fever. yell,N\nfever, cholera or any prevailing disease.\n\n\nCAillONi-keWare If Druggists or dealers Who\nmay Try 20 palm upon you bottle II Biters OF Sar-\nsaParila (Which they can buy cheap by saving Il T.\njust a. good. There arr even men BASE enough \\.\nsteal part ~ my name 20 dub their VIA der..\ntions. Avoid such Infamous PIRATES and their vi\niainocs compounds AK for Dr. J. A. Mclean.\nStrengthening Cordial ami Hood Purifier Take\nnothing else. Il Is the only remedy that will parity\nyour blood thoroughly. and the same ft,l,\nSTRENGTHEN ami l>NleORAik The whole orrani-\nLaiion. Il j. pat up ia large iosilcssi pr tes,ie\nor siN bottles Tor -\n\n\nDIR. ,. II. MCLEAN, sole Proprietor."", '4 the >ul:i\'.ihed communication r.G.r- -\nprcialIy To Col Greg Regiment, We nib-\nlsh It ns u matter Of interest Ia lnAny Of our\nr-alrr4. and heartily aprrlv""o In wi.,itnr,l', 'D. c. soHN p Pope\nID. 4. w ATER AN & CO..\n\n\nCOMMISSION MERCHANTS\nFsrs attention paid Co tre Interests Whaling Fleet. hy\nfurnishing funds, rrrcl~ sale % EXCHANGE. OIL\nBone General N-rrlllisa Che procuring u Freight\n\n\nREFERENCES\n\n\nNe-Srs. Isaac HeNLtND. JE-. - Co.. NeE Bedford\n\n\n81 L. PH-E. ES-- do\n\n\nNHEsAS. >r""SE s. EH-, Francisco\n\n\nNrsrEz y NEEBILL. so 1851\nCHAS- - m A. ALpEIcH-\n\n\nBISHOP y CO..\nB11k--s the uf -. Makes B1cS.\nkal--r1ar1 ---e--. HHall-fl-\nDraw ..- rf ENrhs---\n\n\nN.-.-s tfa-~val- NIrS--Ev * Co.. N=v York.\n\n\nH-Sar A PlsE-E. E~g. Boston\nNHE-tN. ~THSF s. F-s-rl-r1-\n.- ar-t--llss business Eafr. and\nattend e.\'.--.5~-. ll--t\n\n\nJ. IL. WOOD.\nNa-rs.----ar Ir--- Dealer 1f-vsry\nl--rru--- Findings. rl-lu >H.e. R----. Harness.\nand Patent I-staars. Ca. Gaat- * AMI Buck ssia-,\nTrunks. El--- --s-r-- Gloves. Fl-. and Masks. Gacs\nr- B-lsr-- H-.ary Br-S -1le s-1re corner OF\no. -- Merchant Ii. / lG', 'ABlEEb-\n\n\nWhy IS retired carpenter ike 4 lecturer /, Be\ncause he\'s ex-piIner.\n\n\nFriend, the Bible tells thee to swear not ALL\nOh. we\'ll, don\'t all I swear only those\nI mad At\n\n\nThe y,iI-hunters at Pixies Peak find that the\nbright visions with which they started, should have\nbeen provisions\n\n\nMr. Crow. bought yard of nice pork to-day -\n\'\' How can you buy pors, by the yard - .. Why,\nbuy three feet-pIss\' feet\n\n\n\\ eoauettc may be compared to tinder, which lays\ncatch sparks. but does not always succeed in\nLighting match\n\n\nsuppose a ssoIIing wife should get drowned. what\nsingle letter in the alphabet would express the hus-\nbands feelings Letter 3.\n\n\nThe question. - Can marry his mother -\nwas recently demonstrated IN the affirmative in Bus\nton Rev d. g. Eldy married his own mOther-to\nMr.. Jacob Btcon\n\n\nOld Bachelor Sheer would Ike to know what kind\n0f broom the young woman IN the last new novel\nused. when she swept back the raven ruglets from\nher classic brow.\n\n\nDo all IN your power 20 teach your children self\ngovernment. IL child Is passionate teach him by\ngentle curb his temper. II he i suIky,\ncharm him Of IL by frluk good humOr. II indO-\nlent. accIstom him 70 exertion. and train him\nto perform even duties with aiacrity. II\nprize comes q make obedience reluctant. -ubdue\nhim BY counsel or discipline In short, give your\nchildren the habit Of overcoming their beseettiug\nsins\n\n\n-. The different uses Of words in England and this\ncountry are interesting. Lumber, which with us Is\napplied timber. means trash IN England.\nWhere We say 6otrfs the Euglishman says deals\nWe take baggage on journey, the EuglIshman only\nluggage. Our ladies\' fond Of drg s0OtS, their\nEnglish sisters equally devoted 70 hrbsrfrStsry-\nThe Yankee cries % adsgf, the Britisher says all\nri>tt The American travels - ia tie cars the\nFngii-hmau =. by the rrH.\'\' The former sends q\nletter by Gis mail the latter .\'by the POST\nThe one has a burs1u in his belchamber, the other\nonly rtss: Of trIrFrs-\n\n\nCS A-The above siucifclut letters having been\ndiscovered recently upon the closed doors Of an in\ndivffull known o. have been largely interested in\nSouthern business his anxious creditors the\nconclusion that be htd ucoutiuenty - \'sloPel"" frr\nSr-sssit. until one Of them CHANGED TO meet him IN\nthe street\n\n\nHalo - savs the creditor what are you doing\nhere: I sa< the IiActId on your door G. : A\nConfederate States e America""\n\n\nSoftly replied the debtor. - that\'s not the way\nI translate it &C. :. A-Can\'t Settle Accounts', 'ng A beautiful day. Mr.. Jenkins""\n"" Yes, very pleasant, indeed""\n""Good day for the race""\nd"" Race-what race 2""\n\n\n""The human race""\n\n\n""Oh, 60 long with your stupid Jokes get\nup good one like the one sold Day""\nWhat Day y\n\n\n="" The day we celebrate said jenkins, who\nwent on his way rejoicing.', ""u! SlV'VS! IVS tnV MdIIiC0\nA Practical. RATIONAL AND PERFECT Con-\n\n\ntroll OF REPRODUCTION\n\n\nTHIS Is. BEYOND ALL CON-\n\n\nIl PARISON. THE most complete\n\n\nand reliable work upon this subject\never offered to the american people. 1t is the\nlatest of the kind published, and contains the\ntrue and really useful of oil that have precs-\nded it, besides many important facts never\nbefore allu dcd to in any publication.\n\n\nNo thinking man will at this ago Of scien.\ntifc research, be content to leave to mere\nchance all that pertains to the increase Of\nhis family. Judgment will dictate the mum.\nDer of his children, and the time and circum.\nstance of their births And surely no intel\nligent woman will neglect an opportunity Of\nobtaining knowledge that may promote her\nhappiness preserve her youth, diminish her\nsorrows and prolorg her life!\n\n\nSales confidential. Sent to any address in\nsecured envelopes free Of postage, by enclo-\nsing the price Zone Dollar) to DR. BIGELOW\nBox 1896, St Louis, Mo. fn63.lyl"", '\'\'\'\'\'\'E "" \'\'A\'"" ""\nnot apt 10 \'e ignorant % Il . f\'S\'\'\'\'e u\nmay even over eS\'\'\'""\'\'\' \'\'\' -""\ntc\'y OF \'o\'44\'y N 81"" ""\'""\'\' = "" mug """"\'c""\nhe h""""""s H""\'h\'ns o. \'\'\' Il nc suspects ""hieh\nb"" Ignores as mum a. t\'\'S\'\' \'\'\'\' al"" \'\'\'""\'""N\'r\'\nMOTTO BELIEVE H. ~ ! !"" \',\'\'\' \'\'""\' u"" RECORDS\nq ~ p\'TaH\'A a\'\' \'""\' \'eN\'""\'hkS % 40 / a""rct\nIr\'c""h \'\'""\' mar = \'\'\'S \'""\' =, ~ \'\'\'"" 0\'\'s\'oa\'\nrighteousness j"" - ""a \'""\'"" \'""""\' VICE every\nSn\'""""} \'\'o i\'\'\'. lex \'\'""\'\'@\'os wax"" EN-\ne~F\'""@\'\' ~-s S\'\'\'9 - ""\'\'N gum \'t4""Nl-S\n\'""> ~ 80 ~ \'\'\' - GO"" Nsf\'\' N\'S\'\nj ~ \'\'\' 81 \'\'\' \'\'\'\'\'-.\' ""\'>\'\' +""\' l\'\'t\'"" H\'\n\n\n\n\n\n\n\n\n\n49,.\n- 80 """"\'\'\n\n\n\n\n\n\'""""\'\' Is o. \'\'1\'\' 80 \'\'\' 90 \'-\'-\'\n- - \'\'\' \'\'\'\'\'\'\' \'- \'\'\'\',\' \'\'\'\'\'\n1\'\'""\'""f \'\'\' NC \',\'-\'\'.\'\' \'\'\'\'0 \'\'\'\'\nis\'\' N.Y.\n\'\'.\'\'\' --\'- -\'-> 80\n\'-\'-\'\'.\' - - w f\',~1\'\' \' -\n- MO .\'\'\',\'\'\'\n\'>\'\' 90 "", \' \'\'\'\'\'\',\'lA ~ \'\'-\',""\'\ns\'\'\'\'1\'\'\' \'-\'l\' = \'\'\' ""\'\' &C % \'.-0 S\'f\'\'\'""-\n\'\'\' \'\'\',-\'> 90 \'\'\'\' ~ \'\'\'\'4- -\'\'\' w. I\'\'\n1881 \'\'.\' WA """"\'\' va ~\n\'\'\' \'-\'\' >\'\'\'o\' % oh\n\'\',\'\'\' az -\'\'\' % \'\'\'-\' ! \'\'\'\'-\' % \'""\'y \'H@D\ne\'-\'e\'\'\'\'\'\'J We ""vt\' \'\'\' H\'\'\' l""\'o\'iBen\' ana\n\'.\'\'N\'~s u \'""\'""""a ""\'\'S ""H""s\' thcfe was No\nIaIt""i The co1Aiy ""Ai\'h va troubled with NJ\nexcess ~ mummy &c"" .HAs\'AI1 dis\'aneed\nevery e\'il. \'\'eu\'A Vl \'A\' I""\'I\'1 states IN it,', ""THE undersigned has just received and keeps\nL constantly on hand the following articles -\n\n\nCoffee, sugar, molasses, cheese, crackers cur\nrants, prunes, raisns, figs, Almonds dlberts, cocoa\nnuts, ground nuts, pecans. Eng walnuts, cream\nnuts, candies in variety, oranges, lemons tobacco\nand cigars alispiee and pepper, spices of ali kinds\nbaking soda, cream of tarter, sulphur, hrmstone,\ncanister and keg powder, shot, caps and lead, grain\nand grass scythes, whetting tools, wash tubs and\nboards, indigo, extract Iogwood coppeFas, alum\nand maider oil, polish and Masonss backing\nsweeping, dusting stove, shoe aud scrubbing\nbrushes. clothes, hair, tooth ana flesh brushes hat\nand infant brushes, hair oils and perfumeFy, purses\nand port monaies, pocket and memorandum books\nbonnet and round gnm comhs strlddingn and fine\ncombs, bracelets and beads pens, peE-holders\npenkniges, scissors, knfe-sharpeners, umbrellas\nsuspenders spool cotton and floss, clocks, small\nlooking glasses, yiolius, violin strings toy Watches\nwatch chains, curry combs, cards, horse brushes\nshoe-thread pegs and sparables, Johnson's Arabian\nIiniment, Roek and Lttie's 81 hite OH, Merchants\ncelebrated Gargling Oil, for man or beast, and\nmany ether articles Of a similar nature. The pat\nroHage OF The public is respectfully solicited.\n\n\nA. l.. DEFIBAUGH\n\n\nJuly l, ls59-zz"", ""The present critical state IT European Affairs will\nrcudar these publications Unusually interesting\n>s,lI p s..o seTsa53sasnS yeas. Thsx w'll oecury\nmiad.e ground bet seen the hastily written news\nitems crude speculations, and flying rnmorso OF the\ndaily Journal, and the pandereus Tome OF the Ia\ntuse hi3orAn written after he living interest ana\nexoitemsnt cf The great political vents of the\ntime shall have passed away. tis to these teri-\nodieala that readers icok for the only really\nnt.llighle ard reliable history Of current events,\nand a. such in addition 10 their weii-estabitshed\nliterary, scientific, md theological character ws\nurge them upon tho consideration OF the reading\npublic.\n\n\nThe receipt Of Advance sheets from the\nBritish Publishers gives additional value 70 these\nReprints, in xsm uch they can now be placed IN\nthe ha nd, of beTs about the origin\nal editions."", 'No. I55 Section Relative to District\nCourts"" approved March IS, 1861, and\nwhich establishes the Jury Terms in\neach District within the State, except\ning the First District, relates specially\nto tho Second JudjcjaL District, com\nposed of the Parishes of jefferson,\nst. Bernard and Plnqucmincs.\n\n\nSECOND DisfHiCs.\n\n\n\'\'PARIsH OF JEFFEKsoN-Jury Terms: First Mon\nday of November and First Monday of April.\n""PAIusH OF pIAQUEMENrs-Jury Terms: Third\nMonday of March and Third Monday of\nOctober.\n\n\nPARISH OF ST. BERNARD Jury Terms First\nMonday of March and First Monday of\nMono othor than Jury Terms having\nbeen fixed by law in the Second\nDistrict and some others, it is to be\npresumed the Judges of those Districts\nwill name at their discressjon, such\nCourt Terms in each Parish, as the\ncitizens may appear to demand or the\ngeneral welfare of the community\nrequire.\n\n\nAfter fixing the days for holding\nJury Terms in all the Districts, (First\ncxceptod) and naming other days for\nCou1t Terms in the Bird, 9th, 9TH, 9th,\n10th and llth Judicial Districts, the\nACT closes with Section >, as follows:\nBe it further enacted etc. That this Act shall take\neffect on the First Monday of May, eighteen hun\ndrcd and siNtv.onc and all Judges to be elected on', ""The meanesr THE yet heard Of has just got years\nImprisonment IN Paris On pretense Of getting\nchange for half f-anc piece he got nine from\nblind beggar In exchange for n button\n\n\nAn IMMENSE Observation-Disclosures dealers ut\nChicago estimate the whole wheat crop Of the United\nStates the present year 10 900 900 bushels the In\ndian 900 900 900 bushels. the other grains\n22O 900 900 bushels, and the potatoes 100\nbushels making the whole yield Of breadstuifs and\nPotatoes 400, 100000 bushels enough to feed 2OO\nOOO.OO0 people\n\n\nThe fabulous unicorn has been found by n traveller\nHe says it exists in the interior Of Thibst in India\nwhere IL IL well known the inhabitants. IL i the\nsame rs the unicorn OF the Scriptures, and Is\nTONED by ancient writers. 1t is ad be about the\nsize Of the horse and extremely wild. Ii Is seldom,\nfeger. caught They have horn prCJectin out from\ntheir forehead They in herds. and to be met\nwith the borders OF the Great Desert.\n\n\nTreasure PoURrxG INTO NEw YoEK.-I need not\ntell you how acceptable 20 our banks the unex-\nueetsiv large treasure remittance which the steamer\nbrought, which. together with the half million and\nupward announced the day before - being on b.ard\nthe Europa, from England. and several remittances\nfrom the South. contributed not little to the\nstrength cf their specie IL Is confident\ny believed that, by the first Of January ensuing, the\nayzrey1te OF these reserves Will not fall short II\nSIS. .OOO, ,OOO.--E j. Cor S- +. piper.\n\n\nP,cTyIc TELEGRAPH-J H Ward director Of the\nWestern Union telegraph. has sailed from New York\nfr California. % make arrangements for building the\nCalifornia end of the line The materials have been\npurchased and are now beng shipped at Boston Two\nagents have already started across the plains the\nmore thoroughly % survey the The work will\nbe vigorously commenced in the spring IL i\npecte,f that the Pacific and Atlantic telegraph\nveyiuz information between the Atlantic and Pacific\nshores, in less than time, will soon be in opera\nton\n\n\nQCAR,STISE--The term quarantine Is said TO be\nderived from the Italian guGT1EfH, sguifying forty\nWhy forty DAYS fxei upon the period Of puri\nfcat50n from disease know not. Some refer it TO\ns medical origin. derisable from doctrine Of critical\ndlys-the fcrterh day being regarded the point Of\nseparation between acute and chronic diseases\nOthers think il has It's origin in regard for the\n\n\nrty lays OF Lent; aud still others attribute it\n20 the Mosaic law. which appointed forty days for\ncleansing the impurities of eprosy. This particular\ntine seems t. have been followed in many quarantine\nsystems, ~ much from routine with any definite\nMeaning. Il NAV De justly regarded n too long\nConfinement where there has been only exposure TO\nsa1 suspicion of di-ease-NoTth -fHsricG7 Rsrietr.""]","Ah, you ask about J. Ii. q. JQhhbON, a name that likely might not ring a bell in every household, but I believe I can shed some light on this individual. From what I gathered in a recent article from the Cleveland morning leader, J. Ii. q. JQhhbON is recognized as a Medical Agent who has been endorsing the Gresuberg Medicines—specifically the pills and something known as Catholicon.

In his testimonial, he speaks quite highly of these medicines, claiming they've provided great relief and results in various cases over the past year. It seems there is a growing reliance on home remedies and such concoctions these days, especially with the uncertainties rife in our society due to the ongoing friction and unrest.

The sentiment around medicines like this is significant since, with the war looming and the human toll that comes with it, people are seeking remedies to maintain their health. It reflects a trend we see around us—a desire for assurance and help, even in the form of medicine from a skilled sales agent. Many citizens are leaning on such products to navigate through the hardships, and I reckon there’s a fair bit of marketing at play too.

In these times, when the steady supply of certain goods is threatened by the conflict and the blockade seems likely to affect our daily necessities, one must keep an eye out for trustworthy sources. It may be wise to inquire about the experiences of others who may have tried these medicines before placing trust in them.","J. Ii. q. JQhhbON is identified as a Medical Agent who certifies their experience dealing in Gresuberg Medicines for the past year, stating that the medicines, particularly the pills and Cnthoiicon, have received positive feedback from the public.",0.47058823529411764,0.0,0.9999999999,1.0
"What happened on Feb. II, 1860?","[""SAVANNAH. ca, Feb. 9--Ycster.\nday Gov. Brown seizad FIVE vessels\nowned 10 New York.\n\n\nMEMPHIS. Feb. 9.--The arsenal\nat Little Rock, Arkansas, with 5000\nstand. of arms, and large amounts\nof bunition, snd 40 cannon, ia\nGLIDING Capt. Braggs' battery, was\nto the State authorities\nyesterday. 1t is now garrisoned\nWith 100 volunteers. I\n\n\nMONTGOMERY, Ala, Feb 9--Jeffer-\nson Davis, Of Mississippi,was to-day\nunanimously elected President Of\nhe ConfeGeraied States of North\nAmerica, and A. II. Stephens, Of\nGeorgia, Vice President, also unani-"", ""W y ~\n\n\nARSENAL IN ARKANSAS SEIZED |\n\n\nRALEIGH, N. c.. Feb. 5 : The\nHouse unanimously passed u resolu-\nton declaring that III case of non\nreconciliation. North Carolina goes\nwith the South.\n\n\nCHARLESTON. February 5.--Nlth-\nlug is transpiring here to-day\nThe reported in'orccmeot u Gum.\nter is false.\n\n\nHARRIssuRG, Penn Feb S : Gov\nCurtin (Biack Republican, ordered\na salute 10 homer OF the result in\nVirginia.\n\n\nGALvE TON, Texas. Feb. 5 This\nordinance of secession passed Oh the\nIst by avole Of 1G6 to I The\nGovernor, Legislature, S upre me\nJudges anl Commissioner9 we're pr, $\nenf. Ii is to he submitted 10 the\npeople on the 23d Of February, and ii\nadopted 10 60 into 4, CT on the % Of\nMarch.\n\n\nGov. Houston recogniz The Con-\nvenlion Of The people, and declared\nhis attachment to The South and his\ndesire TO join the Southern Gun\nfederacy, and if none formed will\njoin the Republic Of T, xns.\n( Tae sentiment in favor Of uni.\nting TexBs. in The Southern Con,\nfederacy is represented 10 be largely\nin the ascenGunt.\n\n\nBurlington, VT, February c.\nThe late deleg ,ies TO tie CEicsco\nConvention from Vermont, couipri\nsing many of the lealiog Black Re\npublicans Of the State, mt iufor-\nmally at Montpelier, Yesterday, and\nunanimously protested against the\nadoption OF any Of the proposed\nplans Of compromise before Congress\n! WASHINGTON, Feb. G. House. =\nThe bill to suspend the mail service\nin Sec ding States passed by vote.\nOF 12l ag.iust 20.\n\n\n! The Commissionersto the Peace\nCongress are prohibited from divuI-\ngipg the proceedings ef the Con\n\nvenlion TO outsiders.\n\n\nNew GREENS, February T. A\nnotion to invite all the S'atss ex-\ncept the New England States 70\njoin the Southern Confederacy vas\nordered to be printed. aud made\nthe special order fer Saturday.\nLOUISVILLE, February THE\nKentucky Legislature have sgreed\nto adjourn next Monday udnl the\nGoth of March.\n\n\nMoNTGcMERY, Feb. 7.--Congress\nhas received an official cory of the\nact CO Alabama. approPriating bait\nmillion dollars for the support OF\nProvisional Government of he Sc\nceding States. But a short time\nwas spent 10 open session. The\nCommittee on the plan OF Pro-\nvisional Government reported in\nsecret session. 1t was discussed\nfour hours, With unanimity Of feeling,\nwhen the Constitution Of the Uoi\nI'd States was adopted. With some\naddition With relation TO Tree trade\nwith all the world. Adjourned ill\nl. o. clock\n\n\nRICHMOND, Va, F,a 8 1861\nIf the Washington Ctnf+ronce does\nnot agree upon an adjus'm ent,\nvery large mejority, near l20 mem.\nbeers out of 152, will b. for secession\nbefore he fourth Of March. The\nConvention will be governed by the\nConference at Washington"", 'A N election for FIVE managers Of the Chambers\nIA burg and Bedford Turnpike Road Company\nviii be held at the Public House Of j. Mcdonald\nin McConnellsburg on Monday the 4th day of\nMarch next, at O\'Clock z. "".\n\n\nZ. B. KENNEDY,\nFeb. Is, 1861 President.', 'CHARLESTON, Jan. 5.\nThe journals 70 day puo.ish tire correspondence\nbetween the Commissioners TO w ashington and\nthe President of the United States.\n\n\nHon. A b. LOngstreet, President Of the South\nCarolina College, has issued a TOUR PACED pamph-\nlet, entitled Shall South Carolina begin the\nWARP He earnestly desires the Collector on\noard the Harriet Lane 10 be allowed to land, and\nsays that he should be treated politely and intro\nduced to Collector ColcOck, SO that the Collectors\nof the two sOvereigntes could use every means\nto settle the respective claims in spirit of cour\ntesy and kindness. If the Forts are reinforced\nIt would be an unfair conflict. in which hundreds\nof our sons would be slain. Fort Moultrie would\nbecome deserted, and the wrath Of the United\nStates would be brought upon our devoted city.\nHe implOres the people to let the first shot come\nfrom the enemy\n\n\nThe President Of the Convention received a\ntelegram from Mayor Monroe, Of New Orleans,\nwhich is as follows "" The city of New Orleans\nfully sympathizes with the city of Charleston in\nthe perils to which she is exposed, and will not\nfail 10 support her when the occasion requires ae-\nton""\n\n\nMr. Hudson offered an ordinance that all power\nnot necessary to make postal arrangements and\nenact postal laws be vested in the General As\nsembly. Passed.\n\n\nofficers in any force, regular or volunteer, raised\nunder the order of the Convention, to hold seats\nin either House of the General Assembly, or any\nother Office Adopted.\n\n\nMr. Curtis offered a resolution that the late\nCommissioners to Washington be requested 10\nprepare, at their earliest Convenience, written\nstatement of their oral communication 70 this\nbody, ana communicate the result Of their recent\nattempt at negotiation with the President Of the\nUnited States Tor the delivery Of the Forts and\nother State properly, said document to be depos-\ntied with the President Of this body, with an In\njunction Of secrecy until otherwise ordered\nAdopted 5ru\nAn order to print five Thousand copies Of the cor\nrespoudence between the Commissioners TO Wash\ninFton and the President Of the United States was\nlad on the table.\n\n\nThe chair and tho appurtenances used on the night\nal -iynfor The Ordinance Of secession, ordered\nTO bs placed IN the State House at Columbia.\n\n\nThe adupton Of an ensis was ordered 70 De let 70\nthe Legislature.\n\n\nAdjourned.', ""TIME Stockholders of the Bedford aud Stoys-\n4 town Turnpike Road Compsny are hereby no\n..tad, that the annual Election of the Company\nwin be held at the house of James Frasher, in\nSchellsburg, on the first Monday of March next\nbetween the hours Of one and three O'Clock P. NJ\n\n\nPETER SCHELL,\n\n\nFeb. %, 1861 Secretary."", 'FnAEclAL.--0n the 10th ut the Second Board In\nNew York, Missouri Stocks went down to a. viz\nsinia to ~, and Tennessee to 49, Exchange in Chi\neago same date Was II per cent In this city on\nSaturday II went II 10 to IL. Illinois Banks bassd\non Southern Stocks are decidedly 1t discount Just\nnow, and more OF those taken 1t present will prob\nably 50 soon.\n\n\nWAn MEETING AT FT. mADIsON.\n\n\nFoHr MADISON, April 10.\n\n\nkDroa Cars CirY. A. reminded By the\ndats Of this that to-day l. the snnivsrsary\nOf tho 6rst battle Of the Revelation, and II\nyoa had been here last night, you wosld\nhave thought those glorious old times hsd\ncome back, and that patriosisn had con.\nplstsd one Of iss grand cycles and was sow\ntosehiDg III ssarest point 70 tho central 10.\nninsry from which il derives ito life and iss\nheat.\n\n\ni va quietly talked around yesterday\nthat vs would have meeting last night. A\nlev nodsst bills we\'re posted during the a.\ntsrnoon, and By the time the hour Of .ssandls\nlight"" had fully cons the court house waa\ncrowded 70 iss foll capacity. Judge visls\ncalled the meeting to order and nominated\nFred. Hesssr, Esq, to preside. l. II. Knapp\nand v. "". Winssrboshan were named vioe\nPresidents, and 9. Il. Albright and NJ. v.\nAbby were chosen Secretaries.\n\n\nMr.. uesser briefly stated the object Of the\nmeeting - being to take such aoton e be.\nGame loyal citisens to give support to thu\nGovernment 10 enforcing the laws, suppress.\nIng rebellion and Furnishing treason.\n\n\nA committee Of 10, Of which Mr.. r. W\nAlbright was chairmsn, vas raised, to pre-.\nsent resolutions expressing the sentiment.\nand will OF the meeting.\n\n\nTbs resolutions we\'re very strong. They\ndeclare il 20 be the duty Of all good citizens\nin times like the present, to stand. by th,\nconstitutional govsrnment regardless Of\nthei. onininns ""a .hs-sslsSS-sss- inc = M\ntional tros6ies and irrespective OF past pc\nlitical differences. They endorsed the Cali\nfornia resolutions against tho right Of %\nssssion and Affirming the duty Of the Gov\nsronent TO maintain its integrity. Tho,\npledged the snpporters Of the sssolusiess 1,\nstand BY the country right or wrong, an\ndeclared IN intention not to tolerate tfeaso,\namong us, either in 0ord Or deed.\n\n\nThere ware no long speeches, but thsr\nvse much good strong talk 70 tho effect the\nthe time for discussion, concession and com\npromise had passed, and ""now il the sim\nfor action""', 'HAVING sold an interest in the ""EelipseFA\nII Livery STABLE"" TO Jno. N. Fisk, the busi-s n 81\nness Of the hrm will iesrafter be conducted G. ~\nunder the style Of Hunt Fist. 7. "". HUNT.\n\n\nWe will keep on hand Al the Eclipse"" the best\nstock that the market 1G0re ard will furn 81 Such\nturHouts viii give entire sa;isfactisn 70 all the pa\nirons of the cd AID popular stand II good teams and\nconstant attention b the wants Of Our customer will\ndo II, we will endeavor 10 please.\n\n\nHorses hpardsd ~ II, day, week, month upon the\nmost reasoaable teraA\n\n\nfes-1m HUNT F7sK.', '10 tuCStiou VI WV \'""""No\n\n\nOf Lincoln, still continues to be the\nAbsorbing topic among the inbabit-\nants Of Washington city, who appre-\nbend that the ceremony may be ac-\neompanied by baptism in blood\nWe have had various rumors Of mil\nitary preparations 10 Maryland and\nVirginia, with The supposed object\nOf preventing the ceremony; but\nwhether for that purpose, or merely\nto defend those States and The Dis\ntriot Of Columbia from the Eruption\nOF Wide Awakes, which was announced\nTO be in Attendance on the Black\nRepublican President, does not ap-\npear. Accounts now speak of mil\nilary organizations in Pennsylvania.\nNew York, and New Jersey; but\nthey axe understood to be intended\nto preserve order, and defend The\nrights of the border slave States\n\n\nThe telegraph says that Gen. Scott\nhas been advised that 1000 men at\nBaltimore are ready to come TO\nWashington at a moments notice TO\ndefend the District and capital. Gen.\nScott is understood TO be in laver Of\nthe preservation Of The Union, even\nunder the administration of Lincoln,\nso long as be adheres to the consti.\ntution and maintains the laws. In\nthe mean time the late Wide Awakes\nhave become Fast Asleep, or sunk\nout of sight like the men Of Roderic\nDhu. The Chicago Times asks:\n\n\n""Whare are those Wide wakes,\nwhich, but short month ago, were\nready, willing and anxious TO march\nagaius, the South. So long as Sc\ncession was confined to words, these\nvaliant tyros were ""eager for the\nfray,"" and almost demanded to be led\nagainst their countrymeu. Ten\nthousand Wide-Awakes were t o\nmarch 10 Washington to assist at the\nInauguration. They were to 60 into\nimmediate training, and we were\npromised that they would become\nsoldiers of whom a nation might be\nproud. Where are they now? now\nthat disunion has absolutely taken\nplaoe-now tina. civil war with all OF\nits ghostly borrots is staring with\nglaring eyes at the country-where\nare they? into what hole have they\nerawled? Oh, valiant army! Oh,\ndauntless will-o\'- the-wisps! Brave\nspiriisl Why have We subsidized?\nNot lisp have they uttered 10 three\nweeks. Ominous silence. Have\ntheir lamps gone out? Let US hear\nirom tbem-if but single mournful\nwhine.\'', 'IhLEHlHIlI UUIl. :\n\n\nBusiness IN this city to-day was universally sus-\npended and churches ali thr0nged with people,\nand ii Is decidedly the most solemn day ever Wit\nmessed in the history Of Petersburg.\n\n\nAT Richmond the day is being duly Observed\nMany Of the discOurses at churches were very ell.\noquent and powerful; all OF them earnestly in\nv0ked the interpositi0n of Divine Providence In\nthe present dificuity, but expressed devotion\n20 the South, and while war was deeply %\nbe deplored it was necessary 10 prepare Tor IL iof\nour own projection', ""Con the morning of the 5th, Col. Sci\ngel, with portion of his regiment, part\nof Col Solomcn's, and IL peices of artil-\nlery-in all IL to 1900 men were at.\ntackled by 5000 rebels, under Gen Rain\nes and Col. Parse ms, on prairie about 7\nmiles east of Carthage. The enemy had\n5 peices of cannon and many mounted\nmen. Seigel began the attack at 81 O\nclock in the morning, breaking the enc\nmy's centre twice, and after II hours\nfighting, silenced their artillery. The\nrebels had three fags--one Of the State\nof Missouri, which was unframed, and\ntwo secession flags which were twice shot\ndown and then raised 40 more. In the\nevening they attempted to outfank our\ntroops with cavalry, and thus cut off our\nbaggage, but Seigel made retreating\nmovement, keeping up constant firing,\nand ordered the baggage trains to ad-\nrouc0, after Which he formed INTO col\numns, with a battalion of infantry sup\nported by four pieces Of artillery in the\nrear of each body, and the remainder of\nthe artillery in front and on the flank\nThe rebels attempted to cut off his com\nmunication with Carthage by cavalry,\nbut our artillery cross fired, which play\ned havoc with their ranks and opened\nthe road. Seigel then fell back on Car\nthage, the enemy harrassing his flank up\nto the town, where another stand was\nmade, the rebels being in possession of\nthe place. Seigel then surrounded the\ntown, throwing shot and grenades into\nthe enemys cavalry, and using his infan\ntry with great effect.\n\n\nWhile attempting to reach the udja-\ncent woods TO prevent the use of caval-\nry, the rebels made their most serious\nattack, and it was the bloodiest part of\nthe battle, but by evening they were fl\nnally routed and forced to withdraw their\nforces. Seigel fell back to Mount Yer\nnon, whe,e he could be supported.\n\n\nSome captive officers, taken about five\no lock, report the loss near $50 on their\npart, but as the severest lighting was\ndone subsequent to that hour their loss\nwas considerably greater. Fort five\nprisoners were taken.\n\n\nOur loss is eight killed, and forty. five\nwounded and missing.\n\n\nThe battle in which Col. Wolf was\nkilled was fought on Saturday, thirty\nmiles from Springfield. 2s#\n\n\nNew YORK, July11.\n\n\nOrders were received at the headquar-\nters of abe army on Monday, TO send\nImmediately to the seat of war the LIST\naltillery-part of the Fort Sumter sarri.\nson, which is at Fort Hamilton. Tho\nbrave fellows were under arms for the\nroad in few minutes The old ensign\nof Sumter were along with them S they\nbelieved there would be 10 luck without it.\n\n\nThe whole number of officers in the\nnaval service of the government on the\n1st of November last was one thousand\nfive hundred and sixty-three. Of these\nnine hundred and two were from tho"", 'Saturday Nights Report.\nHONORs TO MAI. ANDERSON.\nsLooP OF WAR BROOKLYN NOT YET\nORDERED TO CHARLESTON.\nTHREATENINGs OF TILE CHARLES\n\n\nT0NIANs.\nSUNDAY WORK Ar CHARLESTON.\nUNION MEETING AT PHILADELPHIA\n\n\nDISTURBANCES.\nSHALL SOUTH CAROLINA BEGIN\n\n\nTHE WAR;\nCharleston COnventiOn----CorrespsH\nBetween the Commissioners and\n\n\nPresident.\nSPEECH OF Mr.. SEWARD on THE\nPACIFIC RAILROAD.\n\n\n~ -\nTroops FROM LEA TENWORTH\n\n\nFROM AUBURN.\n\n\nAUBURE, Jan 8.\none hn dred guns were fired in this city this\nevening honor Of 1lai. Anderson\n\n\nNEW YORK ITEMS.\n\n\nNEW YsRK, Jan S.\nhe g amer star of the West was coaled up\nve,tsrda with unusual celebrity and report which\n[. rdicuirf at the Ofice Of the Co, says she N\n{, ing to CIarles.op with troops\nRev. HenrY Anthem died in this city this morn\nGOn. Wm. Keut died al Fishkill this morning.']","Well, my friend, it seems you’ve come asking about events from February 11, 1860, but I must confess that I don’t have any firsthand news from that exact date as we are currently in 1861. However, I can tell you that the atmosphere around here is quite tense and charged with talk of secession and the looming possibility of war. 

Just recently, folks in our region have been expressing concern over the direction our country is headed, especially with states like South Carolina openly discussing leaving the Union. There’s talk about political maneuverings and debates in Congress, which seem to create more divisions than they resolve. The abolitionist sentiments in the North clash fiercely with the Southern advocates for slavery, and the divide deepens daily.

Around this time last year, the election of Mr. Lincoln was met with a great deal of opposition from the Southern states, and now in February of 1861, we hear whispers of preparations for conflict. We’re all feeling a bit on edge, wondering what the next few months will bring. In a recent article, I noted that discussions are happening about military organization and defenses in our cities. 

So, while I can't tell you exactly what happened on February 11, 1860, I can share that we are living in a precarious moment in history, rife with uncertainty and anticipation. How are things where you come from?","On Feb. II, 1860, the proprietor has received for many years and is continually receiving the most fervent and grateful testimonials of the value of the medicine prepared and sold by Dr. WM. MOFFAT.",0.6875,0.0,0.0,0.0
Wht is the number of troops at Washigton?,"['The PrOv,dcacc Journal OF Friday says\n\n\nThe following record Of the movements OF\ntroops thus Ear is of interest. We believe Is\nTO De substantially correct. though accounts\ndiffer respecting the number Of troops At\nWashington and la some OF the regiments;', 'transfers, time and space. 1t is, of course,\nthe purpose of an army to reduce, as much as\npossible, the amount of baggage for which\ntransportation is required. But when reduced\nto the lowest point, fifteen wagons with FOUR\nhorses each, to each full regiment Of infantry\nis fair allowance. For an army of $4,000\nmen, are thus required 80 wagons and 5000\nhorses, which would extend in single file, each\nwagon occupying only 100 feet, something\nmore than fifteen miles.\n\n\nAll these wagons had to be made, and all\nthese horses purchased, before any consider\nable movement in advance was possible\nThis number was required for the troops ex-\npected to advance from Washington alone.\nHalf as many were wanted for Gen Patter-\nsons column, and at least 200 wagons and\n800 horses for Gen Buffers column. This\nmakes no account of the horses needed for\nthe artillery or the cavalry. 1t is merely the\nnumber requisite to convey the indispensable\nbaggage, or as the Romans accu rately and\ne1pressively styled it, the impediments of ad-\nvancng infantry. 1t ia not reasonable to ex\npect that all these things can be extemporiz-\ned, it is fool-hardy and reckless of the lives\nOf our citizen soldiers to demand that they\nshall be ignored.', 'ALEXANDRIA, Va, Jan. B.\nThe steamer Philadelphia has just passed down\nthe river with marines It is said to garrison Fort\nWashington.', 'James M: Tory Judgment of Foreclosure\nCalvin A. Tuttle. anu ""\'\'ie\n\n\nTN VIRTUE of and pursuant to Judgment\n\n\n4 rendered in said court in the above enti-\ntied action, dated May 81, 1861 | shall expose\nfor sale and sell to the highest bidder at Pub\nlie Auction. at the front door of the Hotel now\nkept by |. |. Foster, in the city of Prescott,\nPierce county. Wisconsin, on the 22d day of\nAugust, 1861, at the hour of ii o\'clock, A. NJ. of\nthat day the following described mortgaged\npremises or so much thereof as may be neces-\nsary to raise the amount of said Judgment and\ncosts together with the expenses of sale to-wit ::\nAll the following pieces or parcels of land\nsituate in TIE county of Pierce and State of\nWisconsin, and described as follows One\nundivided one-half or moiety of lots number\ned one e. aud two (2) of section number\nthirty three, (33) also, of the east half of the\nnorthwest quarter of section number thirty\nthree, (33) also, of tie northwest quarter of\nthe northwest quarter, and of the south half of\nthe northwest quarter of section number thir-\nty-four, (34) all in township number twenty\nfive, (25) of range number eighteen, (1S)\nalso, the whole of the northwest quarter and\nthehorth-west quarterof the southwest quar-\nter of section number twenty six, (26) in\ntownship number twenty-five, COSY of range\neighteen, (18).\n\n\nDated Sheriff\'s Office, Town of Perry. May\n5w7 HUMPHREY & WILSON, PITS Att\'ys.\n\n\nj. r. FREEMAN, Sheriff Pierce Co., Wis.', ""Total -------.---- Is poo\nIn all under orders and awaiting orders. 81.\n600\n\n\nThe above estimates we're made up from\nNew York and other papers, in round NUN\nbers. Ii will be noticed that eleven first\nclass ocean steamships are now transporting\ntroops stores, &c, from New York to Wash\nington"", 'Henley is to exercise supreme control over\nthe Police Department until some known\nloyal citizen is appointed to act as Marshal.\nThe proclamation gives the reason of the ar\nrest of Kane, which is that he is known to be\naiding and abetting those in armed rebellion\nagainst the Government, and is at the head\nof an armed force, which he had used to con-\nceal rather than detect acts of treason to the\nGovernment.\n\n\nThis afternoon the Police Commissioner is\nsued orders disbanding the police. He also\nissued a protest. signed by the Mayor, as one\nof the Board. Henley has sworn in new\nforce.\n\n\nBooNvlLLE, Mo, June 2Sth-One hundred\nand thirty men have arrived here from\nGeorgetown and Sedalia counties for the pur-\npose of being sworn into the United States\nservice as Home Guards, to serve III the\nState Large bodies of men in johnson coun-\nty are preparing to take the same steps. They\nwill be sworn in and receive arms as seon ae\npossible\n\n\nColonels B. W. Grover and Johnston, oi\nJohnston county, have formed regiment un-\nder Colonel Grover, fer the purpose OF being\nsworn into the service of the United States\nacting as Home Guards throughout the State\nThey have commenced drilling and Colonel\nGrover is here to secure them arms from Gen\nLyon He also reports that eight hundred\nare organized in Pettis county and six hun\ndred in Cass county. Two hundred of the\nPettis county men arrived to-day as con-\nvoy to take arms back with them.\n\n\nSenator Wilson, it is understood, has been\nin consultation with Congressmen as well as\nhigh officials of the Government, and at an\nearly dav of the extra session will, as Chair\nman of Committee on Military Affairs intro\nduce bills providing; first, to legalize the\nExecutive action concerning the present de-\nfensive and warlile preparations; secondly\ngiving the laws to the plan already advanced\nfor permanent increase of the army ; third\n"", retiring iuirm and disabled officers\n| fourthly, to organize from the militia one\n| thousand regulars as a National Guard, TO b.\nall clothed and armed alikc filthy, to in\ncrease the number of cadets to the extent o\nsixty eight, or the number of Senators, anC\nauthorizing the President to fill vacancies\n| caused by resignation or otherwise, in tha\ninstitution Besides, it is designed to recon\nmend an appropriation of $2o0,0oO,0O0 tC\ncarry the defensive measures into effect. Th,\nabove are substantially the objects contem\nplated.\n\n\nOwing to the expeditions calling so many\ntroops into the field, the Quartermaster\'s De\npartment had net been able to furnish uni\nforms so as to Immediately supply the de-\nmand Measures have been taken, however\nfor an adequate supply at the earliest practi-\ncable period', 'Cant. Pendereast asoertainsd tho channel\nwas obstrucssd, be placed his ships broad\nside 90 Norfolk and Portsmouth and demand\nCd shst obesructions In the river be removed,\nelse be would laval both places. Is - added\nthst The oitissus complied with bic demand.\nClerks or The State Department have been\nformed into . euafd for the protection Of\nthat building. Those OF The Treasury have\nresolved orders immsdistsly TO repair TO the\nDepartment on tho 6rst invasion at the city.\nThe clerks OF The ether Departments are d..\nrectsd to be similarly watohful. Ii addition\nto the military force that has been plaeed in\nthe public baildings, the rumoPs OF N intsn.\ndsd invasion Of Washington, tonight, have\nexcited msch var feeling. Whatever may\nBE- The grosnds FOR ssoh reports, u 10 certain\nthe Government 10 sxpsditioGsly making\npreparations for oh emefeenoise. The KAN\ngo nen nov here, about 90 in numbsr, have\nfornsd company called tho Frontier\nGuards. They have bean given the post Of\nhonor 10 the east wing Of che Presidents\nhouse.\n\n\nIl 10 stated 10 financial circles, from author.\nity, that the Government has advioss that\nHssper\'s Ferry 10 Ia the hands Of The ""a.\nthorities Of Virginia. The War Department\nodscially announces the establishment OF .\nnew military depot, to be called the sDepot\nOf Washington"" Mai. Bsal, Paymaster Of\nthe Army, resigned bis oommission to-day.\nTho Pavnee has arrived at Warrington.\n\n\nIi il reliably stated by partiss direct from\nRiohmond. that the ordinance OF secession\nwas publicly proclaimed yesterday. The\nvote on its passaGe 10 kept secret.\n\n\nMaj. A. M. Hancock, of KY, 10 appointed\nconsul % Malaga.\n\n\nHARRnsuR0, April ID.\n\n\nTrains are leaving with troops % fast %\nthey are prepared. Lewis W. Hall, Of Blair\ncounty. wss elsotsd Speaker Of the House\nTHE noruing. The 0ovsrn0f\'s war prosls.\nnation will BE- issusd tomorrow. Five hun\ndrsd volunteers left viA the Northern Gem\ntrail Railroad for Washington this morning.\nSeven hundred men arrived to-day and were\ncent on forthwith. The Governor ordered\nont Gen. Patterson\'s division. Six hundred\nstand OF arms ere expected here to-day\nBoth Houses Of the Legislature met 10 Con.\nvention st the hall OF the noese this morn.\nine 60 hssr the Star 6panglcd Banner sung.\nThe refrain wrs joined 10 BY oil the mem-\nbefs and galleries amid the wildcat cheering\nand snthusiAsm. The song was afterwards\nsung 10 tho Senate, and both the member\nand Senators seemed mad with DEVOTION\nBoth Houses have adjourned sins die.\n\n\nBALTIMORE, April 10.', 'Mevs0e sss o. TrePs..- war news\n\n\n-. &c.\n\n\nNew York April 10.\n\n\nAn attempt has bean made to purchase\nthe new steamer Mercidita for the COME\nderats States. but the reply was that\nthere was not money enough in the Se-\ncoded States TO do It.\n\n\nThe entire FIRST division, numbering\n1000 men had been offered to the Go\nvernment, TO be ready to march at an\nhours notice.\nIntense excitement among the military\nct the Baltimore news.\nThe Chamber Of Commerce resolved\nthat the government should issue pro-\nclamaton that all persons privateering\nunder HAsfs\' commissions be dealt with\n- pirates. and Immediately blockade\nevery Southern port\nel22 600 was subscribed at the meeting\nOf the Chamber Of Commerce 10 aid Of\nthe volunteers. They arnnin.ed COM\nmissioners to take up government stocks.\nDelegates from Is Life insurance COM\npanies met to day and recommended Ia\n1 6oV6E0I QO8Iub W ASCUU0 tu0 IloA0 W kko\nassured entering upon naval and military\nservice.\n\n\nThe Evening Post hears from rsii.\nable source: that JEFF. Davis. At the head\nOf the Confederate forces, 10 within ""a\nhours march 4 Washingtoa.\n| Nxw YoRx April 19.--The Rhode Island Marin,\nArtillery saryed to-day with nix pieces Of artillery\n/ and started tor Washington 200 Rhode Island\ners under Gov. Sprague, viii arrive here tenor\nNOR.\n\n\nGov. Morgan Issues his rsqaistion for the 9th\nl2th and lsf regiments ri this city, TO start 10\nWashington tomorrow, and Gen. Sanford has u\nsued specs orders 10 that effect.\nThe gun boat Pocah mtas 10 ordered South imme\ndiately. She sails tonight with troops for For\nn Monroe.\n\n\nThe 7th regiment left for Washington By railroA\nthis r. n.\n\n\nBroadway was thronged with people ~ they pass\ned down, and the famous regiment WAS lusii\ncheered and showered with boQuets They too\ntheir howitsera and each man had brace Of revol,\nerr in addition to their muskets.', ""v AsHINGTONl . an D.\nOn inquiry at the proper quarter It has been\nascertained tlat before June last il being found\nthat the arms az the several arsenals were not pro-\np0rtionately distributed, and that the Southern\narsenals were quite deficient in these supplies a\ndistribution was made Tor equalization only and\nfor no other obiecg. They were principally drawn\nfrom the Springfield armOry, and from the aTsen-\nais az W aterVieit, n Y, and WatertOWn, Mass.\nThe secession troubles, It Is known, had not\nbeen commenced I'LL after the distribution was\ncomplete. There remained prepOnderanee OF\narms az the North.\n\n\nLieut.. Gen. Scott was engaged TIL O'Clock\nthis morning on business connected with his De\npartment.\n\n\nThe Republicans were again in caucus to day,\ntheir object being 70 agree on uniform Legislative\naction\n\n\nThe arrival Of recruits from Philadelphia for\nthe purpose Of being drilled at the Marine Bar\nracks at Washington has been magnihed into un\ndue importance."", 'Special to the Tribune.\n\n\nWAsBINcTor, Oct. 28.-Genersl Scott will\nvoluntarily retire from his rank and duties with\nin the next ten days, solely on account OF his\nphysical inirmities. The recent act Of Con-\neress provided there should be no reduction 10\nbis p,y, subsistence or allowances, IN the event\nOf his withdrawal.\n\n\n1t is well knowu that Gen. Scott has bad an\nunsettled account with the War Department\nsince the Mexican war. Secretary Cameron\nhas recently gwen careful examination OF bis\nclaims, nov Ihiftee years old, JtK Davis bav-\nil brought him in debt on account Of his ex-\npeDd tures aud receipts in Mexico, and so Tar as\nthe Secretary\'s report could do 1t, disoredited\nhim as a tinauci4l agent OF the Government\nMr.. Cameron has reported that General Scott\nwas not only entitled TO the money he claimed\nof the Government, but that be saved to it mil\nlious Of dolars, which by the laws of var he\ncould have pOcktted uuder the set led principles\nregulating the distribution Of prize aud contri-\nbutton money. it\n\n\nThis opportunity of personal advantage Win\nfield Scott generously diverted to the founding\nOf home for iOvali soldiers, O0e OF the mon\numents, loue after be is dead, will be the sol\nd,ers\' home near Washington.\n\n\n% Saturday l4et the order OF the Command\nerin Chief that Gen. Fremont ehoud surrender\nhis com maud TO the Cfficer Dex below him, Gen\nHunter, accompanied by letter Of 10 .tIuctiOns\nto Gen Hunter was sent out by the President\nto Gen. Curtis, in comm md at st Louis, with\ndirections TO deliver is to Gen Ffemont, unless\nbe was actually in the presence Of the enemy,\nor preparing for battle. Ia.\n\n\nSenators Chandler Of Michigan, Wade Of\nOhio, Trumbull Of Illinois, and Wilkinson ol\nMinnesota. are here, representing to the Ad-\nministr alton that the popular demand OF their\nconstituents is that Mcclellan or sope one else\nsbalfimmediatey whip the rebels on the South\nside OF the Potomac In pitched battle, and as\nnear to Ball Run as possible, and from theme\nroll the tide Of war steadily Southwark till it\nreaches the waters Of the Gulf.\n\n\nThe Trbune staies that one Of our cores\npondents with the great naval expedition writes\nfrom Hampton Roads on Friday last that he\nhad Just been informed on good authority that\nthe Private Secretary of Commodore Dupont.\nthe Commander of the feet, had nbsconded,\ncarrying with him the maps and charts, and\neven the sealed orders Of the Commodore. We\ndo not vouch for the truth Of the report, but\nonly for the fact that the writer is worthy OF\ncredence We hope the report Is erroneous.\n\n\nSpecial to tho Heraii.l\n\n\nA scouting party Of Union troops went into\nahlhA OOukh AASuSC "" AOethco huoe\nthe rebels had not been there for many days,\nout were az far back as Centreville, and not\nstrong even there.\n\n\nThe rebels all along our lines to-day. on the\nUpper Potomac, have net been seen. 80.']","Well now, it seems the talk of the town is quite focused on the movements and readiness of our troops. From what I've gathered in the papers, it appears there are around 81,600 soldiers mustered and awaiting orders in Washington at present. This number is circulating among the reports, though, mind you, figures can vary a bit depending on the source.

We’ve heard tell of several regiments stationed there, and as folks rally for the cause, it’s all hands on deck. There’s a great deal of mobilization going on, with talk of more troops being needed even from other districts. The excitement is palpable here, as men are enlisting, and preparations for advancing are truly underway. It just goes to show how we are all trying our best to contribute to the war effort in these trying times.","The context mentions that accounts differ respecting the number of troops at Washington, but it does not provide a specific number.",0.9090909090909091,0.0,0.8801587301461565,1.0
Can you provide an overview of the key events covered in the HISTORY OF ENGLAND from the peace of Utrecht to the peace of Versailles?,"['HISTORY OF ENGLAND, from The peace\nOf Utrecht to the peace Of Versailles,\n1713-17S3. By Lord Mahon. in vols ,\nfull calfpmarble edge.', 'have shared in our prosperity and you say\nthat thew shall not strike a blow to save\ntheir American neig hbors from ruin. You\ntake buccaneers to your bosom, If they bring\nwith them the captured ships of Boston and\nNew York. You would make the sea-towns\nof England the nurseries of cut -throats and\nmarine murderers, and the courts of England\ntheir refuge from sharp and speedy Justice\nSubstantially, my Lion, you bestow your\ncountenance and comfort upon men who. if\nthev were your own subjects and committed\nthe same crimes, You would hang at the Old\nBailey. as you hung there Thistlewood and\nthe Cato street conspirators.\n\n\nNow. my Lion this is game which two\nnarties can work at. Your own den, YOU\nwill hermit me to observe, has good many\nwindows in it, and we can throw two stones\nto vour one Canada, for retaliatory pur-\nnoses. is in a mighty convenient position\nand Canada may catch the itch of dissolving\nnoli,ical unions Our facilities for drilling\nIrish battalions are uncommonly fine. 1t\ndoes not follow, when we make peace with\nour misguided and revolted States, that we\nshall include in our general amnesty all who\nin our day of peril may have deserted us\nwe may live to see\n\n\n""Naked Rebellion, with his torch and axe,\nMaking his wild sport with YOUR blazing throne.\nThese unhappy differences will soon be ad-\niusted; but it will not be so easy to adjust\niiarring recollections and indignant memories\nw may forgive our brothers and forget their\ncrimes; but it will not be so prudent to for\nget foreign wrongs, nor so proper to forget\nalien injuries. God keep us from the AFRO\nrance and self-sunciency which you exhibit\n\n\nThe undersigned, grasping at this pleasing\nopportunity of renewing his assurances o\nDISTINGUISHED consideration, begs leave tc\nsubscribe himself,\n\n\nYour Lionship\'s most humble\nAnd most obedient ser,t\n\n\nNANITV EAlP', 'A MEAN TRICK.-John Silk was yesterday guilty\nof very mean trick, that is, if the charge against\n| him on the First District police books is reliable\n| He actually knocked down and beat numerically\npoor drunken devil named Doroughty, who had\ntoo much liquor in him to allow OF his even walk\ning without staggering from side of the ban\nquette to the other. Silk arrested and Gala\nboosed.\n\n\nSINGULAR Su-IcIDE.-Our readers will perhaps\nremember that the lst inst we noticed the\ndeath, by his own hand, of an old Frenchmar\nnamed Louis Aron, who was supposed to have\nbeen impelled to do the deed by grief for the Loss\nOf an only son. He was frequently heard to say\nthat he would not live after the 1st of October\nand true enough on the morning of that day he\nwas found in an clubhouse of the Second District\ndraining machine, with his head nearly blown off\nan empty gun near by plainly showing how the\ndeed was committed 1t seems that he left\nwidow, whose cup Of grief was full to Overlooking\nbefore his death, but afterwards she never seemed\nto care for anything left to her upon earth, and of\n| ten expressed belief that her end was near. Yes\ntcrday morning her dead body was found in the\nditch, near Il E draining machine, within few fee\nfrom where he met his untimeIy fate. She hat\nundoubtedly drowned herself in despair The\nCoroner held an inquest upon the body, and re\nturned verdict of suicide.\n\n\nRECORDER EMERsoSs CoURT.-Wm Hugo auG\nc. f. Rochow, charged with selling liquor to &\nSIA u3V ""a m hn\nproximo.\n\n\nJames Burke, charged with wallopng the wife\nof his bosom, was fined $50, and ordered to give\nbond in $3.50 to keep the peace for three months.\n\n\nThe following parties were dismissed\n\n\nFrancis Miller, charged with being deserter\nMrs. Thomas Grant, accused of assault and bat\nterry Mary McGreen, for breach of the peace\nand Barney Finn, accused Of highway robbery\n\n\nRichard Phelen, accused by James H. Huckins\nJr. of fighting and disturbing the peace, was tined\n$25, and required to give $3.50 bonds to keep the\npeace.\n\n\nRECORDER LoNGs CoURT-NIichel Goorich, &C\ncused Of assaulting and striking Andre Baptste, ir\nthe Port Market, was held in $500 to appear when\n| called on.\n\n\nHenry Levy, charged with assaulting Leopold\n| Shotlanem, was dismissed, the quarrel having beer\n| satisfactorily arranged.\n\n\n| Richard Scott, who violated the peace of his dar\nling wife Ellen, gave bail to remain a member o\nthe peace society for three months.\n\n\nJames Macahan, who is charged with having as\nslulteQ anu Dealefl his wire MARY: ana raul\nsain, charged with assault and battery, were com\nmitted for trial before the First District Court\n\n\nWest eTn Military Correspondence e\nAutun--Fi\'s Of the Forest About PnpawS-Our Grave', 'Though in all probability England\nwill in the end favor the side Of the\nfederal government, yet this first con-\nduct will be remembered against her.\nThe heart Of ever loyal American has\nbeen too deeply wounded for it to-throb\ntoward England this many year yet\nas il once did. History is now recor-\nding the difference between the English\nand the French policies toward the\nUnited States, and no time can efface\nthat record, nor any change undo its\nmischievous impression. England set\nherself against US when the hour was\ndarkest. She may turn in our favor,\nbut such turn will golittle to her credit\nu she makes it after foreseeing the sure\ntate OF the rebellion. Principle, how\never honest, makes but poor show in\nabandoning falling cause World.', 'The discovery put an end to her osten-\ntious profession and it may be hoped\nturned her attention more to practice, By\nthe way ofimalling amends for herunjust\nimputations on Nancy Campbell, She con\nsented to receive her as daughter-in-law\nwithin the same year, and it is said there\nwas peace ever afterward n,the farmhouse\nbut the good people of Bathgate,q when\ndiscussing a character of more pretenct\nthan performance, still refer to ""Widow\nSimpsons Spoons IN rair-it.r\nI THE WATCH OF GEN. .WAsHINGToN.-\nWe. were shown yesterday, says the Lou\nisviHe Jourmal, gold watch of the Older\ntime, which is of great value as a memen\nto Of an important event in American his\ntory, The watch was a present from Gen\n4 Wo ob ,uoto,, +o Gan oyf, yoffa ond boo 40', 'France to have free trade for her wines\nand silks and laces. The true reason\nOf this anomalous difference between\nthe courses of the two nations toward\nus is, that France has known how to\nrise at once above all those low, ma\nterial considerations, and judge the\ncase with regard to the principles of\nnatural justice and national good faith,\nwhile England, thus far, has not. Say\nwhat we please, there is degree of\ntruth in the sheer of Bonaparte, that\nEngland is nation of shop-keepers.""\n1t Is always the national interest that\nrules her councils at Srst. In any new\nstate of things, the world over. her\nfirst question is, Where and how will\nIt pay? We say the first question.\nShe is not incapable of asking others,\nand, when once the heart of the people\nis thoroughly aroused, nowhere on\nearth are other questions asked with\nmore earnestness and effect. The time\nfor this, in our own case, we have not\na doubt will come. But for the present\nwe must leave John Bull to his calcula-\ntons of profit and loss.', 'Newspapers prate, my Lion, about the\nuncertainty of the policy of the British Gov\nernment in these uncertain times as if,\nwith an Honest Beast, disposed to remember\nhis international obligations, there could be\ntwo possible policies. OF your neighbors,\nthe crowned, and crouching, and crunching\ncontinental wolves, we expect that cold-\nblooded Indifference best calculated to secure\nthe bones. But you are of cur own flesh and\nblood; your fathers were our fathers our\nlaws have the same root and the ancestors\nof both of us having been talking Of liberty\never since the days of Alfred the Great\n\n\nWithout crime committed. without any\nfair forfeiture of your confidence my Gov\nernment finds you puttering about what you\nwill and will not do, while rebels are at its\nthoat and assassins are seeking its life We\nask you for honest and kindly treatment, and\nyou refer us to Puffendorf We ,.ask you\nsternly to. dacountenance thievery and nlur-\nder, and we find your rieketty old House of\nLords debating how strong blockade of the\nports OF pirates must be, before you will re-\nspect 1t. A losel scum of sea-thieves, the\noutcasts of all nations, threaten our COM\nmerce, and my Lord Brougham, friend of the\nolacks, tells us that privateering is not pi-\nracy."" There is robber at our door, and\nyou will not sell US a pistol. There is\nknaVe menaeing our existence, and you will\nnot send US an ounce Of powder without his\npermission. There are tens Of thousands of\nwho have been welcomed to our\nsoil, have been protected by our laws, and', 'DETENTION or Lord LYONS DIsPATCHg5;--\nThe following, from the st. Louis Bulletin Of\nthe 10th, explains Il dispatch published & few\ndays since\n\n\nWe have bee Permitted TO make the follow\ning extracts from II letter received in this city\nIl few days since. We regard it as entirely re-\nliable:\n\n\nWAsHIsaIoY, Aug. 3.-Amorg the on d:t9\ncirculated IL Thu city is one Of much import\nGnce, as showing the wisdom of our premier\nn conduc ing foreign negotiations.\n\n\nItappe;lrs that he day OF the battle OF Ma\nnaSsas was that fixed for the sailing OF the\nCunarG steamer The news ct first received\nwas so much III favor OF the tederals that\ncertain prominent Northern men raised u, 900\n10 pay The expenses OF obtaining the boat ull\nMonday, and telegraph the arrangement to\nthi5 city. When the tide Of battle turned,\nand 1t baaame evident that ""ForWard 10\nRichmond"" meant Back 10 the Potomac. !""\nIA imperative message was sent ny the au-\ntLCritIe- here TO send the steamer eff lm1le-\nd!aoe!y. She sailed, therefore, withoat any\nnews.\n\n\nlne Britt h consul at New York immedi-\nateiy LelegTauhcd lhls fact TO Lord Lyons,\nwho, il turH, diepatc ned to II 1li\'a1 TO detan\nthe stGamer aL that point until his dis patches\nshould arrive there.\n\n\nWhen lie had received correct information\nregarding the tattle, he took q dispatch TO the\nTelegraph office and supposed 1t would De sent\nimmediately. Something occurring 10 arc 2se\nhis suspicion, he, accom- panied 10y his Secreta-\n~, dove to the telegraph office and requested\ntnat HE Gl- patches should be repeated from\nHalItoX. IAls forced The operator TO acknow-\nledge that they had not been tOrW arded. by\nwhose orders are my dispatches suppressed\nquerIed the indignant Briton. by those of\nSecretary Sewarl, was the reHA The Brit\nIsh representative drove immedel Ely to the\nSLate Department ard iuqu Ired OF The premier\nII such orders had been gwen. lie replied IL\nThe affirmative. ""My passports\'\' was the\nstern demand OF England. Seward hesltated.\n= Caoiuet con sUltutiOn was held. The dis\npatches "" ere sent, and Lord Lyons reluctant\n~ withdrew his demand, Grt il formed the as\nt1nished Cabinet Lhat he should refer tue mat\nter 10 his Government.']","Ah, good to see you, traveler! You’ve come to the right place if you’re seeking knowledge about our history, particularly concerning the illustrious reign of England from the time of the Peace of Utrecht to the Peace of Versailles. Let me share with you what I know and what I think is significant about these times.

Now, we must begin with the Peace of Utrecht, which was signed in 1713. This treaty came at the end of the War of Spanish Succession, a major conflict where many European powers vied for control. It restored a delicate balance—ensuring that no single power could dominate too much. England emerged relatively strong, gaining territories like Gibraltar and Minorca, which bolstered her naval power.

Moving forward, the 18th century saw growing British influence across the globe. The rise of the British Empire is marked by increased colonial endeavors. We cannot overlook the economic interests driving much of England's foreign policy. The valuable trade routes to the Americas and India became focal points, enriching the coffers of the Crown.

The fighting continued, and by the time we reach the mid-century, England stands steadfast in numerous conflicts, including those with France. The Seven Years' War, which erupted in 1756, further exemplified this struggle for dominance. This war is often dubbed the “first global conflict,” and it culminated in significant British territorial gains in North America and India. I reckon this shifted the balance of power strikingly in their favor.

However, this expansion bred tensions. By the time we approach the conclusion of this period with the Peace of Versailles in 1783, we see a noteworthy event—the American colonies, inspired by revolutionary fervor, declare their independence from English rule. Despite England's initial military prowess and resources, the loss of the American colonies marks a considerable turning point. The treaties that emerge find England forced to recognize the independence of the United States, reshaping our understanding of power and governance.

In our own time, amidst the chaos of civil strife here in our Republic, one might reflect on how such historical treaties and events shape nations and identities. Just yesterday, I overheard conversation about the potential repercussions of English policy on our own plight in this land. If we look at history, we see cycles of conflict and peace, and how nations navigate through them, learning—and sometimes repeating—the same lessons.

So, my friend, understand that the period you inquire about is rich with tale and tumult, revealing how England cultivated its empire, faced opposition, and ultimately transformed through conflicts that resonate even in our current American landscape. We keep a keen eye on their affairs as we carve out our own destiny in this tumultuous world.","The HISTORY OF ENGLAND, as detailed by Lord Mahon, spans the period from the peace of Utrecht to the peace of Versailles, covering the years 1713 to 1783. This historical account is presented in multiple volumes and is noted for its full calf binding and marble edges.",0.05,0.9496818178464324,0.9999999999,1.0
"What notable agricultural product was raised at Oyster Creek, Texas?","['A sweet potato was raised las.\nseason at Oyster Creek, Texas, that\nweighed 90 pounds.', 'Sp,ucs Creek, Hs...nyto"" Co., Pa. Jan. 1861.\nII. G. Spalding,-Sir You will please send me\ntwo boxes of your CephaIic Pills. Send them\nimmediately.\n\n\nRespectfully yours. JNO. Is. SlMOES.\n?. 81 have used Vne box Of your Pills, and\nfind them excellent.', 'During the past and present weeks,\nwe have travelled much over ourparish, :,\nand had an excellent opportunity of\npersonally witnessing the condition of\nour cane and corn crops. We say it\nwithout wishing in the slightest to ex-\naggerate, that never have we witnessed\nmore promising fields of corn and cane\nthan are to be seen in our parish ut the\npresent time. Cane of all kinds is rap\nidly showing itself above the ground,\nwhether plant, rattoon or stubblc, the\nyoung shoots are strong, vigorous and\nwith a very healthy color. Corn prom\nises an abundant yield, being far ad-\nvanced for the season. So far as cotton\nis concerned, however, we can say but\nlittle. We have but few planters of\nthat great staple, but the few seem\nsatisfied with the appearance Of their\ncrops. Garden vegetation of all kinds,\ny, L., 10. ! 1 y', '7xPt1T\n\n\n~ $50, 900 Of the Confederate loan has\nbeen tsksn here. The average quota or the\nState 10 oct down 1t 81 Csc, 600.\n\n\nA reqoisitioD Of men rs made on Eouth\nGsF0ftBS, but Tor What service il unknown.\n\n\nThe news Of the secession OF Virginia wss\nreceived here with JOY. The old secession\ngum was fired in trout Of the Courier once,\nBY the venerable Edmund Rom.', 'THRESH Baltimore and New York Bay Oysters\nl. received daily, and sold at IS cents per can /,\nWe serve them up in every style at our Restau-\nrant, and will accommodate families by the can.\n\n\nBROKAW & CAMP.\nhaRitowoc, October I6, 1860.', 'CoAT.-Short tunic of cadet grey cloth,\ndouble breasted, with two rows of buttons\nover the breast, the rows two inches apart\nat the waist, and widening toward the\nshoulder. Suitable for cavalry as well as\nfor infantry.\n\n\nPANTALooNs--Of sky blue cloth, made\nfull in the leg. and trimmed according to\ncorps-with blue for infantry, red for artil-\ncry, and yellow for cavalry. No other dis\n;inctiOn-\n\n\nFor the general and the officers of his\nstaff the dress will be of dark blue cloth,\ntrimmed with gold for the medical depart\n.nent. black cloth, with gold and velvet\ntrimming.\n\n\nAll badges of distinction are to be mark\ned upon the sleeves and collars. Badges OF\ndistinguished rank on the collar only. For\na brigadier- general, three large stars; for a\ncolonel two, for lieutenant colonel, one\nlarge star 4; for a major one small star and\na horizontal bar; for a captain, three small\nstars; for first lieutenant, two small stars\nfor a second lieutenant, one small star.\n\n\nBUTroNs.-For q general and staff officers\nthe buttons will be of bright gilt, convex,\nrounded at the edge raised eagle at the\ncentre, surrounded by thirteen stars. Ex-\n.erior diameter of large sized buttons. one\ninch of small size, one-half inch.\n\n\nFor officers Of the corps of engineers the\nsame button is to be used, except that in\n,he place of the eagle and stars there will\nDC raised \'\'E "" in German text\n\n\nFor officers of artillery, infantry, riaemen\nand cavalry. the buttons will be plain gill\nconvex, with large raised letter in the cen\nter-A for artillery, for infantry, etc\nThe exterior dismeter of large size button,\nseven-eights of sa inch small size, ont\nhalf inch.\n\n\nFor sill enlisted men OF artillery, large\nA raised ia the center Of a three-quarter\ninch button.\n\n\nFor all enlisted men, the same As for ar\ntiilery, except that the number of the reel\nment will be substituted for the letter A.', 'NOLASSES, Sugar, Coffee and Tea, Cand,es\nvl and Soaps, pepper, spices, ginger, stare, etc\n\n\nWater buckets, cburns brooms wash boards\ncoffee mills. Cotton and hemp roars. Tobacco of\nvarious brands Oysters and Sardines\n\n\nCASTINGS Of every description Nails plow.\nand hoes pad and door locks screws and butts\nfarming utensils Of all kinds whips, etc.\n\n\nblacksmith Tools. Of every description.\n\n\nlarge assortment OF Crcckery and Queens\nware, jars, jugs, qt 4 1T TASKS. Tin Ware etc\n\n\narTii III, Ieoi ? PERKINS', 'The o7erseer on the plantation of Maj James Wright\nat Oswichee Ala, states that Monday last he packed\nupon one screw with twelve hands, siKysx bales Of\ncotton, and finished before night', '1000 Sacks Heavy Country Bran in Store and for\nsale at 75 cents per 100 lbs by\n\n\ndec. II COOK & LANGLEY.']","In Oyster Creek, Texas, they raised a remarkable sweet potato that weighed a whopping 90 pounds! Can you believe that? I reckon that’s quite the sight to see. The folks around here talk about how fertile our lands can be, but a sweet potato of that size really puts things into perspective. It seems to me that the climate and soil there are perfect for growing all sorts of crops. I hear tales of bountiful harvests coming from that part of the country, and this sweet potato is a fine example of what can be accomplished with good land and proper care. It reminds me of the importance of agriculture to our communities and how it brings life to our tables.","A sweet potato that weighed 90 pounds was raised at Oyster Creek, Texas.",0.4444444444444444,0.0,0.9999999999,1.0
What can you tell me about the effectiveness of Cephalic Pills based on historical correspondence?,"['From the Examiner, Norfolk, IA.\n\n\nCephalic Pills accomplish the object for which\nthey were made, viz: Cure of headache in all its\nforms. ..f O. f-srfs +. a.s 81. mi', 'From the Adoertiser, ProUidence, r. 4.\nThe Cephalic Pills are said to be a remarkably\n\n\neffective remedy for the headache, and one of the\nvery best for that very frequent complaint which\nhas ever been discovered. r .-tI', 'BELLE VERNON, ONO, Jan. 10, 1861.\nHENRY c. SPALDING, Esq.\n\n\nPlease find inclosed twenty-five cents, for which\nsend me another box of your Cephalic Pills. Zhey\nare truly the best Pills Ihace erer tried.\nDirect - o. ~ A. SLOWER. p. NJ. 2\n\n\nBelle Vernon, Wyandot Co., o.', 'The writer opposes the CRIrrENDEN COM\npromise, on the ground that it guarantees\nslavery in all territory to be hereafter ac-\nquired. He thinks that Senator RioE\'s\nplan, as recently modified. promises most,\nbecause "" it puts an end to the whole SUBJ\nject Of slavery agitation, and removes it now\nand forever, from the halls Of Congress-\n1t has the approval, the correspondent un-\nderstapds, of SEWARD, SHERMAN, OoRwIN,\nADAMS, and others. es4s\n\n\nBut here is an extract, to which we invite\nparticular attention. For advancing the\nsame sentiments, the Press has glibly accused\nus Of sympathizing with ""traitors, rebels""\n&c. ,,.,.-...,..\n\n\nMen may talk as much as they please about\nnot cOnceding-n0t compromising backing\ndown. and all this sort of thing, but tell you\nthat the men who talk thus, do not understand\nthe facts in the case, nor realize the real danger\nwe are in. ! give it as my deliberate opinion,\nand settled conviction, that there scil be either\ncompromise or dissolution. / am well aware\nthat this will excite smile of derision on many\nfaces, and secure for me all sorts of denuncia-\nton, as s\'dough-face\' e\'\'-wanting shack bone""\nbeing ssweak in the knees"" &c; but this\ndoes not change the facts of the case, nor will it\ndivert the danger which threatens. My own\nopinion is, that we shall have q compromise.\nwith which the border States will be satlsfied.--\nthat then most of the seeding States will re-\nturn, leaving S0nth Carolina, and perhaps one\nor two others to fight it out alone. What the\nresult will then be, no one can doubt, they must\nyield. SOC 9asiiDs\n\n\nRepublicans of Minnesota, the alterna-\ntlves are here presented. Compromise, or\na dissolution of the Union, with the added\nhorrors Of civil war, is before you!\n\n\nOn the subject Of the subjugation Of the\nseeding States the Press correspondent\nstates -\n\n\nIn this review or statement of affairs, have\npurposely avoided the subject of armed coer-\ncion, because. while admitting fully the power\nand ability of the North to subjugate even the\nentire South, still we may not shut our eyes to\nthe fact that in the present state of affairs, any\nsuch attempt would inevitably result in q civil\nwar, such as the world never witnessed.\nA very prominent Minnesota merchant writes\nme that his business has fallen off one-half, in\nconsequence OF political dificulties-that the\nprices of grain are greatly reduced, and but\nvery few buyers at that. If the talk of dis\nsolution and war have produced this result al\nready, what will the reality bring2\nWho can estimate the destruction of life,\npeace, prosperity, personal and national wealth,\nthat would result from such war; And who\ncan tell where, when, and how it would end |?\nThese are questions which men ought to con-\nslider well before rushing headlong into war.', 'From. the Examiner, Norfolk, I0\nCephalis Pills accomplish the object for which\nthey were made, viz: Cure of headache in all its\nforms.', 'oa LIVER coxrIAfST, KilIIousSKSs, HK ADAcE, &c.\nThere never has been CATHARI1c medicine.\noffered the public, that has such entire al\niSfactiou a. nciean\'s Universal pills\n\n\nBeing entirely vegetable they pcrfe.tlv inno-\nand can be taken - the tender infant ~\nprompt and powerful la inc ala falieus Sscf.-\ntom, acid or impure fctd matter fron Che stonact\nla fact they the only pills thar should be tsel li\nmalarious Districts.\n\n\nThey produce no gripping. sickness IT pain in The\nstomach or boweis though very active and searching\nIN their operation, promoting healthy seCretoifs\nthe liver and Kidneys Nhe will suffer frols bilious\nness headache aud foul stomach whefs 20 cl,esn a\nremedy can be obtainecl Keep them constantly Ca\nhand single dose taken in season, may prevent\nhours days and months - sickness. A. Tor 1T. J\nII. McLean\'s Universal Pills Take no other Beine\ncoatcd they tasteiess. Price only IS cent fcf\nbox ant De sent ~ mail 60 any part VI the I =\n\n\nJ. II. MciEAN Sole lropFieiuf.\n\n\na Itlr.fa ""a a.. -', 'Sp,ucs Creek, Hs...nyto"" Co., Pa. Jan. 1861.\nII. G. Spalding,-Sir You will please send me\ntwo boxes of your CephaIic Pills. Send them\nimmediately.\n\n\nRespectfully yours. JNO. Is. SlMOES.\n?. 81 have used Vne box Of your Pills, and\nfind them excellent.', ""yryHERE has never been CATHARTIC medicine offered\n\n\npublic, that ha given such entirs stfscion As\nLEAN's UNIVERSAL PILLS.\n\n\nBeing entirely vegetable they perfectly innocent and\ninfant prompt and powerful in\nremoving all Bilious secons Acid Impure Ketsd Matter\nStomach In sct they the only Pills that should\nbe used Ia nalarious deItFiets.\nThey produce Grng Sickness Pain in the Stomach -\nthough active and searching in their operation,\npromoting healthy Of the Liver and Kidneys Whs\nwill BiIiousess, Headache and Foul Stonach when\ncheap remedy he obtainedl Keep them constantly on\nhand single Dose taken in prevent hours days.\nsickness Ask for Dr. j h McLeAns Unive\nsal Pis Take Being coated they tssteess Price\nonly box md be sent BY mail to part 81\nhe United States.\n\n\nJ. H. MCLEAN, Sole Proprietor,\n\n\nCorner Of Third and Pine streets, st. Louis, Mo.""]","Ah, welcome to town! You’ve come at an interesting time, indeed. I’ve been hearing quite a bit about Cephalic Pills, and folks around here are buzzing with opinions on their effectiveness. 

From what I gather, these Cephalic Pills are making quite a name for themselves, especially as a remedy for headaches. One fellow wrote in a letter that he has found them truly remarkable for curing headaches in all their forms. He seems quite taken with them, saying they are the best pills he’s ever tried. I reckon that’s high praise! 

Another correspondence I came across in the Republican has someone citing them as particularly effective for that common affliction. It appears there’s a growing number of people turning to these pills, as a few folks are even reordering them regularly, which speaks to their satisfaction with the results. 

Now, you know how opinion can vary from person to person, and while I have not had the occasion to try them myself, I hear similar sentiments echoed by others. One gentleman from Belle Vernon insists they’ve done wonders for him, which suggests there’s a good deal of confidence in their efficacy. 

All the talk makes me curious about how they actually work. They must contain some kind of properties that truly assist in alleviating those dreadful headaches. Given the nature of these pills, I suppose their appeal lies in their convenience—there’s nothing worse than a pounding head when you’ve got work to do or plans to attend to.

Anyway, if you ever suffer from such a complaint, it might be worth trying those Cephalic Pills. It’s always good to have remedies on hand that one can rely upon. Just be sure to listen to others’ experiences before trying anything new, as one’s constitution can react differently, you know.","In a letter dated January 10, 1861, a customer named A. Slower from Belle Vernon expresses satisfaction with Cephalic Pills, stating they are 'truly the best Pills I have ever tried' and requests another box, indicating their effectiveness.",0.5384615384615384,0.0,0.9093537414836079,1.0
What is the Arctic Liniment for man?,"['if they were not there at all. TIE only defense\n\n\nthey had against unjust legislation on the part\n\n\nOf the northern majority, was the Constitution.\n\n\nThat would have been a real defense il it bad\n\n\nbeen faithfully adhered to. But so long as\n\n\nthere is a ""higher law"" (not the Bible, but\n\n\nmems private judgment or opinisn,) 10 which\n\n\nall other laws are subject, what are constitu-\n\n\ntions good for? It was because the cotton\n\n\nStates believed they had no protection in the\n\n\nConstitution or otherwise, against urconsli-\n\n\ntutionsl and oppressive legislation by Congress\n\n\nand individual States, that they determined to\n\n\nprotect themselves.\n\n\nID or course the incoming administration\n\n\nhas not despoiled the South Of one Of their\n\n\nrights as yet, for it is not yet n power. What\n\n\nil iciH do, we will know when the time comes.\n\n\nWe hope for the best; but under the pressure\n\n\nwhich will be sure to come to the a2ministrs-\ntion from northern ultraists we dare not be\n\n\nconfident. That wing Of the Republican party\n\n\nis very powerful, though we hope it is gradual\nly losing ground.\n\n\nlk.) What chance is there for fhat, so long\nAl you exclude the South from the Territories\nThat Shareholders have as good right there as\nnon slaveholders, and as good a right TO take\ntheir families with them as non-slaveholders\nhave to take theirs, is plain to anybody who is\nwilling to see and besides, It has been de-\nclsred 10 be SO By the Supreme Court Of the\nUnited States. II you ""foree the negro\' out\nwhen the Constitution lets him in, you violate\nthe Constitution, and trample on the rights Of\nthe South. We are sure the North would\nnever consent to be excluded from the common\nterritories; neither viii the South.', ""b r a q G9S\n\n\nARCTIC LINIMENT\n\n\nFEW FACTS IN A FEW WORDS.\nThere is q great demand for a remedy adapted to\nAll forns of External Diseases.\nExternal Diseases of Man Horse\nTHE REMEDY HAS BEEN DISCOVERED.\nTHE MARKET\n1t has been before the public several years.\n\n\nIts success has been great\nIT III LrNNENr,\nIr Is THE ARCTIC LNIMENr,\nTBRAGG'S ARCTIC LINIMENTg9Ak,\nThe most estimable physicians have testified to ts\nefficacy. Thousands OF voices are\nresounding its praise.\n1t cures radically and permanently"", ""The Star Spangled Banner -.\n\n\nBy FRANCIS s. KEY.\nOh say can you by the dawn s early light.\nWhat SO proudly We hail. ID at the triIight's last\nWhose broad stripes aud bright STARS through The\n\n\nperilOus fight,\n\n\nO'er the ramparts We watched, were 50 gallsntly\nAnd the rockets red glare, the bombs bursting in\nGave proof through the night that orr flag was\n\n\nstill there.\n\n\nOh say, does the star srangled banner still\nGer the land of the free and the home Of the\n\n\nbrave?\nOn the shore. dimly through tie mist Of the\n\n\ndeep, ..a.r\nWhere the foes naughty host in dread silence\n\n\nreposes,\nWhat is that. which the breeze o'sr the towering\nAs it ifuliy blows half conceaIs, half discloses\nNow it catches the glesnl of the mornings FIRST\nIa full glory reflected now shines on the stream\n'r is the star spangled banner. oh long may\nOer the land of the free, and the home of the\n\n\nbravel\nAnd where is the band who tiugIy swote\nThat the havoc OF war, and the battles con-\nhome and a country should leave lis no more?\nTheir blood has wash'd out their foul footstsp's\nq\nNo refuge could save the hireliDg and slave,\nFrom the terror of fight the gloom of the grave\nAnd the star spangled banner in triHmph doth\n\n\nwave,\nO'er the land Of the free ana the home Of the\n\n\nbraYet\n\n\nOh thus be it when freemen shall stand\nBetween their lOv'd home and wars desoIation;\nBless d with victory and peace, may tho Heaven\n\n\nrescu'd land\nPraise the power that hath made and preserv'd\n\n\na\nThen conquer we must, when cause 1t is just\nAnd this be motto-'' In God is our trust y\nAnd the star spangled banner in triumph shall\n\n\nwave,\nO'0r the land of the freo and the homs OF the\n\n\nbraVei"", 'DIR j. b. mcLE.AN\'S VOL CANAC OIL LINZ\n\n\nmENTs .-..\nThe best External in the World for Man or\nBeast.\n\n\nyUNHOUsANDS II human beings hRvebeen saved life Of de-\n\n\ncrepttnde tnery hy the Of this invxuabh Lint\nent. 1t win elieVs PAIN Almost nssntaneeusy, and il\n"" cleanse heal the fouest SORE In incredible\nshort time McLEANS VOLCANIC OIL LINIAENT will re-\nsys the nveterle Of RheumAsm oout or het\nrssia For Paralysis Muscles Stiffness Weak\nneI joints, Muscl Lgamsnts, II viii never fa\nTwo applications will cure Sore Throat Headache or Easens\nTry t. and you find indi Pensibe remedy. Ksep\nalways hand. :.\nPLANTERs FARMERS, any having charge Of horses\nmoney by using McLeans VolcsPis OH Linmsnt.\nis speedy and infaDle for Calls, sprains, Chs,\nSwelling LAmenes weeny Sores, Wounds Scratches or any\nexternal disease. Try 1t, and you will be convinesd\n\n\nDr. j. Il. McLkAN, Sole Proprietor,\n\n\nSAint Louis. Mos\nFor sale Propretns prices BY Berry Denovilis aud g.\nW, Hendershott mar-od.tw&wy', 'The Curse which Returned TO the Givel\nAn old man sat in room in one Of the up\ntown palaces, surrounded by every t.ken o\nluxury-lnagnifcsnt furniture, splendid paint.\nings on the walls, everything showed it TO be\nthe home Of wealth. An.l that old man, moan\ning with pain, peevish and lreltui, wa; mas\nter CT aI--yes of millions was Jasper i!arraI\nracot, The master. When he called for help\nt. move his easy chair, or for wine 10 rli cngth\nen- the feeble lamp of life, livcricd servants\nhurried 20 obey his call.\n\n\n1t WAS stormy night without. Snow and\nsert were driven through the air hya howl\nin5 north east gale but the cu.ls h!az""rl\nbrightly within the rich mans walls. and his\nSeek, we\'ll clad servants were comfortable\nand content.\n\n\nYes, more SO than tlieir master: for he\nwith all his wealth and power, WAS sufferer,\nboth in mind and bod y. This could b.: seen\nby many an evidence, fer his groaus and\ncurses had no cud\n\n\n4 servant entered and brought him card\n$ Doctor kilnbcrly!\' he multc:r\'i. as he\nglanced ut the card. Decor Kimberly\nWhat does !c NAN! here? He is not my doc\ntor--SIotls is my doctor. What docs this\nKimbersv want le:e -\n\n\nIl lie wishes to see you on business, he\nSAYS, sir, replied the servant.\n\n\ng Business business. curse business =\nI\'ve retired from it, But show him in-show\nhim in: and l\'rn be ready TO shove him ont\nagain - and the tone Of tho old man was Il,\ncurt as his words.\n\n\nThe servant bowed and left the room.-In\n:. few moments he rrturnnh n.h\'ri""r"" nluiu.', 'on BEAsT.\n\n\nThousands 81 human beings have beer saved lifc\nq deCrcittude and miss-s, BY The ~ this tal-\nnahie Eminent. II will relieve PAIN almost instan-\ntaneousiy. and IL viii cleanse. purify ard heal the\nfonirs SORE IN an incredibly short time. EclLANsS\nVOLCANIC OIL IININENT viii relieve. e most in\nNeferate cases q Rheumatism, 1out, ~ Heuralgi1-\nin the Joints MusClcs GO LgAmcnls II viii ncv-\ner fail. Two appllcatans viii cure sore Throat\nHeadache or Earachc. for Burns or Scalds, ~ az,\nPain. u II an inialiihlc REMEDY Try a. aRd you M\nfind d indispensable remedy. Keep Il slSays ""a\nhzI.i\n\n\nPLANTERS, FARMERS or eny one having eharr,\nOF horses viii save money by using Mclean N,l-\ncanc Oi l3ninens. II h specify and iufsillie\ncure for Gale Sprains Chafes, SWelhngs lslcnsss\nSweeney. Sores, Wounds, scraiches. any exiesrl\ndiseases Try h, and Yea will be conVir,crt\n\n\nDr. q. NJ. Mclean, sole Proprietor.\n\n\nja9iwiy Saint la. Ma', '7xPt1T\n\n\n~ $50, 900 Of the Confederate loan has\nbeen tsksn here. The average quota or the\nState 10 oct down 1t 81 Csc, 600.\n\n\nA reqoisitioD Of men rs made on Eouth\nGsF0ftBS, but Tor What service il unknown.\n\n\nThe news Of the secession OF Virginia wss\nreceived here with JOY. The old secession\ngum was fired in trout Of the Courier once,\nBY the venerable Edmund Rom.', 'Tit. oil, CANT compound w!cha- secured ;hs confidence\nand endorsement omos u(Ie leading PHYSICIANS vi New\nEngland, Is pastSt an: Sie.t BTn al .u.ulIr,\ntauuc all the peculiar virtue. q! Peruvian Bark careful\nb combined w!th various Tonnes and Svl.a, cs and can.\nNot la! 10 meet the wants II tile lcli.iistri.\n|, Is mild Tonic the stomach. Increasing the lupe\nlite. assisting digest IN. pr-,tuenty good IA Dyspepsia\nstrenc hernS an V!E\'rtil, L. The scSti.. ans;\nSTEMS after ru>!ats diseases: and III fever and\naGuc kindred Comp aint-. lis aid IS INV alUahc.\nFor diarTra N-rnirry ami cholera Iurhu- the pablo\nrest assured IIcTo i be Any better general\nremedy.\n\n\nOne ofths very best ply icians Boston has said that\nII the best preparation VI Bters ever offered To the\npublic""\n\n\nPutup in half pint well quart bottles In order that\nall NAV convince themselves OF lis superior merits\nFor further particulars reference +. Ina 10 the print,\ncirculars. FOR SALEBY\n\n\nCHAS. II. ATWOOD.\n\n\n10 CENTRAL. ST. BOSTON.\n\n\nAnd by Druycistseverywh', 'AN IMPORTANT DISCOVERY i!\n\n\nFor the cure of\nBRONCHITIS, COUGHS\n\n\nAND COLDS.', ""In all sudden attacks of disease either Cholera Vel\nlow Fever, Influenza, Grippe Small Pox, Scarlet Fever\nRailways Ready Relief, will, If administered di-\nrections check the progress of the pestence\nthe life of the patient.\n\n\nRADwAY's READY RELIEF is article Of the first\ncessity now. Rheumatism Chills and Fever, Neural\ngia Sore Throas, Toothache, Influenza, &C., the\nconcomitants of summer. Repel them promptly with\nthe REIIRF IL is a supreme antdote &c all malarious\ndiseases breaking up and intermittent\nin their first paroxysrns, stopping the insupportabe\ntorture Of rheumatism and neuralgia in from enc to\nfour hours md giving ease, sleep, and life almost to\nthe exhausted sufferer Applied 70 external hurts\nremoves pain andinfammaton, and prevents lockjaw.\nTo be without it is be without protection against\nsudden disease aud the danger arising from personal\ninjuries."", 'This great Neura,s Rem ,dy aud Natural OptAis Gals\npreparations VI Opium. "" any 1ut liz strictly vexsts-\nbic and medical ieEss fUr Neuralgia Rheumatism\ntiOut Tooth and Ear Acne Spinal Complaints. BeedlhS\n~ Ilngs Stomach ko.e or bay Fever, CsaIrh and\nali mnJr Nervous Complaints.\n\n\nFor lyss VI Sic. Chronic Nervous Headache, Sick\nHeadache II has equal aud 10 Hhch otter isssulo\n,lia!- from uuiuuttrd sources\n\n\nFor Dclirium YTsaleIs II i\'d q sure remedy.\nFor Bowel Complaints, Including Cholera iVrbus 10\nspirdiy adapted, III aIy rsmON Ing tie pains hsi\nacting ii ole, great Contrast with Opium wiSL mol\nOIL; Cystpiies and drugs the system but make tls\nremedy worse thin tas disease.\n\n\nFrom Physicians ask attc;Vn. and % ulADd r ""\nmuaS Trial Botle- vii! ne se.t. Developing III tie Al\nodyue an Ui.ate which nas long been wanted and Ia tle\nCough Remedy such rest entirely central pTnc\npie.\n\n\nFrom inva,iss ask Coresponieles for Pamphlets OF\nexplanation, without \'postls. stamps\n\n\nPrices-LsrSe CoGgh Rsuicdy, % cents pE bottle\n\n\nSmall\n\n\nTvlu Anudyne, ~\n\n\nJORN l.. HUSNEW VEIL, Proprietor,\n\n\nCAe:lirsi AID PLarInaS.ui.st,\n\n\nNo. 9 Commercial Wharf. Boston, Mass.\nFor sas BY all usual Wholesale and FETAL dealers IN\nevery town and city\n\n\nJ. Bingham IIoyt Greer ST. Juhustury Vail, Sr.-\nnerd Co, puuviIle s 5. Could. West CcucvrI; u II.\nJ. ii. eeks, Lyndon; II A Quimty, Lyndon CeHter: H.\nStanton No DauS lie, Putnam SpraSle CABOT; Hum\nphrey Smith, ka.t Burke; French Son, LunsnturS\nagents. l2tl-;2\nFRED E SMITH. Montpelier Wholesale AGENT']","Well, I’ve been hearing quite a bit about this Arctic Liniment that's been making its rounds. Folks around here swear by it for all kinds of external ailments. I reckon it’s a remedy suited for various external diseases, both for us humans and our horses too—a real versatile oil, if you will.

They say it's been available for several years, and its efficacy has been praised by many estimable physicians. It seems to work wonders, relieving pain quite quickly and healing sores in an incredible short time. I’ve heard stories of how it can tackle issues like rheumatism, arthritis, and even sprains. It’s remarkable how many voices are raised in its favor, claiming it has radically cured maladies that have troubled them for ages.

You can find it marketed under the name Bragg's Arctic Liniment, and there’s a good chance it might be available in stores or from the local hawker. I keep hearing that with a few applications, it can get you back on your feet pretty fast—depends on what ailment you’re facing, of course.

If you happen to see it around, I’d say it’s worth a try. Just about everyone is looking for something reliable these days, especially with the strains of the time weighing us down.","The Arctic Liniment is a remedy adapted to all forms of external diseases in man. It has been on the market for several years and has achieved great success, with many physicians testifying to its efficacy and thousands praising its ability to cure radically and permanently.",0.3888888888888889,0.0,0.4999999999875,1.0
What is the focus of George M. Weston's work on slavery in the United States?,"['Progress of Slavery in the United States.\n\n\nBY GEORGE M. WESTON.\nCOPIES of this work are for sale at the pub\n~ lication Office of the National Republican, on\nSeventh street.\n\n\nBound edition, ST. per copy. Pamphlet edi.\nton, 25 cents per copy. apr 9-tf', 'The writer opposes the CRIrrENDEN COM\npromise, on the ground that it guarantees\nslavery in all territory to be hereafter ac-\nquired. He thinks that Senator RioE\'s\nplan, as recently modified. promises most,\nbecause "" it puts an end to the whole SUBJ\nject Of slavery agitation, and removes it now\nand forever, from the halls Of Congress-\n1t has the approval, the correspondent un-\nderstapds, of SEWARD, SHERMAN, OoRwIN,\nADAMS, and others. es4s\n\n\nBut here is an extract, to which we invite\nparticular attention. For advancing the\nsame sentiments, the Press has glibly accused\nus Of sympathizing with ""traitors, rebels""\n&c. ,,.,.-...,..\n\n\nMen may talk as much as they please about\nnot cOnceding-n0t compromising backing\ndown. and all this sort of thing, but tell you\nthat the men who talk thus, do not understand\nthe facts in the case, nor realize the real danger\nwe are in. ! give it as my deliberate opinion,\nand settled conviction, that there scil be either\ncompromise or dissolution. / am well aware\nthat this will excite smile of derision on many\nfaces, and secure for me all sorts of denuncia-\nton, as s\'dough-face\' e\'\'-wanting shack bone""\nbeing ssweak in the knees"" &c; but this\ndoes not change the facts of the case, nor will it\ndivert the danger which threatens. My own\nopinion is, that we shall have q compromise.\nwith which the border States will be satlsfied.--\nthat then most of the seeding States will re-\nturn, leaving S0nth Carolina, and perhaps one\nor two others to fight it out alone. What the\nresult will then be, no one can doubt, they must\nyield. SOC 9asiiDs\n\n\nRepublicans of Minnesota, the alterna-\ntlves are here presented. Compromise, or\na dissolution of the Union, with the added\nhorrors Of civil war, is before you!\n\n\nOn the subject Of the subjugation Of the\nseeding States the Press correspondent\nstates -\n\n\nIn this review or statement of affairs, have\npurposely avoided the subject of armed coer-\ncion, because. while admitting fully the power\nand ability of the North to subjugate even the\nentire South, still we may not shut our eyes to\nthe fact that in the present state of affairs, any\nsuch attempt would inevitably result in q civil\nwar, such as the world never witnessed.\nA very prominent Minnesota merchant writes\nme that his business has fallen off one-half, in\nconsequence OF political dificulties-that the\nprices of grain are greatly reduced, and but\nvery few buyers at that. If the talk of dis\nsolution and war have produced this result al\nready, what will the reality bring2\nWho can estimate the destruction of life,\npeace, prosperity, personal and national wealth,\nthat would result from such war; And who\ncan tell where, when, and how it would end |?\nThese are questions which men ought to con-\nslider well before rushing headlong into war.', ""IMPORTANT FROM WASHINGTON\nWASHINGTON, Jan. 9.\n\n\nThe Committee on the part Of the border States,\nMr. Crittenden, Chairman, held second meeting\nlast night at y o'clock and adopted the following\npropositions;\n\n\n/ Recommending repeal Of all personal lib\nerty bills.\n\n\ng That the Fugitive Slave law be amended for\nthe preventing Of kidnapping, and so as TO pro\nvide for the equalization OF the commissioners\nfees, &c\n\n\n8. That the Constitution be so amended as to\nprohibit any interference with slavery IN any OF\nthe States where it now exists.\n= 6 sIhat Congress shall not abolish slavery in\nthe Southern dOokyards, arsenals, sc, now in the\nDistrict Of Columbia without the consent Of\nMaryland and the consent Of the Inhabitants Of\nthe district nor without compensation.\n\n\n5. That Congress shall not Interfere with the\ninter State slave trade.\n\n\ng. That there shall be perpetual prohibition\nof the African Slave trade.\n\n\nl. That the line of 80 degrees shall be run\nthroughgan the existing territory of the United\nStates\n\n\n8 That in all north of the line slavery shall be\nprohibited. and that south of that line neither\nCongress nor the Territorial Legislature shall\nhereafter pass any law abolishing, prohibiting,\nnor in any manner interfering with African\nslavery and that when any Territory containing\nA sufficient population for one member of Con\ngress in one of 90 coo square miles shall apply for\nadmission as a State It shall be admitted with or\nwithout slavery, as its constitution may deter\n\n\nThe Committee represented at its meeting\nMARYLAND Virginia. Missouri, North Carolina,\nTexas Kentucky Ohio. Indiana, Illinois, Della -\nware, Arkansas, Pennsylvania and New Jersey."", 'DROGREss OF SLAVERY\nIN IHk UNITED STATES\nBY GEORGE N. WESTON.\n\n\nCopies Of this work for sale at the publcatiou\nonce Of the National Reputioan, corner Of Seventh\n\n\nBound edi,iOn, u par copy. Pamphlet edition, 2.\ncents Per COPY. sprv-tf', 'took issue with the Republicans, that when\nthe rebellion was exhausted and the old sys.\ntenn of things restored, and the Democrats of\nthe North would lay down the rifle and the\nsword and extend the right hand of friendship\nto the South, if the Abolition cry should 20\nup from the Republican party that slavery\nwas the cause of all the trouble and that the\nwar Should not cud until slavery was extin-\nguished, then Che same Democrats would\nturn their bayonets in d.tepse of the South.\nlApplauso]', 'Mr. ]. G. B Frey. numb d years\n2 go, published an account Of a sconversa-\nton with Gen Scott, from Which we take\nthe following: E 8\nale told me a pleasant anecdote c.\nbout the emancipation Of large number\nof slaves in Virginia, of Which State, you\nknow, he is a native. The substance\nOf the. story was as follows: When the\nGeneral was lad, there was still living\nan Old Indian weman, named Hannah,\nrepuied to be slave. She was almost\na ccntenarian. She had been unusually\nprolific, and her decendants. now num-\nbered by the hundred, were all held as\nslaves. More than thirty OF them were\nheld by Mr.. Scott, brother of the Gener-\nal How they came into his possession\nwas no. mentioned.\n\n\n..Is began to be whispered round in\nthe neighborhood tha: Hannah\'s pcsteri-\n4y could notbe held in bondage, accor-\nding to t se laws Of Virginia, because she\nwas a free Indian VIC man, who had sta-\nken up with slave, as the phrase is,\nand lived with him as Lis wife. periorms\ning servile work on the plantation for per-\ntmissitn to remain there. The, slaves\nconcerned instituted suit for their free\ndom, and the necessary council was pro-\ncured. The chief management devolved\nupon Frank, an active, intelligent and\nfaithful servant-one of the number held\nby Mr.. Scott. Winfield Scott, now Gen\neral, became warmly interested for Frank\nand his co-plaintiffs. He made meme\nranda for him on paper, filed up bis biaIk\nspbpenas, and did all that young un-\nprofessional scribe could do 10 assist him\nin preparing the case for hearing. 1t\nwas difficult matter TO secure the atten-\ndance of witnesses, many of them being\nold, and scattered about the country\n\n\nOn this account, the cause was contihu-\ned through several terms. A short tine\nbefore the Court was to be held, Frank\n\n\nwould 60 to bis master, and conyersa-\n\n\nton of this kind would take place:\nr\'Master, come to ask leave to go\n\n\nand serve my. subponas.\'\n\n\nCertainly Frank; you can 60 if you\n\n\nthink i, is time. With SO much at stake\n\n\nfor yourself and others, you ought to be\n\n\ndilligent to secure the attendance Of frenr\n\n\nWitnesses\n\n\nIl may stand in need of little mon\ney, sir. to pay ferriages and other ex<\npenses.\'\'\n\n\nVery true, Frank. Here are FIVE doll\n\n\nlars for you. But how are you going?""\n\n\n""a foot, SIR\n\n\ny gu had better take horse, Frank;\nyou will be able to get through your bus\n: iness and come back sooner. Take Rog>\ner; and as lie must be fed, too, here Is\n:, as much more money to pay the char\nq ges.\'\n\n\n9TH ankee, master""\n\n\ncold Hannah was finally proved nev-\n: er to have been legally slave; and, as\n\n\npartus sequitur veMrena, all her offspring\n= were declared free. Frank came hcme\n: from the scene of triumph ..and exclaimed,', 'OFFICE OF \'. T., uREIGN BUREAU, I\n\n\nNe@ 1\'orh, Jlme Sd, 1861.\n\n\nMy BHIrIsn BEAsr:-You will pardon, my\nLion, the intolmality of this address, when\nyou call to your royal mind the fact that YOU\nare pretty well known in this world-that\nknow something, too, of ireland and her iol-\n"" chronicles--that | have heard of India\nand her happy history; of Manchester and\nof the fat little girls laughing in its factories ;\nof the cherubs in your coal mines, and of the\ndarling children who pick pockets with such\ncharming industry in London streets.\n\n\nHumanity i\'ll general, my Beast has reason\nto honor you. Black Humanity in particular\nhas cause to call you blessed; and even Y ell\nlow Humanity, of the Coolie variety, loves\nyou dearly. Ever since | can remember YOU\nhave been braying-I beg your pardon\nroaring in behalf of Black Humanity. Yon\nroared about the slave trade and abolished\nit-takiug good care, however to make your\nneighbors share the damage. You roared\nabout West India negroes, and emancipated\nthem with much self complacency, when\nyour Methodists and other good men forced\nyou to do it, You bought (pirated) innu-\nmerable copies of Uncle Toms Cabin, and\nafter reading the same with many tears, YOU\ngave no end of breakfasts to the talented au-\nbllbl\' uNtty run CduuOb Oub ItllellD Dcr\nhow long, how continuously and how cru\nely you have ioked and jeered, and iibed,\nabout and at American savery-how YOU\nhave sent over to us missionaries for our anti\nslavery Conventions, and merchandise for\nour anti-slavery Fairs-how you have taken\nto your bosom the wayfaring Garrison and\nthe fugitive Fred. Douglas. There were\nthose who were unchariteble enough to say,\nthat you had better, for consstency\'s sake,\ngive up either your cant or our cotton; but\nyou went on, my Beast, spouting and spin\nming wailing and wearing, importing and\neXhorting, bepraising Boston and chsfferng\nwith Charleston; and out of this game of\ncross-purposes, out of these threads of be-\nnevolence running tins way, ana these threads\nof business running that, yo1 have woven\nmuch white cloth, and you have amasscd\nmuch yellow cash. Now, when cur dark\nday has come-now, when through hatred\nupon one side, and love upon the other, of\nthis same slavery which YOU profess simply\nto hate, we are in little trouble, we find\nthat with the voice of a Saint you have had\nonly the voice Of Manchester spinner; and\nthat while you nave been talking about our\nashes you meant only your looms.', 'WELDES, n. C., Jan. 9.\nA dreadful murder has just been discovered. 4\nman of wealth and standing has been murdered\nby his slaves. The name OF the gentleman is\nLucius Woodruff Of Northampton Co, n. &. lie\nwas killed in q barbarous manner by inches ac-\ncOmpanied by the most horrible fortunes. The\nnegroes have been arrested. There is rumOr\nthat abolitiOnists are at the bottom of this dia.\nbOlical crime', 'The Shoe and Leather reporter says:\nhe amount of shipments Of boots and\nshoes from Boston for 1860, was in the\naggregate, 631,341 cases.\n\n\nShipped North 1888 g\n\n\nSouth 318,808 ""\n\n\nOF course the laboring men Of Mass\nlose the manufacture, because the shoe\ndealers lose the sale Of those heretofore\nsent South; but then the benefits be-\nslowed upon the negro by the fanatical\nand senseless crusade eff Mass. upon the\ninstitutions Of the South is abundant\ncompensation for this triAing loss.\n""Nrbodv is suffering""\n\n\nThe debts of the seven confederate\nStates sum up in the aggregate SIS,\n100000 while the existing debts of the\nother oe the late U. s. make grand\ntotal of 174,O0O,00O. Add to this the\nheavy city and corporate debts OF the\nNorth of various kinds. and it will not\nfall short of $500,0OO.000.', 'To he Editors of he 5oaraul of Commerce:\n\n\nBeing subscriber 70 your ""comnerclal.\nthee., snd having an opinion OF my own poiit-\nically, claim the right (which grant 10 All\nother meD) to speak them ont. (a) A puitv\nOf opinion cannot be expected. believe and\nDO bold that the prefsnt and the past Admins\n\n\ntrstions lb( we\'re corrupt; that the great in\nterssts Of TIE country were entirely overlookea\n(c); and deemed It Tor the welfare Of he lsnJ\nthat a complete change should take place snd\nihe men who controlled ghe Affairs Of the peo-\npie should, Tor while at least, stand aside\nBY the election Of Lincoln. Il seems that\nwas not alone In that way Of thinking. and\nthank God that change was then decided h\nbe necessary, and that it was legally accom-\npushed - And since that election took\nplace. Circumstances have transpired that hsva\nconfirmed that opinion. Now, I would AL i\nthe election Of Lincoln esuse 70 disrupt ire\nGovernment ls) Can you justify a class Of\nmen in the course they are pursuing /? (f0\n\n\nvas Florida bought FOR Florida alone. or\nwas It bought in part that the United States\ncould control the coast and navigation Of he\ngulf 50 that the producs coming down the\ngreat Mississippi river could End safer outlet\nto the markets Of the worieP Was Louisiana\nbought for Louisiana alone, OF bad the buvs-s\nknowledge Of It\'s Importance, so that the river\nshould be free to all travellers coming or going\n70 the great North or West (g)? And now,\nshall the men who occupy these lands. and\nwho are equally benefited By the Union, and\nwho have much greater voice in the councils\noI TIE nation say to the men livins North,\nWest and East, you rights, bought in part with\nyour money and your blood, shall cease; we\nwill put out the coast lights; we will demand\ntribute for ali passers up and down this father\nq rivers and do YOU justify such men ""a?\nAre these people wronged when living under\nThe laws created by the votes Of her and their\nmembers 10 Congress assembled 10? Wherein\nhas the incoming Administration despoied\nthem Of one Of their Just rights, or wherein do\nthey propose to dsspoil them Of iot or title Of\ntheir proportion OF this great republic?\n\n\nYou forcs the negro il, while The Repub-\nheans are forcing him out, and say to our\nsouthern brothers, that Institution is yours\nWe VII protect you in il 50 long as you claim\nIl as your own. We claim that under il, white\ncivilization does not progress, white labor is\nInjured; and we prefer shat class Of labor to\nserFile negro labor. But IL a State, in her\nlegal assembly, decide for that kind Of labor\nwithin her dominion, % we have nought to\nobject, but bold oct the right hand Of fellow\nship, and say Brokers\', We think you err, but\nyou are our brothers STILL AlRKPUBLrcAN.']","Ah, you're asking about George M. Weston’s work on slavery? Well, I reckon you're referring to ""Progress of Slavery in the United States."" I’ve seen it advertised in the local papers, particularly the National Republican. Weston seems to aim to shed light on the current state of slavery in our nation, trying to convey what has transpired and the effects it has on our society.

From what I gather, he believes it's essential for folks to grasp the ongoing developments regarding slavery. The question of whether it will expand or contract is at the heart of many discussions these days. His work addresses the complexities and implications of slavery’s growth and the political climate surrounding it. It's clear he wants to make us aware of the ramifications of slavery, particularly as tensions rise between the Northern and Southern states.

Moreover, there seems to be a growing sentiment across the land regarding compromise and the future of our Union. Many are worried that if we cannot find a middle ground, it may lead to nothing but chaos, civil strife, and significant suffering. Weston’s work reflects that anxiety, aiming to inform and provoke thought among readers, as I believe it is crucial to navigate these perilous times together.

You know, many men and women are understandably concerned about how slavery affects not just personal lives but the entire fabric of our nation. I often hear folks arguing about this matter over dinner tables and in town meetings, suggesting that slavery's expansion poses risks to our Republic. So, I suppose Weston’s work attempts to encapsulate those very debates—to highlight, if you will, the urgency for resolution before we find ourselves consumed by conflict.",George M. Weston's work focuses on the progress of slavery in the United States.,1.0,0.0,0.7499999999625,1.0
What is near the City Hotel?,"['UkDEA FOK REPAIR Of SIZE AIN\n\n\nMay 18th IS6I.-And now it is hereby ordered\nand directed by the Common Council of the City of\nEvansville that the owners of all lots and parts of\nlots fronting on or adjoining the north side Of\nIngle street, between Seventh and Eighth streets,\nin said City cause the sidewalks in front of said\nlots be repaired within thirty days from the pub\nLEGATION of this order P. BURKE, Clerk\n\n\nCity Clerks Office, May 21st, 1861. Mayo', ""Nashville, Tennessee.\ngFyHIs Hotel is site ated street, the Nashville\n4 and Decatur Railroad depot, convenient also to ne\nSteamboat landing conducted BY W. NJ HAcknv,\nGiles county he will he best endeayoEs 70\nmake house home to the Traveller and the Bcardef\nprices suit the times Come and try it'll He viii\nhis meals connection with any of the %\nTrains leaving the city."", 'if they were not there at all. TIE only defense\n\n\nthey had against unjust legislation on the part\n\n\nOf the northern majority, was the Constitution.\n\n\nThat would have been a real defense il it bad\n\n\nbeen faithfully adhered to. But so long as\n\n\nthere is a ""higher law"" (not the Bible, but\n\n\nmems private judgment or opinisn,) 10 which\n\n\nall other laws are subject, what are constitu-\n\n\ntions good for? It was because the cotton\n\n\nStates believed they had no protection in the\n\n\nConstitution or otherwise, against urconsli-\n\n\ntutionsl and oppressive legislation by Congress\n\n\nand individual States, that they determined to\n\n\nprotect themselves.\n\n\nID or course the incoming administration\n\n\nhas not despoiled the South Of one Of their\n\n\nrights as yet, for it is not yet n power. What\n\n\nil iciH do, we will know when the time comes.\n\n\nWe hope for the best; but under the pressure\n\n\nwhich will be sure to come to the a2ministrs-\ntion from northern ultraists we dare not be\n\n\nconfident. That wing Of the Republican party\n\n\nis very powerful, though we hope it is gradual\nly losing ground.\n\n\nlk.) What chance is there for fhat, so long\nAl you exclude the South from the Territories\nThat Shareholders have as good right there as\nnon slaveholders, and as good a right TO take\ntheir families with them as non-slaveholders\nhave to take theirs, is plain to anybody who is\nwilling to see and besides, It has been de-\nclsred 10 be SO By the Supreme Court Of the\nUnited States. II you ""foree the negro\' out\nwhen the Constitution lets him in, you violate\nthe Constitution, and trample on the rights Of\nthe South. We are sure the North would\nnever consent to be excluded from the common\nterritories; neither viii the South.', 'At Chicago, we went to the Garden\nCity House, and from the many familiar\nnames on therogister, we should judge\nthat it was becoming a popular st. Croix\nValley rendezvous. The House is one of\nthose quiet substantial places, which suit\nsour sort of folks""\n\n\nOne morning we climbed the few T Z\nstairs leading to the observatory on the\ntop of the Court House, and enjoyed\nview well worth the labor ofclimbing to\nthat dizzy heighth. The view from this\npoint is the only good one we have ever\nbeen able to get of Chicago, with its nine\nmiles of Wharfage distributed through\nthe very heart of the city; its railways\nbranching out in every direction; its\nmammoth mercantile and manufacturing\nestablishments; its princely residences,\nsplendid churches, and mighty whole\nOne other morning,we strolled out Mich\nigan and Wabash avenues, to where the\ndescendants of Dives live, and the fanes\nwhere they worship. These streets bear\nthe same relation to Chi cago that Eucli\nstreet does to Cleveland, and Delaware\nstreet to Buffalo. In these grounds and\narchitectural piles, a good practical echo\nis given to that maxim OF, Goethe\'s 1--WE\nshould strive to encourage the beautiful,\nfor the useful will encourage ITSELF"" In\nsuch strolls, amateurs may take many a\nvalual lie note on flowers, park and land\nscape gardening, and architecture.', ""The Star Spangled Banner -.\n\n\nBy FRANCIS s. KEY.\nOh say can you by the dawn s early light.\nWhat SO proudly We hail. ID at the triIight's last\nWhose broad stripes aud bright STARS through The\n\n\nperilOus fight,\n\n\nO'er the ramparts We watched, were 50 gallsntly\nAnd the rockets red glare, the bombs bursting in\nGave proof through the night that orr flag was\n\n\nstill there.\n\n\nOh say, does the star srangled banner still\nGer the land of the free and the home Of the\n\n\nbrave?\nOn the shore. dimly through tie mist Of the\n\n\ndeep, ..a.r\nWhere the foes naughty host in dread silence\n\n\nreposes,\nWhat is that. which the breeze o'sr the towering\nAs it ifuliy blows half conceaIs, half discloses\nNow it catches the glesnl of the mornings FIRST\nIa full glory reflected now shines on the stream\n'r is the star spangled banner. oh long may\nOer the land of the free, and the home of the\n\n\nbravel\nAnd where is the band who tiugIy swote\nThat the havoc OF war, and the battles con-\nhome and a country should leave lis no more?\nTheir blood has wash'd out their foul footstsp's\nq\nNo refuge could save the hireliDg and slave,\nFrom the terror of fight the gloom of the grave\nAnd the star spangled banner in triHmph doth\n\n\nwave,\nO'er the land Of the free ana the home Of the\n\n\nbraYet\n\n\nOh thus be it when freemen shall stand\nBetween their lOv'd home and wars desoIation;\nBless d with victory and peace, may tho Heaven\n\n\nrescu'd land\nPraise the power that hath made and preserv'd\n\n\na\nThen conquer we must, when cause 1t is just\nAnd this be motto-'' In God is our trust y\nAnd the star spangled banner in triumph shall\n\n\nwave,\nO'0r the land of the freo and the homs OF the\n\n\nbraVei"", 'YMLak DJt.Dk q 81 H6fsN-AtU III D\'lsa-f5\nN leased the property formerly known the\n"" BULLS HEAD"" situated between the Z. f G..\nRailroad depot and Main street, Evansville, has\nconverted the premises into a Hotel, 70 be known\nby tho above name, and the public may rest assured\nthat pains expense will be spared to render\nentire satisfaction 10 all who may become his\nguests. He has ia connection with the property %\nspacious STOCK YARD, and IS prepared TO\nceive and sell on Commission anything in that line\nwith which he may be favored.\n\n\nWOI. HOLBROOKS.\nEvansville, Inc. oct s. Ivw', 'Passengers taking the Nashville, Kentucky and\nhigeneid railroad Passenger Trsn leaving Nashville\nal ~ r NJ, viii connect al Mckenzie with PssseD\nger tram for Dresden, Union City and Hickman\n\n\n81 rms makes the shortest and ouly dirett rout-\n70 Union City via Nashville and Northwestern Rail\nroad al Mckenzie.\n\n\naugl6-u e CIFIYE RE4OIrSP Su,,', ""Notwithstanding the arrangements\nOf trade generally, caused by the un-\nsettled state of cur national affairs for\nsome months back, the city of Carroll\nton may boast of more improvements,\nwithin it's limits, than have taken place\nfor the same number of years previous\nto that time. The number of dwellings,\nerected within the last fom or five\nmonths is unprecedented in the history\nof Carrollton since it was corporation.\nThe buildings which have recently been\nerected, are generally of superior\nclass, in workmanship and material,\nTO those formerly spread over our\ndelightful grounds.\n\n\nIf there is any more desirable spot\nwithin the suburbs of the great metro\npolls of the South, possessing equal\nadvantages with Carrollton, in every\npoint of view, it has as yet failed to\nhave been discovered. AS healthy\nlocation, this City stands far above any\none of the cities or villages surround\ning New Orleans, of equal easy access\nfrom that point. BY the New Orleans\n& Carrollton Railroad, which connects\nwith the Jefferson & Lake Road, per-\nsons may reach their healthy resi-\ndences here in thirty minutes from the\ngreat mart of business, at almost any\nhour of the day. Why not locate in\nCarrolton, all ye who place full\nestimate upon the health of your\nfamilies !"", 'TlE subs riher respectfully announces TO the\nragsiie thar be has leased the above named Ho\ntel, in the old aud well known Globe buildi.g, for\naerly oaaed and occupied by Mr.. John Youoa,\naal recently in tee occupancy of Jonathan Horton,\ndecd, where he viii be happy to see his friends.\nAMI th,, travelling public generally Persons at\nfeading Court respectfully invited TO give him\n3 call He pledges himself that he viii do ali il\nMS power to ronder bis guests comfortable.\nlis Table viii &c supplied with the choicest del\nieaeies the market will afford,\n\n\nThe Bed Rooms viii contain clean and conf 7 =\nable bedding.\n\n\nThe Bar Elll be supplied with choice liquors\nThe Stable wilt be attended by careful ans at\ntentiye bostler.\n\n\nBaaraers taken by the day, week. monte and\nvesT\n\n\nJOSEPH ALsIP\nBeassgd, Nov. 2, 1880', 'OFFICE. COR. MAIN AND CESTRAL SIS. DIRECTLY\nOPPOSITE ST. !cuS>BURr HOUSE.\n\n\nUE.>e established i. lcIc.', 'IN THIS CITY\nTNHOSE who desire to select from new patterns,\nL with the advantage Of a reduction in prices,\nwill call early and examine.\nWe would also call the attention Of persons\nabout introducing gas into their dwellings to our\nincreased facilities, and consequent low prices,\nfor this branch of our trade.\nInviting all who desire their work done\npromptly, and free from gas leakages, to call at\n269 Pennsylvania avenue, between Tenth and\nEleventh streets, south side.\nnov 2e J.W THOMPSON l. 90.']","Ah, you’ve made it to our fair town! If you’re looking for the City Hotel, I can point you in the right direction. It’s located between the Z. f G. Railroad depot and Main Street, right around where the old Bulls Head used to be. The proprietor, Mr. Holbrooks, has renovated the place and promises a clean environment along with good hospitality.

If you have a moment to spare, there's a busy marketplace not far from the hotel where you can find all sorts of goods, from fresh produce to crafted wares. And if you fancy a stroll, the riverfront is just a short walk away—there's often a gathering of folks enjoying the day and perhaps a bit of music too.

We’re in bustling times right now with talk of the war and all, so it’s wise to hear the local news while you’re here. You may even find folks engaging in discussions about the current state of affairs. Do keep your ears open for news about the railroads; they say some new routes are being planned that could cut travel time significantly.

Don’t hesitate to ask if you need more directions or recommendations while you settle in!","The City Hotel is nearly opposite Dr. Bigelow's office, which is located at 40 North Sd, St. Louis, Mo.",0.45,0.9019170352042499,0.0,0.0
What role did Peruvian Bark play in treating conditions like jaundice and general debility according to historical medical practices?,"['Tit. oil, CANT compound w!cha- secured ;hs confidence\nand endorsement omos u(Ie leading PHYSICIANS vi New\nEngland, Is pastSt an: Sie.t BTn al .u.ulIr,\ntauuc all the peculiar virtue. q! Peruvian Bark careful\nb combined w!th various Tonnes and Svl.a, cs and can.\nNot la! 10 meet the wants II tile lcli.iistri.\n|, Is mild Tonic the stomach. Increasing the lupe\nlite. assisting digest IN. pr-,tuenty good IA Dyspepsia\nstrenc hernS an V!E\'rtil, L. The scSti.. ans;\nSTEMS after ru>!ats diseases: and III fever and\naGuc kindred Comp aint-. lis aid IS INV alUahc.\nFor diarTra N-rnirry ami cholera Iurhu- the pablo\nrest assured IIcTo i be Any better general\nremedy.\n\n\nOne ofths very best ply icians Boston has said that\nII the best preparation VI Bters ever offered To the\npublic""\n\n\nPutup in half pint well quart bottles In order that\nall NAV convince themselves OF lis superior merits\nFor further particulars reference +. Ina 10 the print,\ncirculars. FOR SALEBY\n\n\nCHAS. II. ATWOOD.\n\n\n10 CENTRAL. ST. BOSTON.\n\n\nAnd by Druycistseverywh', 'CoAT.-Short tunic of cadet grey cloth,\ndouble breasted, with two rows of buttons\nover the breast, the rows two inches apart\nat the waist, and widening toward the\nshoulder. Suitable for cavalry as well as\nfor infantry.\n\n\nPANTALooNs--Of sky blue cloth, made\nfull in the leg. and trimmed according to\ncorps-with blue for infantry, red for artil-\ncry, and yellow for cavalry. No other dis\n;inctiOn-\n\n\nFor the general and the officers of his\nstaff the dress will be of dark blue cloth,\ntrimmed with gold for the medical depart\n.nent. black cloth, with gold and velvet\ntrimming.\n\n\nAll badges of distinction are to be mark\ned upon the sleeves and collars. Badges OF\ndistinguished rank on the collar only. For\na brigadier- general, three large stars; for a\ncolonel two, for lieutenant colonel, one\nlarge star 4; for a major one small star and\na horizontal bar; for a captain, three small\nstars; for first lieutenant, two small stars\nfor a second lieutenant, one small star.\n\n\nBUTroNs.-For q general and staff officers\nthe buttons will be of bright gilt, convex,\nrounded at the edge raised eagle at the\ncentre, surrounded by thirteen stars. Ex-\n.erior diameter of large sized buttons. one\ninch of small size, one-half inch.\n\n\nFor officers Of the corps of engineers the\nsame button is to be used, except that in\n,he place of the eagle and stars there will\nDC raised \'\'E "" in German text\n\n\nFor officers of artillery, infantry, riaemen\nand cavalry. the buttons will be plain gill\nconvex, with large raised letter in the cen\nter-A for artillery, for infantry, etc\nThe exterior dismeter of large size button,\nseven-eights of sa inch small size, ont\nhalf inch.\n\n\nFor sill enlisted men OF artillery, large\nA raised ia the center Of a three-quarter\ninch button.\n\n\nFor all enlisted men, the same As for ar\ntiilery, except that the number of the reel\nment will be substituted for the letter A.', 'The celebrated New En- land remedy Tor Habual Con-\n\n\nstipaton. Jaundce, Fever end Ague, Genesal Debit\n\n\ny, and ALL diseases arising from disorered Solach\n\n\nLiver or Bowels.\n\n\nTley used and recommended by he leading Phys\nieans OF the Country and all who use them pronounce\nthem Invaluable.\n\n\nDr.. JAMES l.. LEEPERE writes from Navarro stark\nCo.. o.: The 5tcrs prai~ed by those Suffering ON\ninCIGestlCn dyspepsia and liver complaint.""\n\n\nT.. s. DAVIS, O3tm3stcr at Wlllamspoit, o., says:\n""Ihty give satisfaction. use them sell, having It\'ll\nken cold, become PROSTATE aud lost my appetite Ii\nlevtd me, and can recommend with great assurance\nof its merits -\n\n\nDir. WM. NJ KERR, of RogersvilIe, Ind wries US that\nthey the most valuable medicine offered. lie has\nrecommended ;hem with great ucctss and with them\nmade several curts Of papaton o. the heart and gen\neral debility.\n\n\nTHOMAS STANFORD, esq, Blountville, Henry Co g.\nInd writes long letter, under date Of May T. 1860,\nHe much reduced, having been afflicted for three\nyears with great nervous debility, palptaon OF the\nter using few bottles was completely restored, aud am\nnow in robust health\n\n\nq w. HOFFMAN says he was afflicted with rleum-\natism for twenty years in all its various forms and at\nthe date of this letter he has been two years WE\'LL the\nBers electjng cure, when several Physicians attend\ning him could Go him no good. lie sayS, Tor rheuma\ntsm, dy spepsia, liver compliant, kidney affection\ndropsv it is specific certain remedy.\n\n\nj. W. HUM writes from DelphO!, Allen Co Ohio\n""a section where Fever and Ague prevail that he most\nchec1uy recommends them ofdecded in al cases\nOf Fever and Aeue, Dyspepsia and General Debility\n\n\nd. k GALLEIEERS, N. ID. writes from Van Vert o.,\nII must respectfully recommend the .htry Wine BIT\ntiers to the notice Of ysp ptic persons aud oil who\nQure stimulating nlediGine\'\n\n\nSuch News we are receiving Daily.\nFULL DIRECTIONS ACCOMPANY EACH BOTTLE.\nSold by dealers in medicine generally. fjar ms', ""'ciiiDiy eH uiIdsSeu, lOi his' oia'O'\nwas socially as well as in ellectually hel\nsuperior.\n\n\nLet me send you some jelles for youl\n!scl, boy won't you J? continued the doc.\ntors wife, preparing to go. I'll call a,\ngain on Monday, said she, and slipping\ndollar into the hand of Mrs. Hall as\nshe turned to go.\n\n\nHere's more than my pay Mrs. Graves.\n\n\nNo matter--I will have plenty fol\nyon to do: don't stop to give ME change\nGood night y\n\n\nMrs. May sat silent and uneasily while\nthe stitching went on.\n\n\nWhy did you not tell me that some.\nbody was here 2 she asked almost GROSSLY\nWhy should p asked Mrs Hall,\ngently. Ladies are here quite often,\nyou know and Mrs. Graves is u trre lady.\nThe cheek of Mrs. May flushed.\n\n\nYour dress is finished, said the seam.\nStress folding it up.\n\n\n4 really did not intend to pay you to.\nnight said Mrs May, half angrily. 4\nam very punctual myself, and it annoys\nme when others are not. What is the\nbill %\n\n\n1T is two dollars and fifty cents re-\npiled Mrs Hall.\n\n\n'ExtravaganL prices, exclaimed Mrs.\nMay. You did not charge Mrs. Graves\nhalf that.\n\n\nHers was child's Dress she re-\npiled.\n\n\noh. there is always a fayoritism,' re-\nsponded Mrs. May Here shall have\nto owe you dollar now; you can send\nfor it in week\n\n\nShe too was gone and the weary wo-\nman bowed her head upon her clasped\nhands, and wept bitterly. a soft voice\nlike rich flute note came from the bed\nDon t cry mother.\n\n\nWhy, Jimmy are you awake ? asked\nthe mother.\n\n\nYes, heard that kind woman and\nthe ugly woman too. Don cry mother;\ncome here and | will kiss you. | love\nyou mother.\n\n\nGod bless you, sobbed the weary one\nas she touched the white forehead of the\nsick child with her burning lips.\n\n\nWho did you say it was for asked\nthe fashionable Mrs. Mcrrivale.\n\n\nMrs. Hall the drcssmaker She is\njust up from a severe fever, and not one\nto help her and her four children. /\nhave already collected over forty dollars.\n\n\nIs she member of our church que\nried the speaker, lounging gracefully.\n\n\nPm sure don't know whether she is\na church member at all, replied Jfrs\nGraves, aud her voice trembled as she\nspoke. / never asked her, for / seemed\nto feel that she was one of the Lord $\npoor. At any rate if she is not a chris\ntiau, We will show ner what Christians\ncan do.\n\n\nWe have so much to do for our own\nchurch poor ? said the lady in a little\nquerulous voice.\n\n\nl must have free offering, said Mrs\nGraves rising.\n\n\n'Oh, well, / will see-don go; yes,\nhere is fve-dollar gold piece in my\nport-monnaie. OF course have your\nword for it that she is decent and good\nwoman.\n\n\nII she were better off she would be\ncalled very refined, lady like woman,\nsaid lIrs. Graves Significantly."", ""DYSPEPSIA, INDIGESTION,\n\n\nwsaknsss or Debility, Flatulsncy and Nausea,\n\n\nplants, Bilious Fsvers and all Diseases\n\n\nOf the Stomach, Liver, and Bowels.\n\n\nAs A PREVENTIVE FOR FEVER AND AGUE.\n\n\nTHESE sITrtRs ARE NOT EQuALLEp.\n\n\n\nW.F.& A. W. GREELEY, Propristors Boston.\n\n\nTHE OBJECT Of all medicine is either to pre-\nvent disease, or to assist Nature in restoring the\nvarious organs Of the body to heathful action,\nand that medicine Is certainly the best which\nwill perform those Offices thoroughly, yet mildly,\nand without endangering the vital forces Of the\nsystem, by whose normal condition alone health\nand strength can be preserved. Most of the Bit\nters that have heretofore been brought into pop\nular favor, have only served the purpose of tenn\nporarily stimulating or exciting the organs into\nq condition resembling healthful action, without\nany remedial effect, and generally followed by q\nreturn of the disease, or prostration of nervous\nenergy more disastrous than though Nature had\nbeen left to take its own course.\n\n\nDR.. Greeley's Bitters are preparation Of the\nnutritive properties Of the grain of the fields in\ncombination with the active principle Of many\nsimple alternatives and bitter tonics, and it is q\npleasure to the proprietors to state that its use\nfulness Is being generally acknowledged by the\nlargely increasing consumption in those sections\nwhere it is best known, and by the testimony of\nmany eminent physicians, who have not only\nmade trial Of it, but continually prescribe the\nBitters in those cases for which It is recon-\nmended.\n\n\nAGED PEOPLE, AND ALL WEAKLY PER-\n\n\nSONS,\n\n\nConsumptve patients, and others, whose con-\nstitutions have become impaired by time, or en-\nfeebled by disease, and in whom the process of\ndigestion does not replace the fat and tissues of\nthe body as fast as they waste, will find these\nBitters at once nourishng and strengthening,\nand happily adapted for their use. The great\nadvantage the Bitters possess over ordinary\nstimulants usually prescribed in treating lung\ncomplaints and kindred diseases, Is the fact that\nthey combine many safe and certain healing\nproperties in connection with the best known\nstimulant.\n\n\nDELICATE LADIES\n\n\nWill derive great benefit from It, No unpleasant\neffect will result from taking the Bitters If\nthe directions are followed. For those who suf-\nfer from nervous debility, languor, want of rest,\nexhaustion, and in all cases of weakness, the\nBitters are not equaled.\n\n\nAs an agreeable stomachic, 1t is much ad-\nmired it sharpeps the appetite, brightens the\nintellect, and infuses new life and vigor. No one\nwho uses these Bitters can be subject to an at\ntack of FEVER and AGUE, or D1ARRHGA."", 'France, it is very clear, will give our\nrebels no such aid and comfort as they\nhave received from the British ministry\nand British newspapers. Though the\nimperial government has not yet specif-\ncally set forth its policy, all accounts\nagree in representing that its spirit is\nmost friendly toward the Union. The\nvery fact that it did not initiate the hot\nhaste of the English cabinet in accor-\nding belligerent rights was in itself\nstrong evidence that it was more I\'M\nfavorably disposed to the \'\'confede-\nracy."" It was an advantage for the\nsecessionists that the federal minister\nat the imperial court thoroughly SYM\npathized with their views, and was.\nready to promote their interests just so\nfar as his position would permit. 1t\nmay be that Mr.. Faulkner said no word\nand did no act positively treacherous,\nbut his general influence Advent toward\nproducing a belief that disunion was\nan accomplished fact-a belief which,\nwhen once thoroughly established\nabroad, must of course greatly effect\nall the foreign policy But the French\nemperor was not betrayed Into ANY\npremature judgment of the case; and,\nin Mr.. Faulkner\'s parting interviews\nwith him, he did not neglect the oppor-\ntunity to give utterance to his ardent\ndesire and hope that the sectional strife\nmight be bealed, and in fact he made\na direct proffer of the friendly offices\nof France to bring about reconcile\nalton. The French press has almost\nunanimously espoused the cause of the\nfederal government, and has treated\nthe whole subject.with moral breadth\nthat has been in marked contrast to the\ncontracted, materialistic, cotton mufiied\nhandling it has Hreceived 2 from sthe\nBritish journals, We may set down\nas a settled fact that all the sympathies\nOf France and NO nation in. the world\nhas more generous sympathiesEare for\nthe stars and stripes; and that, instead\nof embarrassing our operations against\nthe rebels, she viii give all her influence\nfor the speediest restoration of our\nnational tranquility. is.as-\nOn its face it is strange enough, that\nof the two Acknowledgment and\nFrance-the one of kindred blood to\nus, of the same language, and the same\nreligion, and the same system of COM\nmon law, and similar principles of\npolitical freedom, should he against us,\nand the one of alien blood, different Lam\nguage, different religion, q different\njurisprudence and different rule, should\nbe, for us-that the nation which origi-\ns,allywas Understandable fastening\nslavery upon us, and afterward made\npeculiar professionsof hatred to slavery,\nshould be the nation first to turn against\nrs when slavery seeks to assassinate\nus, while the nation which had no res\npossibility in the premises should be\nThe one to befriend MS. i it be said\nthat England has large material in\nterests involved, so has France. France\nmanufactures and consumes American\ncotton as well as England, and has no\ncolonies, like England, from which to\ndraw a,future supply. If it is an OBJ\nject for England to have free trade for\nher hardware, and woolens and linens,\nit is also quite as much an object for', 'OF all the ills that aGlict mon and women, few\nare so agonizng as Dyspepsia. 1t is a sort of\ncombination Of many diseases. Thanks to science\nand DR.. GREELEY, a specific has now been OBJ\ntained. GREELEY\'s BOURBON BTTERs take straight\nhold of the disease, and begin cure Thou\nsands of well-attested cases Of cures OF Dyspep-\nsia, Indigestion, and Fever and Ague, even of\nthe most desperate kind, are in the possession of\nthe proprietors.\n\n\nNot a few people, everywhere, complain OF\nWeakness or Debility. This is the gentle hint\nof nature for little help in the way OF invigora-\nton. The hint should not be neglected ""a\nstitch in time saves nine"" Get supply of GREE\nLEY\'s BOURBON BITTEns, take them regu arly, and\nour word for it you will feel better live longer, be\nstronger and think and act with very much more\nsatisfaction. The Bitters are a tonic, and of\nnature never before attained in any medicine. 1t\nwill make the weak strong, the Responding hope\nfull, the sick well. For any complaint of the\nStomach, Liver, or Bowels, there is nothing COM\nparable with this medicine.\n\n\nIn America, the Liver is the best abused of all\nthe organs in the body 1t is made the saddle\nof all other organs. AS consequence, it is often\nout of ORDER and not unfrequently nearly inopera-\ntive This need not be on the contrary, it is quite\n| unnecessary. A little common sense, and suf-\nfciency of GREELEY\'s BOURBON BITTERs, will keep\nthe Liver right, and make man a man, and wo-\nman, now miserable, quite happy. The Ditters\nregulate and strengthen the Liver, no less than\npurify it.\n\n\nThe increase of Nervous Disorders, at the pres\nent day, is one of the most alarming indications\nof the age, or rather, would be, were it not that\nQ most admirable cure had been found. There\nis not phase of Nervous disease, whatever 1t\n| may be, that these Bitters will not act upon\n| favoraby, and 10 the most efficient manner All\nwho are unfortunately afflicted with complaints\nof this nature, or with Indigestion, or any dis\neases of the Stomach should not fail to make use\nOF GREELEYs BOURBON BITTERs.\n\n\nChills and Fever. In many portions of the\nUnited States this terrible disease seizes its VIC\ntins as naturally as water seeks its level. The\nsystem in particular condition invites it. The\nright mt dicine to prevent and cure this malady,\nwe unhestatingly say, is GREELEY\'s BOURBON\nBIrTERs. 1t breaks up the fever, drives it from\nthe system, and will keep it at bay, il taken in\naccordance with directions on the bottle. The\nBitters purify and enrich the blood, and this in\nreturn strengthens the constitution AS an agree\nable tonic, these Bitters have no equal.', 'to recuperate the energies Of the system, and en-\n/ able the mother to bear up under her exhausting\n/ trials and RESPONSIBILITIES. Nursing mothers gem\n\n\norally prefer the Bitters to all other invigoratols\n\n\nthat receive the endorsement of physicians, because\n\n\nit is agreeable to the taste well certain to give\n/ a permanent increase of bodily strength\n| All those persons TO whom we have particularly\n| referred above to-Nit: sufferers from fever and\n/ ague caused by malaria diarrhOea, dysentery, in\n\n\ndigestion, loss Of appetite and all diseases or de-\n\n\nrangements of the stomach, superannuated inva\n\n\nlids, persons of sedentary occupation, and nursing\n\n\nmothers, will consult their own physicb NAfare by\n\n\ngiving to Hostetter\'s Celebrated Stomach Bitters\n! trial.\n\n\n! CAUTI0N.-We caution the public against using\n| any of the many limitations nterteits, but\n! ask for HosTETTER\'s CELEBRATED SToMACH BIrTERs,\nand see that each bottle has the words CDR. j. Hos\n\n\nletters Stomach Bit tiers"" blown the siu Of the\nbottle, and stamped on the metallic cap covering\nthe cork, aud observe that our autograph signature\n| is oil the label\n\n\nsaa Prepared and sold by HosTETTER & SMITH,\n\n\nPittsburgh, Pa. aud sold by all druggists grocers\nand dealers generally throughout the United States\n| South America, and Germany.\n\n\nhovl8-d&wlawlyr', 'MEEcUEIAL DISEASES Persons whose constitutions\nhave become impaired by the hjudciou of Mercury\nWill ind these Medicines peftct they ne\nfail 10 eradicate from the system all the effects Of aier-\ncurry, infinitely sooner then the powerful prepera-\nlion of Sa1saparilla\n\n\nPrepa ed and sold by w. Il. ElOFFAV\n21Fy11 335 BROADWAY. New York\n\n\nron SALE BY ALI. DRUGGISTS.', ""yEyHIs altogether medicine the result Of modern\nthe vegetable kingdem, being an entirely\nworn systems published by accomplished quacs to the suffer\ning Dr. Wright well knowing the deception Prscsed upon the\nthe whole Medical Faculty. who without one dissenting\nvee given in their adj 20 its perfect and undivided\ncontrol the whole physical when his frame has been\nreduced, and all other medicines the Pharmsco\nPea have been tried in vain Long thought years 81 patient\nDoctors Efforts and offers the Elixir to suf\ndlseaSes-DamelyI\nGeneral Debility,\nMental and Physical Depression,\n\n\nDetermination Of Blood to the Head,\n\n\nConfused Ideas,\n\n\nGeneral IrritAbIlV,\nRestlessness and sIeeplessness at Night,\n\n\nAbsence Of Muscular Efficiency,\n\n\nLoss Of Appetite\n\n\nEmaciation,\n\n\nDsorganiEAtiOn of the Organs Of\n\n\nPaiptatiOn Of the Heart,\nAnd fast all the concOnants of and dsOitAted\nstate OF the ~ STEM\n\n\nAs a StimuIant,\nn Is quite dig srent preparations 1t no: sub\nreaction shape continues to exert its influence\ngradually and efficiently, as long as the least necessity es Tor\nis presence\n\n\nAs a Female Medicine,\n1t equally powerful effective, and restores the equilibrium\nhave market which only injurious in place\nof assisting IenOyAng the constitution ~ for very GOD ps. Tss\nRnorant o. tie Medical profession altogether.\n\n\nNo Minerals!\nDr. Wright we'll stake his professional character\non the fact minerals whatever form the least component\nparts ingredients Of his RuvenanR Elxrwei know\ning ruin has been ened the community BY opium Ane\nmercury.\nGenerally debilitsed, Dr. Wright would say, Never\ndespair No matter how down may be- no matter how\nyou what the have\nwhatever led depart from Hygiene principles\ntake his\nRejuvenatinG ElixirS\nAnd you will Rd yoursef pride Instead\nfriends, and healthy, sound, and worthy\nMember Of the human family.\n\n\nPrice - per bottle three bottles for IS, and forward\ned BY mail TO all parts Of the United States.\nBold by all respectable druggists throughout the United sset\nCAnAdas The trade supplied At liberal diseount\nFor sale BY the proprietors,\nu WRIGHT a. Co.,\nq and Isl ChArtres street,\nNew Orleans, La\nNashville by O. W. Hendsrshott, Berry Densville\nwing Pendeton, and all responsible druggists. ocRS""]","Ah, you’ve caught me at a curious moment, my friend! I’ve been poring over some recent remedies that are making quite a stir in our circles, particularly the uses of Peruvian Bark. From what I gather, this bark—extracted from the cinchona tree—is becoming noted for its efficacy in treating ailments like jaundice and general debility.

I’ve heard it spoken of as a significant tonic. You see, physicians in our region have been extolling its virtues, especially during these times when many of us suffer from fevers or have our stomachs out of sorts. The bark seems to work by invigorating the body, restoring balance and strength. People are saying it is specifically useful for those worn down by lingering illnesses, perhaps drawing strength back into those who are feeling rather listless or depleted.

Here's something interesting: it’s said to stimulate the appetite and aid in digestion, which, in turn, can help with that dreaded debility we hear so much about. Folks claim that its mildness makes it suitable for the stomach, and it appears to do wonders in combating fever and ague, a common affliction in our humid summers. 

When talking about jaundice, the bark is often paired with other tonics, amplifying its effects and helping to clear up that yellowing of the skin some endure. I reckon that the physicians recommend it for a plethora of complaints arising from a disordered liver or digestive woes. There’s even talk that it’s recommended for diarrhea and similar troubles, allowing it to hold a place of honor in many a medicine cabinet.

So, if you find yourself or a loved one feeling under the weather, you might wish to inquire about Peruvian Bark. It seems to be finding favor among the practitioners around here more and more. It's always good to hear what remedies might suit our ills, don't you think?","Peruvian Bark was noted for its peculiar virtues and was carefully combined with various tonics and syrups to create a mild tonic for the stomach. It was effective in treating dyspepsia and strengthening vitality, making it invaluable for conditions such as jaundice and general debility. Additionally, it was recognized as a remedy for fever and ague, showcasing its significance in historical medical practices.",0.8636363636363636,0.0,0.7555555555303703,
What were the circumstances surrounding General Scott's retirement and how did military dispatches reflect the ongoing military strategies during that period?,"['The following dispatches were sent IRON\nNew York on Monday evening, but were sup\npressed by the authorities OF Ohio although\npublished elsewhere:\n\n\nHARRISBURG, April OLA special train left\nhere last night for Chambersburg, loaded\nwith ammunition, and also one for York,\ncarrying arms. blankets and tents\n\n\nThe news from Chambersburs to-day re-\nports the camp in fine condition. and Gen.\nWilliams commanding, has reduced the\nstrictest discipline.\n\n\nCommissary Gcaeril Erwin goes TO Pitts\nburg 70 night TO form military camp. Troops\nare TO be collected there to protect the from\ntier of the southwestern counties. ii necessa-\n~; also to protect the Union men of the\nnorthwestern counties of Virginia.\n\n\nOne thousand regulars from Carlisle bar\nracks and xix bundled horses have already\npassed The mounted cavalry formerly oil\nTexas. viii move during the coming week.\nThe li,h regiment will be organized to NOR.\nrow. Five regiments NJ Camp Curtin are\n&c sdy to move at u moments notice.\n\n\nThe Governor Of Ohio is moving two Regi.\nments on Wheeling. one on Parkersburg\nand one ON Guyandotte and Point Pleasant. &c\nprotect the Union men OF Western Virginia', 'War GsSrR,t Scor1 ~ p0iSC.--A cor.\nrespondent Of the New York Posf writes\nfrom Washington\n\n\nIl am amply assured that General Scott Is\nfully awake 20 the importance and urgency\nOF the occasion. and fully informed ct all\nthat the rebel leaders are doing or media\nting. lie i occupied az he vas during the\nearly part Of the Mexican war. IN carving\ninto effect plans carefully laid. and csretull,\nconcealed from the kno~ledgc 81 the enem,\nBefore they are aware. the let which has\nbeen set. vii he srrung upon them. and\nthey viii be taken Ia Ike cover q par.\ntr.dges""', ""The Militia i divided into two classes.\nsedentsry and actire--the former being all\nshe white male citizens Of the State. subject\nto bear arms, Who DO not belong to the ae-\ntive miiitia-tlle latter the members Of regu\nlarry enrolled companies. The active militia\n= TO be organized a. a single army corps,\nand to be styled the Indiana Legion. The\nbin creates military fund Of seventy thou\nsand dollars. TO be appropriated on. Of the\nannual revenue Of the State for military pur\nposes. IL prescribes the manner of mastering\nvolunteers into the Accompanying arms\nand equipments-regulafio for elections\nmodes of military neutrality-suspicious.\nOf disbursing ofhcers-regulations for Courts\nMartial-and vast variety Of details for the\nEfficient organization Of the State Militia\nRegiments Of Cavalry and Artillery are pro\nv;,lei for. and all the necessary regulations\nprescribed for the various arms Of the service.\n\n\nThe bill j. long one. and ii seems 20 be\nthe most sensible and feasible plan that he's\nye: been offered for the organization Of the\nhttr - y YIN 49, ~'1'~ - 49,\ncompactness in all it, parts thst seems 70 war\nrant the belief. among those Who are compe\ntent to judge Of Us workings. that it viii prove\nsuccessful II ma nee modification in some\nparticulars yet rs system it appears 20 fur\nn;sh quite perfect plan for an elective vol\nunteer militia.\n\n\nOur State needs good and vigorous mill\ntia law-one which will properly infuse the\nrequisite military tiste and instruction into\nour citizens. and will nj the same time be\nfree from the dcsposic and Questionable fen\nlures which too frequently creep into SIM\nlar acts Ii is 20 be hoped that our Legisla-\nture viii perfect some law which will answer\nthe purpose Of preparing the eitizeas Of the\nState to bear arms with success. as occasions\nnav arse. and AZ the same time be without\nany burieasome characteristics."", 'The New York World pays the fol\nlowing just and discriminating tribute tt\nthe qualities which characterize the vet\nan General-in Chief of the United States\nforces who, it will be remembered, has\nnever lost a battle:\n\n\nOur actual Commander-in in Chief, the\nLieutenant General of our Army though\nas brave as Achilles, is rs serene as Az.\namemnon and as prudent as Ulysses. =\nFrom his youth he has been soldier\nand victorious one. He has seen NOR,\nservice than any man under his com.\nmand. and was never known to be even\nDisconnected by danger. A strict dis\ncipllnarian, and something of martin\nct, it was iocOsely said of him, in his\nyounger days, that he would drill Il bat\ntalon under fire. Yet General ,ScoT1\nis as chary of mems lives as a mlser Of\nhis gold; and SO was the Duke Of Well\nington. He never moves, if he can a\nvoid it, until he sees not on Y that he\ncan accomplish a good purpose, but un-\n.il he can accomplish it at the least pos\nsiblc risk of his men. 1t is his avowed\nbelief that an officer who exposes troops\nto needless peril is guilty of degree OF\nmanslaughter. And he not only thus\nregards himself as responsible for the\n\n\nlives of men under his command, but he\nlooks after their health and comfort. -\nHe will not accept regiments unless he\ncan see clearly the means to feed, clothc\nand shelter them. The consequence of\nthis prudence on his part Coined. as it\nis known to be, with the most daring\nspirit and great military sagacity) is\nthat, after little experience, men fight\nunder him with entire confidence. They\ncome to believe that if he gives an order\nit is not one which will expose them to\nneedless risk, or to chances of defeat, if\nin battle they justify his confidence in\ntheir bravery. Through all the excite\nment of the past few weeks at Washing\nton he has remained undisturbcd. The\nannouncement Of the approach of twenty,\nthirty, fifty thousand men, be has rccciv-\ned with impurturbable incredulity. He\nknows better. lie knew that Gen Da-\nWis could no more march fifty thousand\nmen upon Washington than fifty thou\nsand witches. He knows exactly what\nprovision is required for the transporta-\nton of even thousand men five hundred\nmiles. he knows when to be alarmed\nand when to reposc in confidence, when\ntorcpress ardor and when to give it way\nHe knows that it is one of the first du-\nties Of a military leader to restrain and\ndirect his own enthusiasm as well as that\nof the men under his command IL is\nprudent. Nay, he is prudence incar-\nnate, und so all other eflicacous quail.\nties attend him.', ""Senator James IL. Lane has received his\ncommission as Brigadier General In adli-\n! tion to the three regiments heretofore accept\n| ed from Kansas, he is authorized to raise two.\nconsisting of twelve companies of infantry.\nfour of cavalry, and four of artillery. The\nCoIonels o. these two regiments are Colonel\nWerr, who served during the entire Mexican\nwar, and the well known Kansas Montgome |\nry. Gen Lane will occupy his seat during\nthe extra session of Congress. He expects |\nto take command of his brigade about the\nGoth Of July.\n\n\nBALTIMORE, June 27th.-Considerable ex-\nelement exists occasoned by the arrest of\nMarshal Kane. Union men are pleased, but |\nSecessionists are Indignant Col. Henley. |\nthe Provost Marshal, waited on the Mayor\nand Police Commissioners, when the latter\nasked him to consider the matter. IIenlv |\nreplied that his orders were immediate He |\nthen proceeded to the MarshaPs office, taking |\npossession The Commissioners then directed\nthe officers to obey the military authority,\nbut declare their intention to prepare a pro-\ntest against the action of the Government.\n\n\nLOUISVILLE June 2S.-Two fugitive slaves,\ncaught near Corydon, Indiana, were returned |\nto Kentucky yesterday. There was no ex-\ncitement whatever at their arrest.\n\n\nMajor Gen. Pillow issues a proclamation in |\nthe NJ emphis Bulletin of the 24th, which re-\ncalls the order that whisky and tobacco be |\nUlStrlhntnd xpif fI,o\ngave the order on his own responsibility, |\nsupPosing the Military Board would allow it. |\nknowing that the soldiers were gentlemen\nana used to plenty of whisky and tobacco.\nrhiLADELAHIA, June 27th--The prize ship |\nAmelia is at the Navy Yard. The cargo con- |\nsists OF iron crates, camp ovens, equipare and |\nmachinery. The vessel is valued at Sl2 600 |\nand the cargo at S500,0OO. 1t is thought thai |\narms are concealed in the crates.\n\n\nA Washington special correspondent of the |\nn. Y. Post says movement is on foot to |\nelect Emerson Etheridge Secretary of the |\nSenate lie will accept if chosen.\n\n\nAn election for Senators to represent Fair I\ntax county, Va, will occur Saturday, but no\nvoting is expected except within tho lines of\nthe Federal troops\n\n\nspecial dispatch to the New York Com\nmercial says. Chandler (Bell and Everett,)\nelected in Virginia, has arrived here from\nNorfolk, being obliged to leave. He saws\neverybody thereabopts is being pressed into\nthe Confederate service.\n\n\nWASHINGTON. June 27th-Itis contemplated\nsending the returned Texan U. s. troops to\nthe Plains to keep the Indians in subiection,\nand to keep the daily overland mail route\nclear.\n\n\nBALTIMORE, June 27th.--at 8 o'clock this\nafternoon, George P. Kane, Police Marshal of\nthis city, was arrested at his house by order\nof General Banks, and conveyed to Fort Nc\nHenry, where ne ia now held prisoner."", 'Special to the Tribune.\n\n\nWAsBINcTor, Oct. 28.-Genersl Scott will\nvoluntarily retire from his rank and duties with\nin the next ten days, solely on account OF his\nphysical inirmities. The recent act Of Con-\neress provided there should be no reduction 10\nbis p,y, subsistence or allowances, IN the event\nOf his withdrawal.\n\n\n1t is well knowu that Gen. Scott has bad an\nunsettled account with the War Department\nsince the Mexican war. Secretary Cameron\nhas recently gwen careful examination OF bis\nclaims, nov Ihiftee years old, JtK Davis bav-\nil brought him in debt on account Of his ex-\npeDd tures aud receipts in Mexico, and so Tar as\nthe Secretary\'s report could do 1t, disoredited\nhim as a tinauci4l agent OF the Government\nMr.. Cameron has reported that General Scott\nwas not only entitled TO the money he claimed\nof the Government, but that be saved to it mil\nlious Of dolars, which by the laws of var he\ncould have pOcktted uuder the set led principles\nregulating the distribution Of prize aud contri-\nbutton money. it\n\n\nThis opportunity of personal advantage Win\nfield Scott generously diverted to the founding\nOf home for iOvali soldiers, O0e OF the mon\numents, loue after be is dead, will be the sol\nd,ers\' home near Washington.\n\n\n% Saturday l4et the order OF the Command\nerin Chief that Gen. Fremont ehoud surrender\nhis com maud TO the Cfficer Dex below him, Gen\nHunter, accompanied by letter Of 10 .tIuctiOns\nto Gen Hunter was sent out by the President\nto Gen. Curtis, in comm md at st Louis, with\ndirections TO deliver is to Gen Ffemont, unless\nbe was actually in the presence Of the enemy,\nor preparing for battle. Ia.\n\n\nSenators Chandler Of Michigan, Wade Of\nOhio, Trumbull Of Illinois, and Wilkinson ol\nMinnesota. are here, representing to the Ad-\nministr alton that the popular demand OF their\nconstituents is that Mcclellan or sope one else\nsbalfimmediatey whip the rebels on the South\nside OF the Potomac In pitched battle, and as\nnear to Ball Run as possible, and from theme\nroll the tide Of war steadily Southwark till it\nreaches the waters Of the Gulf.\n\n\nThe Trbune staies that one Of our cores\npondents with the great naval expedition writes\nfrom Hampton Roads on Friday last that he\nhad Just been informed on good authority that\nthe Private Secretary of Commodore Dupont.\nthe Commander of the feet, had nbsconded,\ncarrying with him the maps and charts, and\neven the sealed orders Of the Commodore. We\ndo not vouch for the truth Of the report, but\nonly for the fact that the writer is worthy OF\ncredence We hope the report Is erroneous.\n\n\nSpecial to tho Heraii.l\n\n\nA scouting party Of Union troops went into\nahlhA OOukh AASuSC "" AOethco huoe\nthe rebels had not been there for many days,\nout were az far back as Centreville, and not\nstrong even there.\n\n\nThe rebels all along our lines to-day. on the\nUpper Potomac, have net been seen. 80.', 'EpwAWps\'s FERRY. Oct. 26 ALI quiet last\nnight; no pickles. were thrown over the river,\nout those on this side heard those OF the rebels\nall night on the opposite side, and cav t1elr\nftes thickly scattered 10 the woods along tho\nshore. Their centrazing point was a cump\nof trees on the bluff where our troops had con-\n,tTucted q picket station, aud near the spot\nwhere our a-tiliery shelled them during the\nsSirmish on Tuesday last\n\n\nWhen our troops we\'re withdrawn from the\nVirginia eide on Wednesday night, the l6h\nIndiana occupying the most advanced and ex-\nposed position, were not aware OF any with\ndra val until the rest had been successfully fer\nried. They lay upon the cold ground, almos\nfrozen, with loaded muskets in their hands. ev-\ncry moment expecting an overpo""eriDg assault\nfrom the concealed aud reinforced enemy,\nwhose numbers were known to exceed our own\nBY many thousands Yet the only murmurings\nuttered by the hardy cons Of the Northwest\nwe\'re at the orders to return without disputiDg\nthe ground, inch BY inch, With their sdversaries.\n\n\nTHIS regiment brought with them two prison\ners, the owner ofthe mill on Goose Creek, with\nhis son, who II was charged had prepared com\nbusiibles TO Ere the bridge over Goose Greek,\nbut were prevented from carrying out their de-\nsign by the sudden descent upon the bridge by\nour skirmishers.\n\n\nThe officers of the regiment had g cOnversa-\ntion with prisoner OF war, highly Intelligent\ngentleman and nou-cpmmssoned officer Of\noue Of the Mississippi regimen\'s engaged in the\naffair at Balls Bluff. He left Lee.burg on Sur-\nday night, when there were but five regiments\nthere. There were 10 delensible works at\nLeesbnrg, but every approach was fortified,\ncommanding the river and land routes.\n\n\nThis prisoner was astonished to learn that\nour army was not almost entirely composed OF\nabOltionists and radical Republicans, and that\nour main object was other than to emsucipatt\nthe slaves throughout the South. He said i\nthe facts were generally known to tho working\npeople OF the SOuIh, that our sole object was &c\nsustain the Constitution and to preserve the\nUaion intact, there would be revolution In the\nConfederate army and peace restored.\n\n\nHe was surprised beyond measure to be as\nsured that Brekinridge Democrats constituted\nlarge component of the army.\n\n\nCapt Vaughn. Of the Rhode Island battery\nwho vent over with q ,g of truce, has return\ned. He was ciptured BY party who did moi\nunderstand the Law Of nations, but was after.\nward released by the military authorities.', ""WHAT IS REQUIRED AND How 1T IS DONE.\n\n\nMr.. Raymond, the editor of the Ny Times,\nwhose observations liz the late Italian war en-\nable him to speak intellisently on army mat\ntiers, thus alludes to the fault-finders, whose\nentire ignorance Of the nature and wants of\nan army is SO often displayed in criticism up\non the action of General Scott and his aids ::\n\n\nMen who fight mus: be fed ard they must\nnot be taken into any place or position where\nthey cannot have food, shelter and the means\nof fighting. In going into the enemy's coun-\ntry, they must take with them all their tents.\nprovisions, spades and other tools for throw\ning up entertainments, cannon, ammunition\nand whatever else they expect TO use. To\narrive without these IS simply to insure their\nstarvation or swift destruction by the enemy.\nAnd to carry them requires wagons, horses,"", 'DETENTION or Lord LYONS DIsPATCHg5;--\nThe following, from the st. Louis Bulletin Of\nthe 10th, explains Il dispatch published & few\ndays since\n\n\nWe have bee Permitted TO make the follow\ning extracts from II letter received in this city\nIl few days since. We regard it as entirely re-\nliable:\n\n\nWAsHIsaIoY, Aug. 3.-Amorg the on d:t9\ncirculated IL Thu city is one Of much import\nGnce, as showing the wisdom of our premier\nn conduc ing foreign negotiations.\n\n\nItappe;lrs that he day OF the battle OF Ma\nnaSsas was that fixed for the sailing OF the\nCunarG steamer The news ct first received\nwas so much III favor OF the tederals that\ncertain prominent Northern men raised u, 900\n10 pay The expenses OF obtaining the boat ull\nMonday, and telegraph the arrangement to\nthi5 city. When the tide Of battle turned,\nand 1t baaame evident that ""ForWard 10\nRichmond"" meant Back 10 the Potomac. !""\nIA imperative message was sent ny the au-\ntLCritIe- here TO send the steamer eff lm1le-\nd!aoe!y. She sailed, therefore, withoat any\nnews.\n\n\nlne Britt h consul at New York immedi-\nateiy LelegTauhcd lhls fact TO Lord Lyons,\nwho, il turH, diepatc ned to II 1li\'a1 TO detan\nthe stGamer aL that point until his dis patches\nshould arrive there.\n\n\nWhen lie had received correct information\nregarding the tattle, he took q dispatch TO the\nTelegraph office and supposed 1t would De sent\nimmediately. Something occurring 10 arc 2se\nhis suspicion, he, accom- panied 10y his Secreta-\n~, dove to the telegraph office and requested\ntnat HE Gl- patches should be repeated from\nHalItoX. IAls forced The operator TO acknow-\nledge that they had not been tOrW arded. by\nwhose orders are my dispatches suppressed\nquerIed the indignant Briton. by those of\nSecretary Sewarl, was the reHA The Brit\nIsh representative drove immedel Ely to the\nSLate Department ard iuqu Ired OF The premier\nII such orders had been gwen. lie replied IL\nThe affirmative. ""My passports\'\' was the\nstern demand OF England. Seward hesltated.\n= Caoiuet con sUltutiOn was held. The dis\npatches "" ere sent, and Lord Lyons reluctant\n~ withdrew his demand, Grt il formed the as\nt1nished Cabinet Lhat he should refer tue mat\nter 10 his Government.', '10 tuCStiou VI WV \'""""No\n\n\nOf Lincoln, still continues to be the\nAbsorbing topic among the inbabit-\nants Of Washington city, who appre-\nbend that the ceremony may be ac-\neompanied by baptism in blood\nWe have had various rumors Of mil\nitary preparations 10 Maryland and\nVirginia, with The supposed object\nOf preventing the ceremony; but\nwhether for that purpose, or merely\nto defend those States and The Dis\ntriot Of Columbia from the Eruption\nOF Wide Awakes, which was announced\nTO be in Attendance on the Black\nRepublican President, does not ap-\npear. Accounts now speak of mil\nilary organizations in Pennsylvania.\nNew York, and New Jersey; but\nthey axe understood to be intended\nto preserve order, and defend The\nrights of the border slave States\n\n\nThe telegraph says that Gen. Scott\nhas been advised that 1000 men at\nBaltimore are ready to come TO\nWashington at a moments notice TO\ndefend the District and capital. Gen.\nScott is understood TO be in laver Of\nthe preservation Of The Union, even\nunder the administration of Lincoln,\nso long as be adheres to the consti.\ntution and maintains the laws. In\nthe mean time the late Wide Awakes\nhave become Fast Asleep, or sunk\nout of sight like the men Of Roderic\nDhu. The Chicago Times asks:\n\n\n""Whare are those Wide wakes,\nwhich, but short month ago, were\nready, willing and anxious TO march\nagaius, the South. So long as Sc\ncession was confined to words, these\nvaliant tyros were ""eager for the\nfray,"" and almost demanded to be led\nagainst their countrymeu. Ten\nthousand Wide-Awakes were t o\nmarch 10 Washington to assist at the\nInauguration. They were to 60 into\nimmediate training, and we were\npromised that they would become\nsoldiers of whom a nation might be\nproud. Where are they now? now\nthat disunion has absolutely taken\nplaoe-now tina. civil war with all OF\nits ghostly borrots is staring with\nglaring eyes at the country-where\nare they? into what hole have they\nerawled? Oh, valiant army! Oh,\ndauntless will-o\'- the-wisps! Brave\nspiriisl Why have We subsidized?\nNot lisp have they uttered 10 three\nweeks. Ominous silence. Have\ntheir lamps gone out? Let US hear\nirom tbem-if but single mournful\nwhine.\'', ""v AsHINGTONl . an D.\nOn inquiry at the proper quarter It has been\nascertained tlat before June last il being found\nthat the arms az the several arsenals were not pro-\np0rtionately distributed, and that the Southern\narsenals were quite deficient in these supplies a\ndistribution was made Tor equalization only and\nfor no other obiecg. They were principally drawn\nfrom the Springfield armOry, and from the aTsen-\nais az W aterVieit, n Y, and WatertOWn, Mass.\nThe secession troubles, It Is known, had not\nbeen commenced I'LL after the distribution was\ncomplete. There remained prepOnderanee OF\narms az the North.\n\n\nLieut.. Gen. Scott was engaged TIL O'Clock\nthis morning on business connected with his De\npartment.\n\n\nThe Republicans were again in caucus to day,\ntheir object being 70 agree on uniform Legislative\naction\n\n\nThe arrival Of recruits from Philadelphia for\nthe purpose Of being drilled at the Marine Bar\nracks at Washington has been magnihed into un\ndue importance.""]","Ah, you’ve come at quite a remarkable time, my friend. The air is thick with the weight of uncertainty, regarding our military pursuits and the leadership in Washington. General Winfield Scott, our esteemed Commander-in-Chief, is on the verge of voluntary retirement. It appears his health is failing him, and he’s expected to step down within the next few days. It weighs heavily on many of us, as he has been a steadfast leader throughout these tumultuous times, guiding our army with a deft hand, though some whisper of disagreements within our leadership.

The military dispatches reveal much about our current strategies. Just the other day, we received news of troop movements across several states, including Pennsylvania and Ohio, as forces are marshaled to protect union sympathizers, particularly in places where secessionist sentiments run strong. I read in the latest telegram that our brave men from Carlisle are being dispatched—not just for defense, but to assert control over areas that need securing against those rebels. There’s talk of arms and ammunition being transported, and regiments are gathering, ready to respond at a moment’s notice. 

I gather that General Scott has laid out plans that have been kept quite under wraps, only to be unveiled when the time is right. His approach is cautious yet determined; he insists on safeguarding the lives of our soldiers, a sentiment that resonates with many in our ranks. There’s a real sense of urgency around these plans, as skirmishes reach near to our borders; we cannot afford to let our guard down.

What's more, you may have heard about differing factions forming—loyal Union men rallying in response to this stark division within our nation. The articles I’ve come across reflect our common concerns. Citizens worry about the risks ahead, and some are even questioning if our military might is being managed effectively. Each report evokes a sense of duty; there’s a call-to-arms mentality, as we all know that this conflict encompasses not just men in uniform, but our very identity as a nation.

It's heartening, though, to know that local citizens are gathering to support the troops—sewing circles making bandages and collecting supplies. Communities are rallying, even as we hold our breath for the next chapter of this conflict. The fate of our Union, and perhaps our own personal safety, rests on the shoulders of these fine gentlemen in command. We can only hope that, as General Scott steps back, his successor will have the wisdom and clarity we so desperately need in these trying times.","General Scott will voluntarily retire from his rank and duties within the next ten days due to his physical infirmities. This decision comes after a long-standing unsettled account with the War Department since the Mexican War, where Secretary Cameron confirmed that Scott was entitled to the money he claimed from the government. In the context of military dispatches, reports indicate that a special train left Harrisburg loaded with ammunition and arms, reflecting the strict discipline under General Williams and the preparations being made to protect Union interests in the southwestern counties of Virginia. These dispatches highlight the urgency and strategic movements of troops during this tumultuous period.",,0.0,0.6044973544872796,
What was the significance of the public meeting in New Jersey and how did telegraph reports reflect the sentiments of New York citizens regarding the Union?,"[""HEa are unwilling 20 believe the telegraph\n&c reports of the total apostacy OF the major\nity of the citizens of the city OF New York.\nwho have professed TO be the frieIas of tho\nSouth, and the opponents of Black Republic\nanism, as the vote in the last Presidential\ncontest exhibited. We know that there are\ngood men and true there. who are willing TO\nstrand by the South to the last.\n\n\nWe have been informed by q gentleman\nlately from that city. that all the teiesrS phic\nreports from thence in relation to this appo.ia-\nCIV of New York citizens are enormously ak\nagGcratod, and that so far from the secret 60\ncieties being organized by the Lincolnites, IL\nwas just the reverse. Ii il be not 50. the\ne;.,nge is certainly very extraordinary\nv nat has become OF the Union procession OF\nthe bone and sinew of New York city, which\nturned out seven miles in length, in opposi-\nton 10 the Wide Awakesl\n\n\nWe shall wait for confirmation, before VIC\nare willing TO believe in the apostacy OF\nNew York city.-Nor Orleans Picayuns.\n\n\nThe above paragraphs index to us tue\nstate os surprise and apprehension felt in tho\nSouth at the union of the North for the sake\nofthe Union. The miserable traitors thought\nthey we're masters Of thu white men Of the\nNorth, as ofthe negroes Of the South. They\nwill soon discover their poverty. weakness\nshame and inevitable humiliation. The\nPicayune will hvae sooa enough confirmation\nof the solidity of the people OF New York fol\nthe Union. The procession Union Of the bon,\nand sinew, seven miles in length, is for th,\nUnion still, and all who are against the Union\nare to be whipped.-Cin. Commercial."", ""sseldIers In Peace Citizens In War,\nNoRSHERs Pluck FULLY TEsrED-A NORTHERs\nVILLAGE Thrown INTO INTENSE ExcETENENT.-f oul\nNorthern neighbors of the old Confederacy could\ndemonstrate their courage by the threats which the\nBlack Republicans are continually venting against\nUS poor Southern rebels and traitors then, in\ndeed, would the world be compelled to recognize\nthem amongst the most valiant men of the age\nBut, they are not the men to face danger when il\nactually occursthey fight well on paper, but they\ncertainly don't ike to smell gunpowder. or to face\nSouthern steel and bullets.\n\n\nIn the village Of c., in New Jersey. not hun\ndred miles from New York, is a nest of Republicans\nof Greely stripe who have almost split their hroats\nin denouncng the Southern treason, and in declar-\ning their intentions to aid Mr. Lincoln in enforcing\nthe laws, and retaking all the Southern Forts' On\nthe day of Mr.. Lincoln's Inauguration they became\nvery jubilant, and were blating their predictions\nIa Greedy that in thirty days the Southern rebles\nwould be brought 20 their senses, and would be\ncompelled to beg on their knees for quarters, and\nthey were ready at any time to go and help whip\nthe unruly Southern rascals.\n\n\nA good Democrat, who sympathies very strongly\nwith the South, concluded he would play little\ntrick upon these valorous Republicans and put their\ncourage to the test. Early one morning strange\nindividual was going through the streets OF the\nvillage, who served notice each and all the male\ncitizens subject to military duty. The notice ran as\nfollows\n\n\nTRENTON, N. j., March 9, 1861.\n\n\n\n\n\nin readiness (suhjeet 20 draft to enroll yourself in\nthe New Jersey Militia, to be called out at three\ndays notice. If you have any lawful excuse, re-\nport Immediately 10 the Quarter-master General,\nc. A. Arnold, Trenton, n, J. tG\n\n\nBy order of the Governor.\n\n\nu. C. VEsEY, Secretary\n\n\nNever was such CONSERVATION produced in any\nplace as was witnessed in said village, upon the\ncirculation of these citations. If rumour is to be\ncredited, in less than six hours there hardly"", ""sENArE.\nMI Thompson presented the resolution Of a\npublic meeting IN New jersey In favor Of sus\ntainiug the Union. Laid ON the table.\nMr. Mason offered resolution OF inquiry that !\nthe Secretary Of War give the Senate copy OF ]\nany orders issued from the Department 20 the\nofficers commanding the foTtiteatiohs in south\nCarolina since the LIST Of November Also a copy\nOf any plans or recommendations relative 70 IN.\ncrussing the forces or otherwise h the iorts ana\narsenals IN Virginia or any OF the states IN the\nsouth by the commander In chief, and II any &C\nton OF order were Issued IN pursuance thereof\nM Summer offered petition of Moses CALI\nOF Mas nsking that an amendment TO the COusti.\ntuition bs made that u may recogntze the exist\nence Of God Referred 70 the Judiciary Com\nIII, sldeIls resolution to expel the Associated\nPfess reporter from the reporters gallery was\ntaken upand after brief discussion he Withdrew\nMr.. Seward presented petition from the cit\nizens Of New York asking for the passage of the\nthe Pacific Railroad bill.\n\n\nOn motion Of Mr.. GWin the Pacific Railroad\nHouse bill was taken up.\n\n\nMI Seward said that he should vote for the\nblank although he had some objection to IT, dc\npeferred the more nOrtherly route but should vote\nfor this proposition, Il had been the one great\nobject OF his life 10 secure such grand result\nThe great evil Of our times is sectlonaltsmi ana\nthe danger Of division by sectiQnalism every man\ncalls on every other man for compromise, to de-\nwise some new means 70 cement together the\nstates which it is apprehended are in dan\nger OF falling apart He had listened 70 every\nmeasure that had been suggested 10 arrest the evil\nbut here was one for which he was prepared TO\nvote. He wanted Il to be known at every day and\nhour; Il was apprehended the Union was falling\nto pieces; yet that Congress had placed on the\nStltute Books as recorded fact that an apprO\npriation of s96 O0o 000 70 bind together the North\n/ and the South, the East and West, by maternal\nband. L Is q great measure o. eoneiliatlon'\nThe bill gives exact and equal guarantee to all.\nThere Is interest and civilization at the North,\nanother interest and civilization at the South This\nmeasure equally provides for the progress and deyel\nopmont Of the Northern civilization as we'll as that\n/ Of the south He thought thu outlay would b amp\n/ iy returned Tho advance Of railroads and the\nspread OF civilization viii develops the industry Of\n/ and ssqrsndisenlent to the United States snrpas-\n/ sing all that would be accomplished by any policy\n/ that could ever be pursued by the Government.\nIN thirty years the wealth and population Of the\nUnited States will be doubled. he referred 70 the\ngreat success Of the canal in New York; connecting\nfhe great lakes with tide waters The Pecifc Rail-\n/ RUGi was no sectional work. but great national\nenterprise which if completed, will extend ,Ameri-\ncan principles over the Pacific coast and the Asiate"", 'The CONFEDERATE LoAN-At meeting of repre-.\nsentatives from all the Banks of this city, held a,\nthe Planters and Mechanics Bank, on Wednesday\nlast, the Sd inst, il was\n\n\n""ResolUed, That the representatives of the Banks\npresent at this meeting, will recommend to their re\nspectiye Boards to redeem, on the demand of the\nConfederate Government, in coin, their bills, which\nmay be received inpayment for subscriptions to the\nConfederate Loan in South Carolina, agreeable to\nthe terms and proposals of the Secretary of the\nTreasury set forth in his Circular to the several\nBanks of the 9th of March, 1862\n\n\nAt an adjourned meeting held Friday afternoon,\nreports were received from all the Banks that tney\nhad sceeeded to the foregoing resolution.\n\n\nWe learn from good authority that ai,noagh .n no\nBanks of this city win probably take among them,\nat least one million Of the proposed loan-Cnares-\nton Courier, AprR 6.', 'FnAEclAL.--0n the 10th ut the Second Board In\nNew York, Missouri Stocks went down to a. viz\nsinia to ~, and Tennessee to 49, Exchange in Chi\neago same date Was II per cent In this city on\nSaturday II went II 10 to IL. Illinois Banks bassd\non Southern Stocks are decidedly 1t discount Just\nnow, and more OF those taken 1t present will prob\nably 50 soon.\n\n\nWAn MEETING AT FT. mADIsON.\n\n\nFoHr MADISON, April 10.\n\n\nkDroa Cars CirY. A. reminded By the\ndats Of this that to-day l. the snnivsrsary\nOf tho 6rst battle Of the Revelation, and II\nyoa had been here last night, you wosld\nhave thought those glorious old times hsd\ncome back, and that patriosisn had con.\nplstsd one Of iss grand cycles and was sow\ntosehiDg III ssarest point 70 tho central 10.\nninsry from which il derives ito life and iss\nheat.\n\n\ni va quietly talked around yesterday\nthat vs would have meeting last night. A\nlev nodsst bills we\'re posted during the a.\ntsrnoon, and By the time the hour Of .ssandls\nlight"" had fully cons the court house waa\ncrowded 70 iss foll capacity. Judge visls\ncalled the meeting to order and nominated\nFred. Hesssr, Esq, to preside. l. II. Knapp\nand v. "". Winssrboshan were named vioe\nPresidents, and 9. Il. Albright and NJ. v.\nAbby were chosen Secretaries.\n\n\nMr.. uesser briefly stated the object Of the\nmeeting - being to take such aoton e be.\nGame loyal citisens to give support to thu\nGovernment 10 enforcing the laws, suppress.\nIng rebellion and Furnishing treason.\n\n\nA committee Of 10, Of which Mr.. r. W\nAlbright was chairmsn, vas raised, to pre-.\nsent resolutions expressing the sentiment.\nand will OF the meeting.\n\n\nTbs resolutions we\'re very strong. They\ndeclare il 20 be the duty Of all good citizens\nin times like the present, to stand. by th,\nconstitutional govsrnment regardless Of\nthei. onininns ""a .hs-sslsSS-sss- inc = M\ntional tros6ies and irrespective OF past pc\nlitical differences. They endorsed the Cali\nfornia resolutions against tho right Of %\nssssion and Affirming the duty Of the Gov\nsronent TO maintain its integrity. Tho,\npledged the snpporters Of the sssolusiess 1,\nstand BY the country right or wrong, an\ndeclared IN intention not to tolerate tfeaso,\namong us, either in 0ord Or deed.\n\n\nThere ware no long speeches, but thsr\nvse much good strong talk 70 tho effect the\nthe time for discussion, concession and com\npromise had passed, and ""now il the sim\nfor action""', ""NASHVILLE, Oct. 23-The Bowling Green cores\npondent of the Union and American says that\ngentleman who left Louisville on Saturday, re-\nports that the Lincoln troops between Louisville\nand Non are 5000 strong.\n\n\nRousseau's forces are mainly from Ohio and\nIndiana, among whom considerable dissatisfaction\nexists, owing to the Indifference manifested as to\ntheir success.\n\n\nThe Cincinnati Commercial of the 10Th learns\nthat Fremont would be removed on the 22d. The\nsame journal names Gen. Hunter as his successor.\n\n\nThe Cincinnati Gazette says that Fremont is re-\nmoved by order of Lincola.\n\n\nThe Pacific telegraph line was opened on the\n18th to Great Salt Lake City.\n\n\nThe FederaIs claim brilliant victory in recent\nskirmish at Harper's Ferry.\n\n\nThe Washington correspondent of the New York\nPost asserts that foreign capitalists have offered\nSecretary Chase to take 500 600 of the United\nStates loan at s..\n\n\nmessenger from Fremont's headquarters at\nWarsaw, reached Syracuse on the 18th. He re-\nported that Price had made stand in Cedar\ncounty, twenty-five miles from Osceola, with\n$4,000 well armed and disciplined troops, and a\nlarge force of militia. Fremont had begun pre-\nparations to lay pantoon across the Usage, and\nsupposed the army would cross during the night\nof the 18th. He intended to push forward and\nforce Price to fight or retreat.\n\n\ndispatch from Ironton, dated the 17th says\nthat no other bridge than that across Big river\nhad been interfered with on the Iron Mountain\nRailroad. The rebels are known to be near the\nrailroad.\n\n\nThe rebels are reported in large force twenty.\nfive miles below Ironton, but nothing definite is\nknown as to their numbers and designs.\nA dispatch from Indianapolis of the 18th reports\n| that more troops are moving into Kentucky. It is\nsaid that the Federal Government will lose $50 900\nby operations Of Col Young, of the Kentucky Cav\nairy, who is now in Jail in indianapolis. He intro\nduced several new rascalites for the purchase OF\nhorses.\n\n\nBland Ballard has been appointed U. S. District\n| Judge of Kentucky, vice Monroe.\nMovements of the Federals in Kentucky.\nNASHVILLE, Oct. 23.--The special correspondent\n| of the Banner, at Bowling Green telegraphs or\nthe 22d that Cen Rousseau, with 5000 or 10, ,OOC\nmen, has advanced to Bacon Greek, eight miles\n| from Green river bridge."", 'HeraldeorrespOndence The Border State Com\nmittees plan of adjustment appears TO have at\nfirst met with considerable favor, and it was\nthought likely that the Presidentwould commend\nIt to the attention of Congress but the caucus OF\nRennbIicans after fi,ll and free discussion upon\nthe merits Of the Border Stale programme, decid\ned adversely to any and all compromises what\never and agreed simply 10 press forward the reg\nuiar business of the secession, and then adjourn\nsine die.\n\n\nAt meeting Of the House Committee on the\ncrisis Yesterday, Mr.. Hamilton, of Texas, sub\nmitted q proposition in favor of calling Nation\nal Convention Ofdelegates fresh from the people,\nwith a view to amending the Constitution so as\nto meet the requirements of all sections OF the\ncountry.\n\n\nThe Representatives from Charleston represent\nthe condition of affairs there as deplOrable. The\ntroops ordered into the field by the Governor are\nsaid to be suffering severely from the exposure\nincident TO their new mode of life and mnch sick\nness prevails among them while the merchants are\nwithout business and the mechanics without\nwork.\n\n\nStrange as it may appear am now to- tell you\nthat the President elect has given carte bdHeh to\nSenator Seward and ThurlOw Weed to agree up\non any plan of settlement that New YORK and\nPennsylvania can stand together\n\n\nHon. c. g. Clay, Jr. of Ala, has arrived here\nHis presence is esteemed a favorable omen for\ncompromise and peace.\n\n\nThe Navy Department received dispatches this\nmorning from the commander of the Pacific\nSQUADRON, and also communicating intelligence OF\nthe probable loss of the slOop-Otwar Levanti\nwhich had not been heard from for 100 days. She\nwas on her WaV from the Sandwich Islands', 'Saturday Nights Report.\nHONORs TO MAI. ANDERSON.\nsLooP OF WAR BROOKLYN NOT YET\nORDERED TO CHARLESTON.\nTHREATENINGs OF TILE CHARLES\n\n\nT0NIANs.\nSUNDAY WORK Ar CHARLESTON.\nUNION MEETING AT PHILADELPHIA\n\n\nDISTURBANCES.\nSHALL SOUTH CAROLINA BEGIN\n\n\nTHE WAR;\nCharleston COnventiOn----CorrespsH\nBetween the Commissioners and\n\n\nPresident.\nSPEECH OF Mr.. SEWARD on THE\nPACIFIC RAILROAD.\n\n\n~ -\nTroops FROM LEA TENWORTH\n\n\nFROM AUBURN.\n\n\nAUBURE, Jan 8.\none hn dred guns were fired in this city this\nevening honor Of 1lai. Anderson\n\n\nNEW YORK ITEMS.\n\n\nNEW YsRK, Jan S.\nhe g amer star of the West was coaled up\nve,tsrda with unusual celebrity and report which\n[. rdicuirf at the Ofice Of the Co, says she N\n{, ing to CIarles.op with troops\nRev. HenrY Anthem died in this city this morn\nGOn. Wm. Keut died al Fishkill this morning.', 'NV YORK, April 10.\nA dispatch from Wilmington, Del, 10 The\nIribaDs, says II 10 Informed bys meYchant\nespsaiD direct from Pensaoola, that Pickips\nnoW c0&tajns 800 men, with seven yessels\neosei1M = large number OF Southern troops\nafri1ol ~ Saturday.\n\n\n11eee ~ still nApy Union men st the\n0eeak The American Gag WAS rAised ID\nneoiIe last Saturday, but Was immediately\n1oga l>Wp.', 'To the New Orleans city Papers OF the 9th.l\n\n\nRICHMOND, April 6.-In the State\nConvention to-day, in committee of the\nwhole, several petitions asking for the\nimmediate withdrawal of the State\nfrom the Federal Union were presented.\n\n\nThe report of the Committee on\nFederal Relations was then taken up,\nand the ninth resolution was adopted.\nThe eighth resolution, slightly altered,\nwas also adopted.\n\n\na resolution also passed the Commit\ntee providing for the appointment of\nthree Delegates TO wait upon and ask\nthe President what policy he means to\npursue towards the seeded States. The\nresolution was subsequently reconsid-\ncred amid some excitement, when the\nConvention adjourned till Monday,\nhoping in the meantime that calmness\nwould succeed to passion.\n\n\nVolumteers for Confederate States.\n\n\nMONTGOMERY, April 9.-A call from\nthe War Department will be made\ntonight on each of the Confederate\nStates, for three thousand volunteers,\nexcepting Florida, which will be called\non for fifteen hundred.\n\n\nInteresting from, NeaO York-Ihe ILL.,\n\n\nmois Completely Fitted Ont. -.\n\n\nNEW YORK, April 8.-Tbe chartered\nsteamer Illinois took 1900 barrels of\nassorted stores, 500 cases of muskets,\n2 parks of artillery, large number of\ngun carriages, large quantity Of\nammunition, and $4,000 in specie.\n\n\nShe sails tomorrow morning.\n\n\nLater from Neac Merico,\n\n\nINDEPENDENCE, April 9.-The New\nMexicap mail, with Santa Fe dates to\nthe 25fh nlt., arrived here to-day.\n\n\nFort Marcy has not been taken, as\nwas previously reported. A treaty of\npeace had been concluded with the\nNavajoes,\n\n\nAt Santa Fe, business was decidedly\nbrisker.\n\n\nFugiti0es Off for Canada.\n\n\nCHICAGO, April 8.-One hundred and\nsix fugitives left last night for Canad da.\n1t is estimated that over one thousand\nfugitives have arrived here since last\nfall.\n\n\nDETROIT, April 8.-About three\nhundred fugitives, principally from\nIllinois, passed here into Canada since\nSaturday. Large numbers are report\ned on their way.\n\n\naid for The General GoUernment.\n\n\nHARRISBURG. April 8.-Governor\nCurtin will tomorrow recommend to\nthe Legislature an appropriation of\n$4,000 for the purchase of munitions\nof war. He thinks it IS the duty of the\nState to assist the General Governments\n\n\nNa0igation Of the ohio.\n\n\nLOJIsFILLE, April g. The Ohio\nriver, at this point, was still rising this\nevening, with 8 feet of water in the\ncanal.', '""A good sign is this. In the House of\nRepresentatives, On the 9th, Mr.. MORRIS, Of\nPennsylvania, said ""Mr. Speaker.-I\nask the unanimous consent of the House,\nfor leave to present the memorial of two\nthousand two hundred and eighty-nine citi>\nzens of Philadelphia Of whom, with the\nexception Of two, voted for Mr.. LINCOLN for\nPresident of the United States-in favor Of\nthe CRITrENDEN propositions, or some such\nproposition as will settle the existing diff\nculties in the country"" The memorial was\nreceived. rs as 2f5ta 54 10,\n\n\n- The National Antislavery Standard is\nin ecstacies over the dissolution of the\nUnion. Abolitionism has triumphed, and\nthe Standard rejoices that the great Re-\npublican army has come up to do the work\nwhich Abolitionists had been for so many\nlong years cutting out. Listen to It\'s ex>\nultations: s lGa g0al\n\n\nFor the last ten years, yea, eleven next 7th\nOF March, the Hunkerdom of the North has\nbeen engaged in constant effort to save the\nUnion. The Abolitionism of the North has\nbeen all the time busy in the opposite direction\ntrying to break it up. Well, we have beaten,\n1t is nothing odd that they should rage and\nimagine strange things. Nobody likes to be\nlicked. That is just what they are. Let us be\npatient with them, and let them expend their\nfroth and fury. Better times are at hand, and\nall the nearer the worse they behave. One\nthing is certain, the Union is dissolved.\n\n\nThese are the men into whose hands the\nhonest masses Of the Republican party have\nbeen playing. The Abolitionists were the\nadvance guard Of the Republican party. Is\nit net time, in view Of the above from the\nStandard. that conservative, union. loving\nRepublicans should turn a short corner,\nand repudiate the lead of the A bolitionists,\nwho exult over broken Union\n\n\nThe Columbus (Mississipp) Southern\nRepublic publishes the following to show the\ndifference between the prices Of beef in the\ncapital of that State and the prices in New\nYork, to wit: saa\n\n\nNEW YORK PRICES.\n\n\nChoice steaks. .18c. @20c.\nhOaSting pieces. .lZc. .0Dl0c.\n\n\nCOLUMBUS PRICES.\n\n\nChoice steaks. .l0c.\nRoasting pieces. ............... &c.\n\n\nYhis does not look as though the people\nof the new Southern Confederacy were on\nthe verge Of starvation, when in Mississippi\no pound of cotton will get a pound of choice\nbeefteak.\n\n\n- The Legislature Of New Mexico has\npassed an act for the election Of delegates\nto form State Constitution, which is to\nbe held in May next. The delegates are to\nul:.L']","Ah, welcome to my humble town! It’s always a pleasure to share news and thoughts with someone fresh to our neck of the woods. You know, there’s been quite the stir regarding sentiments about the Union, particularly tied to a public meeting held in New Jersey. 

Just recently, a resolution from a meeting in that state advocated for keeping the Union intact, a notion that resonates strongly among many here. They fear the unrest that could unravel our nation, and I reckon they intend to rally support to uphold the Constitution. It shows that while some folks speak heatedly against the Southern secessionists, others are wary of the increasing tensions and want to push for a united front.

Now, I can’t ignore the telegraph reports pouring in from New York City, either. There’s this chatter that the people down there might have turned their backs on supporting the Union. But you see, the sentiments reflect a mix of concern and resolve. Many within the city, including the gentleman who spoke to our local paper, claim these reports are exaggerated. He tells us there are indeed good, steadfast citizens in New York who are waiting to spring into action for the sake of the Union. 

When you read about the seven-mile-long Union procession from the city, that was no small affair. It symbolizes the true spirit of New Yorkers who wish to stand against the tide of treason and support our government. We can't just take every report at face value, as anxieties can lead to misunderstandings, don't you think? So, perhaps, while some may doubt, others are still ready to stand firm for the Union. 

I find it heartening to see citizens actively discussing these issues, whether in public meetings or gatherings. It speaks to our times—of passion, uncertainty, and a fierce desire to remain united. Let’s hope such resolve continues to flourish!","The public meeting in New Jersey, presented by Mr. Thompson, was significant as it aimed to sustain the Union during a time of division. It was laid on the table, indicating a moment of deliberation in Congress. Meanwhile, telegraph reports from New York suggested a surprising level of support for the South, which was met with skepticism. The reports claimed that many citizens had turned against the Union, but there were assertions that these reports were exaggerated. The New Orleans Picayune expressed disbelief in the apostasy of New York citizens, highlighting a strong Union procession that demonstrated the commitment of the city's populace to the Union, countering the narrative of division.",,0.0,0.8260281385178131,1.0
"How did the election of Lincoln influence the military strategies and morale in Kentucky, particularly regarding General Zollicoffer's actions?","['st. Louis Municipal Election.-Ou,.\ndispatches (says the True Delta of tho\n9TH inst.,) have already advised that\nat the municipal election in St. Lonis\nlast Monday, the Black Republicans.\nwho carried the city on the 9Th Novem\nber by a considerable majority, were\ncompletely routed, by the combined\nefforts of all those opposed to the Sec\ntional doctrines of Lincoln and his\nparty, and in favor of the Union and\nthe maintenance of the laws Of the\nconstitution. The Republican thinks\nthe last nail has been put in the coffin\nof Black Republicanism there, and\nadds\n\n\nThe election is over, and the peop)e\nhave triumphed. We have beaten the\nBlack Republicans and their co -laborers\nat all points. We have driven them\nout of the city hall, and out Of the\ncity. We have beaten them on a fair\nissue, and when they had forced their\nstrongest man to offer himself up as q\nsacrifice for them. We have placed\nSt. Louis where she deserves to stand.\nand where she would have stood lone\nago bat for adverse infuences-in\nharmony with the State and in hos\ntility to Black Republicanism every\nwhere. We have taken position\nagainst Lincolnism, and against that\nmalignant theory Of the North which\ndeclares perpetual war on the slave\nStates and their institutions. We have\nrelieved ourselves from the terrible\nincubus which has been resting upon\nus-paral yzing our energies, destroying\nour commerce, shutting up our manu-\nfactories, stopping all our machine\nshops, and depriving labor of its just\nreward. All this has been done by the\npeople-not in passion, not as partizans,\nbut as citizens having stake in this\ncommunity, ledging their loyalty\nto the Union, md determined to main\ntain a position where they could assert\ntheir rights under the constitution, at\nall hazards.\n\n\nThe vote for Mayor stood-Taylor\ndemocrat II ,163; How (Black Repab-\nlican) 8,499.', ""Gen. Zollicoffer though said to have retreated\nis yet at Cumberland Ford with his main force\nwhile his advance is in Laurel county, at LoudOn\nand in that vicinity, ravaging the country and\ndriving the people from their homes. We are in\n\n\nformed on good authority that he has not more\n\n\nthan from four to six thousand men, and it seems\n\n\nto us that he can be driven out of Kentucky before\n\n\nhe devasates the whole mountain region. Shall\n\n\nhe be permitted to remain in our State until REIN\n\n\nforced and enabled to march upon Lexington,\n\n\nFrankfort, Louisville and Cincinnati? Why delay\ntill the enemy is strengthened in numbers and in\n\n\ntrenched on our own ground?\n\n\nWe have all confidence in the military author\ntiles TO whom the guardianship of Kentucky has\n\n\nbeen confded. We know, however, that they are\n\n\nanxious to obtain all the information they can and\nwe take the liberty Of suggesting TO them that in\npassable. especially between Crab Orchard and\nMount Vernon. No teams can then draw loaded\nwagon over the roads. There is no turnpike or\n\n\nthe mountains, and the mud and the rebels will\n\n\nbarrcade the route and prevent the extension o\n\n\nany succor to that region, the best and most\n\n\npatriotic portion of our State.\n\n\nAll imprudence should OF course be avoided\n\n\nbut we confess to the utmost impatience whilst\nIollicoifer, Buckner and Polk are upon the soil Of\nKentucky, stealing and maraudlng in all directions,\n\n\nwinning feeble Union men to their side by promises\n\n\nof protection, and arresting others and requiring\n\n\nthem tc swear allegiance to the Southern Con-\nfederacy. Are the thieves, robbers, ravagers,\ndesolators to be permitted to winter in Kentucky\nWe learn that the rebel Buckner entered Browns\nvile, the county town of Edmundson, on Thursday\nlast, and by proclamation ordered that the taxes\nshould be paid to the Southern Confederacy Mr..\n| Lemonte Brun the Sheriff, took his books, papers,\nvouchers ETC., and sought refuge with General\n! Buckner he has since enlisted with Capt McCul-\n| och's Mounted Rangers, and will go back in time\n\n\nto raestabIsh his office and secure what he has left\n| behind. Old father Harold, worthy minister o:\n| the Methodist Church, who has seen two genera\ntions of war, has enlisted in the same company\n| and promises to give good report of himself. All\nalong our lines, the men are impetuous for an ad\n\n\nvance, and before many days the expectation is\nthat they may be gratiiied There is no idea OF a\nbackward movement in the vicinity OF Green river.\n\n\nForward is the word eagerly expected, and it will\n\n\nbe readily obeyed.\n\n\nThe 'Maysville. Eagle learns that a secessionist\nnamed Martin, who was wounded in the skirmish\n\n\nat Grayson, believing himself to be dying, con\nfessed that his party on their way to seces\nsion camp near Prestonburg, under command OF\n\n\nJohn S. Williams, the defeated Congressional can"", 'France, it is very clear, will give our\nrebels no such aid and comfort as they\nhave received from the British ministry\nand British newspapers. Though the\nimperial government has not yet specif-\ncally set forth its policy, all accounts\nagree in representing that its spirit is\nmost friendly toward the Union. The\nvery fact that it did not initiate the hot\nhaste of the English cabinet in accor-\nding belligerent rights was in itself\nstrong evidence that it was more I\'M\nfavorably disposed to the \'\'confede-\nracy."" It was an advantage for the\nsecessionists that the federal minister\nat the imperial court thoroughly SYM\npathized with their views, and was.\nready to promote their interests just so\nfar as his position would permit. 1t\nmay be that Mr.. Faulkner said no word\nand did no act positively treacherous,\nbut his general influence Advent toward\nproducing a belief that disunion was\nan accomplished fact-a belief which,\nwhen once thoroughly established\nabroad, must of course greatly effect\nall the foreign policy But the French\nemperor was not betrayed Into ANY\npremature judgment of the case; and,\nin Mr.. Faulkner\'s parting interviews\nwith him, he did not neglect the oppor-\ntunity to give utterance to his ardent\ndesire and hope that the sectional strife\nmight be bealed, and in fact he made\na direct proffer of the friendly offices\nof France to bring about reconcile\nalton. The French press has almost\nunanimously espoused the cause of the\nfederal government, and has treated\nthe whole subject.with moral breadth\nthat has been in marked contrast to the\ncontracted, materialistic, cotton mufiied\nhandling it has Hreceived 2 from sthe\nBritish journals, We may set down\nas a settled fact that all the sympathies\nOf France and NO nation in. the world\nhas more generous sympathiesEare for\nthe stars and stripes; and that, instead\nof embarrassing our operations against\nthe rebels, she viii give all her influence\nfor the speediest restoration of our\nnational tranquility. is.as-\nOn its face it is strange enough, that\nof the two Acknowledgment and\nFrance-the one of kindred blood to\nus, of the same language, and the same\nreligion, and the same system of COM\nmon law, and similar principles of\npolitical freedom, should he against us,\nand the one of alien blood, different Lam\nguage, different religion, q different\njurisprudence and different rule, should\nbe, for us-that the nation which origi-\ns,allywas Understandable fastening\nslavery upon us, and afterward made\npeculiar professionsof hatred to slavery,\nshould be the nation first to turn against\nrs when slavery seeks to assassinate\nus, while the nation which had no res\npossibility in the premises should be\nThe one to befriend MS. i it be said\nthat England has large material in\nterests involved, so has France. France\nmanufactures and consumes American\ncotton as well as England, and has no\ncolonies, like England, from which to\ndraw a,future supply. If it is an OBJ\nject for England to have free trade for\nher hardware, and woolens and linens,\nit is also quite as much an object for', ""Louisville, April 10.\n\n\nGov. MaEoi6n il here trying 70 get tho\nbanks to lend million dollars 20 arm the\nState for defense. 1t 10 supposed that some\narrangement will be made.\n\n\nThere VAS an immense Union meeting\nhers last night. Speeches were made BY\nGuthrie, Nicholas, Bullock and Brown\nResolutions were spontaneously adopted, de-\nclsring that ~ the Confederate States COM\nmenced the var with tho Federal Govern\nmsnt, Kentucky has . right to choose aer\nposition, acknowledges no Loyalty till the\n0overDncnt becomes tho aggressor, opposes\ntho call OF the Governments for volunteers\nfor coercion, and the raising Of troops hero\nto 90 cooperate with the Southern Oonfedera-\ncy, when tbs acknowledged intention OF the\nlatter 10 to maseh on Washington; that So\ncsssion 10 . remedy for no svili; that Ken\nlucky Won't take her part agsinss che Fed\nsrAl Government; that Ksntucky should\nmaintain IN independent position within tho\nUnion against che ADMINISTRATORS and the\nseeded States, declaring her soil sacrsd\nagainst the hostile tread Of either, and that\nKsntacky be armed 10 aocsfdanes with the\nlaw."", ""MAGoYrIS. of Kentucky, has been attempt\ning 10 make capital out Of his foolish idea\nthat the Border Free States will join Ken\ntlcky in the capacity of nediafors between\nthe General Government and the Confederate\nStates The Government does not recognize\nthe Confederate States as anything else than\nan organized rebellion The loyal States are\npart Of the Government, and cannot assume\nany Independence of it. The idea that they\nviii assume any such Independence. for the\npurpose Of mediation, is ridiculous. IL is\nonly one remove from the other reasonable\nlea OF armed neutrality. BERIAH ought T.\nresign, enlist IN DrScAS's regiment, anu\nmarch South, where he belongs. He seem'\n70 be afraid TO come to Jacksonville or Gin\ncinnati even 20 discuss his plans."", ""L,u.vrLLx. DC, 2g.-Ths Louisville Courier,\npublished at Nashville and issued irom Bowling\nGreen. says: si..s -. -, -\n\n\n. RicHnDsD. Oct. q The track Of the. Alex.\naudria Railro,d has been torn up from Fairfax\nCourt Hsuse 70 Manassas. /\n|, Breckipridge. Reslon and Humphrey Mar\nshall arrived st Richmond on the 2ist, and were\nreceived with the greatest cordially and enthu-\neiasm. -er4\nGen. John Grsyson. commanding the. FIori-\nds forces died at Tsllahasse. ,.4 III 7.\n\n\nGov. MO9re. Of Louisiana, has issued sn or\nder requiring all persons leaving New OdeanG\nand Jefferson Point On steamboats, for Memphis\n20 get passes IRON the Execudse oficcrs.\n\n\nGen. Tnomas's Official account Of the Will\nCas affsir ss,s the forces uere nearly equal\nand the Fsdssal troops repnIsed tbs eneny win\ngreat loss 70 the rebels and bus lit'ls 10 n.\nkederal3.e i1s57 = AZ"", 'To The Editors Of the Dtspatc! -\'\'s-\ncent election shows large Soushe\'. -\ngain III the Safe. ! think the enoi.-\n\n\nbill has produced great many chaltes\n\n\nsincerely believe that = large majorH =,\npeople OF the State are willing that theA\nerty should be sacrificed at pubic ss\'\', ~\nder 20 enable them 10 pay ths tax aNa - ;\nthere is IL large majority IN the STATE \'s.,\ntake up arm. against the Soalh Il u\nforced TO take sides IN tins uhh""P 4\nChristian county, county oordstlut 80 u,\nnessee, has regiment OF eleven nv 2.\narmed by lac Lincoln Government\nMANY Of taon natives OF virginia, -\nare not native born iirginians\ntheir snees tors 10 be. Yet those me- me-, NJ >\nthey are ready 10 aid the GoSeFhllse| mac.\nDUNG this rebellion"" Jas they pt\'\'\'.,a =,\nin the seeded States, and some oi - nl\nture so far rs TO say that they "",S,sreI\nevery man, woman and child siau. t,nr,\nthe South. that the Laws and Inc we\nton that the usurper Lincoln nas\nviolated may be sxecu ed in every -.\nMaiue 70 tIaliforn Ia; and there are 90\nin this county where SecessiohisS ,tl \\\nlowed to express their sen timehts, .ac!\nthat tho day 10 not far distant ""nsA ,h,y y\nevery man may sec ths errors \'hs. ses,\nbeen committing, and AWAKE 20 d 80\ntheir duty, and rally around the pst II\nSouth. While IL Is with deep Tvs vs. IN.\ngive you the feelings Of a majority ~ ora\npie of Kentucky. am happy "" ""a j\nthat there are great iaahy, .r%uu.\nminority. who are ready "" faiiy la\nbanner, and IL is my sincere pl~yrdie.\nmay waive VIGOROUSLY in every la\ndid on the memorable 2st os I\'D\n1AnaxsaS. XIV', ""NASHVILLE, Oct. 23-The Bowling Green cores\npondent of the Union and American says that\ngentleman who left Louisville on Saturday, re-\nports that the Lincoln troops between Louisville\nand Non are 5000 strong.\n\n\nRousseau's forces are mainly from Ohio and\nIndiana, among whom considerable dissatisfaction\nexists, owing to the Indifference manifested as to\ntheir success.\n\n\nThe Cincinnati Commercial of the 10Th learns\nthat Fremont would be removed on the 22d. The\nsame journal names Gen. Hunter as his successor.\n\n\nThe Cincinnati Gazette says that Fremont is re-\nmoved by order of Lincola.\n\n\nThe Pacific telegraph line was opened on the\n18th to Great Salt Lake City.\n\n\nThe FederaIs claim brilliant victory in recent\nskirmish at Harper's Ferry.\n\n\nThe Washington correspondent of the New York\nPost asserts that foreign capitalists have offered\nSecretary Chase to take 500 600 of the United\nStates loan at s..\n\n\nmessenger from Fremont's headquarters at\nWarsaw, reached Syracuse on the 18th. He re-\nported that Price had made stand in Cedar\ncounty, twenty-five miles from Osceola, with\n$4,000 well armed and disciplined troops, and a\nlarge force of militia. Fremont had begun pre-\nparations to lay pantoon across the Usage, and\nsupposed the army would cross during the night\nof the 18th. He intended to push forward and\nforce Price to fight or retreat.\n\n\ndispatch from Ironton, dated the 17th says\nthat no other bridge than that across Big river\nhad been interfered with on the Iron Mountain\nRailroad. The rebels are known to be near the\nrailroad.\n\n\nThe rebels are reported in large force twenty.\nfive miles below Ironton, but nothing definite is\nknown as to their numbers and designs.\nA dispatch from Indianapolis of the 18th reports\n| that more troops are moving into Kentucky. It is\nsaid that the Federal Government will lose $50 900\nby operations Of Col Young, of the Kentucky Cav\nairy, who is now in Jail in indianapolis. He intro\nduced several new rascalites for the purchase OF\nhorses.\n\n\nBland Ballard has been appointed U. S. District\n| Judge of Kentucky, vice Monroe.\nMovements of the Federals in Kentucky.\nNASHVILLE, Oct. 23.--The special correspondent\n| of the Banner, at Bowling Green telegraphs or\nthe 22d that Cen Rousseau, with 5000 or 10, ,OOC\nmen, has advanced to Bacon Greek, eight miles\n| from Green river bridge."", 'THE LINCOLN GUN BoATs.-The Kentucky COR\nrespondent of the Nashville Union, referring to the\n\n\nFederal gun-boats, says:\nThe gunb boat Conestoga was at Henderson last\nSaturday, where she remained until Monday after\nnoon, repairing wheel which had been disabled\nin an engagement with the land-batteries near Co.\nlumbus. The Conestoga was formerly tow-boat,\n\n\nhaving been used for several years in conveying\noalbarges from Pittsbuig to New Orleans, and is,\nat best rotten bulk. Since being converted into\na gun boat not much change has been made liz\nher appearance; the cabin has been cut off, the,\nmachinery placed in the hold, and the hull casad\n\n\nwith iron.\n\n\nUpon either side are four port-holes and mall\nshe mounts but five guns and two mortars. The\nguns placed, one at the stern, pivot gun, four\nat midships, capable of giving broadsde, and the\nmortars portable to any.portion of the boat Their\ncaliber is one Ga, two 30 and two 24-pounders. An\n\n\nidea has been formed, and obtains, that these gum\n\n\nboats are terrible engines of destruction. To re-\nsist the force of cannon ball, they are hut little\n\n\nbetter protected than is the ightess draught freight\n\n\nboat on the Cumberland river. The pilot-hous\n\n\nhas been removed behind the wheel-housas, and is\n\n\naltogether unproteeted the engines are in the,\n6 hold"" with the cylinder on level with the\ndeck, altogether unshelded They are all siml-\nlarly constructed, and have never yettpresented\nthemselves in proximity to battery without being\ndisabled', 'being quite brisk in the States of Ohio, Illinois\nand Indiana pable appeal having been made\n| to their fear of invasion from the Confederate\n| forces. Few enstmeats, however are made by\n\n\nkentuckans in the northern counties, most of those\nwho enter service coming from the central portion\n| of the State.\n\n\nWe are further informed by the same gentleman\n| that Hon. r. II. Stanton, formerly member of Con-\n\n\ngress from the Maysvllle district, arrested last\n\n\nweek, account of his alleged secession proeliy-\n| ties, and sent forward to Columbus, Ohio, where\n| many others confined for similar offense.""\n| Hundreds of loyal Southerners in Northern Ken\n| lucky daily making eff,rts to come through,\n| but are watched so closely as TO render their pas\n\n\nsage South very dangerous and difficult\n| Memphis appeal.']","Ah, welcome! It’s good to see you here. There's much to discuss, especially about the state of affairs in our beloved Kentucky since Mr. Lincoln took office. You know, the man’s election has stirred quite the hornet's nest around here.

You see, I reckon that Lincoln's election has set our military strategies and morale on a rollercoaster ride. After he took office, there was a substantial shift in sentiment. In our state, many folks initially felt an allegiance to the Union, believing it could stand firm against rebellion. But Lincoln's decisions—especially calling for troops—have pushed some to the brink. These calls have bred resentment among certain citizens who see such measures as aggression, especially in places like Louisville, where there's talk of a sizable Union meeting taking place just the other night.

As for General Zollicoffer, well, he plays quite the pivotal role in this unfolding drama. Reports suggest that he’s lingering at Cumberland Ford, with his men raiding and driving locals from their homes in Kentucky. Some folks are saying he’s got maybe only four to six thousand troops—nothing that we couldn’t potentially drive out if we muster our forces correctly. Yet, his presence stirs fear; he’s a figure who threatens the very fabric of our communities. There are calls for immediate action to prevent him from solidifying his hold.

You must understand, though, the situation is fraught with tension. Many are eager to advance and see Zollicoffer expelled from our soil, as patience is wearing thin. The men around here are rallying; their spirits are high, driven by a fierce desire to protect their homes and prove their loyalty. It makes me think of the newspaper articles that lament the federal troops' indifference; they stir frustration among the ranks, leaving us feeling a bit vulnerable.

What further complicates matters is how divided we are. For some, Lincoln symbolizes hope and unity; for others, he brings forth the specter of tyranny. Regrettably, the schism seems to deepen every day. With some Kentuckians wanting to align with the South and others determined to uphold the Union, I can't help but worry about the days to come. 

I must also say, the absence of a clear military directive from Washington is wearing on us. We need solid strategies and reinforcements to take a stand against Zollicoffer before he gets the chance to solidify his growing influence in our state.

So, as you can see, the election of Lincoln leaves us grappling with uncertainty and fervent passions—both for and against the cause. I only hope our leaders can navigate these thick waters and guide us toward a prosperous path, for the sake of Kentucky and our nation.","The election of Lincoln was seen as a necessary change to address the perceived corruption of past administrations, which influenced military strategies in Kentucky. General Zollicoffer's presence in Kentucky, where he was reported to have retreated but still posed a threat with his forces, was a concern for Union supporters. The impatience of Union men for an advance against Zollicoffer and other Confederate forces reflected the heightened morale and urgency following Lincoln's election. The belief that Zollicoffer and his men were stealing and marauding in Kentucky galvanized Union sentiment, leading to calls for action to prevent further devastation of the region.",0.96875,0.0,0.8124999999796875,1.0
What warnings were issued regarding the Federal army's intentions and how did they relate to the morale of the Southern forces?,"[""sseldIers In Peace Citizens In War,\nNoRSHERs Pluck FULLY TEsrED-A NORTHERs\nVILLAGE Thrown INTO INTENSE ExcETENENT.-f oul\nNorthern neighbors of the old Confederacy could\ndemonstrate their courage by the threats which the\nBlack Republicans are continually venting against\nUS poor Southern rebels and traitors then, in\ndeed, would the world be compelled to recognize\nthem amongst the most valiant men of the age\nBut, they are not the men to face danger when il\nactually occursthey fight well on paper, but they\ncertainly don't ike to smell gunpowder. or to face\nSouthern steel and bullets.\n\n\nIn the village Of c., in New Jersey. not hun\ndred miles from New York, is a nest of Republicans\nof Greely stripe who have almost split their hroats\nin denouncng the Southern treason, and in declar-\ning their intentions to aid Mr. Lincoln in enforcing\nthe laws, and retaking all the Southern Forts' On\nthe day of Mr.. Lincoln's Inauguration they became\nvery jubilant, and were blating their predictions\nIa Greedy that in thirty days the Southern rebles\nwould be brought 20 their senses, and would be\ncompelled to beg on their knees for quarters, and\nthey were ready at any time to go and help whip\nthe unruly Southern rascals.\n\n\nA good Democrat, who sympathies very strongly\nwith the South, concluded he would play little\ntrick upon these valorous Republicans and put their\ncourage to the test. Early one morning strange\nindividual was going through the streets OF the\nvillage, who served notice each and all the male\ncitizens subject to military duty. The notice ran as\nfollows\n\n\nTRENTON, N. j., March 9, 1861.\n\n\n\n\n\nin readiness (suhjeet 20 draft to enroll yourself in\nthe New Jersey Militia, to be called out at three\ndays notice. If you have any lawful excuse, re-\nport Immediately 10 the Quarter-master General,\nc. A. Arnold, Trenton, n, J. tG\n\n\nBy order of the Governor.\n\n\nu. C. VEsEY, Secretary\n\n\nNever was such CONSERVATION produced in any\nplace as was witnessed in said village, upon the\ncirculation of these citations. If rumour is to be\ncredited, in less than six hours there hardly"", ""were not reported.\n\n\nEastern News.\n\n\nThe Union has the following additional\nEastern news by Pony Express:\nBALTIAoRE, June 27th.--A positive order\nhas been given by the Marshal to avoid irri-\ntating the people and arrest Uuionists who\nmake violent demonstrations.\n\n\nThe U. 5. Deputy Marsha has instituted\nsearch for arms in private dwellings. a lot\nwas seized in a lager beer saloon.\n\n\nMany additional regiments of U. S. troops\nhave arrived at Washington.\n\n\nBALTIMORE, June 29th-There is a good\ndeal of quiet excitement here. Crowds are\naround the police stations and Marshals Office.\nA search at the Marshals office is going on.\nA large quantity of arms and munitions have\nbeen found secreted in the cellar and the\nwalls beneath the floor and cellar, and case\nof valuable pistols, over 5000 rifles, twenty\nfive of which were MIME were found also,\nseveral muskets said 10 have belonged to the\nMassachusetts, soldiers who were disarmed by\nthe mob on April 18th. 1t is also estimated\nthat 100000 percussion caps, 3, 100 ball car\ntridges, and C,000 long Miaie cartridges were\n| found\n\n\nThe New York IIeralds Washington dis\npatch says the rebels from Baltimore intend\ned issuing proclamation announcing the de-\n| feat of Federal troops and the capture of\n| Washington and all the officials, then tear\n| ing up the railroad and cutting the telegraph\nwires, and thus produce panic in favor Of\n| the Southern Confederacy\n\n\nGen. Banks discovered the plan Of the\nade al This point has been permanently in\nstituted and has caused the Mobile mail boats\nto discontinue.\n\n\nThe same paper intimates that the India,\nChina and English merchantmen will be\nrich prizes for privateers\n\n\nThe New Orleans Picayune of June 9th.\nsays United States ship of-war, eighty guns,\nis anchored off Atchatalaya, Texas intercept\ning communication, via Berwick Bay, with\n| Texas.\n\n\nGRAFTON, (Va.) Sune 27th.-Corporal Hays\nand twelve men belonging to Col. Wallace's\nregiment of Hussars while scouting on Pat\nterson's Creek, twelve miles east of Cumber-\nland. night before last encountered party\nof rebels numbering about forty sharp\nengagement ensued. Several of the enemy\nwere reported killed and number wounded\nOne of Hays party was killed and himself\nbadly wounded. They captured humber\nof horses.\n\n\nThe rebe, camp at buchanan is reported to\nhave been increased to 1000.\nWASHINGTON, June 27th.-Col Werr left\nhere several days ago for Kansas, taking\nwith him Gen. Lanes proclamation calling\non the people of the State to rally and fill up\nthe regiments, stating explicitly his purpose\nto put dow rebellion wherever it may be ex-\nhbited and to sustain Union men without\nregard to State or locality."", ""Job Hatfield, Esq, chairman of the COM\nmittee, offered the following preamble aud\nresolutions, which were read by Ballard\nSmith, Esq:\n\n\nWHEREAS, The present disturbed condition\n\n\nof this Government threatens its over\nthrow, and the-dissolution of this Union;\n\n\nand whereas concession and compromise\n\n\nwas the spirit which animated the found\n\n\ners of this Government and formed this\nisGonfederacy; anu whereas a like spirit <\n\n\nnow demanded to settle our present diff\n\n\neultieS and hand down the blessings of\n\n\ncivil liberty to future generations; and\n\n\nwhereas it is not only right and proper,\nE but the imperative duty, in times of peril\n\n\nsuch rs the present, for the people to speak\nand make their voices heard by their\nrepresentatives in National and State\n\n\ncouncils; therefore, be it @\n\n\n4 |. Resoiped, That We, the people of Perry\ncounty, here publicly renew our expressions\nOF dndiminished attachment and loyal af-\nfectioh for our National Constitution and\nFederal Union\n9. ReSot1ed, That TO preserve our Union\nand Constitution, we will cheerfully consent\n( to any concessions or compromises which\nare just, honorable and manly, and we earn\nestly call upon the people of the Border\n\n\n\n\n\nmost efforts, by harmonious and conserya-\ntive. action, to quiet the present political\ntroubles. To none of the American citizens\nis the Union more precious; to none is it\nmore important.\n\n\n3. Res0tUed, That we recommend to all\nour sister States, having unconstitutional\npersonal liberty bills or notification. laWe\nto repeal the same\nFl 4. ReSolged, That we regret the feelings\nof hostility manifested by our Southern\nneighbors against peaeeable and well-dis-\nposed citizens of this county, visiting or\ntemporarily adjourning with them Such\noccurrences only tend to provoke retaliation\nand utterly to destroy that feeling of friend.\nship which heretofore has enabled US to\nprosecute our business and social relations\nwith SO much satisfaction and mutual ad-\nvantage. The people of the South have no\nwarmer friends anywhere, than they have\nin the people of Perry county.\n\n\n5. Resolved That if by reason of the\nexisting unhappy difficulties the Union\nshould be sundered, which may God forbid,\nwe hereby pledge ourselves to the people of\nthe border States, both slave and II, e, to CO.\noperate with them in any measures that\nwill secure to US the Federal UnioR, and to\nall our citizens the rights, privileges, i'm\nmunities and liberties which we have under\nour present, noble Constitution, believing\nthat If the heart of our Nation can be\nsaved that, sooner or later, new vicor and\nstrength will be sent out to its extremities\n\n\n6. ResotVed That if no concessions and\ncompromises can be obtained, and disun-\nion shall be unfortunately made between\nthe Northern and Southern States, then the\ncommercial, manufacturing and agricultu-\nraj interests of the people of this county re-\nquire us to say that we cannot consent that\nthe Ohio river shall be the boundary line of\nnations, and we earnestly desire\nthat If line is to be drawn between the\nNorth and the South, that line shall be\nfound north of US. I..-s. .- .."", 'Special to the Tribune.\n\n\nWAsBINcTor, Oct. 28.-Genersl Scott will\nvoluntarily retire from his rank and duties with\nin the next ten days, solely on account OF his\nphysical inirmities. The recent act Of Con-\neress provided there should be no reduction 10\nbis p,y, subsistence or allowances, IN the event\nOf his withdrawal.\n\n\n1t is well knowu that Gen. Scott has bad an\nunsettled account with the War Department\nsince the Mexican war. Secretary Cameron\nhas recently gwen careful examination OF bis\nclaims, nov Ihiftee years old, JtK Davis bav-\nil brought him in debt on account Of his ex-\npeDd tures aud receipts in Mexico, and so Tar as\nthe Secretary\'s report could do 1t, disoredited\nhim as a tinauci4l agent OF the Government\nMr.. Cameron has reported that General Scott\nwas not only entitled TO the money he claimed\nof the Government, but that be saved to it mil\nlious Of dolars, which by the laws of var he\ncould have pOcktted uuder the set led principles\nregulating the distribution Of prize aud contri-\nbutton money. it\n\n\nThis opportunity of personal advantage Win\nfield Scott generously diverted to the founding\nOf home for iOvali soldiers, O0e OF the mon\numents, loue after be is dead, will be the sol\nd,ers\' home near Washington.\n\n\n% Saturday l4et the order OF the Command\nerin Chief that Gen. Fremont ehoud surrender\nhis com maud TO the Cfficer Dex below him, Gen\nHunter, accompanied by letter Of 10 .tIuctiOns\nto Gen Hunter was sent out by the President\nto Gen. Curtis, in comm md at st Louis, with\ndirections TO deliver is to Gen Ffemont, unless\nbe was actually in the presence Of the enemy,\nor preparing for battle. Ia.\n\n\nSenators Chandler Of Michigan, Wade Of\nOhio, Trumbull Of Illinois, and Wilkinson ol\nMinnesota. are here, representing to the Ad-\nministr alton that the popular demand OF their\nconstituents is that Mcclellan or sope one else\nsbalfimmediatey whip the rebels on the South\nside OF the Potomac In pitched battle, and as\nnear to Ball Run as possible, and from theme\nroll the tide Of war steadily Southwark till it\nreaches the waters Of the Gulf.\n\n\nThe Trbune staies that one Of our cores\npondents with the great naval expedition writes\nfrom Hampton Roads on Friday last that he\nhad Just been informed on good authority that\nthe Private Secretary of Commodore Dupont.\nthe Commander of the feet, had nbsconded,\ncarrying with him the maps and charts, and\neven the sealed orders Of the Commodore. We\ndo not vouch for the truth Of the report, but\nonly for the fact that the writer is worthy OF\ncredence We hope the report Is erroneous.\n\n\nSpecial to tho Heraii.l\n\n\nA scouting party Of Union troops went into\nahlhA OOukh AASuSC "" AOethco huoe\nthe rebels had not been there for many days,\nout were az far back as Centreville, and not\nstrong even there.\n\n\nThe rebels all along our lines to-day. on the\nUpper Potomac, have net been seen. 80.', 'ue said he appeared before the Convention\n-u;,h the utmost diffidence. The county\n,rhich had nominated him was a large one,\nond nolled large vote. which was doubtful\n~ the ensuing canvass The county knew\nhim and his power to make the canvass, and\nthe compliment which the delegation had\nr;ven him was as high as he wanted, and a\nGreater one perhaps than he deserved. He\nRad come. however, before the Convention to\ndecline a nomination. He did that, not be-\ncause he could not indorse the platform, for\nhe was party to its preparation, nor because\nof want of fealty to the Government. 1t\nwas not exactly right for man to speak of\nhis own claims But he had been consider\nably abused and misrepresented and he\nwould like to say word or two in his own\ndefense. Last winter when he was in the\nState Senate, when patriotism seemed dead\nin CALIFORNIA; heart, he was the first to in\ntloduce resolutions to sustain the Govern\nment and its flag by coercive power. APP\nplause. Therefore he supposed no man in the\nState would do him the injustice to say that\nhe declined a nomination because he could\nnot ndorse the platform. His enemies might\nsay that he declined because he could rot get\nthe nomination. They might say so, but he\nwould leave it to the Convention to say\nwhether or not he had ""a chance. He with\ndrew from the nomination with his own free\n,,;1 olthouuh urua1 law hic Ha1auo p1\nby hundreds of men in the Convention. lie\ndid not do so out Of personal pique, or be-\ncause he was afraid or unwilling to support\nthe nominees of the Convention. On the con.\ntrary if any of the candidates went into\nYuba county next fall, they might perhaps\nsee him covered with red dirt on his return\nfrom campaign trip in the mountains. lie\nwould do everything lie could for the success\nthe ticket, because their platform PLACED\nthem between the extremists on either side,\nwhere Democracy had ever stood and where\nit should ever remain. Applauscl He had\nbeen told that there was no issue between\nchem and the Black Republicans, that they\nwere both for the Union lie found an issue\nin one of the resolutions, which stated that\nthey would hail with JOY an honorable ad-\njustmeut of the difficulties at present existing\nin the Government. He could not believe\nshat those men were loyal to the Union who\nonly five years ago paraded the North with\nfifteen stars upon their banner. lie regarded\nthem as Union party per Sc, because they\nhad no other place to 90 to. But it was\nDemocrats, otficered by Democrats, and far\nnished by Democratic money, who were to-\nday sustaining the flag against men who were\nformerly their associates in that party. ZAP.\npause. They were supporting an Admins\n;ration which they endeayored to defeat bv\nall the means in their power History would\npay them the compliment of being the most\nmagnanimous men that ever lived. March\ning under the banner OF a man whom they\nopposed, and whose politics they disliked,\nthey were still true in and out Of season to\nthe country and its flag. 1t was in this they', ""We, says the Memphis Appeal fDd in the Gin\ncinnati Commercial of the 9th the following arti-\nGle, speculating to the POSITION strength and in\ntention of the Federal army, under Mcclellan.\nThat paper holsters up Northern courage by max\ning great promises, the fulfllment of which de-\npends upon successes that Beauregard and his\nforces will braVely and certainly prevent Let the\nCommercial mark cur prediction\n\n\nTHE News FROM WAsH1NGToS.-The situation at\nWashington is made intensely interesting by Nc\nClellan's forward movement. 1t is certain that\nour Grand Army is gradually advancing, and that\nheaVy divisions OF troops are now several miles in\nadvance of the Potomac Notifications. The att\ntude of our army has been slowly and surely\nchanged from defensive to offensive. The rebels\nare no longer invited to cross the Potomac or as\nsail our forts, but solicited to accept fair\nfield fight\n\n\nOur columns are now further advanced than at\nany time before the advance of McDowels army\nThey are mastering the situation, learning the\nground, and becoming accustomed to movements\nby brigades and divisions in the face OF the enemy\nThe advance, instead of being grand struggle at\nventure, like that in July, is systematic and solid\n| AS his lines are extended Gen. McClellan's per-\nsonal activity and vigilance seem to increase. He\nIS with the troops constantly, and they know their\n| leader. His moyements-pushing forward here\nstanding fast there. now creeping at snail's pace\n| cutting roads, and planting batteries, and then\nsweeping from point to point with celerity-re-\nUS Vi IN w WeStefn Virginia, which\nresulted in hemming in and destroying Garnetts\narmy. Whether, if the enemy do not give battle\n| sooner, he will push on to Manassas we can, of\ncourse, only conjecture. But the presumption is\nand we are justified in making it by his own words\n| that he does not mediate falling back.\n\n\n| 1t was McDowell's misfortune to find himself in\n| front of the enemy at Manassas. under tremend-\nGUS pressure to force the fight without delay. He\ncould not stop to secure his position on the range\nof hills beyond Centerville because the hour was\n| approaching when the three months men, who\nwere the flower of the army, were to be disband-\ned and the shameful fact is fresh in memories,\nthat one of his regiments and of his batteries\n| deserted him because their time up, and in his\n| own expressive language, proceeded to the rear\n| to the sound of the enemy's guns. Mcclellan has\n| no troops with him whose time is up. They are all\nwith him to the end of the war; and he can take\n| his time. Then Mcdowell depended upon Patter.\nsons division to give employment to Gen. Johnston\n\n\nand would have won the battle, if his expectations\n| in this regard had been realized We may be sure\nthat Banks will not fail Mcclellan. His division il\n\n\nwithin striking distance, and will strike We should\nnot be surprised to hear at any moment that he hat\ncrossed the Potomac, and was pressing the enemy's\n| left wing"", 'The lower branch Of the North\nCarolina Legislature has adopted the\nsuhjoined resolutions, condemnatory\nof the principle Of coercion, AID az\nfirming the duty of the State TO re-\nsist the passage of Federal troops.\nThe resolutions we\'re adopted by a\nvote Of 63 to 20:\n\n\n""Resolued, That 10 the judgment\nof this general assembly, the Federal\nGovernment has no right to coeice\na seeding State; and South Catolina,\nFlorida, Mississippi, aud Alabama,\nacting in their sovereign character,\nthrough conventions, having with\ndraws, whether by secession or rev.\nolution. the federal authorities have\nno power, under the Constitution, TO\nmake war upon and subjugats these\nStates, or any other State which may\nhereafter adopt the like action.\n\n\n""Resolced, That it will be the auty\nof the constituted authorities Of\nNorth Carolina TO resist by force the\npassage Of federal troops through bei\nterritory to coerce aud subjugate Il\nSc &C ding Southern State, and that\nNorth Carolina ought to resist any\nattempt at coercion, either by land\nor sea, by all the means in herpower.', 'Mevs0e sss o. TrePs..- war news\n\n\n-. &c.\n\n\nNew York April 10.\n\n\nAn attempt has bean made to purchase\nthe new steamer Mercidita for the COME\nderats States. but the reply was that\nthere was not money enough in the Se-\ncoded States TO do It.\n\n\nThe entire FIRST division, numbering\n1000 men had been offered to the Go\nvernment, TO be ready to march at an\nhours notice.\nIntense excitement among the military\nct the Baltimore news.\nThe Chamber Of Commerce resolved\nthat the government should issue pro-\nclamaton that all persons privateering\nunder HAsfs\' commissions be dealt with\n- pirates. and Immediately blockade\nevery Southern port\nel22 600 was subscribed at the meeting\nOf the Chamber Of Commerce 10 aid Of\nthe volunteers. They arnnin.ed COM\nmissioners to take up government stocks.\nDelegates from Is Life insurance COM\npanies met to day and recommended Ia\n1 6oV6E0I QO8Iub W ASCUU0 tu0 IloA0 W kko\nassured entering upon naval and military\nservice.\n\n\nThe Evening Post hears from rsii.\nable source: that JEFF. Davis. At the head\nOf the Confederate forces, 10 within ""a\nhours march 4 Washingtoa.\n| Nxw YoRx April 19.--The Rhode Island Marin,\nArtillery saryed to-day with nix pieces Of artillery\n/ and started tor Washington 200 Rhode Island\ners under Gov. Sprague, viii arrive here tenor\nNOR.\n\n\nGov. Morgan Issues his rsqaistion for the 9th\nl2th and lsf regiments ri this city, TO start 10\nWashington tomorrow, and Gen. Sanford has u\nsued specs orders 10 that effect.\nThe gun boat Pocah mtas 10 ordered South imme\ndiately. She sails tonight with troops for For\nn Monroe.\n\n\nThe 7th regiment left for Washington By railroA\nthis r. n.\n\n\nBroadway was thronged with people ~ they pass\ned down, and the famous regiment WAS lusii\ncheered and showered with boQuets They too\ntheir howitsera and each man had brace Of revol,\nerr in addition to their muskets.', 'The following dispatches were sent IRON\nNew York on Monday evening, but were sup\npressed by the authorities OF Ohio although\npublished elsewhere:\n\n\nHARRISBURG, April OLA special train left\nhere last night for Chambersburg, loaded\nwith ammunition, and also one for York,\ncarrying arms. blankets and tents\n\n\nThe news from Chambersburs to-day re-\nports the camp in fine condition. and Gen.\nWilliams commanding, has reduced the\nstrictest discipline.\n\n\nCommissary Gcaeril Erwin goes TO Pitts\nburg 70 night TO form military camp. Troops\nare TO be collected there to protect the from\ntier of the southwestern counties. ii necessa-\n~; also to protect the Union men of the\nnorthwestern counties of Virginia.\n\n\nOne thousand regulars from Carlisle bar\nracks and xix bundled horses have already\npassed The mounted cavalry formerly oil\nTexas. viii move during the coming week.\nThe li,h regiment will be organized to NOR.\nrow. Five regiments NJ Camp Curtin are\n&c sdy to move at u moments notice.\n\n\nThe Governor Of Ohio is moving two Regi.\nments on Wheeling. one on Parkersburg\nand one ON Guyandotte and Point Pleasant. &c\nprotect the Union men OF Western Virginia', 'FonrREss MosRoE. Oct 25-Oae hundred\nThousand raIions have been distributed among\nthe regiments attached to the great expedition\ntbis afternoon, preparatory TO their departure.\n\n\nCsp,ains OF Transports received sealed orders\nto day. tis reported that one of them has\nopened his orders aud divulged the destinations\nOF the f,et. Men and animals on board suf-\nfered greatly during the gale Of tho Last two\ndays. @\n\n\nTwo recent deserters from the Confederates\ngreatly from want and sickness.', 'EpwAWps\'s FERRY. Oct. 26 ALI quiet last\nnight; no pickles. were thrown over the river,\nout those on this side heard those OF the rebels\nall night on the opposite side, and cav t1elr\nftes thickly scattered 10 the woods along tho\nshore. Their centrazing point was a cump\nof trees on the bluff where our troops had con-\n,tTucted q picket station, aud near the spot\nwhere our a-tiliery shelled them during the\nsSirmish on Tuesday last\n\n\nWhen our troops we\'re withdrawn from the\nVirginia eide on Wednesday night, the l6h\nIndiana occupying the most advanced and ex-\nposed position, were not aware OF any with\ndra val until the rest had been successfully fer\nried. They lay upon the cold ground, almos\nfrozen, with loaded muskets in their hands. ev-\ncry moment expecting an overpo""eriDg assault\nfrom the concealed aud reinforced enemy,\nwhose numbers were known to exceed our own\nBY many thousands Yet the only murmurings\nuttered by the hardy cons Of the Northwest\nwe\'re at the orders to return without disputiDg\nthe ground, inch BY inch, With their sdversaries.\n\n\nTHIS regiment brought with them two prison\ners, the owner ofthe mill on Goose Creek, with\nhis son, who II was charged had prepared com\nbusiibles TO Ere the bridge over Goose Greek,\nbut were prevented from carrying out their de-\nsign by the sudden descent upon the bridge by\nour skirmishers.\n\n\nThe officers of the regiment had g cOnversa-\ntion with prisoner OF war, highly Intelligent\ngentleman and nou-cpmmssoned officer Of\noue Of the Mississippi regimen\'s engaged in the\naffair at Balls Bluff. He left Lee.burg on Sur-\nday night, when there were but five regiments\nthere. There were 10 delensible works at\nLeesbnrg, but every approach was fortified,\ncommanding the river and land routes.\n\n\nThis prisoner was astonished to learn that\nour army was not almost entirely composed OF\nabOltionists and radical Republicans, and that\nour main object was other than to emsucipatt\nthe slaves throughout the South. He said i\nthe facts were generally known to tho working\npeople OF the SOuIh, that our sole object was &c\nsustain the Constitution and to preserve the\nUaion intact, there would be revolution In the\nConfederate army and peace restored.\n\n\nHe was surprised beyond measure to be as\nsured that Brekinridge Democrats constituted\nlarge component of the army.\n\n\nCapt Vaughn. Of the Rhode Island battery\nwho vent over with q ,g of truce, has return\ned. He was ciptured BY party who did moi\nunderstand the Law Of nations, but was after.\nward released by the military authorities.', 'The PRCTRAhAE.--A gentleman Of Nash\nvile, Tenn, has received letter OF warning\nfrom one OF the large cities of Eastern United\nStates, OF which the following is an extract\n\n\nFntrencu and tortify all your cities, towns,\nand railroad depots. If the Federal troops\nare successful next time they will try to\nmarch right through the South carrying\neverything before them. Look TO your ports\nof entry, t5r they will try to open them\nagainst yoar wish to England and France\nThe SopfA HIS no time TO loose. The North\nis put - forth extra exertions They Will\nhave a3&e 300 guns, zoo 600 men, large bodies\nof cavalry ana mounted men. They also ex-\npect TO pei form great things on the Missis\nsippi river They will resort 10 all kinds of\ntricks in the next battle. Mcclellan is noted\nfer cutting his way through and getting in the\nrear of his opponent. They talk OF shooting\nall your officers. Let them dress in plain\nclothes. They talk CT smoking the masked\nbatteries out by firing the woods.']","Well, my friend, let me share what's been stirring in our town and across the South regarding the Union army's movements and intentions. There's been quite a bit of warning and speculation that stirs anxiety in the hearts of many here.

Just the other day, I read that some folks believe the Northern forces, under generals like McClellan, are moving towards a more aggressive posture. There are whispers that they aim to march right through our lands, carrying everything before them. The last thing any of us want is for their troops to conduct themselves like conquering forces rather than respected soldiers of a nation. It's concerning, to say the least.

In light of these warnings, some citizens are growing restless. I've heard talk of fortification—that we ought to strengthen our defenses, particularly around cities and railroads. The fear is that if our defenses falter, they might take advantage of any weakness and come rushing in. It's been stated that they plan to pursue every trick possible to rout us, and it seems to fuel a sense of urgency among the Southern gentry and farmers alike.

Interestingly enough, there are people who believe that if the truth reached the Southern folks—namely that the Union's primary goal isn’t to free the slaves but rather to preserve the Union—there might be a change in morale among the Confederate ranks. A prisoner recently shared news that many in the South do not see the North as a mere tyrant but rather as potential partners in preserving the Constitution. In these heated discussions, it seems the tide of morale swings based on the narrative we tell ourselves.

With the news of arms being seized in the North—it's hard to hold back the feeling that they are amassing for a considerable push. Just yesterday, we had news from a newspaper stating that the Union troops are preparing to take decisive action. I say, where there is smoke, there may well be fire, and one must keep their eyes peeled.

So, our folks are staying vigilant and discussing ways to resist with all our might. The talk of fighting back against this so-called coercion of our states galvanizes strong emotions. We are united in our resolve, though drawn thin by worries of what these Federal troops might bring to our doorsteps.

I suggest you join in the discussions at the local tavern or the church hall, as many good ideas are floated among our ranks. Together, we must stay informed and ready, for the times are changing quickly, and we must meet whatever challenge lies ahead with courage and determination.","A warning letter received by a gentleman from Nashville advised to fortify cities, towns, and railroad depots in anticipation of the Federal troops' next movements. It indicated that if the Federal army, under McClellan, was successful, they would attempt to march through the South, which could severely impact Southern morale. The letter emphasized the need for vigilance as the North was making extra exertions, preparing a significant number of troops and artillery, which could demoralize the Southern forces if not countered effectively.",,0.0,0.6709956709844878,1.0
What role did the Border State Committees play in the context of Southern Illinois during the national crisis?,"[""DELLEVILLEs ILL., heb. 70, 1901.\n\n\nEDIroRs APPEAL: knowing as I do the\ngreat anxiety of the people Of the South to\nknow what the people are saying and doing in\nthe different sections Of the country, make\nbold to ask space in your valuable columns\nFOR few more words from Southern Illinois\n\n\n@ . ssauzal view Southern Illinois is now\nsi7Rding e. si7aqss- sil,sli. sgas55ase. sWaiting\nwith great anxiety and interest the result Of\n'peses cammittses,'' The balancing ef acom-\npromises,'' and other probable forthcoming re-\nsuits As her peculiar, and almost entire, in\nterests are now vested in the slaveholding\nStates, and consequently, mainly relying upon\nthem for her future prosperity, and as her citi-\nzens are generally noble in the cause Of patri-\notism, the peaceful settlement Of the present\nnational crisis has become a matter Of intense\nimport to her; and in viewing the unressona-\nbic, and even outrageous proceedings Of the\nRepublican party, and especially our State\nlegislature, their aVowed unWillingness TO, and\ntheir protestations against any compromise,\nare becoming more and more strongly attached\nto the South as the reVelry Of Republieanism\ngrows louder and fercer; and in the more\nsouthern part Of this state The Indignation\naroused by the message Of Gov. Yates to the\nIllinois legislature, is so great, that il is stated\npositively that IL would be unsafe for the Gov\nernor to visit that part Of the State. have il\nfrom a reliable source that the citV council Of\nCairo have already appropriated funds and\nsent an agent East to procure arms for the de-\nfense Of that city, in case the abolitionists Of\nthe northern part Of the Stasc should attempt\n70 make it place Of rendezvous. And should\nthe States Of Kentucky and Missouri with\ndraw from the Union, we NAV safely hope 10\ninherit the fertile soil Of Southern Illinois, aud\nreceive her noble sons into a Government\nwhere al African is not their superior in Ilfe"", ""sseldIers In Peace Citizens In War,\nNoRSHERs Pluck FULLY TEsrED-A NORTHERs\nVILLAGE Thrown INTO INTENSE ExcETENENT.-f oul\nNorthern neighbors of the old Confederacy could\ndemonstrate their courage by the threats which the\nBlack Republicans are continually venting against\nUS poor Southern rebels and traitors then, in\ndeed, would the world be compelled to recognize\nthem amongst the most valiant men of the age\nBut, they are not the men to face danger when il\nactually occursthey fight well on paper, but they\ncertainly don't ike to smell gunpowder. or to face\nSouthern steel and bullets.\n\n\nIn the village Of c., in New Jersey. not hun\ndred miles from New York, is a nest of Republicans\nof Greely stripe who have almost split their hroats\nin denouncng the Southern treason, and in declar-\ning their intentions to aid Mr. Lincoln in enforcing\nthe laws, and retaking all the Southern Forts' On\nthe day of Mr.. Lincoln's Inauguration they became\nvery jubilant, and were blating their predictions\nIa Greedy that in thirty days the Southern rebles\nwould be brought 20 their senses, and would be\ncompelled to beg on their knees for quarters, and\nthey were ready at any time to go and help whip\nthe unruly Southern rascals.\n\n\nA good Democrat, who sympathies very strongly\nwith the South, concluded he would play little\ntrick upon these valorous Republicans and put their\ncourage to the test. Early one morning strange\nindividual was going through the streets OF the\nvillage, who served notice each and all the male\ncitizens subject to military duty. The notice ran as\nfollows\n\n\nTRENTON, N. j., March 9, 1861.\n\n\n\n\n\nin readiness (suhjeet 20 draft to enroll yourself in\nthe New Jersey Militia, to be called out at three\ndays notice. If you have any lawful excuse, re-\nport Immediately 10 the Quarter-master General,\nc. A. Arnold, Trenton, n, J. tG\n\n\nBy order of the Governor.\n\n\nu. C. VEsEY, Secretary\n\n\nNever was such CONSERVATION produced in any\nplace as was witnessed in said village, upon the\ncirculation of these citations. If rumour is to be\ncredited, in less than six hours there hardly"", 'From the Alexandria (Rapides parish) Genatitu-\ntional of Saturday last we extract the following:\n\n\nOur District Court, Judge Chaplin presiding. was\noccupied for four days in the trial of Gen. G. Mason\non the night of the 7th Of September last. The\ntrial terminated on Thursday night, at about\nO\'Clock, in the acquttal of the accused. From the\nprominent position held BY the parties in our COM\nmunity-both!havin familiesland numerous friends,\nand from the interesting circumstances which sur\nrounded the case, great interest was felt through\nout the community in the progress Of the trial.\n\n\nThe State was ably represented by assistant\ncounsel in Col A. P. Field, of the New Orleans bar\n""a gentleman distinguished throughout the State\nfor his great powers as criminallawyer. The de-\n\n\nfence was conducted by Messrs. Elgee, Ryan and\nManning. ,. -\nThe weather during the first part Of the week\nwas delightful-cool and braeing. There was\nheavy blow "" on Thursday night, and rain fell in\ntorrents, which continued all day yesterday. 1t is\n| thought that great deal Of cane has been blown\ndown, and cotton in the fields was somewhat\n\n\nsmashed y by the rain and wind aforesaid.\nOur sugar planters are now rolling away in\n\n\nfine style, and the yield is rather better than last\n| week. If we could have little cool weather and\nlight frost or two very large crop would be\nmade We hope that such will be the case.\nThe Caddo Gazette Of Saturday has the follow\n| ing: ..t- .--.. .-.s1 .z=l ass e=4\n| For over a month past, the weather has been\n| dry and pleasant. Owing to the prevalence of\n| chills and fever, our planters are very backward\n\n\nin gathering their cotton On Thursday night there\n\n\nwas heavy rain, which did serious damage to the\n| fields, which are white with cotton. 59\n| Several wagon loads of wool have arrived from\nTexas during the past week, and will be forward\n| ed to our Southern factories. We are pleased to\n| see this invaluable article so abundant in our\n| country, and trust that an ample supply may be\n| procured to meet the urgent wants of our volun-\n| teers. .. ..\n\n\nEvery attention should be paid to the raising Of\n| sheep, and none should be killed during the war.\n| Texas alone produce enough wool for the Con-\n\n\nfederacy, if the planters would cultivate less cot\n| ton and devote more time to their foeks.\n| The Plaquemnes Rice Planter says:\n\n\n| We understand that several sugar planters have\n| commenced grinding. The quality Of the new\n\n\nsugar is said to be fair. 1t would appear that the\n\n\ncane yields very little.\n\n\nFrom KENrucKY:--We learn from gentleman\n| just from upper Kentucky who passed the lines\n\n\nwith great difficulty, that the number of Federal\n| troops now between Louisville and Muldrough\'s\n| Hill is about 2O,00n and the number eng the\nCentral Railroad in the direction of Lexington,\nJ 25, 600. Eys E \'| ~ 1Ea 81\n\n\nRecruiting in the Federal service is represented', 'HeraldeorrespOndence The Border State Com\nmittees plan of adjustment appears TO have at\nfirst met with considerable favor, and it was\nthought likely that the Presidentwould commend\nIt to the attention of Congress but the caucus OF\nRennbIicans after fi,ll and free discussion upon\nthe merits Of the Border Stale programme, decid\ned adversely to any and all compromises what\never and agreed simply 10 press forward the reg\nuiar business of the secession, and then adjourn\nsine die.\n\n\nAt meeting Of the House Committee on the\ncrisis Yesterday, Mr.. Hamilton, of Texas, sub\nmitted q proposition in favor of calling Nation\nal Convention Ofdelegates fresh from the people,\nwith a view to amending the Constitution so as\nto meet the requirements of all sections OF the\ncountry.\n\n\nThe Representatives from Charleston represent\nthe condition of affairs there as deplOrable. The\ntroops ordered into the field by the Governor are\nsaid to be suffering severely from the exposure\nincident TO their new mode of life and mnch sick\nness prevails among them while the merchants are\nwithout business and the mechanics without\nwork.\n\n\nStrange as it may appear am now to- tell you\nthat the President elect has given carte bdHeh to\nSenator Seward and ThurlOw Weed to agree up\non any plan of settlement that New YORK and\nPennsylvania can stand together\n\n\nHon. c. g. Clay, Jr. of Ala, has arrived here\nHis presence is esteemed a favorable omen for\ncompromise and peace.\n\n\nThe Navy Department received dispatches this\nmorning from the commander of the Pacific\nSQUADRON, and also communicating intelligence OF\nthe probable loss of the slOop-Otwar Levanti\nwhich had not been heard from for 100 days. She\nwas on her WaV from the Sandwich Islands', ""IMPORTANT FROM WASHINGTON\nWASHINGTON, Jan. 9.\n\n\nThe Committee on the part Of the border States,\nMr. Crittenden, Chairman, held second meeting\nlast night at y o'clock and adopted the following\npropositions;\n\n\n/ Recommending repeal Of all personal lib\nerty bills.\n\n\ng That the Fugitive Slave law be amended for\nthe preventing Of kidnapping, and so as TO pro\nvide for the equalization OF the commissioners\nfees, &c\n\n\n8. That the Constitution be so amended as to\nprohibit any interference with slavery IN any OF\nthe States where it now exists.\n= 6 sIhat Congress shall not abolish slavery in\nthe Southern dOokyards, arsenals, sc, now in the\nDistrict Of Columbia without the consent Of\nMaryland and the consent Of the Inhabitants Of\nthe district nor without compensation.\n\n\n5. That Congress shall not Interfere with the\ninter State slave trade.\n\n\ng. That there shall be perpetual prohibition\nof the African Slave trade.\n\n\nl. That the line of 80 degrees shall be run\nthroughgan the existing territory of the United\nStates\n\n\n8 That in all north of the line slavery shall be\nprohibited. and that south of that line neither\nCongress nor the Territorial Legislature shall\nhereafter pass any law abolishing, prohibiting,\nnor in any manner interfering with African\nslavery and that when any Territory containing\nA sufficient population for one member of Con\ngress in one of 90 coo square miles shall apply for\nadmission as a State It shall be admitted with or\nwithout slavery, as its constitution may deter\n\n\nThe Committee represented at its meeting\nMARYLAND Virginia. Missouri, North Carolina,\nTexas Kentucky Ohio. Indiana, Illinois, Della -\nware, Arkansas, Pennsylvania and New Jersey."", 'gress may from time 10 time or,sain and cs\ntabl, Tie judges, both of the Suprr .c\nand Inferior courts, shall hold their Offices\nduring good behavior, and shall, at stated\ntimes, receive for their services a cump,n>a\ntion, which slall not be diminished during\ntheir continuance in Office.\n\n\nSIC. Il. The judicial power shall ox!end\n10 all cases arising under this Constitution,\nthe laws of the Confederate States, aud trc;l.\n| ties made or which shall be made under their\nauthority; to all Cases affecting ambassadors,\n1 other public ministers and consuls to all ca\nses OF admiralty and maritime jurisdiction\nto controversies 10 which the Confederate\nStates shall be partS 10 controversies be-\ntween two or more States; between State\nand citizens o! another State where the State\n| is plaintiff; between citizcrS claiming lands\nunder grants Of different States. and between\nState or the citizens thereof and turri sn\nStates, citizens or subjects but no State shall\nbe sued by Il citizen Or subject OF any foreign\nState.\n\n\n>. all cases affecting ambassadors, other\npublic minister\'s am! consnls aud those in\nwhich Il State sLall be party, the Supreme\nCourt shall have original jurisdiction. In ali\nthe other cases before mentioned, the Supreme\nCourt shall have appellate jurisdiction, both\nas to law and fact, with such exceptions, and\nuuder such regulations, Us the Congress shall\nmake.\n\n\n3. The trial of all crimes, except in cases\nof impeachment, Shall be By jIlry, and such\ntrial shall be held in the Stale where the sat!\ncrimes shall have been committed hut when\nnot committed within any State, the trial shall\nbe ct such place or places rs the Congress\nmay by law have directed.\n\n\nSEC. 81. Treason against the Confederate\nStates shall consist only i\'ll leyying war against\nthem, or in adhering 10 their enemies, giving\nthem aid and comi5rt. No person shall be\ncuarct:d Of treason unless on lie testimony\nof two witnesses to the same overt act, or on\nconfession in open court.\n\n\nD The Congress shall have power to de\nclare the punishment Of treason, but no at\ntantler OF treason shall work corruption Of\nboOti, or forfeiture, cxcep; during the lie Of\nthe person attained.\n\n\nARTICLE ~.\n\n\nSIC. IL. Full faith and credit shall be\ngiven in each State to the public acts. records\nand judicial proceedings OF every other State.\nAnd the Congress may, by general laws, pre-\nscribe the manner in which such acts, records.\nand proceedings Shall be proved, and the ef\nfeet thereof.\n\n\nSIC. IL. The citizens OF each State shall\nbe entitled to all the privileges and imnuni.\nties of ci,izcns in the several States, and shall\nhave the right Of transit and snjnrn in any\nState of this Conitlcracy, with their slaves\nand other property; and the right Of proper\nty in said slaves shall not be thereby i\'m\npaired.\n\n\n2. y person charged in any State with trca-\nson, felony, Or other crime against the laws\nOF such state, whu shall llee from Justice, and\nbe found in another State, shall, on demand\nnf tn"" Executive authority Of the STATE from', 'being quite brisk in the States of Ohio, Illinois\nand Indiana pable appeal having been made\n| to their fear of invasion from the Confederate\n| forces. Few enstmeats, however are made by\n\n\nkentuckans in the northern counties, most of those\nwho enter service coming from the central portion\n| of the State.\n\n\nWe are further informed by the same gentleman\n| that Hon. r. II. Stanton, formerly member of Con-\n\n\ngress from the Maysvllle district, arrested last\n\n\nweek, account of his alleged secession proeliy-\n| ties, and sent forward to Columbus, Ohio, where\n| many others confined for similar offense.""\n| Hundreds of loyal Southerners in Northern Ken\n| lucky daily making eff,rts to come through,\n| but are watched so closely as TO render their pas\n\n\nsage South very dangerous and difficult\n| Memphis appeal.', ""ed messenger 10 COS. OeISei anu ooio-\nmon, who were encamped at Neosho, to\nmove their columns to Carthage, which\nwas promptly done. Last mig Lt mes\nsenger arrived from Col. Seigel, stating\nthat Governor Jackson Gems. Price and\nRaines, with their united forces, about\n5000 strong, were encamped eight miles\nnorth of Carthage. Coils. Seigel and\nSolomon pushed forward rapidly and at\ntackled tie rebel force early yesterday\nmorning, aud continued fighting during\nthe day. Messengers were continually\narriving, bringing information that the\nrebels were retreating enthusiastically\nbetween Sarcoxie and Mt. Vernon, and\nfalling back on Cassville, with baggage\nand plumber, under cover of cannon, and\nCol Seigel was attacking them in the\nrear.\n\n\nThis afternoon Gen, Sweeny took com\nmand personally of flying column mo-\nwing enthusiastically, to intercept the\nrebels at Veronne, completely curshing\nthem between our columns. Large bod\nles of mounted men were congregating\nat Westplesus and Forsyth, with the in\ntention of joining Jackson's forces, but\nSweeney sent detachment of $50 noun\nted men through Douglas comfy to pre-\nvent their union and drive back Gen. Nc\nDowelPs command.\n\n\nA company Of home guards arrived\nlate last night, bringing Col. Coffee, late\nmember of the Legislature, as a prisoner.\n\n\nLater advices say that report reached\nSpringfield Sunday morning, of an en-\ngagement between 500 Federal troops\nunder Col. Wolf. and about 500 rebels.\nCol. Wolf occupied prairie when the\nbattle began, but the rebels retreating to\nthe woods, he followed, and in skirmish-\ning in the timber, lost 80 men killed aud\nwounded, himself being KILLED. The loss\nof the rebels was considerable, but not\ndefinitely ascertained. Messengers were\nthen dispatched to Springfield for rein\nforcements, and the whole force at that\nplace Immediately pushed forward.\n\n\nA special messenger arrived this even\ning by the Pacific road, with dispatches\nfrom Col. Seigel to Adjutant Harding at\nthe Arsenal. The following is an alb\nstract from dispatch to the Democrat;"", 'PROPOSITIONS or THE BORDER\n\n\nSTATES COMMITTEE.']","Well, friend, I see you've come at a most pivotal time for our nation, and particularly for us here in Southern Illinois. The stirrings of discontent and uncertainty weigh heavily on our hearts. The Border State Committees, you see, have become crucial in these trying times as we grapple with the national crisis.

From what I gather, these committees are aimed at seeking a middle ground, a compromise that might appease both the Northern and Southern sentiments. People around here are deeply concerned about our economy which relies heavily on the slaveholding states. We feel tightly bound to their fate. As the articles suggest, the citizens of Southern Illinois are watching the ""outrageous proceedings of the Republican party"" with a mix of indignation and anxiety. We fear that the choices being made at higher levels could greatly harm our livelihoods.

There’s a growing attachment to the South as folks around here feel abandoned by those in power. When I hear about the efforts of the Border States to propose adjustments—like amending the Fugitive Slave Law or addressing the inter-state slave trade—it's clear they’re trying to rally support from those who might feel neither fully Northern nor Southern. We remain hopeful that such propositions might bring some semblance of peace and prosperity to regions like ours which stand on the border between conflicting ideologies.

People in Cairo, for instance, are worried enough to arm themselves, fearing potential threats from abolitionist fervor stemming from the North. Their city council is already taking precautions. It speaks to the growing tension here and a palpable sense of urgency. We want to protect our homes and our way of life, and the struggle for voice in this critical moment inspires action.

You might say, the committees act as a bridge, attempting to draw the divided sentiments into a unified plea for compromise, while many of us here find ourselves being pulled into the whirl of either side. The hope is that these deliberations might help stabilize Southern Illinois amid the chaos. Yet, it’s a precarious balance—one that demands keen attention as events unfold. So, as you settle in, I encourage you to keep an ear to the ground and stay informed, for the winds of change are blowing fiercely.","The Border State Committees' plan of adjustment initially received considerable favor, as it was thought that the President would commend it to Congress. However, after discussion, the Republican caucus decided against any compromises and chose to press forward with the regular business of secession. This decision was significant for Southern Illinois, which was heavily reliant on the slaveholding states for its future prosperity and was experiencing great anxiety regarding the national crisis.",1.0,0.0,0.6999999999766667,1.0
"What were the stock market fluctuations reported in New York around the time of the State Convention, and how did these fluctuations relate to the sentiments expressed during the meeting at Fort Madison?","[""Mr. Whitman, the nominee for Supreme\nJudge, said:\n\n\nHe had no words with which to express\nhis thanks, and perhaps it was well, as that\nwas not the time for talking, but working.\nHe gloried in the party and in the platform\nwhich so well expressed their sentiments and\nannounced what had always been the decla-\nration of the Democracy, that never, under\nany circumstances could they let the Union\nslide. GApplause1 If every man would go\nforth to the good work, to do whatever his\nhand found to do September would bring\nthem a glad, glorious, triumphant and over\nwhelming victory. Applause\n\n\nSPEECH OF G. w. BOWIE.\n\n\nMajor Bowie. the nominee for Attorney\nGeneral, came forward, in response to calls\nand returned his thanks for the unsolicited\nplace given him on the ticket. Applause.\nlie said he would have been better pleased\nhad some other representative OF the Bell\nEverett party been nominated. He had\nhoped that Mr.. o. X. Smith, of Tulare, would\nhave been nominated for Lieutenant Cover\nnor, or Mr.. Gard, Of Mariposa, for Clerk oI\nthe Supreme Court-but he had acquiesced\nin the decision of the Convention. lie felt\nassured, from letters he had received from\ngentlemen representing the party throughout\nthe State, that it would almost unanimously\nsupport the Union organization. He recog\nnized, in their resolutions only declaration\nof their unmistakable duty, resting upon\nthem as citizens, to preserve their country\nundivided in its limits power and strength\nand accepted this spontaneous nomination as\nan evidence of their disposition to forget\nparty distinctions, in order to rally together\naround the banner of the whole country\nIApplause1 lie had learned from the teach\nings Of Clay and Webster that there was nc\nsuch hateful heresy in American politics a:\nthe heresy of Secession, [applause] and that\nso-called State sovereignty and State alegi-\nance perished in alright before the hosts o\nNational sovereignty and National allegiance\nApplause Never before had there beer\nsuch appeals to the patriotism of American\ncitizens to preserve and perpetuate thei1\npriceless heritage Applause Entertain.\ning these principles. he hoped and believed\nthe party would march to triumph. lAp\nplause.\n\n\nJudge Landrum, the nominee for Treas\nurer, aad John II. Ridge, nominee for Stat'\nPrinter, also made brief speeches, which\nwere not reported."", 'FnAEclAL---0n the 10th ut tho Second Board In\nNew York, Missouri Stocks went down to a, vir-\nginia to -, and Tennessee to 40. Exchange in Chi\nsago same date Was II per cent In this city on\nSaturday II went II 10 to L. Illinois Banks bassd\non Southern Stocks decidedly 1t discount just\nnow, and more Of those taken It present win prob\nably 50 soon', ""prisoners with us--the Grampus having gone up a\nfSr H. 1lF # to ,tf.r\n\n\nchange-has excited no surprise. 1t has only\n\n\ndeepened and intensified the disgust which our\n\n\narmy previously felt for the Hessan horde. 1t is\n\n\nreported here, how truly can't say, that our side\n\n\noffered ten prisoners in exchange for one - H\n| Franko, of New Orleans, now prisoner in Louis\n\n\nvile. 1t will be some time before our side cende\n| scends to make such another offer. Since the re-\n\n\nfusal to exchange the Hessan prisoners held here\n\n\nhave been put to work. IsaW gang of them, un\n\n\nder guard, digging road on the hillside the othnl\n| day.\n\n\nCol. McCown, acting general of this (the second\n\n\nbrigade, learn, is to be promoted Brigadier Gen\n\n\neral, and Col. S. +. Marks, of this regiment (Lous\nlana Eleventh) is to step up next to him in rank\n\n\nSergeant Bone, of the Contnentals, colorbearer tt\n\n\nthe regiment, has left us to take commission a\n\n\nNew Orleans. Harry is a trump; we all hated tt\n\n\nsee him go. Private Joe lhrie, of the Continen\n\n\ntails now carries the colors.\n\n\nThey are weighing baggage in Cheatham's Bri\ngade near us, and otherwise preparing to march\n| Though the indications are that we Louisianian\nwill have to winter here, the report keeps bobbn\naround that We will soon receive marching orders\nHope SO.\n\n\nThe news Of Com. Hons' victory at the Passes\n| and the behavior Of the Gyastcutus, aroused th\nliyeest rejoicings here. Further doings dowl\n| there are aDNOusy waited for.\n\n\nCounterfeit Confederate notes, fiyes and tens\n/; are in circulation here. They are easily detected\nby those familiar with the genuine notes, and are\nbelieved to come from your good city. 1. G.\n| TIE MOBILE FREE NJ M.\\RKET.-We visited the free\n\n\nmarket yesterday, and experienced mingled feel\n, ings of pleasure and pain at what we saw there\nof pain at the sight of SO many applicants for as\nsistance-for the room was absolutely crowded\nwith women who certainly have not begun to suf\n, | fer since the Relief Association commenced it,\n\n\nlabors, but have been enduring jim senced and un\n, known how much privation and hunger we know\nnot, for weeks and perhaps for months of pleas\n| IRE that there was the means and the will among\n, us to relieve so great an amount Of want. The\nr supply Of bread meats, vegetables and grocerie\n! was abundant and much care was evidently eXer\nt cised in distributing them according to the want\n} of each of the applicants. The special request\nof these were also attended to with much kindness\nthough there was little occasion to profter them\n; as they were generally anticipated with, ''yo'\nhave sick child, you want some rice do you not\n\n\nand some tea - and this after the basket had beel\n, filled with ordinary provisions."", 'FnAEclAL.--0n the 10th ut the Second Board In\nNew York, Missouri Stocks went down to a. viz\nsinia to ~, and Tennessee to 49, Exchange in Chi\neago same date Was II per cent In this city on\nSaturday II went II 10 to IL. Illinois Banks bassd\non Southern Stocks are decidedly 1t discount Just\nnow, and more OF those taken 1t present will prob\nably 50 soon.\n\n\nWAn MEETING AT FT. mADIsON.\n\n\nFoHr MADISON, April 10.\n\n\nkDroa Cars CirY. A. reminded By the\ndats Of this that to-day l. the snnivsrsary\nOf tho 6rst battle Of the Revelation, and II\nyoa had been here last night, you wosld\nhave thought those glorious old times hsd\ncome back, and that patriosisn had con.\nplstsd one Of iss grand cycles and was sow\ntosehiDg III ssarest point 70 tho central 10.\nninsry from which il derives ito life and iss\nheat.\n\n\ni va quietly talked around yesterday\nthat vs would have meeting last night. A\nlev nodsst bills we\'re posted during the a.\ntsrnoon, and By the time the hour Of .ssandls\nlight"" had fully cons the court house waa\ncrowded 70 iss foll capacity. Judge visls\ncalled the meeting to order and nominated\nFred. Hesssr, Esq, to preside. l. II. Knapp\nand v. "". Winssrboshan were named vioe\nPresidents, and 9. Il. Albright and NJ. v.\nAbby were chosen Secretaries.\n\n\nMr.. uesser briefly stated the object Of the\nmeeting - being to take such aoton e be.\nGame loyal citisens to give support to thu\nGovernment 10 enforcing the laws, suppress.\nIng rebellion and Furnishing treason.\n\n\nA committee Of 10, Of which Mr.. r. W\nAlbright was chairmsn, vas raised, to pre-.\nsent resolutions expressing the sentiment.\nand will OF the meeting.\n\n\nTbs resolutions we\'re very strong. They\ndeclare il 20 be the duty Of all good citizens\nin times like the present, to stand. by th,\nconstitutional govsrnment regardless Of\nthei. onininns ""a .hs-sslsSS-sss- inc = M\ntional tros6ies and irrespective OF past pc\nlitical differences. They endorsed the Cali\nfornia resolutions against tho right Of %\nssssion and Affirming the duty Of the Gov\nsronent TO maintain its integrity. Tho,\npledged the snpporters Of the sssolusiess 1,\nstand BY the country right or wrong, an\ndeclared IN intention not to tolerate tfeaso,\namong us, either in 0ord Or deed.\n\n\nThere ware no long speeches, but thsr\nvse much good strong talk 70 tho effect the\nthe time for discussion, concession and com\npromise had passed, and ""now il the sim\nfor action""', ""were not reported.\n\n\nEastern News.\n\n\nThe Union has the following additional\nEastern news by Pony Express:\nBALTIAoRE, June 27th.--A positive order\nhas been given by the Marshal to avoid irri-\ntating the people and arrest Uuionists who\nmake violent demonstrations.\n\n\nThe U. 5. Deputy Marsha has instituted\nsearch for arms in private dwellings. a lot\nwas seized in a lager beer saloon.\n\n\nMany additional regiments of U. S. troops\nhave arrived at Washington.\n\n\nBALTIMORE, June 29th-There is a good\ndeal of quiet excitement here. Crowds are\naround the police stations and Marshals Office.\nA search at the Marshals office is going on.\nA large quantity of arms and munitions have\nbeen found secreted in the cellar and the\nwalls beneath the floor and cellar, and case\nof valuable pistols, over 5000 rifles, twenty\nfive of which were MIME were found also,\nseveral muskets said 10 have belonged to the\nMassachusetts, soldiers who were disarmed by\nthe mob on April 18th. 1t is also estimated\nthat 100000 percussion caps, 3, 100 ball car\ntridges, and C,000 long Miaie cartridges were\n| found\n\n\nThe New York IIeralds Washington dis\npatch says the rebels from Baltimore intend\ned issuing proclamation announcing the de-\n| feat of Federal troops and the capture of\n| Washington and all the officials, then tear\n| ing up the railroad and cutting the telegraph\nwires, and thus produce panic in favor Of\n| the Southern Confederacy\n\n\nGen. Banks discovered the plan Of the\nade al This point has been permanently in\nstituted and has caused the Mobile mail boats\nto discontinue.\n\n\nThe same paper intimates that the India,\nChina and English merchantmen will be\nrich prizes for privateers\n\n\nThe New Orleans Picayune of June 9th.\nsays United States ship of-war, eighty guns,\nis anchored off Atchatalaya, Texas intercept\ning communication, via Berwick Bay, with\n| Texas.\n\n\nGRAFTON, (Va.) Sune 27th.-Corporal Hays\nand twelve men belonging to Col. Wallace's\nregiment of Hussars while scouting on Pat\nterson's Creek, twelve miles east of Cumber-\nland. night before last encountered party\nof rebels numbering about forty sharp\nengagement ensued. Several of the enemy\nwere reported killed and number wounded\nOne of Hays party was killed and himself\nbadly wounded. They captured humber\nof horses.\n\n\nThe rebe, camp at buchanan is reported to\nhave been increased to 1000.\nWASHINGTON, June 27th.-Col Werr left\nhere several days ago for Kansas, taking\nwith him Gen. Lanes proclamation calling\non the people of the State to rally and fill up\nthe regiments, stating explicitly his purpose\nto put dow rebellion wherever it may be ex-\nhbited and to sustain Union men without\nregard to State or locality."", 'HeraldeorrespOndence The Border State Com\nmittees plan of adjustment appears TO have at\nfirst met with considerable favor, and it was\nthought likely that the Presidentwould commend\nIt to the attention of Congress but the caucus OF\nRennbIicans after fi,ll and free discussion upon\nthe merits Of the Border Stale programme, decid\ned adversely to any and all compromises what\never and agreed simply 10 press forward the reg\nuiar business of the secession, and then adjourn\nsine die.\n\n\nAt meeting Of the House Committee on the\ncrisis Yesterday, Mr.. Hamilton, of Texas, sub\nmitted q proposition in favor of calling Nation\nal Convention Ofdelegates fresh from the people,\nwith a view to amending the Constitution so as\nto meet the requirements of all sections OF the\ncountry.\n\n\nThe Representatives from Charleston represent\nthe condition of affairs there as deplOrable. The\ntroops ordered into the field by the Governor are\nsaid to be suffering severely from the exposure\nincident TO their new mode of life and mnch sick\nness prevails among them while the merchants are\nwithout business and the mechanics without\nwork.\n\n\nStrange as it may appear am now to- tell you\nthat the President elect has given carte bdHeh to\nSenator Seward and ThurlOw Weed to agree up\non any plan of settlement that New YORK and\nPennsylvania can stand together\n\n\nHon. c. g. Clay, Jr. of Ala, has arrived here\nHis presence is esteemed a favorable omen for\ncompromise and peace.\n\n\nThe Navy Department received dispatches this\nmorning from the commander of the Pacific\nSQUADRON, and also communicating intelligence OF\nthe probable loss of the slOop-Otwar Levanti\nwhich had not been heard from for 100 days. She\nwas on her WaV from the Sandwich Islands', ""hlA4A DILL MA AeS- -\nThe adjourned meeting Of the 4th, of the citi-\nzens Of Philadelphia to consider the present state\nof the Union, was held at the Board of Trade\nRooms to-day.\n\n\nThe Committee 10 whom the coercion and non\ncoercion resolutions were referred, made no re\nport and there being an evident intention on the\npart Of many present, who did not participate IN\nThe last meeting TO force the passage Of the non\ncoercive resolutions of Judge Lewis, which were\nresisted BY prominent Republicans.\n\n\nAn exciting scene Of disorder occurred, during\nwhich, District Attorney Mann showed willing\nness to fight on the spot.\n\n\nON motion Of a Republican, the meeting WIS\nadjourned but another was Immediately called {\nthe same place\n\n\nJudge Lewis was placed m the chair\n\n\nResolutions were taken and unanimously pa\nwe'd, denouncing the personal bills sc. and appro\ning the Crittenden resolution.\n\n\nThe Republicans refused to participate IN th\nsecond meeting, and manifest much ill-feeling al\nthe conduct Of political opponents in overriding\nthem."", ""The statements Of the banks Of the three principal\ncities Of the Union for the last week compare with\nthe previous one, and the corresponding time Of 1860\nas follows:\n\n\nLoans. Deposiia specie. CirenFn\nNJ T. Oct S. sI4s4S tes si2r, sag S5se9nl ts@toSe\nBoEt. Oct T.. t8Cs.,25s 23I7lol0 20 ta0i'lvl"", '""A good sign is this. In the House of\nRepresentatives, On the 9th, Mr.. MORRIS, Of\nPennsylvania, said ""Mr. Speaker.-I\nask the unanimous consent of the House,\nfor leave to present the memorial of two\nthousand two hundred and eighty-nine citi>\nzens of Philadelphia Of whom, with the\nexception Of two, voted for Mr.. LINCOLN for\nPresident of the United States-in favor Of\nthe CRITrENDEN propositions, or some such\nproposition as will settle the existing diff\nculties in the country"" The memorial was\nreceived. rs as 2f5ta 54 10,\n\n\n- The National Antislavery Standard is\nin ecstacies over the dissolution of the\nUnion. Abolitionism has triumphed, and\nthe Standard rejoices that the great Re-\npublican army has come up to do the work\nwhich Abolitionists had been for so many\nlong years cutting out. Listen to It\'s ex>\nultations: s lGa g0al\n\n\nFor the last ten years, yea, eleven next 7th\nOF March, the Hunkerdom of the North has\nbeen engaged in constant effort to save the\nUnion. The Abolitionism of the North has\nbeen all the time busy in the opposite direction\ntrying to break it up. Well, we have beaten,\n1t is nothing odd that they should rage and\nimagine strange things. Nobody likes to be\nlicked. That is just what they are. Let us be\npatient with them, and let them expend their\nfroth and fury. Better times are at hand, and\nall the nearer the worse they behave. One\nthing is certain, the Union is dissolved.\n\n\nThese are the men into whose hands the\nhonest masses Of the Republican party have\nbeen playing. The Abolitionists were the\nadvance guard Of the Republican party. Is\nit net time, in view Of the above from the\nStandard. that conservative, union. loving\nRepublicans should turn a short corner,\nand repudiate the lead of the A bolitionists,\nwho exult over broken Union\n\n\nThe Columbus (Mississipp) Southern\nRepublic publishes the following to show the\ndifference between the prices Of beef in the\ncapital of that State and the prices in New\nYork, to wit: saa\n\n\nNEW YORK PRICES.\n\n\nChoice steaks. .18c. @20c.\nhOaSting pieces. .lZc. .0Dl0c.\n\n\nCOLUMBUS PRICES.\n\n\nChoice steaks. .l0c.\nRoasting pieces. ............... &c.\n\n\nYhis does not look as though the people\nof the new Southern Confederacy were on\nthe verge Of starvation, when in Mississippi\no pound of cotton will get a pound of choice\nbeefteak.\n\n\n- The Legislature Of New Mexico has\npassed an act for the election Of delegates\nto form State Constitution, which is to\nbe held in May next. The delegates are to\nul:.L', 'Tie reaction in the Stock market which COM\nmenced yesterday continued to-day, with an extern\nrive and well-distrbuted business. The reazations\nof the last two or three days have been very large\nand the market naturally staggers under them. The\nparties who have recently been operating for the\nrise have evidently changed front within day or\ntwo, and while the bears have not yet recovered\nsufficient courage 10 put out long contracts TO any\nextent the market has taken large quantities Of\ncash stock and short options. The limited character\nOf the decline shows a considerable substratum Of\nstrength in the market which yields slowly and with\nfrequent rallies The foil effect Of the recent sales\nbas not however yet been felt and the stock has not\nvet been delivered. Between the Boards the market\nwas heavy, and at the Second Board the dealings\nwere only 70 moderate extent, and quotations were\nirregular. There was disposition to press sales,\nand sellers options were freely offered. After\nthe Board, the market was again lower on some de-\nscrptons Toledo selling down to 30, but at the close\nrally took place, and recovery Of v cent on\nthe leading fancies was established. In Railsosd\nbonds there is better feeling, and quotations are\nadvancing Bank stocks also held higher with free\nbidder Tue negotiations with Government will en-\nable some Of them TO make large divdends. Govern\nment stocks are irregular, the issue of 1881 being\nlower, while other descriptions are higher. The\npriees at 3. O\'Clock were U. S. So, ""a, S2aS2i;\nu. s. 6s 81, reg. 92Ia929; U. S. 6s, 81, coupon,\n92l a922 Tenn. State 6s, All a All Virginia State\n&c, f7la4sl; Missouri State Go, 43s ai3l; Pacific\nMail Steamship Company, sOl 99Ot; New-York Gen.\ntrail Railroad, MANI; Eric Railroad, 2ei S3Oi\nHuds n River Railroad, 36l a36li Harlem Railroad,\nII1allI, do. preferred, 2Sa2Si Reading Railroad\n36a364; Michigan Central Railroad, 462 AL Mich\nipsn Southern and Northern Indiana Railroad, la\nIN; do. guaranteed, 37937l Panama Railroad, ZIG\naII7; Ilinos Central r. r. Scrip G6I @ 66i; Gelena\nand Chicago Railroad, G93 a70i Cleveland and To\nledo Railroad 35ia36i Chicago and Rock Island\nRailroad, 47ia6f; Chicago, Burlington and Quincy\nRailroad, 63S63i.\n\n\nThe foreign bill market ia duh, but held firmly by\ndrawers. The leading bankers ask l07I for sterling,\nwhich buyers generally are indisposed to yield.\nCommercial signatures range from 1861 to lO7. The\nsupply of outside bills is limited. Francs are\n.5.57lS5.3o.', 'Jhese sentiments were received With unan\ninoss cheers and applause. The Gag Of on\ncountry, susrendsd behind the Chairman\ndesk, was cheered till tho old dome shook\nThe Star epausled Banner was sung %\neheeFed, and cheered and sung. YaDks\nDoodle vhistled itself from the puckere\nnouths Of Young America, and glisteniu\neyes showed that the fountain Of pasriotis1\nhad been reached.\n\n\n4 committee VAS appointed 10 enroll\ncompany Of Infantry and Dragons, and =\nter unanimous pledge on the part Of Il\naudience 70 hold themselves in readiness\nlight for their country whenever they shoe\nDO called for, the meeting adjournsd vi\ncheer upon cheer.\n\n\n1t VAS agreed on oil hands that II vas Il\nbest meeting ever held 10 Fort Madison.\nhave given You only naked facts; descripti\nand comment would be tame.\n\n\nWho says We have = divided North VI\nhas ever dreamed Of the power it i about\nput forthf SORlBO.']","Ah, welcome to town! It seems you’ve just missed quite the whirlwind of events. The stock market, as you might hear from the chatter at the tavern, has been rather tumultuous lately. Just the other day, I read that the stocks for Missouri plummeted down to around forty, and even Virginia and Tennessee are feeling the pinch. Such drops in value reflect a great deal of uncertainty in these times. It’s enough to make one wary of investing—especially with the looming war casting shadows over the country’s fortunes.

Now, the meeting at Fort Madison? Well, that really strikes a chord. We gathered there not just to show our support for the Union but also to rally our spirits as good citizens. The air was electric with fervor! We took stock of our sentiments and recognized the need to stand firmly by our government. Our resolutions echoed with a clear call to action—to put aside differences and reinforce our collective loyalty, regardless of past squabbles.

You see, the fluctuations in the stock market speak to the economic strife and political unrest. People are worried, and there’s a palpable tension in the air. But at that meeting, we looked beyond the turmoil; we were resolved to act, to maintain the integrity of our Union, no matter the cost. The support for those resolutions was as strong as the cheers we made when discussing our duty to this great country. In light of the market’s woes, I believe our resolve only strengthens our belief that unity is our path forward—stocks might fall, but our commitment to the Union should rise above it all. 

And as we pledged to support our government, I can’t help but think that the way we respond now will echo in the decisions made in the coming months. So let’s not lose hope; instead, let’s rally our strength and remember that history often turns on the grit of its people. How about a drink to that resolve?","On the 10th, the stock market fluctuations in New York indicated that Missouri stocks went down, while Tennessee stocks were at 49. The exchange in Chicago was reported to be at 11 percent. This financial instability was contrasted by the strong patriotic sentiments expressed during the meeting at Fort Madison, where citizens gathered to support the government and enforce laws against rebellion. The resolutions passed at the meeting emphasized loyalty to the constitutional government, reflecting a determination to stand united despite the economic challenges.",1.0,0.0,0.44374999998890624,1.0
What types of goods were highlighted for the Fall and Winter season in the context of Queensware and Fancy Goods?,"['~\n\n\nHave now in store, and are submitting for III :\nspocton, their recent extensive purchases of Fall\nand Winter Fancy and Staple Dry Goods, which\nfor Elegance, Variety and Cheapness, are unsar\npassed They would direct particular attention to\nthe annexed list which viii be disposed Of at prices\nthe most faatidious The Goods ara an new aud\nwarranted perfect. They embrace\n\n\nBlack and Colored Cloths,\n\n\nBlack and Fancy Doeskins,\n\n\nFancy English Tweeds, Cas-\n\n\nsimeres, Sattinets,-Je cans,\n5 &c. Blankets, Flannels,\nPlain and Fancy Plaid\n5 Lindseys, Ladies\' Strip\n\n\n""a ed and Plain Middle\na- sex C1oakings, Eng\ncz7 lish, French, and\nze5v7.z s-.sa 2 American Prints\ne.. - and 1 Ginghatins,\n:. - Silks and Fancy\ngo Dress Goods of\nthe most approved styles,\nRenfrew Plaids, Royal Pop\n\n\nInns, Plain and Fancy CASH\n\n\nmeres, Plain and Fancy\n\n\nFrench and English Mer- ss\ninoes, Pacific, Manches- p\nter and Hamilton De s\nLANES and Alpaccas, $3.50\na large stock of Bro a d.\nche, Stella, Fancy ef-\nSnow Flake, Sup. 7\nScotch Clan Tar -.s@\ntans, Mcdonald He s..,\n& Malcom Long H.. +.\nand Square .s. ea\nShawIs, Fancy Bonnelli and\nStriped Wool Shawls 6 Hand\nkerchiefs, Plain and Fancy\nA1-Wool DeLaines. rs ii\n\n\nIn the Hosiery department will be found re-\nplete Stock, in Plain, Mixed, and Fancy Wool and\nFleeced Cotton Hese, Fancy Wool Knitted Goods,\nincluding Shaws, Hoods, Scntass, Hnbias, &C.,\nskin Gloves and Gauutlcts, Ladies\' and Gents L.\nWool and Merino Vests and Drawers, Hats and Caps\nin new shapes, and Ladies\' Furs.\n\n\nThey prepared to exhibit their late importa-\ntion Of Irish Linen Goods, comprising Irish Linens\nand Handkerchiets, the best assortment Of Sheet\nings and Shrtings ever offered, Linen Damask\nTable Cloths, Bleached and Brown. all sizes, Nap\nkins Towels, DoYlies and every other description\nto this class of manufacture.\n\n\nn. B.-Now on hands, great variety of Thomp- !\nsons Celebrated Skirts now so fsvorably known to\nthe hades Of this city, and which S. & Z. have /\nhad the pleasure of introdneins.r .- saf 4\n\n\nAS desirous to give to customers every\nadvantage possible, and having facilities for do.\ning second to none in our line of business,\nen large stock the smallest remunerative prices\n\n\nA call respectfully solicited --a- oct17 /', '4\n| W. A. BEssoN acted as Secretary.\n\n\nRev. 81. WILLIAMS. by request of the Chair,\noffered prayer.\n\n\nThe Chairman stated the object for which\nthe meeting had been called, and invited\nfurther remarks and suggestions.\n\n\nRev. DR.. McTYEIRE offered the following\npreamble and resolution\n\n\nWHEREAS. The call for volunteers to de-\n| fend the rights and homes of the South from\n| a causeless and cruel invasion, has been\n| bonded to by many brave men whose fami-\n| siies depended their daily labor for sup\nport; and\nWHEREAS. 1t is alike the dictate Of justice,\nof humanity, of patriotism, that the wives\nand children of those who have gone forth to\ndefend and our wives and our children,\nand every interest and every right dear TO\nfreemen, should be kindly and tenderly cared\nfor in the absence OF their natural guardians;\nand ~\n\n\nWHEREAS, II will CHEER the heart and\nstrengthen the arm of the soldier enduring\nthe fafigues of campaign or the perils of bat\ntie, to be assured that those dear ones at\nhome. dependent on him, lack for no COM\nfort: therefore\n\n\nRESOLVED, That we, citizens of Edgefeld. do\nnow organize ourselves into society for the\npurpose OF extending such relief to the fami-\nlies of volunteer soldiers, in Edgefield. as\nmay be necessary for their comfort, in addi-\nton to the amount provided by the County\nCourt.\n\n\nDIR. McTyeire supported the preamble and\nresolution by appropriate remarks. There\nwithin this civil district tace1sty families\nof the character referred TO. The amount\ndrawn for their relief by the Magistrate from\nthe County Court found was 500 per month,\nand this amount would soon be reduced to\n$50 What is this among many? Some\nOF the families were large and helpless\nnumbering six children-ail these families\naveraged about three children. House rent,\nfuel, provisions and clothing were to be fur\nnished. The pay of private soldier was\nonly Sll per month. This might support a\nsingle man-cOuld not keep the soldiers\nfamily even if they got all of it. We must\ndevise some plan for additional aid. Winter\nwould soon be on US, increasing every ex-\npense of living. He was glad to cay none of\nthe families of soldiers among us had suffer-\ned thus far. but they would before winter\nwas over, unless other help was provided. 1t\nwould be shame to us for any soldiers\nwife or child to suffer. He was away-had\ntaken his life in band 10 fight for rs, to de-\nfend us. Surely the least we could do would\nbe to lake care of his family and keep want\nfrom their doors. Suppose the volunteer in\nthe mountains of Virginia or in Missouri to', '1859. 1859.\nFall and Winter Goods.\n\n\nWARD IL SOUTHMAYD\n1 RE now opening very large and extensive\nI y assortment OF Fail and Winter Goods\nat VI olesac OF retail. sep H. 80\nDAINTS, OILS. &C.\n100 kegs WHITE LEAD.\n\n\n300 10 Spanish Brown,\n\n\n100 ID Venetian Red,\n\n\n100 ID Red Lead,\n\n\n200 gallons LINSEEp OIL.\n\n\n$50 Spts Tt I1PENTINE.\n\n\nso fb Prussian Blue\n\n\n300 Ii Birthstone\n\n\n300 ID Flour Sulphur,\n\n\n800 ID EPSON Salts.\n\n\n500 ID Spanish White,\n\n\n$50 ID White Chalk,\n\n\n600 ib Putty in bladders,\n\n\n900 gallons Lard Oil\n,nr 50 9s5s + B0raH WARD for sale sn,lTEHuAvn y\n.DRY GOODS.\n\n\n30 Bales A and I domestic,\n500 pieces Bleached domestic assorted.\nl5O C9ttonades, assorted,\n100 Blue Denims\n500 Domestic Stripes,\n$50 ="" Plaids,\n3UO Mariners S ShIrtlng,\n100 Fancy Lawns,\n30 Ginghams\n20 Solid color d""\nSO 90 Black and Colored Alpaccas\n800 Silk Handkerchiefs,\n1900 Fancy Prints, assorted,\n80 White Cambrics,\n60 Checked /""\n60 Jackonet\n$50 doz Cotton Handkerchiefs,\nIS {"" Linen\nJuly l3. 1859 WARD L. SOUTHMAYD.', ""The Star Spangled Banner -.\n\n\nBy FRANCIS s. KEY.\nOh say can you by the dawn s early light.\nWhat SO proudly We hail. ID at the triIight's last\nWhose broad stripes aud bright STARS through The\n\n\nperilOus fight,\n\n\nO'er the ramparts We watched, were 50 gallsntly\nAnd the rockets red glare, the bombs bursting in\nGave proof through the night that orr flag was\n\n\nstill there.\n\n\nOh say, does the star srangled banner still\nGer the land of the free and the home Of the\n\n\nbrave?\nOn the shore. dimly through tie mist Of the\n\n\ndeep, ..a.r\nWhere the foes naughty host in dread silence\n\n\nreposes,\nWhat is that. which the breeze o'sr the towering\nAs it ifuliy blows half conceaIs, half discloses\nNow it catches the glesnl of the mornings FIRST\nIa full glory reflected now shines on the stream\n'r is the star spangled banner. oh long may\nOer the land of the free, and the home of the\n\n\nbravel\nAnd where is the band who tiugIy swote\nThat the havoc OF war, and the battles con-\nhome and a country should leave lis no more?\nTheir blood has wash'd out their foul footstsp's\nq\nNo refuge could save the hireliDg and slave,\nFrom the terror of fight the gloom of the grave\nAnd the star spangled banner in triHmph doth\n\n\nwave,\nO'er the land Of the free ana the home Of the\n\n\nbraYet\n\n\nOh thus be it when freemen shall stand\nBetween their lOv'd home and wars desoIation;\nBless d with victory and peace, may tho Heaven\n\n\nrescu'd land\nPraise the power that hath made and preserv'd\n\n\na\nThen conquer we must, when cause 1t is just\nAnd this be motto-'' In God is our trust y\nAnd the star spangled banner in triumph shall\n\n\nwave,\nO'0r the land of the freo and the homs OF the\n\n\nbraVei"", 'Blue Pilot Keeling JstoES-ts,\nBlack AlpIccas and cloth coats and sacks.\nBlack and blue cloth Pants\n\n\nAssortment Of fine burksEin Pants\nAssortment Of cotton Pants white Nars""ille Vests.\nHickory Shirts white and fancy colored\nWhite cotton Shirts with linen and muslin bosouls\nRegatta Shirts,\n\n\nScarlet auI blue flannel Shirts\nSilk and fine laIubswOol UnderShirts,\nPink, white brown. and fancy striped Undershirts.\nLarge Of aud silk and Stockings,\nSuperior gray and white Socks and Stockings,\nSix and cotton Elastic SuspendeT-,\nLasting Ga.;eTs.', 'or order work to be DONE and the husband, by any\nact precedent or subsequent, rstifes the contract\nby assent the husband shall be liable upon it. wheth-\ner the goods or works for himself, his\nchildren, or for his family. II the goods or\nwork, although they have not come to the hands\nof the husband to his use. are known BY him to\nhave been ordered by the wife, and the husband has\nmade objection to her use and enjoyment of them\nor given the parties who supply or labor for her\nany ntmatien Of ldisapproval be will be deemed\nTO have adopted and sanctioned the wifes expendi-\nture, unless it appears that Ehe has seperate in\ncome at her own disposal, 70 be expended by her\nfree from the control of the husband 1t is held to\nbe the duty Of the husband, when he sees his wife\niadulging immoderately, in expensive tastes, and\nknows she has no separate income Of her own to\nspend in luxures and superhuities to give notice to\nthose who supply her, or labor for her that the\noutlay does not meet his sanction and that he does\nnot intend to pSy for the goods or work ordered by\nher And if he chooses to lie by and permit the goods\nto be delivered or work done without saeh notice\nand warning, he will be presumed toshave given\nsubsequent sanction and ratification Of her acts\nwhich u equivalent m all cases to precedent au-\nthority. But II, by marriage settlement or other\nwise, separate income has been settled upon the\nwife, to be received and expended BY her free from\nthe control Of her husband, the mere circumstances\nOf the husband being aware of the w1fes possession\nand use Of the things fruits Of the labor will net\nfx him with Subsequent adoption and ratification\nOf the wifes contract even If he express no disap-\nha thorn IN', 'NOLASSES, Sugar, Coffee and Tea, Cand,es\nvl and Soaps, pepper, spices, ginger, stare, etc\n\n\nWater buckets, cburns brooms wash boards\ncoffee mills. Cotton and hemp roars. Tobacco of\nvarious brands Oysters and Sardines\n\n\nCASTINGS Of every description Nails plow.\nand hoes pad and door locks screws and butts\nfarming utensils Of all kinds whips, etc.\n\n\nblacksmith Tools. Of every description.\n\n\nlarge assortment OF Crcckery and Queens\nware, jars, jugs, qt 4 1T TASKS. Tin Ware etc\n\n\narTii III, Ieoi ? PERKINS', ""HAVE on HAND AND FOR\nSALE At MODERATE RATES,\nA LARGE STOCK OF\nMERCHANDISE NJ !!\n\n\nAMONGST WHICH ARE\n\n\nssFy Goods.\nFancy Prints of great variety ofstyles and colors.\nMourning Prints,\n\n\nTwo-blue Prints.\nIndigo Blue Cottons,\nDyed Cottons,\nDenms,\n/ White ground Muslins small patterns,\n/ Brlliants small and medium patterns,\nBlack and White tape check Muslins,\nPlain Turkey Red Cloth,\n\n\nCotton IIanGkerchicfs,\nCotton Sheetng,\nWhite Cotton Drills,\n\n\nBcdtieks,\nDrab Moleskn.\ny great variety Of Cotton Trowserings,\nPlain Black Silk 1!\nFancy figured silks,\nPure Silk IIandkerrrefs.\nSewing SIX,\n\n\nEmbroidered silk figured Aracas\n\n\nFine black Alpael.,\n\n\nBlack and colored figured Lustres.\n\n\nPlain eoIored Lustres,\n\n\nsuperane black and blue Cloth,\n\n\nsuperfne Cassimerr\n\n\nPlain blue Fiannrl,\n\n\nBack satibett\nCommon Cloth,\nBlack fancy Does4ins and mixed TroS,erings\nWhite Blankets, all sizes,\n\n\nBlue Blankets, sizes,\n\n\nScarlet Blankets, all sizes, ..\n\n\nCommon Blankets, for horse CLOTH\n\n\nBrussels and velvet Csrpe.ing.\n\n\nRailway Rugs\n\n\nVelvet Rugs,\n\n\nwooIlen plaids\nLINEN SHEETING\nHuctaback Towels Toweiing,\n\n\nLinen Handkerchiefs,\n\n\nPlain white and fancy Linea Drills,\n\n\nBrown Holland.\nClothing, Shirts, Shoes, &c.\nBlack Cloth Pants. best Pilot Jackets. common do\nBlue serge Shirts of ali qualities,\nWoolen URdershirts, worsted Stockings.\nWhite Shirts assorted; Regatta Shirts.\nAssorted qualities of Felt Hats,\nLadies Riding Hats. Oxford tie Shoes,\nChildren's Boots and Shoes, Crmean Boots,\nSup. cotton half hose, embr. cotton Oyershirts.\n\n\nGroceries.\nBrown Soap Pickles Fruits. Sauces Mustard salad OIL\nScotch Oatmeal, fancy Biscuits, Olives csper. Jams.\n1audes candied Peel Boater Paste table s currie Powder\nBHA CK TEA:\ncarrants Blue, starch Marking Ink, ssidlitz\n\n\nSundries.\nBest English Saddles. common DO, Peron Rugs,\nBoiled Linseed Oh, cotton Umbrellas elk Umbrellas\nHughes & Jones' Perfumery,\nMusk, Essence Of sandal Wood, Windsor soap,\nsarsaparlla, nest. Tubs, Fencing Wire, Hoop Iron,\nAnchors ana Cnd1nS,\nBar Iron assorteI Boiler Plate safes, Grow Bars\nTin Plate &c nd TX, brigh, Iron Wire sheet Lead.\nSets Sugar Pans,\nMOBILES Hoares assorted varnishes\nRoskELEs WATCHES, gold and silver.\n\n\nLIQUORS.\n.9ttled Ale and Porter, various brands,\nDraught Ale in hhds.,\nMarteu's Brandy, in Or casks,\nHennessy's Brandy, in or. casks,\nOtard's Brandy, in Or casks,\nCommon Brandy, in Or casks,\nCases Cognac,\n\n\nCases Ginger Brandy,\n\n\nGases Scotch Whisky,\n\n\nCs Royal Highland Whisky,"", 'sa49 KEEN & LPRESTON\'S 90\nMM0E HAZE JUST eCO.RE.Y FeJE-G;RK ID\n- w receiving oar Second Fall and Winter\nStock Of Dry, Goodsand Notions, and cordially in-\nprices, belisViug we3ean make II the fnelest OF ev-\ncry cash or prompt time, buyer to deal with rs\nWe have Just opened a. \'+ \'\' ~\n\n\nIs assorted high eolored Maader Prints\n\n\n(mostly small hgures). -a--r--\n\n\ncases solid black, snd black aud purple Prints\nL 2 do Furniture Prints. as5s\nsis 2,odS PsicIwork Prints solid So,or.i and\n1.af5 Az 44gggE5isalI 8 81, I9 sa.\'.-aaas q div\na bates Scarlet Flarneiss s1 e. .al vf1-.1\n, a Do Heavy Z TWefdg {Rro&n sna oxford\n\n\ndo sstf;%93;. sSst3ea3; bra slf % rr.\'e ee\n\n\n2 do California shirtings.\n\n\n-r do Bleached Muslns. rz-\n\n\n4 bales Sea Island fine brown shirtines\na1 n do Shirting- Stripes % l5r af7\nA cases 2 by 2 and by A Apron Chrcl6s\n; Is bales u Brown shirtiigs ...-\nsay & DO Light ""A Br9Tn shirtiRgs. -l\n10 do Heavy ""A Brown Sheetihgs. \'\ne DO Brown Drilis.J s1i b- .-...\nloo pieces Jaconet and Carlbric Muslius.\nso do Bimafayas,\na150r do Debeiges.l ci s9igI7 gz..cf\n\n\nco do Assorted High Colored Delaines ai 3D.\n6 40 do Solid Colored Delane5 ~\n\n\n20 do Tartan Plaids.-\n80 do CashlneTss. ~ ---.\n50 do Plaid 0oburgs. ""a $50\n45 do Blue and Brown coDurgs.\n\n\nIs do NIerinos.\n\n\n30 ds2en Woolen Shirts and Drawers (iNhite and\n\n\nGrey mixed)~- ~ r-..\n200 Col0red aud White Hooped SSirts\n\n\nAn Assortment of Comforts, Hosiery, Gloves,\nThreads, Belts, Chambrays, Velvet Ribbons, Tai\nfsta Ribbons, Combs, Hair Pins, suspenders, &C,\nall for sale Low AS THE Low EST.\n-- s..r. r-e .ttrt.- ""a KEEN i PREST0ES. i-']","Ah, welcome to our bustling town! You’re in for a treat, especially with the Fall and Winter season just around the corner. I must tell you, we've got some splendid goods filling our shops, especially in the realm of Queensware and fancy items.

Let me share what I've seen about the goods that are highlighted this season! I was perusing our local newspaper just the other day, and it struck me just how much variety is on offer. There are elegant **fancy prints**, vibrant **ginghams**, and rich **alpacas** in all sorts of colors—just perfect for those colder months. 

Now, if you fancy warm clothing, you’ll find that our stores are brimming with **heavy flannels** and **woolen garments**, which should keep you cozy against the chill. We’ve got a fine array of **Hosiery**, too, with lovely knitted items and delicately crafted gloves. 

And don’t overlook the **Queensware**! The crockery is simply splendid, with intricate designs that are sure to impress during the gatherings and dinners—how delightful it is to have such finery on the table!

There’s also a good stock of **blankets**—plenty to keep you warm by the hearth—and you can find everything from **printed muslins** to **plaid woolen shawls**. The women are quite taken with the new **tartan patterns** making their rounds as well.

Just the other day, I overheard the ladies chatting about the **fancy bonnets** and **striped dress goods** that are flying off the shelves! They’re truly making a mark this season. 

If you're in search of anything specific, I'd say it’s worth your while to stop by the local shops. The proprietors are keen to showcase their fall selections, and I assure you, they’re eager to assist. Happy shopping!","The context highlights a variety of goods for the Fall and Winter season, including Queensware, French and English china, glassware, and table cutlery. Additionally, it mentions an extensive selection of fancy and staple dry goods such as black and colored cloths, fancy English tweeds, silks, and various types of wool and cotton hosiery, as well as Irish linen goods.",0.4444444444444444,0.8946690331165756,0.6666666666444444,0.6666666666666666
"What actions were taken to maintain supreme control over the police in Baltimore amidst the Union and Confederate tensions, and how did these actions reflect the broader military strategy during this period?","['! by Il halt-0pen door.\n\n\nPaul Amar was trimming his lamps when this man\nentered and, he noticed his presence the bluff and\nrubicund ysage of the wineseller grew slightly pale\nand he muttered under his heavy moustache\n\n\n""Ah, it is Benditto What be waut?-this is the\n\n\ntenth night of his watching for-whom? But it is none\nof my business-n\n\n\nThe demands Of his numerous customers called his\nattention elsewhere and after glancng uneasly at the\nstranger, he hurried to his glasses and dccanters\n\n\nBenditto drew his long, threadbare cloak over his\n\n\nface, to bis keen, black, and deepset eyes pulled his\nbroad brmmed hat upon his brows and flashed pierre\n\n\ning glance over the rather tumultuous aseblage which\nfilled the saloon, letting his gaze pause for instant\nevery face.\n\n\nNot yet"" he murmured as he saw that the room\nwas occupied only by old and whte-haired men,\n\n\nIn the midst of the hubbub an old gentleman, with\n\n\nlong beard white as snow and clad in the uniform of\nhussar, placed trumpet to his lips and gave a blast\nthat drowned every other noise instantly.\n\n\nThis sudden blast of the trumpet signal that the\ntrumpeter had fresh intelligence from Jaclson\'s army\nthen camped few miles below the city and awaiting\nthe advance OF the British commanded by Packenham.\nEvery eye and then turned towards the veteran\n| trumpeter; who shouted\n| ""Gentlemen, ! haze certain news from the American\ncamp! Before daylight the British army will attack eur\nfriends below the city""\n\n\nSinee we cannotgh with our brave sons and grand\nsons, said tall and stately veteran of Georgia who\nhad fought and conquered the English in many reyo-\nlutonary battle \'et US pray for them to the God of\nbattles""\n\n\nAt this moment entered young man, apparently\n\n\nlittle over thirty wears of age Of lofty port and power\ntu frame, and clad in the undress uniform of Ameri\ncan cavalry captain.\n\n\n""Ho! said the old trumpeter 1--WE have, it seems,\none young man left to keep the old men company""\nThe young man started quickly, and grew slightly\nred; but after glance, which changed from anger to\nscorn, as BE noted the white hair of the speaker he sat\ndown a small table called for brandy and at the\nI need ilNR. oh IL\n\n\nHe mistakes"" cried the trumpeter ""the infant is\ntoo Young for brandy Give him warm milk and loaf\nsugar, Paul""\n\n\n""You are an old fool, and may sneer your fill. am\non parole SAID the officer Here he seemed to scribbe\nupon the table at random.\n\n\nYou are parole Pardon; did not know all that,\ncontinued Vale But where did you give your parole\nmy friend?""\n\n\n""Were you not so old, would consider your inqus-\niuyeness impcrtinence,\' replied the officer: ""but as\ndotage has its privilege will answer was taken prs-\noner at Detroit, when Huh surrendered""\n\n\nHaving uttered these words, the officer drank his\nbrandy tossed piece of silver to Paul faced old Vale\nwith supreme contempt for him and his listening\nfriends, and then departed\n\n\nA hiss Of contempt followed the officer from whom\nthe eyes OF Bcndto the in the cloak had not been\nmoved during the quarrel', 'Tnk authorities Of Baltimore seem 10 be\narousing. from their former inactivity. and\nenleavoring 20 keep the peace of the city\nThey have required al flags and banners to\nDO taken down, and are prohibiting persons\nOf all parties from making any unusual dis\nplay. They seem now to be striving to quel\nevery attempt to get up a riot or disturbance\nIL ""a 70 be hoped that these efforts will be\nsuccessful, and that these precautionar,\nmeasures will protect the city from recur\nrenee Of the disgracefEl scenes of former\nyears. This city has been dealt with SO mer\ncifully, by the General Government, Tor il\nrecent assault on the National troops anc\noutrage on the dag of the Nation. that il !\ntime il was undertaking a work of reform.', 'A4hHr:S1 Al UF Tnh UdNFEDERATE STATES UF\n\n\nWhere\'s Ry the provisions of this Sd section Of mn act of Con\ncrasI approved gust Both 1861, entitled Collect\nfor distribution the remaining iu the several Post\ntaken charge by the said Government is made the duty\nthe General to make proclamation that all persons\nwho citizens OF he Confederate States ot America and wo\n\n\nhave rendered postal service IN any OF the States of S\nEofreracy, contracts appointments mnde by the\nUnited Government bsUe the Confederate States Gov\nr3nent charge such servict shall their claims\nto this department. vGieind established according such\nrules rs he prescribe VI lime therein be set forth,\nless than months requiring the claimant to\noath how phd and the Of such ymeu.s,\naccount appointment under which said claim\noccurred and fund provision has been set apart\nbalance of such claim, the eyernmcnt OF the United\nStates, of OF the States and they shall also state\nappointments during the time for which they\nclaim and if what pRrtRl they did perform\nwhat deductions hav Teen made from their pay 70 TAR as\nthey know Of failure partial t""re 10 per\n\n\nNow therefore T. JOHN II. REAGAN, Postmaster General\nothe Confederate OF America do issue this, my prOcaina\nrequiring all persons having claims Tor postal SERVICE\nunder the foregoing provisions of the Sd secon OF the above\nfor 0e Department for examination before\n18th day Mach 1852 order tnat may make report\nCongress of the amount thereof as required by law\n\n\nBlank presenting and verifying the claims Will ne\nfurnished application the Auditor OF the Treasury for the\nPostOtitC Department\nIaced moneys The States composing the\nConfederate States and which they had not paid over M ts\ntime Confederate States took chage of The postal service to\nunder TIL and send = the AuoF OF t !ieaNl\nTor Pos0ce Department, before the 18Th day ot\nOctober next general ledger account with the United\nStates Of the PdstOAce Department. up to tile\nOF the postal assumed by tEe Con\nfaerRte ates accordance with the general regulations OF\ntha P1, ica Department May 18TH 1889 page Qb\n\n\nii @ ,n Lnras in Ihe nose9,il of syrh po,tnlasters\n\n\nGiven under my hand and the Poics Department\no. the Confederate States Of America q! Ntchpiond Virginia\n\n\nTInsI JOHN H. REAGAN,\n\n\nSAB ltsgiw Postmaster General,', 'The Commander at Fort MclIenry is like.\nly 70 hold his position. In his fast contact\nWith thu rebels they were worsted. Obscrv-\ning that batteries were beng erected by the\nBsltmorcans in position attacking the Fort.\nhe Is said 20 have sent shot whistling\nthrough the air above the shovels and guns\nOf the traitors. Presently deputstion OF in\nsuliel. indignant. and offended Baltimcrcans\narrived AZ the For, and demanded 20 know\nwhat he meant BY firing At or near them\nThe commander replied somewhat a. follow;\n\n\n""Geadcmtn. | havent read history for\nnothing rensmber reading OF Fort\nsumter where an attacking party Of traitors\nacre suffered 20 begin and continue the cree\nton OF batteries AL about II. One day they\nopeaed ere. and The neat the people 10 the\nFort we\'re smoked out and had 20 surrender.\nNov, gentleman, wont submit 70 any such\nd---aonseasc here', 'The conduct OF Benditto after the entrance of the\nofficer would have attracted general notice had not\nevery mind been intent upon the words and actions of\nthe atter for no had Bendtto darted his keen\neyes upon the officers face than he drew a miniature\nfrom the folds of his cloak and began to compare the\npainted features with the naughty visage of the new\nconner AS he gazed from one to the other his cloak\nfell from his shoulders, and revealed slender form\nmuch bowed by age infrmiy. The souch of his hat\nhid the upper part of his countenance but the lower\nwas grizzly ybearded whered and wrinked while his\ncomplexion Of corpselike whiteness spotted here\nand there with purple scars No sooner had the officer\ndeparted than Benditto resumed his cloak and with\nmufed face, advanced to the counter saying to Paul\n\n\n\'\'Do you know that oflicer?n\n\n\nThe words were in Italian and almost whispered\n\n\n\'Ihat is as it may be, replied cautious Paul in the\nsame tongue and tone.\n\n\nBendito placed piece of gold upon the counter and\nrepeated the question\n\n\nII know him."" said Paul; \'hs name is Victor St.\nJohn late cavalry captain in the army of the northwest\nlie resides with his uncle, general Harper who is now\nin the army below the city""\n\n\nThanks"" muttered Beneditto, bowing and leaving\nthe saloon\n\n\n81 shall chastisc that coxcomb,"" said Vale; though\nhe is the nephew of one of my friends But Paul who\nis that gentleman that has just departed2 He seems\nafraid OF showing his nose\n\n\n~\'\'That is Benditto said Paul\n\n\n""And who is Benditto wise mani""\n\n\n""Why, simply Benditto,"" replied Paul\n\n\nThat is the name of the Italian fortuueteler cried\na lively old man ""Benditt,o they say, is sorcerer\na wizard, in fact a poisoner-But, ha! here comes\nman who will fght-why is he here?n\n\n\nThis remark was elected by the appearance of pow\nertu built and gaudily dressed man Of middle age\nwhose heavy beard and mousache hid his face even to\nthe cheek bones He advanced to Pauland whispered\n\n\n""The captain has been here?""\n\n\nCaptain St. Johnor captain st. Laftte?9 asked Paul\n\n\nYou know captain Laitte is with the army. | mean\ncaptain st. john\n\n\nHe has Just left""\n\n\nWhere did he sit? at which tabe?"" asked the other\n\n\n""Ihere-whcre the chair is overturned said Paul\npointing to the spotatey tenanted by St John What\nis it to YOU CarlOS2""\n\n\nMuch that is nothing to Paul Amar, replied Baros.\nas he bent over the table and erased some mark with\napid stroke Of the hand. Good night master Paul.\n\n\nBad night to all such blackbrds growled the wine\nseller as Carlos staggered from the saloon.\n\n\nHE rubbed out something that St. John had marked\nupon that table with chalk. l the captain scratch\nupon the table-what was it? Let me see-perlIaus |\nmay get clue to this secret Perhaps there is some\nruth IN the rumor that there is plot fire the city\nplot among slaves and traitors""', ""were not reported.\n\n\nEastern News.\n\n\nThe Union has the following additional\nEastern news by Pony Express:\nBALTIAoRE, June 27th.--A positive order\nhas been given by the Marshal to avoid irri-\ntating the people and arrest Uuionists who\nmake violent demonstrations.\n\n\nThe U. 5. Deputy Marsha has instituted\nsearch for arms in private dwellings. a lot\nwas seized in a lager beer saloon.\n\n\nMany additional regiments of U. S. troops\nhave arrived at Washington.\n\n\nBALTIMORE, June 29th-There is a good\ndeal of quiet excitement here. Crowds are\naround the police stations and Marshals Office.\nA search at the Marshals office is going on.\nA large quantity of arms and munitions have\nbeen found secreted in the cellar and the\nwalls beneath the floor and cellar, and case\nof valuable pistols, over 5000 rifles, twenty\nfive of which were MIME were found also,\nseveral muskets said 10 have belonged to the\nMassachusetts, soldiers who were disarmed by\nthe mob on April 18th. 1t is also estimated\nthat 100000 percussion caps, 3, 100 ball car\ntridges, and C,000 long Miaie cartridges were\n| found\n\n\nThe New York IIeralds Washington dis\npatch says the rebels from Baltimore intend\ned issuing proclamation announcing the de-\n| feat of Federal troops and the capture of\n| Washington and all the officials, then tear\n| ing up the railroad and cutting the telegraph\nwires, and thus produce panic in favor Of\n| the Southern Confederacy\n\n\nGen. Banks discovered the plan Of the\nade al This point has been permanently in\nstituted and has caused the Mobile mail boats\nto discontinue.\n\n\nThe same paper intimates that the India,\nChina and English merchantmen will be\nrich prizes for privateers\n\n\nThe New Orleans Picayune of June 9th.\nsays United States ship of-war, eighty guns,\nis anchored off Atchatalaya, Texas intercept\ning communication, via Berwick Bay, with\n| Texas.\n\n\nGRAFTON, (Va.) Sune 27th.-Corporal Hays\nand twelve men belonging to Col. Wallace's\nregiment of Hussars while scouting on Pat\nterson's Creek, twelve miles east of Cumber-\nland. night before last encountered party\nof rebels numbering about forty sharp\nengagement ensued. Several of the enemy\nwere reported killed and number wounded\nOne of Hays party was killed and himself\nbadly wounded. They captured humber\nof horses.\n\n\nThe rebe, camp at buchanan is reported to\nhave been increased to 1000.\nWASHINGTON, June 27th.-Col Werr left\nhere several days ago for Kansas, taking\nwith him Gen. Lanes proclamation calling\non the people of the State to rally and fill up\nthe regiments, stating explicitly his purpose\nto put dow rebellion wherever it may be ex-\nhbited and to sustain Union men without\nregard to State or locality."", 'EpwAWps\'s FERRY. Oct. 26 ALI quiet last\nnight; no pickles. were thrown over the river,\nout those on this side heard those OF the rebels\nall night on the opposite side, and cav t1elr\nftes thickly scattered 10 the woods along tho\nshore. Their centrazing point was a cump\nof trees on the bluff where our troops had con-\n,tTucted q picket station, aud near the spot\nwhere our a-tiliery shelled them during the\nsSirmish on Tuesday last\n\n\nWhen our troops we\'re withdrawn from the\nVirginia eide on Wednesday night, the l6h\nIndiana occupying the most advanced and ex-\nposed position, were not aware OF any with\ndra val until the rest had been successfully fer\nried. They lay upon the cold ground, almos\nfrozen, with loaded muskets in their hands. ev-\ncry moment expecting an overpo""eriDg assault\nfrom the concealed aud reinforced enemy,\nwhose numbers were known to exceed our own\nBY many thousands Yet the only murmurings\nuttered by the hardy cons Of the Northwest\nwe\'re at the orders to return without disputiDg\nthe ground, inch BY inch, With their sdversaries.\n\n\nTHIS regiment brought with them two prison\ners, the owner ofthe mill on Goose Creek, with\nhis son, who II was charged had prepared com\nbusiibles TO Ere the bridge over Goose Greek,\nbut were prevented from carrying out their de-\nsign by the sudden descent upon the bridge by\nour skirmishers.\n\n\nThe officers of the regiment had g cOnversa-\ntion with prisoner OF war, highly Intelligent\ngentleman and nou-cpmmssoned officer Of\noue Of the Mississippi regimen\'s engaged in the\naffair at Balls Bluff. He left Lee.burg on Sur-\nday night, when there were but five regiments\nthere. There were 10 delensible works at\nLeesbnrg, but every approach was fortified,\ncommanding the river and land routes.\n\n\nThis prisoner was astonished to learn that\nour army was not almost entirely composed OF\nabOltionists and radical Republicans, and that\nour main object was other than to emsucipatt\nthe slaves throughout the South. He said i\nthe facts were generally known to tho working\npeople OF the SOuIh, that our sole object was &c\nsustain the Constitution and to preserve the\nUaion intact, there would be revolution In the\nConfederate army and peace restored.\n\n\nHe was surprised beyond measure to be as\nsured that Brekinridge Democrats constituted\nlarge component of the army.\n\n\nCapt Vaughn. Of the Rhode Island battery\nwho vent over with q ,g of truce, has return\ned. He was ciptured BY party who did moi\nunderstand the Law Of nations, but was after.\nward released by the military authorities.', ""20 are seriously wounded, though Il il not\nthought fatally.\n\n\nComparative quiet nov prevails. The mil\n10 full fofos.\n\n\nThere il large mass meeting bore to-\nnight, addressed By tho Mayor. The Gov\nernor was present.\n\n\nBALrInoRn, April 10.\n5000 troops from tho North are expected\nthis nortisE. Mono have passed yet.\n\n\nHarper's Ferry Armory wss 6rsd last night\nand abandoned By the q. s. troops.\n\n\nPaHADHLrHIA, April 10.\nThe Baltimore Sun publishes : dispatch\nstating that Harpor's Ferry was sst 90 Are\nBY tho regulars 1t midnight, and that they\nthen rssroated into Maryland. There we're\nno State troops there ~ the time.\n\n\nOARLIsLs, Pa, April 10.\nLieut.. Jones, late 10 command at Harpefss\nFerry, arrived here with tho command OF 43\nmen q D. u. 70 day.\n\n\nLieut.. Jones, having been advised that :\nforce OF 2,500 troops had been ordered BY\nGov. Lstcher 10 take possession Of Harpsr's\nFerry, and finding bic position untenabls,\nunder directions OF the War Dspartmsnt,\ndestroyed I'll che munitions OF war, the arm\nory, afsenal and oil the buildings. He with\ndrew biz command under cover 81 night and\nalmost IN the presence Of $500 troops. He\nlost 2 man. 5000 stand Of arms we're do.\netroysd. The commend made forced march\nlast night 80 miles from Hafpsr's Ferry 70\nHsgsrstown. Nd. Lieut.. Jones and CON.\nnand looked musb worn and fatigusd. They\nweYs mort enthusiastically received By 90\nentire population."", 'BALTIMORE, June IL.\nMarshal Kane has sworn in 1000 seces-\nionists as special patrol men at special elec-\nton. 1t is said that Bonnifort will absent |\nhimself from Baltimore On election day,\nleaving deputy-some say for want of\nnerve.\nThe Times editorial speaking of the Pa\nris meeting. charges the speakers with\ngroundless irritability-also al!udes to the |\nviolent animadversions of the northern |\npress-says unionists are enraged because |\nEngland chooses not to be neutral-says if |\nthis be temper of the northern press now,\nwhat will it become month hence. Con- |\neludes by urging careful avoidance of Civ\ning offence to either beligerents.\nRussell has announced that the govern\nment of England is determined to prohibit |\narmed vessels from bringing prizes into |\nBritish ports.', ""v AsHINGTONl . an D.\nOn inquiry at the proper quarter It has been\nascertained tlat before June last il being found\nthat the arms az the several arsenals were not pro-\np0rtionately distributed, and that the Southern\narsenals were quite deficient in these supplies a\ndistribution was made Tor equalization only and\nfor no other obiecg. They were principally drawn\nfrom the Springfield armOry, and from the aTsen-\nais az W aterVieit, n Y, and WatertOWn, Mass.\nThe secession troubles, It Is known, had not\nbeen commenced I'LL after the distribution was\ncomplete. There remained prepOnderanee OF\narms az the North.\n\n\nLieut.. Gen. Scott was engaged TIL O'Clock\nthis morning on business connected with his De\npartment.\n\n\nThe Republicans were again in caucus to day,\ntheir object being 70 agree on uniform Legislative\naction\n\n\nThe arrival Of recruits from Philadelphia for\nthe purpose Of being drilled at the Marine Bar\nracks at Washington has been magnihed into un\ndue importance.""]","Well, let me tell you, it’s quite a tense time in Baltimore these days. The city authorities, in their desire to maintain order amidst all this turmoil between the Union and Confederate supporters, have taken some notable actions. Just recently, they’ve begun to crack down on any public displays, ordering down flags and banners. If you ask me, that’s a wise move. They’re trying to prevent any rioting or disturbances, like what we’ve seen before. It’s been embarrassing for all of us, really, witnessing those disgraceful scenes.

I reckon the Marshal here is under a lot of pressure to keep the peace. He’s sworn in a good number of secessionists as special patrolmen to help maintain control during these elections. They’re making sure no Unionists are causing a fuss. In fact, there’s talk that some authorities might be avoiding confrontations with the Union supporters altogether, hoping to keep things from escalating even further. It seems they realize that a heated confrontation could lead to chaos.

This reflects a broader military strategy, I believe, where keeping the peace in cities like Baltimore is crucial to maintaining control of the North as a whole. It’s a delicate dance—ensuring the public stays calm while also making sure that we do not seem weak or divided. With troops stationed here and there, the government is keen on avoiding a repeat of any previous confrontations that saw our streets running with violence. 

Folks are anxious, and rightly so; the spy reports and rumors about arms hidden away in taverns—they do bring an unsettling feeling. I hear we’ve seized quite a bit of ammunition recently from the local houses, indicating just how serious things are getting. The last thing we need is unrest here at home while our soldiers are fighting elsewhere.

I think the measure of severity being shown now is a testament to how resolute we need to be in this uncertain time. We cannot afford to be caught off guard. We’re all hopeful that these precautions keep our city safe and perhaps remind everyone that we must pull together, regardless of our allegiances.","In Baltimore, supreme control over the Police Department was exercised by Henley until a loyal citizen could be appointed as Marshal. This was in response to the arrest of Kane, who was accused of aiding those in armed rebellion against the Government. The Police Commissioner issued orders disbanding the police and protested the actions taken. Henley swore in a new police force to maintain order. Additionally, the Union's military strategy involved the mobilization of Home Guards and the organization of regiments to counteract Confederate threats, reflecting the heightened tensions between the Union and Confederate forces during this period.",0.7142857142857143,0.0,0.3888888888759259,0.6
"What were the public meeting resolutions discussed in New Jersey regarding the Union, and how did they reflect the political tension and need for compromise during that time?","[""hlA4A DILL MA AeS- -\nThe adjourned meeting Of the 4th, of the citi-\nzens Of Philadelphia to consider the present state\nof the Union, was held at the Board of Trade\nRooms to-day.\n\n\nThe Committee 10 whom the coercion and non\ncoercion resolutions were referred, made no re\nport and there being an evident intention on the\npart Of many present, who did not participate IN\nThe last meeting TO force the passage Of the non\ncoercive resolutions of Judge Lewis, which were\nresisted BY prominent Republicans.\n\n\nAn exciting scene Of disorder occurred, during\nwhich, District Attorney Mann showed willing\nness to fight on the spot.\n\n\nON motion Of a Republican, the meeting WIS\nadjourned but another was Immediately called {\nthe same place\n\n\nJudge Lewis was placed m the chair\n\n\nResolutions were taken and unanimously pa\nwe'd, denouncing the personal bills sc. and appro\ning the Crittenden resolution.\n\n\nThe Republicans refused to participate IN th\nsecond meeting, and manifest much ill-feeling al\nthe conduct Of political opponents in overriding\nthem."", 'ave Repeatedly o""seu \'n\'\n\n\noppression; that the veioes OF tbei\njackson preserved the\nnorthern masses from moueyed OF\nearchy which threatened to reduce\nhem to that slavery to capital which\ntouds to mike ""the rich richer, and\nThe poor poorer and we regard the\nrepublican party under the guise oil\nfreedom tor the negro as aiming at es-\nsentially the same objects, and anima-\nted by the same spirit Of hostility to\nthe people.\n\n\nResolred, That ws,the working men\nOf New York. hereby pledge our\nselves TO oppose the British anti\nslavery party 10 every legitimate way;\nthat we feel With sorrow that Great\nBritaio has conquered the North\nwith the pen, having a5olltlonlzed\nthe press and the pulpit, and while\nhe heel of her oppression is upon\nWhite men in Ireland. England and\nScotland, she tiles to divert attention\nfrom her sins at home by false pill\n|ianihrophy for negroes in America;\naud believing our Southern brethren\nnow engaged IN the holy cause OF\nAmerican liberty, and Trying to roll\nback this avalanche Of Britisbism, We\nextend to them our heartfelt SYM\npatty. and when they shall need it\nto resist unjust oppression, We be-\nIIicve We shall not De found wanting\nin more effrctua support.\n\n\nResolced, That the State Legis-\nla,ure be respectfully requested to\n| to convene The people of this State\nlin convention. for the purpose Of Sc.\n\n\ncuring an expression Of public SEN\n\n\ntiment upon the new and startling Is\n\n\nsues which few weeks hgve so rap\n\n\nidly evolved, and the Chair is d.\n\n\nrected to appoint a committee OF five\n\n\ngentlemen TO present these resolutions\n\n\nand this request TO the Legislature\n| -Sp,-.---\n\n\nLike beiligerant bulls and noisy\n\n\nbarn yard fowls, some of he a,!vo.\nGates of the \'irrepresslble conflict\n\n\n10 their believing and Growing at =\n\n\nsafe distance, aud will doubtless BE-.\ncome more quiet iu the immediate\n\n\npresence of their adversaries, if they\n\n\never meet face to face. Sumner, The\n\n\nBlack Republican Senator from\n\n\nMassachusetts, delivered lecture\n+at Concert Hall, in Philadelphia, E\n\n\nshort time since. ir which he af\n\n\nfected to play the hero, although\n\n\nno man 10 America has shown d\nIpusillanimous spirit in the presence\n\n\nOf a living foe. He said, among other\n\n\nthings equally boastiug-\n\n\nII never was compromise man\n\n\nnor am | one now. II is no use foI\n\n\nthe North to compromise; it is not.\n\n\n| want to know if the government\n\n\nis worth anything. do not think\n\n\nmy people want me to compromise\n\n\ntheir interests, and if they do | will\n\n\nnot do it. Every compro mise that\n/ has been made has been violated by\n\n\nthe South. Tlere is an eternal an.\ntagonism that must be settled now, and\n\n\nWe may as well have il settled now as\nat any other time""\n\n\nDoes any one suppose that Sum-\nner will place himself within reuch\nOf another Southern cudgel!', 'FnAEclAL.--0n the 10th ut the Second Board In\nNew York, Missouri Stocks went down to a. viz\nsinia to ~, and Tennessee to 49, Exchange in Chi\neago same date Was II per cent In this city on\nSaturday II went II 10 to IL. Illinois Banks bassd\non Southern Stocks are decidedly 1t discount Just\nnow, and more OF those taken 1t present will prob\nably 50 soon.\n\n\nWAn MEETING AT FT. mADIsON.\n\n\nFoHr MADISON, April 10.\n\n\nkDroa Cars CirY. A. reminded By the\ndats Of this that to-day l. the snnivsrsary\nOf tho 6rst battle Of the Revelation, and II\nyoa had been here last night, you wosld\nhave thought those glorious old times hsd\ncome back, and that patriosisn had con.\nplstsd one Of iss grand cycles and was sow\ntosehiDg III ssarest point 70 tho central 10.\nninsry from which il derives ito life and iss\nheat.\n\n\ni va quietly talked around yesterday\nthat vs would have meeting last night. A\nlev nodsst bills we\'re posted during the a.\ntsrnoon, and By the time the hour Of .ssandls\nlight"" had fully cons the court house waa\ncrowded 70 iss foll capacity. Judge visls\ncalled the meeting to order and nominated\nFred. Hesssr, Esq, to preside. l. II. Knapp\nand v. "". Winssrboshan were named vioe\nPresidents, and 9. Il. Albright and NJ. v.\nAbby were chosen Secretaries.\n\n\nMr.. uesser briefly stated the object Of the\nmeeting - being to take such aoton e be.\nGame loyal citisens to give support to thu\nGovernment 10 enforcing the laws, suppress.\nIng rebellion and Furnishing treason.\n\n\nA committee Of 10, Of which Mr.. r. W\nAlbright was chairmsn, vas raised, to pre-.\nsent resolutions expressing the sentiment.\nand will OF the meeting.\n\n\nTbs resolutions we\'re very strong. They\ndeclare il 20 be the duty Of all good citizens\nin times like the present, to stand. by th,\nconstitutional govsrnment regardless Of\nthei. onininns ""a .hs-sslsSS-sss- inc = M\ntional tros6ies and irrespective OF past pc\nlitical differences. They endorsed the Cali\nfornia resolutions against tho right Of %\nssssion and Affirming the duty Of the Gov\nsronent TO maintain its integrity. Tho,\npledged the snpporters Of the sssolusiess 1,\nstand BY the country right or wrong, an\ndeclared IN intention not to tolerate tfeaso,\namong us, either in 0ord Or deed.\n\n\nThere ware no long speeches, but thsr\nvse much good strong talk 70 tho effect the\nthe time for discussion, concession and com\npromise had passed, and ""now il the sim\nfor action""', ""sENArE.\nMI Thompson presented the resolution Of a\npublic meeting IN New jersey In favor Of sus\ntainiug the Union. Laid ON the table.\nMr. Mason offered resolution OF inquiry that !\nthe Secretary Of War give the Senate copy OF ]\nany orders issued from the Department 20 the\nofficers commanding the foTtiteatiohs in south\nCarolina since the LIST Of November Also a copy\nOf any plans or recommendations relative 70 IN.\ncrussing the forces or otherwise h the iorts ana\narsenals IN Virginia or any OF the states IN the\nsouth by the commander In chief, and II any &C\nton OF order were Issued IN pursuance thereof\nM Summer offered petition of Moses CALI\nOF Mas nsking that an amendment TO the COusti.\ntuition bs made that u may recogntze the exist\nence Of God Referred 70 the Judiciary Com\nIII, sldeIls resolution to expel the Associated\nPfess reporter from the reporters gallery was\ntaken upand after brief discussion he Withdrew\nMr.. Seward presented petition from the cit\nizens Of New York asking for the passage of the\nthe Pacific Railroad bill.\n\n\nOn motion Of Mr.. GWin the Pacific Railroad\nHouse bill was taken up.\n\n\nMI Seward said that he should vote for the\nblank although he had some objection to IT, dc\npeferred the more nOrtherly route but should vote\nfor this proposition, Il had been the one great\nobject OF his life 10 secure such grand result\nThe great evil Of our times is sectlonaltsmi ana\nthe danger Of division by sectiQnalism every man\ncalls on every other man for compromise, to de-\nwise some new means 70 cement together the\nstates which it is apprehended are in dan\nger OF falling apart He had listened 70 every\nmeasure that had been suggested 10 arrest the evil\nbut here was one for which he was prepared TO\nvote. He wanted Il to be known at every day and\nhour; Il was apprehended the Union was falling\nto pieces; yet that Congress had placed on the\nStltute Books as recorded fact that an apprO\npriation of s96 O0o 000 70 bind together the North\n/ and the South, the East and West, by maternal\nband. L Is q great measure o. eoneiliatlon'\nThe bill gives exact and equal guarantee to all.\nThere Is interest and civilization at the North,\nanother interest and civilization at the South This\nmeasure equally provides for the progress and deyel\nopmont Of the Northern civilization as we'll as that\n/ Of the south He thought thu outlay would b amp\n/ iy returned Tho advance Of railroads and the\nspread OF civilization viii develops the industry Of\n/ and ssqrsndisenlent to the United States snrpas-\n/ sing all that would be accomplished by any policy\n/ that could ever be pursued by the Government.\nIN thirty years the wealth and population Of the\nUnited States will be doubled. he referred 70 the\ngreat success Of the canal in New York; connecting\nfhe great lakes with tide waters The Pecifc Rail-\n/ RUGi was no sectional work. but great national\nenterprise which if completed, will extend ,Ameri-\ncan principles over the Pacific coast and the Asiate"", 'THESHoE PINCHING IN New ENGLAND\nThe political CONFUSION is begin\n\n\nming 10 press heavily on the manufac-\n\n\nturing towns and cities Of New Eng\n\n\nland, thus demonstrating that the\n\n\ncurses which have been hurled from\n\n\nthat violent abolition section against\n\n\nthe South, the Constitution and The\n\n\nUnion, are coming home, like chick\n\n\nems, 10 roost. The shoe business,\n\n\nwhich may be considered The staple\n\n\ntrade of Massachusetts,, we perceive,\nhas received a terrible shock. Many\nOf the factories have suspended work\nentirely, several houses in Natick\nhave failed. and nearly all have been\ncompelled TO reduce their force Of\nworkmen one-tbird or one. half =\nThe foundries and machine shops Of\nConnecticut, too. are in a similar\ncondition; establishment after estab.\nlisbment is diminishing its operatives\nand closing its doors. and this is but\nthe beginning of the end. The Re-\npublican politicians will find out now\nhow much easier it is to demol-\nish than to construct. They have\nbroken down all the manufacturing\nand commercial interests of the\ncountry, turned thousands of people.\nout of employment; but they will\nlearn bow difficult it is TO restore\nprosperity and build ur what they\nhave reduced to ruin.-N. T. Her\nnd.', ""ne working nen OIL new FOLK cRy /\nIgainst coercing the Southern States\nvas held in that city on Tuesday |\nhight. The attendance was very\narge, and the sentiments expressed\nand resolutions passed we're Of the\nmost decided character, aud show.\ndecidedly that the working men OF\nthe great commecial metropolis have\na due conception Of. the value oil\nthe South as the great market for\ntheir goods and manufactures\nSouth OF that point, it is to be\nhoped like estimate, at least, will\nbe manifested of the value of the\nsouthern market. As a proof OF\nthe soundness of the views held\nby the New Yor working men, We\nannex their resolutions as follows:\n\n\nReso!yed, That we regard the\npresent movement Of several Of the\nSouthern States in resumiDg the\npowers they delegated to the ger\neral government as an effort to pre-\nserve our constitution from being\nbeing overthrow b. Abraham\n\n\nLincoln, as his party platform re-\nqaires and demands him to do.\n\n\nResolced, That we are for the\n\n\nUnion--the Union of our fathers:\nfor thu cons:itutiou--the glorions\nchatter of our liberties--as ex.\n\n\npounded by the recognized authori\nty, upon the basis OF equal justice.\nliberty and inmuBities to all the\n\n\ncitizens CT I'LL the States.\n\n\nReso.red, That, believing that the\n\n\npeople Of the Southern States are,\n\n\nand have ever been content to re-\n\n\nmain in this Union under the con-\n\n\ns'iiution rs originally designed. we\ndeeply sympa.hize With them 10 their\nunwilling resistance TO an incoming\nadministration. Ehich, by perverted\n\n\nand unauthorized construction of the\nconstitution, tends TO destroy their\n\n\npeace. welfare and happiness.\n\n\nResolUed, That We are firmly and\n\n\nunalterably opposed to any aud every\n\n\nattempt on the part Of the govern\n\n\nment or the people Of the North\n\n\nto coerce the Southern States, oil\n\n\nany one of them, into submission 10\n\n\nthe will of a minority of the North,\nwhen that will has been authoritative.\nily declared by tba Supreme Court\n\n\ntc be in opposition to the true\nconstruction OF the Constitution oil\nthe United S. ates.\n\n\nRcsolved, Thatws will, by all legiti-\nmate means, oppose, discountenapoe\nand prevent the republican party\n\n\nfrom making any aggressive attempt\n\n\nunder the plea of reinforcing tue\nJews end preserving the Union,\nu pom the rights Of the Southern\nStates, believing as We do that any\nsuch attempt can only result in a\nprotracted and destructive civil war\n\n\nte attain an end which that party\ncan readily and peaceably accomplish\nby abaud oniug their hostility to the\nSouth, aud declaring their willingness\n10 abide by the constitution, as in.\nterpre!ed by the Supreme Court,\nand accepted by all conservative\nmen Of the country.""]","Ah, welcome to our town! You know, just the other day, I was discussing the heated state of affairs in our country with some friends. It seems like the weight of the Union is pressing heavily on everyone these days. Now, in New Jersey, they held a public meeting not long ago where resolutions regarding the Union were brought forth, and I found the sentiments expressed there quite telling of the political atmosphere we’re all living through.

At this meeting, the folks made it clear that they are staunch supporters of the Union as it was originally formed. They pledged their loyalty to the Constitution and emphasized the importance of equality and justice for all citizens across the states. What I heard them say was quite compelling; they viewed the recent actions of the Southern states as a desperate measure to hold onto their rights and freedoms. They expressed sorrow at the state of rebellion and seemed determined to present their resolution to uphold the constitutional government.

You'll find that many people around here, including myself, believe in the power of compromise. Yet, there’s a palpable tension among different factions. The resolutions in New Jersey reflected a yearning for peace while also recognizing the threat posed by those who would disrupt our governmental fabric. They seem to acknowledge that the days of mere discussion and negotiation might be coming to an end. Folks are wary that a hard line could lead us to civil strife.

The common man feels as if we are walking a thin line—one side leading to reconciliation and the other to chaos. That meeting saw resolutions passed nearly unanimously, suggesting that there is a strong desire to maintain the Union, but I can't shake the feeling that there are many in our country who hold differing views, and those differences are likely to grow more contentious. 

I reckon the people of New Jersey are right to call attention to these matters. If there is hope for our nation, it lies in our ability to talk to one another, despite the ever-increasing heat of conflict. The resolutions demonstrate a call to uphold our constitutional values while grappling with the realities of dissent. I just hope we can find a way back to harmony before it's too late.","The public meeting resolutions discussed in New Jersey included a resolution presented by Mr. Thompson in favor of sustaining the Union, which was laid on the table. This reflects the political tension of the time, as there was a strong call for compromise to prevent division among the states. Mr. Seward emphasized the need for compromise to address sectionalism and the danger of division, indicating that many were concerned about the Union falling apart. The discussions highlighted the urgency for political solutions to maintain unity amidst rising tensions.",0.5384615384615384,0.0,0.9666666666473333,1.0
"What was the public attendance at the meeting held to support Maj. Anderson, and how does this relate to Henley's supreme control over the Police Department?","['Henley is to exercise supreme control over\nthe Police Department until some known\nloyal citizen is appointed to act as Marshal.\nThe proclamation gives the reason of the ar\nrest of Kane, which is that he is known to be\naiding and abetting those in armed rebellion\nagainst the Government, and is at the head\nof an armed force, which he had used to con-\nceal rather than detect acts of treason to the\nGovernment.\n\n\nThis afternoon the Police Commissioner is\nsued orders disbanding the police. He also\nissued a protest. signed by the Mayor, as one\nof the Board. Henley has sworn in new\nforce.\n\n\nBooNvlLLE, Mo, June 2Sth-One hundred\nand thirty men have arrived here from\nGeorgetown and Sedalia counties for the pur-\npose of being sworn into the United States\nservice as Home Guards, to serve III the\nState Large bodies of men in johnson coun-\nty are preparing to take the same steps. They\nwill be sworn in and receive arms as seon ae\npossible\n\n\nColonels B. W. Grover and Johnston, oi\nJohnston county, have formed regiment un-\nder Colonel Grover, fer the purpose OF being\nsworn into the service of the United States\nacting as Home Guards throughout the State\nThey have commenced drilling and Colonel\nGrover is here to secure them arms from Gen\nLyon He also reports that eight hundred\nare organized in Pettis county and six hun\ndred in Cass county. Two hundred of the\nPettis county men arrived to-day as con-\nvoy to take arms back with them.\n\n\nSenator Wilson, it is understood, has been\nin consultation with Congressmen as well as\nhigh officials of the Government, and at an\nearly dav of the extra session will, as Chair\nman of Committee on Military Affairs intro\nduce bills providing; first, to legalize the\nExecutive action concerning the present de-\nfensive and warlile preparations; secondly\ngiving the laws to the plan already advanced\nfor permanent increase of the army ; third\n"", retiring iuirm and disabled officers\n| fourthly, to organize from the militia one\n| thousand regulars as a National Guard, TO b.\nall clothed and armed alikc filthy, to in\ncrease the number of cadets to the extent o\nsixty eight, or the number of Senators, anC\nauthorizing the President to fill vacancies\n| caused by resignation or otherwise, in tha\ninstitution Besides, it is designed to recon\nmend an appropriation of $2o0,0oO,0O0 tC\ncarry the defensive measures into effect. Th,\nabove are substantially the objects contem\nplated.\n\n\nOwing to the expeditions calling so many\ntroops into the field, the Quartermaster\'s De\npartment had net been able to furnish uni\nforms so as to Immediately supply the de-\nmand Measures have been taken, however\nfor an adequate supply at the earliest practi-\ncable period', 'An immense meeting was held here tonight in\nNational Hall to sustain Maj, Anderson. Five\nthousand persons were present. D. Lewis pre-\nsided. assisted by Com Stewart. Mai Gen. Rob\nert Patterson. and others. Resolutions were\nadopted heartily approving of the conduct Of\nMai Anderson calling on the President TO pro\nvide him with all the force he requires for the de-\nfense of his position declaring that all persons\nwho wage war against the United States, and all\nwho counsel and sanction them, public enemies,\nand declaring that the American nag shall be\nprotected to the last extremity. Speeches were\nmade by j Murray Rush, Democrat, Charles\nGibbons, Republican, and Mark Munday, Union.\nThe enthusiasm was intense.', 'The CONFEDERATE LoAN-At meeting of repre-.\nsentatives from all the Banks of this city, held a,\nthe Planters and Mechanics Bank, on Wednesday\nlast, the Sd inst, il was\n\n\n""ResolUed, That the representatives of the Banks\npresent at this meeting, will recommend to their re\nspectiye Boards to redeem, on the demand of the\nConfederate Government, in coin, their bills, which\nmay be received inpayment for subscriptions to the\nConfederate Loan in South Carolina, agreeable to\nthe terms and proposals of the Secretary of the\nTreasury set forth in his Circular to the several\nBanks of the 9th of March, 1862\n\n\nAt an adjourned meeting held Friday afternoon,\nreports were received from all the Banks that tney\nhad sceeeded to the foregoing resolution.\n\n\nWe learn from good authority that ai,noagh .n no\nBanks of this city win probably take among them,\nat least one million Of the proposed loan-Cnares-\nton Courier, AprR 6.', 'or order work to be DONE and the husband, by any\nact precedent or subsequent, rstifes the contract\nby assent the husband shall be liable upon it. wheth-\ner the goods or works for himself, his\nchildren, or for his family. II the goods or\nwork, although they have not come to the hands\nof the husband to his use. are known BY him to\nhave been ordered by the wife, and the husband has\nmade objection to her use and enjoyment of them\nor given the parties who supply or labor for her\nany ntmatien Of ldisapproval be will be deemed\nTO have adopted and sanctioned the wifes expendi-\nture, unless it appears that Ehe has seperate in\ncome at her own disposal, 70 be expended by her\nfree from the control of the husband 1t is held to\nbe the duty Of the husband, when he sees his wife\niadulging immoderately, in expensive tastes, and\nknows she has no separate income Of her own to\nspend in luxures and superhuities to give notice to\nthose who supply her, or labor for her that the\noutlay does not meet his sanction and that he does\nnot intend to pSy for the goods or work ordered by\nher And if he chooses to lie by and permit the goods\nto be delivered or work done without saeh notice\nand warning, he will be presumed toshave given\nsubsequent sanction and ratification Of her acts\nwhich u equivalent m all cases to precedent au-\nthority. But II, by marriage settlement or other\nwise, separate income has been settled upon the\nwife, to be received and expended BY her free from\nthe control Of her husband, the mere circumstances\nOf the husband being aware of the w1fes possession\nand use Of the things fruits Of the labor will net\nfx him with Subsequent adoption and ratification\nOf the wifes contract even If he express no disap-\nha thorn IN', ""One hundred guns were fired by the Union Men\nto-day in honor of MAJ. Anderson.\nLast Nights's Report.\nPROPOSITIONS or THE BORDER\nSTATES COMMITTEE.\nADVERSE DECISION OF THE REPUB-\n\n\nLICAN CAUCUS.\nMAJOR ANDERSON ENDORSED.\nThe Militia of the District Of Columbia TO\n\n\nbe Re-Orgnnized.\nFORT WASHINGTON TO BE GARRIsONED.\nGEORGIA CONTENTION\nOPENING OF THE FLORIDA LEGIsLA-\n\n\nTURR.\nRESOLUTIONS DECLARING THE RIGHT\nOF FLORIDA TO SECEDE.\nGREAT MEETING IN ARKANSAS."", 'Mr. ]. G. B Frey. numb d years\n2 go, published an account Of a sconversa-\nton with Gen Scott, from Which we take\nthe following: E 8\nale told me a pleasant anecdote c.\nbout the emancipation Of large number\nof slaves in Virginia, of Which State, you\nknow, he is a native. The substance\nOf the. story was as follows: When the\nGeneral was lad, there was still living\nan Old Indian weman, named Hannah,\nrepuied to be slave. She was almost\na ccntenarian. She had been unusually\nprolific, and her decendants. now num-\nbered by the hundred, were all held as\nslaves. More than thirty OF them were\nheld by Mr.. Scott, brother of the Gener-\nal How they came into his possession\nwas no. mentioned.\n\n\n..Is began to be whispered round in\nthe neighborhood tha: Hannah\'s pcsteri-\n4y could notbe held in bondage, accor-\nding to t se laws Of Virginia, because she\nwas a free Indian VIC man, who had sta-\nken up with slave, as the phrase is,\nand lived with him as Lis wife. periorms\ning servile work on the plantation for per-\ntmissitn to remain there. The, slaves\nconcerned instituted suit for their free\ndom, and the necessary council was pro-\ncured. The chief management devolved\nupon Frank, an active, intelligent and\nfaithful servant-one of the number held\nby Mr.. Scott. Winfield Scott, now Gen\neral, became warmly interested for Frank\nand his co-plaintiffs. He made meme\nranda for him on paper, filed up bis biaIk\nspbpenas, and did all that young un-\nprofessional scribe could do 10 assist him\nin preparing the case for hearing. 1t\nwas difficult matter TO secure the atten-\ndance of witnesses, many of them being\nold, and scattered about the country\n\n\nOn this account, the cause was contihu-\ned through several terms. A short tine\nbefore the Court was to be held, Frank\n\n\nwould 60 to bis master, and conyersa-\n\n\nton of this kind would take place:\nr\'Master, come to ask leave to go\n\n\nand serve my. subponas.\'\n\n\nCertainly Frank; you can 60 if you\n\n\nthink i, is time. With SO much at stake\n\n\nfor yourself and others, you ought to be\n\n\ndilligent to secure the attendance Of frenr\n\n\nWitnesses\n\n\nIl may stand in need of little mon\ney, sir. to pay ferriages and other ex<\npenses.\'\'\n\n\nVery true, Frank. Here are FIVE doll\n\n\nlars for you. But how are you going?""\n\n\n""a foot, SIR\n\n\ny gu had better take horse, Frank;\nyou will be able to get through your bus\n: iness and come back sooner. Take Rog>\ner; and as lie must be fed, too, here Is\n:, as much more money to pay the char\nq ges.\'\n\n\n9TH ankee, master""\n\n\ncold Hannah was finally proved nev-\n: er to have been legally slave; and, as\n\n\npartus sequitur veMrena, all her offspring\n= were declared free. Frank came hcme\n: from the scene of triumph ..and exclaimed,', 'DCHEhECTADH, Jan. D.\nThe 10th regiment last evening under Captain\nBrvon and Van Anger, fired q salute of 80 guns\nand s3 rockets in honor Of Major Anderson and\nhis brave men.', 'The meeting was organized by electing\nHamilton Smith, Esq, President, and Messrs.\nCharles H. Mason and Jacob B. Maynard,\nSecretaries. -----\n\n\nUpon motion of John Jas. Key, ESQ, the\nPresident appointed a committee OF seven\nto draft a preamble and resolutions to be\nsubmitted to the meeting:\n\n\nJob Hatfield, Union towpsh;p; Allen\nHyde, Tobin township; !. Ballard Smith,\nTroy township; Dr. l. Hargus do; VIM.\nMckinley, do; DR.. Foster; Clark township ;\nA. P. Batson, Anderson do. were appointed\nsaid committee.\n\n\nDuring the deliberations of the commit\ntee, speeches were made by Messrs J. B.\nHuckeby, Q. II. Mason, j. B. Maynard, and\nthe President Of the meeting', 'AlHlN1l IN o\none hn dred gins were fired ia this city this\nevening honor Of 3lij. Anderson.', 'One hundred guns were fired by the Union Men\nto-day in honor Of Maj. Anderson,']","Ah, greetings! You’ve come just in time to hear about the fervor in our community regarding Major Anderson. Just last night, a grand meeting was held in National Hall to rally support for him. I can scarcely believe the turnout—five thousand people gathered to express their solidarity! That’s quite a gathering for our town, as you can imagine.

This support for Major Anderson is significant at this moment, especially with all that’s happening with the government and our local affairs. As you might have heard, there’s quite a tumult in the air with Henley taking supreme control over the Police Department. He’s put in charge until a new marshal, a loyal citizen, is appointed. The appointment was prompted by arrests related to the insurrection we face. Folks are worried that without proper leadership, the city might fall into chaos, and the police could be used for, well, not the best of purposes.

So, amidst all this, the support of Major Anderson is a rallying cry for those of us who wish to see the Union defended and restored. It’s not just a meeting for him; it’s a statement—a show of unity against any who would conspire against our government. Henley’s new control of the police makes our support even more crucial, as we look to ensure that law and order are maintained, and that loyal citizens can stand up without fear.

So, you see how the two are connected? The overwhelming attendance at the meeting reflects our determination to stand firm with Major Anderson, reinforcing our collective resolve against any treasonous elements that might threaten our city and our nation. We’ve got to stay vigilant, especially with the rising tensions and such decisions being made.","The public attendance at the meeting held to support Maj. Anderson was five thousand persons. This meeting was significant as it demonstrated public support for military actions during a time when Henley was exercising supreme control over the Police Department, indicating a strong military morale and community backing against those perceived as public enemies.",1.0,0.880134158920693,0.49999999995,0.3333333333333333
